delay_event_id,raw_flight_id,delay_ts,delay_category,delay_code,delay_minutes,notes
DE0000000001,F00000011,09-10-2025 04:30,other,OPS9,19,crew swap
DE0000000002,F00000013,14-12-2024 16:31,TRAFFIC,GT3,4,ground stop
DE0000000003,F00000013,14-12-2024 16:00,weather,WX01,2,crew swap
DE0000000004,F00000013,14-12-2024 17:05,GATE,ATC7,1,maintenance check
DE0000000005,F00000020,07-05-2025 23:49,WX,MX5,9,maintenance check
DE0000000006,F00000020,05-07-2025 23:15,GATE,WX01,34,ground stop
DE0000000007,F00000021,05-02-2025 04:27,OPS,ATC7,30,gate hold
DE0000000008,F00000021,05-02-2025 03:27,OTHER,ATC7,12,gate hold
DE0000000009,F00000025,29-08-2025 14:07,other,WX01,6,crew swap
DE0000000010,F00000026,2026-01-17T13:34:00,MAINT,WX01,25,ground stop
DE0000000011,F00000026,17-01-2026 14:29,AIRPORT,,-5,gate hold
DE0000000012,F00000032,19-06-2025 06:44,MAINT,CR02,11,ground stop
DE0000000013,F00000032,19-06-2025 06:38,MX,WX01,1,
DE0000000014,F00000036,02-07-2025 11:33,maint,GT3,7,deicing
DE0000000015,F00000036,02-07-2025 14:00,MX,GT3,14,maintenance check
DE0000000016,F00000039,12-01-2026 20:39,OTHER,ATC7,13m,crew swap
DE0000000017,F00000039,01-12-2026 18:46,MAINT,ATC7,1,crew swap
DE0000000018,F00000042,13-10-2025 15:14,ATC,GT3,6,crew swap
DE0000000019,F00000042,13-10-2025 15:39,WEATHER,ATC7,5,ground stop
DE0000000020,F00000042,13-10-2025 13:16,other,OPS9,3,crew swap
DE0000000021,F00000043,02-09-2025 00:04,crew,CR02,7,gate hold
DE0000000022,F00000047,25-02-2025 13:57,airport,GT3,0,deicing
DE0000000023,F00000047,25-02-2025 13:42,crew,,1,
DE0000000024,F00000049,24-02-2024 13:56,CRW,GT3,2,
DE0000000025,F00000049,02/24/2024 15:31,GATE,WX01,-1,crew swap
DE0000000026,F00000049,24-02-2024 15:22,ATC,GT3,7,crew swap
DE0000000027,F00000053,11-11-2024 17:39,OTHER,MX5,15,ground stop
DE0000000028,F00000053,11-11-2024 16:11,airport,,13,maintenance check
DE0000000029,F00000053,11-11-2024 17:49,MX,ATC7,2,
DE0000000030,F00000054,30-05-2025 20:03,TRAFFIC,MX5,-6,maintenance check
DE0000000031,F00000060,2024-02-10T06:16:00,weather,OPS9,30,maintenance check
DE0000000032,F00000062,05-03-2024 13:55,TRAFFIC,ATC7,17,ground stop
DE0000000033,F00000063,01/28/2026 03:46,AIRPORT,ATC7,22,ground stop
DE0000000034,F00000063,28-01-2026 01:47,MAINT,ATC7,7,ground stop
DE0000000035,F00000063,28-01-2026 04:17,ATC,,10,gate hold
DE0000000036,F00000066,29-03-2025 14:37,AIRPORT,,0,ground stop
DE0000000037,F00000066,2025-03-29T13:54:00,MAINT,OPS9,1,late inbound
DE0000000038,F00000066,2025-03-29T15:14:00,GATE,WX01,1,gate hold
DE0000000039,F00000068,05-01-2025 15:36,airport,,2,crew swap
DE0000000040,F00000068,05-01-2025 14:47,WX,GT3,2,
DE0000000041,F00000073,09-07-2024 20:17,maint,ATC7,0,deicing
DE0000000042,F00000073,07-09-2024 21:16,atc,MX5,2,ground stop
DE0000000043,F00000075,06/19/2024 16:59,crew,,23,gate hold
DE0000000044,F00000098,02/25/2024 04:45,MX,,49,maintenance check
DE0000000045,F00000098,25-02-2024 04:17,MAINT,WX01,6,
DE0000000046,F00000103,2025-06-02T13:57:00,CREW,ATC7,17,late inbound
DE0000000047,F00000103,06-02-2025 14:03,weather,CR02,11,deicing
DE0000000048,F00000117,11-05-2025 01:27,ATC,ATC7,3,late inbound
DE0000000049,F00000117,05-11-2025 01:49,TRAFFIC,,3,gate hold
DE0000000050,F00000118,02-08-2025 21:47,WEATHER,WX01,51,gate hold
DE0000000051,F00000122,15-09-2025 19:26,TRAFFIC,CR02,4,ground stop
DE0000000052,F00000122,15-09-2025 20:40,ATC,MX5,7,crew swap
DE0000000053,F00000122,15-09-2025 21:00,GATE,ATC7,26,deicing
DE0000000054,F00000123,07-05-2024 16:16,ATC,,29,maintenance check
DE0000000055,F00000128,04-09-2025 07:55,CREW,OPS9,29,ground stop
DE0000000056,F00000128,04-09-2025 09:27,MAINT,MX5,1,late inbound
DE0000000057,F00000134,10-01-2024 07:07,CREW,CR02,28,late inbound
DE0000000058,F00000138,24-01-2025 03:07,MAINT,OPS9,46,late inbound
DE0000000059,F00000138,2025-01-24T03:54:00,WX,OPS9,8,maintenance check
DE0000000060,F00000141,2024-05-21T06:52:00,WEATHER,GT3,50,crew swap
DE0000000061,F00000144,05-06-2025 15:17,WEATHER,CR02,17,late inbound
DE0000000062,F00000144,05-06-2025 17:01,crew,CR02,25,ground stop
DE0000000063,F00000144,05-06-2025 14:19,WEATHER,,3,maintenance check
DE0000000064,F00000148,07/16/2025 04:33,CREW,MX5,6,crew swap
DE0000000065,F00000148,16-07-2025 06:39,MAINT,WX01,2,late inbound
DE0000000066,F00000148,16-07-2025 04:59,ATC,CR02,1,deicing
DE0000000067,F00000149,01-01-2025 05:34,OPS,GT3,-29,
DE0000000068,F00000152,06-11-2025 04:20,AIRPORT,ATC7,5,gate hold
DE0000000069,F00000152,11-06-2025 05:04,WEATHER,,22,late inbound
DE0000000070,F00000162,27-02-2025 04:42,other,WX01,3,crew swap
DE0000000071,F00000162,27-02-2025 06:02,airport,,3,maintenance check
DE0000000072,F00000162,27-02-2025 06:59,AIRPORT,ATC7,3,deicing
DE0000000073,F00000163,27-02-2024 15:03,WEATHER,WX01,8,gate hold
DE0000000074,F00000163,02/27/2024 12:56,crew,CR02,41,maintenance check
DE0000000075,F00000167,29-02-2024 15:09,WEATHER,WX01,7,late inbound
DE0000000076,F00000167,29-02-2024 14:09,other,WX01,3m,late inbound
DE0000000077,F00000167,29-02-2024 14:20,MAINT,CR02,5,maintenance check
DE0000000078,F00000170,12-04-2024 08:21,OPS,MX5,1,deicing
DE0000000079,F00000170,12-04-2024 09:57,CREW,MX5,10,gate hold
DE0000000080,F00000173,03-11-2024 11:23,AIRPORT,OPS9,2,late inbound
DE0000000081,F00000176,01/22/2025 02:46,atc,MX5,4,late inbound
DE0000000082,F00000180,29-11-2025 13:50,TRAFFIC,CR02,10,deicing
DE0000000083,F00000181,28-03-2024 17:26,crew,,-15,ground stop
DE0000000084,F00000184,07/30/2024 09:45,crew,MX5,5,maintenance check
DE0000000085,F00000186,30-08-2025 19:48,airport,GT3,12,maintenance check
DE0000000086,F00000186,30-08-2025 20:28,TRAFFIC,,12,late inbound
DE0000000087,F00000187,12-12-2024 04:14,crew,ATC7,38,deicing
DE0000000088,F00000187,12-12-2024 05:11,TRAFFIC,GT3,6m,gate hold
DE0000000089,F00000187,12-12-2024 04:48,TRAFFIC,,3,gate hold
DE0000000090,F00000189,10-12-2025 16:01,ATC,OPS9,13,late inbound
DE0000000091,F00000191,25-12-2024 15:43,airport,MX5,9,gate hold
DE0000000092,F00000191,25-12-2024 14:51,AIRPORT,CR02,1,crew swap
DE0000000093,F00000193,24-07-2024 17:35,WX,GT3,14,late inbound
DE0000000094,F00000193,24-07-2024 17:58,OTHER,GT3,7,ground stop
DE0000000095,F00000195,08-07-2024 21:09,weather,OPS9,23,
DE0000000096,F00000201,2025-04-11T21:45:00,ATC,CR02,12,late inbound
DE0000000097,F00000205,01-01-2026 16:00,OPS,OPS9,30,gate hold
DE0000000098,F00000205,01-01-2026 17:32,OTHER,GT3,1,
DE0000000099,F00000206,06/16/2024 06:35,MX,MX5,30,ground stop
DE0000000100,F00000208,18-02-2024 05:12,MX,,1,
DE0000000101,F00000210,10/20/2025 19:12,WEATHER,OPS9,5,crew swap
DE0000000102,F00000212,29-12-2025 21:28,ATC,WX01,3,deicing
DE0000000103,F00000212,29-12-2025 20:29,MX,GT3,1,gate hold
DE0000000104,F00000212,29-12-2025 21:08,WX,WX01,1,ground stop
DE0000000105,F00000214,21-09-2024 01:36,MAINT,WX01,5,gate hold
DE0000000106,F00000214,09/21/2024 01:45,crew,ATC7,-3,gate hold
DE0000000107,F00000214,21-09-2024 02:35,atc,WX01,35,deicing
DE0000000108,F00000215,09-01-2025 16:46,CRW,CR02,3,crew swap
DE0000000109,F00000215,09-01-2025 15:55,GATE,ATC7,4,ground stop
DE0000000110,F00000215,09-01-2025 16:57,atc,,7,crew swap
DE0000000111,F00000219,14-11-2025 01:13,other,CR02,28,deicing
DE0000000112,F00000220,07/21/2025 23:41,AIRPORT,GT3,4,gate hold
DE0000000113,F00000220,22-07-2025 00:00,other,MX5,3,
DE0000000114,F00000220,07/22/2025 01:23,airport,CR02,13,deicing
DE0000000115,F00000221,12-04-2025 23:23,other,CR02,7m,crew swap
DE0000000116,F00000227,21-08-2025 22:30,WEATHER,OPS9,18,ground stop
DE0000000117,F00000227,21-08-2025 21:41,TRAFFIC,,1,maintenance check
DE0000000118,F00000227,08/21/2025 20:30,TRAFFIC,MX5,3,
DE0000000119,F00000230,04-04-2024 15:54,GATE,,31,ground stop
DE0000000120,F00000231,06-07-2025 16:39,crew,ATC7,14,maintenance check
DE0000000121,F00000231,07-06-2025 17:27,atc,ATC7,6,crew swap
DE0000000122,F00000231,07-06-2025 16:46,maint,OPS9,11,
DE0000000123,F00000232,2025-08-12T10:20:00,other,,3,maintenance check
DE0000000124,F00000232,12-08-2025 10:22,MAINT,CR02,24,
DE0000000125,F00000234,06-08-2024 00:24,maint,OPS9,5,ground stop
DE0000000126,F00000234,05-08-2024 23:58,other,CR02,1,gate hold
DE0000000127,F00000234,06-08-2024 00:21,crew,CR02,3,late inbound
DE0000000128,F00000242,27-01-2025 07:00,atc,,17,late inbound
DE0000000129,F00000242,01/27/2025 08:05,other,,10,late inbound
DE0000000130,F00000244,12-05-2025 13:46,WX,,1,maintenance check
DE0000000131,F00000244,12-05-2025 11:55,WEATHER,GT3,7,crew swap
DE0000000132,F00000246,09/13/2025 23:09,GATE,MX5,25m,ground stop
DE0000000133,F00000248,31-12-2024 00:39,ATC,CR02,27,gate hold
DE0000000134,F00000248,31-12-2024 01:11,airport,MX5,9,crew swap
DE0000000135,F00000248,31-12-2024 01:36,maint,WX01,2,crew swap
DE0000000136,F00000253,22-03-2024 02:54,maint,GT3,30m,maintenance check
DE0000000137,F00000257,29-01-2026 23:25,WX,ATC7,14m,
DE0000000138,F00000257,01/30/2026 01:57,atc,,3,maintenance check
DE0000000139,F00000257,30-01-2026 00:39,maint,MX5,1,deicing
DE0000000140,F00000258,25-12-2025 16:13,WEATHER,CR02,1,gate hold
DE0000000141,F00000258,25-12-2025 17:25,AIRPORT,OPS9,1,ground stop
DE0000000142,F00000258,25-12-2025 18:57,MX,WX01,1,gate hold
DE0000000143,F00000259,06-01-2025 14:02,AIRPORT,,-1,late inbound
DE0000000144,F00000259,01-06-2025 13:28,OTHER,ATC7,1,deicing
DE0000000145,F00000259,01-06-2025 15:29,WX,WX01,1,late inbound
DE0000000146,F00000265,12/17/2024 22:33,weather,CR02,13,late inbound
DE0000000147,F00000265,17-12-2024 21:40,OPS,MX5,17,late inbound
DE0000000148,F00000268,2025-11-02T17:35:00,OPS,OPS9,0,crew swap
DE0000000149,F00000268,11-02-2025 16:26,MX,ATC7,1,maintenance check
DE0000000150,F00000268,02-11-2025 16:21,WEATHER,,2,maintenance check
DE0000000151,F00000270,28-05-2024 16:43,CRW,MX5,2,late inbound
DE0000000152,F00000270,28-05-2024 15:16,WX,MX5,6,deicing
DE0000000153,F00000270,05/28/2024 15:43,WX,,16,crew swap
DE0000000154,F00000271,01/19/2026 03:34,MX,OPS9,-3,gate hold
DE0000000155,F00000271,19-01-2026 01:07,CRW,WX01,12,
DE0000000156,F00000272,07/28/2024 02:41,ATC,MX5,26,
DE0000000157,F00000275,10-02-2024 13:33,MAINT,GT3,18,crew swap
DE0000000158,F00000275,10-02-2024 12:57,airport,CR02,20,
DE0000000159,F00000275,02-10-2024 11:45,CRW,WX01,-4,gate hold
DE0000000160,F00000279,15-10-2025 22:53,WX,GT3,8,gate hold
DE0000000161,F00000279,10/15/2025 23:57,OTHER,ATC7,4,
DE0000000162,F00000280,2024-07-04T20:55:00,TRAFFIC,GT3,10,gate hold
DE0000000163,F00000283,2025-03-18T21:59:00,AIRPORT,,27,ground stop
DE0000000164,F00000283,18-03-2025 23:19,CREW,ATC7,8,deicing
DE0000000165,F00000283,18-03-2025 22:47,crew,MX5,3m,
DE0000000166,F00000284,09/14/2025 09:57,airport,MX5,3,
DE0000000167,F00000284,09/14/2025 09:13,OTHER,GT3,7,ground stop
DE0000000168,F00000289,19-03-2025 01:44,OTHER,CR02,2,ground stop
DE0000000169,F00000289,19-03-2025 03:21,WX,CR02,24,ground stop
DE0000000170,F00000291,07-04-2025 12:28,MAINT,GT3,5,deicing
DE0000000171,F00000292,2024-09-05T09:28:00,crew,MX5,23,gate hold
DE0000000172,F00000296,2024-05-02T02:20:00,crew,OPS9,11,
DE0000000173,F00000303,15-01-2026 22:16,CRW,MX5,44,deicing
DE0000000174,F00000303,15-01-2026 23:00,atc,,3,gate hold
DE0000000175,F00000305,29-01-2026 08:07,AIRPORT,GT3,16,maintenance check
DE0000000176,F00000305,2026-01-29T07:35:00,CRW,MX5,5,maintenance check
DE0000000177,F00000305,01/29/2026 08:11,atc,,19,gate hold
DE0000000178,F00000308,04-12-2024 02:13,MX,GT3,4,late inbound
DE0000000179,F00000308,04-12-2024 01:52,OPS,ATC7,12,maintenance check
DE0000000180,F00000310,08-10-2025 10:55,OPS,MX5,-5,
DE0000000181,F00000310,08-10-2025 12:31,GATE,ATC7,3,crew swap
DE0000000182,F00000317,31-12-2025 22:16,MX,GT3,2m,crew swap
DE0000000183,F00000317,12/31/2025 22:23,TRAFFIC,MX5,15,late inbound
DE0000000184,F00000321,21-05-2024 10:04,maint,MX5,5,
DE0000000185,F00000325,30-07-2024 13:38,CREW,OPS9,1,crew swap
DE0000000186,F00000325,30-07-2024 12:26,CREW,OPS9,5,
DE0000000187,F00000325,07/30/2024 11:50,GATE,CR02,16,ground stop
DE0000000188,F00000326,05-03-2025 21:43,crew,MX5,2,maintenance check
DE0000000189,F00000326,03-05-2025 21:02,TRAFFIC,,5,maintenance check
DE0000000190,F00000326,03-05-2025 21:37,CREW,CR02,1m,late inbound
DE0000000191,F00000328,03/29/2024 19:02,MX,ATC7,1,gate hold
DE0000000192,F00000328,29-03-2024 17:40,TRAFFIC,ATC7,9,maintenance check
DE0000000193,F00000329,2024-03-08T06:10:00,MAINT,OPS9,5,late inbound
DE0000000194,F00000329,08-03-2024 08:05,atc,ATC7,-27,maintenance check
DE0000000195,F00000329,08-03-2024 06:09,CRW,CR02,15,maintenance check
DE0000000196,F00000334,30-07-2025 13:32,WEATHER,GT3,26m,crew swap
DE0000000197,F00000334,30-07-2025 15:19,CREW,MX5,20,late inbound
DE0000000198,F00000334,07/30/2025 15:45,GATE,WX01,1,late inbound
DE0000000199,F00000336,14-01-2026 02:16,maint,MX5,5m,deicing
DE0000000200,F00000336,01/14/2026 01:09,AIRPORT,OPS9,13,
DE0000000201,F00000340,16-11-2025 20:47,atc,MX5,17,ground stop
DE0000000202,F00000340,16-11-2025 19:06,AIRPORT,OPS9,1,ground stop
DE0000000203,F00000341,25-08-2025 14:52,AIRPORT,MX5,5,deicing
DE0000000204,F00000341,25-08-2025 16:44,WEATHER,MX5,8,gate hold
DE0000000205,F00000342,02-11-2024 10:53,OPS,GT3,-1,
DE0000000206,F00000342,02-11-2024 08:57,OPS,WX01,1,late inbound
DE0000000207,F00000344,05-09-2024 20:20,crew,ATC7,4m,deicing
DE0000000208,F00000344,05-09-2024 19:54,CRW,,7,crew swap
DE0000000209,F00000344,05-09-2024 20:08,weather,GT3,6,gate hold
DE0000000210,F00000350,02-10-2024 14:27,WX,CR02,13,ground stop
DE0000000211,F00000350,02-10-2024 14:43,other,MX5,2,maintenance check
DE0000000212,F00000354,11-12-2024 12:40,WEATHER,GT3,5,ground stop
DE0000000213,F00000354,2024-12-11T11:53:00,OTHER,WX01,1,maintenance check
DE0000000214,F00000355,13-10-2025 10:38,other,GT3,1,
DE0000000215,F00000355,13-10-2025 09:25,CRW,GT3,9,crew swap
DE0000000216,F00000355,13-10-2025 09:25,GATE,,29,maintenance check
DE0000000217,F00000357,24-08-2024 03:04,CRW,MX5,26,
DE0000000218,F00000357,24-08-2024 02:07,WX,CR02,16,ground stop
DE0000000219,F00000359,14-11-2025 20:48,airport,OPS9,27,crew swap
DE0000000220,F00000359,14-11-2025 20:16,MX,WX01,8,ground stop
DE0000000221,F00000365,10-04-2025 07:40,WX,OPS9,0,crew swap
DE0000000222,F00000365,10-04-2025 07:40,airport,WX01,3m,
DE0000000223,F00000365,10-04-2025 07:05,OPS,ATC7,1,gate hold
DE0000000224,F00000373,03-05-2025 15:35,CREW,GT3,5,deicing
DE0000000225,F00000373,03-05-2025 15:48,OPS,CR02,1,gate hold
DE0000000226,F00000373,03-05-2025 15:46,GATE,OPS9,1,ground stop
DE0000000227,F00000376,01-02-2025 02:24,TRAFFIC,,3,late inbound
DE0000000228,F00000376,01-02-2025 03:13,OPS,MX5,17,
DE0000000229,F00000378,06/16/2024 20:17,ATC,,30,maintenance check
DE0000000230,F00000379,19-03-2024 11:39,MX,ATC7,4,gate hold
DE0000000231,F00000379,19-03-2024 09:46,crew,,26,
DE0000000232,F00000382,08-07-2025 15:28,crew,GT3,0,crew swap
DE0000000233,F00000382,08-07-2025 15:44,CRW,CR02,-1,maintenance check
DE0000000234,F00000392,2025-10-22T15:08:00,MAINT,,9,
DE0000000235,F00000392,22-10-2025 16:43,airport,,2,deicing
DE0000000236,F00000392,2025-10-22T17:35:00,MAINT,OPS9,3m,gate hold
DE0000000237,F00000395,2024-03-02T08:43:00,GATE,CR02,19,deicing
DE0000000238,F00000396,16-10-2024 06:17,MX,WX01,1,crew swap
DE0000000239,F00000396,10/16/2024 05:53,other,CR02,3,gate hold
DE0000000240,F00000402,2024-07-14T11:39:00,AIRPORT,,-1,late inbound
DE0000000241,F00000402,14-07-2024 12:47,ATC,MX5,1,
DE0000000242,F00000402,14-07-2024 11:09,weather,CR02,1,gate hold
DE0000000243,F00000409,10-12-2024 16:21,maint,WX01,22m,gate hold
DE0000000244,F00000409,10-12-2024 16:24,AIRPORT,WX01,8,ground stop
DE0000000245,F00000414,02/20/2025 10:21,airport,GT3,3m,
DE0000000246,F00000414,20-02-2025 07:56,AIRPORT,WX01,43,ground stop
DE0000000247,F00000416,23-09-2025 09:23,TRAFFIC,ATC7,12,deicing
DE0000000248,F00000416,23-09-2025 06:56,AIRPORT,OPS9,3,
DE0000000249,F00000418,2024-12-25T22:24:00,MAINT,OPS9,26,late inbound
DE0000000250,F00000419,06-02-2024 11:47,MAINT,GT3,-1,late inbound
DE0000000251,F00000419,06-02-2024 11:45,OPS,ATC7,1,deicing
DE0000000252,F00000419,06-02-2024 12:33,other,WX01,1,gate hold
DE0000000253,F00000422,23-08-2024 16:27,maint,ATC7,30,late inbound
DE0000000254,F00000423,21-06-2024 19:08,ATC,OPS9,36,maintenance check
DE0000000255,F00000423,21-06-2024 19:15,other,GT3,14,maintenance check
DE0000000256,F00000425,10-06-2025 02:34,airport,GT3,18,deicing
DE0000000257,F00000427,09-09-2025 03:51,OPS,ATC7,14,maintenance check
DE0000000258,F00000427,09-09-2025 03:32,airport,MX5,4m,gate hold
DE0000000259,F00000427,09-09-2025 01:58,CRW,WX01,24,deicing
DE0000000260,F00000428,26-10-2025 08:46,other,OPS9,4,crew swap
DE0000000261,F00000430,13-12-2024 00:12,OTHER,MX5,31,deicing
DE0000000262,F00000430,12/13/2024 00:27,OPS,CR02,-1,gate hold
DE0000000263,F00000430,13-12-2024 00:10,WX,,17,deicing
DE0000000264,F00000431,11-11-2024 18:16,MAINT,GT3,4,maintenance check
DE0000000265,F00000431,11-11-2024 17:00,WX,CR02,4,crew swap
DE0000000266,F00000438,21-01-2025 06:01,MX,GT3,0,maintenance check
DE0000000267,F00000438,21-01-2025 05:56,weather,OPS9,2,deicing
DE0000000268,F00000438,21-01-2025 06:27,OTHER,WX01,12,late inbound
DE0000000269,F00000440,04-06-2024 00:43,crew,WX01,2,late inbound
DE0000000270,F00000440,04-06-2024 01:55,OPS,WX01,12,late inbound
DE0000000271,F00000443,11-05-2025 07:22,GATE,ATC7,47,deicing
DE0000000272,F00000448,06/21/2025 21:04,OTHER,ATC7,5,late inbound
DE0000000273,F00000448,21-06-2025 20:39,WEATHER,WX01,5,gate hold
DE0000000274,F00000448,21-06-2025 20:48,MX,GT3,3,
DE0000000275,F00000451,14-10-2025 23:25,other,,26,gate hold
DE0000000276,F00000453,12-10-2025 01:56,MX,ATC7,2,crew swap
DE0000000277,F00000453,12-10-2025 01:14,WEATHER,CR02,12,late inbound
DE0000000278,F00000453,10-12-2025 02:34,WEATHER,,1,late inbound
DE0000000279,F00000454,06-08-2025 10:31,TRAFFIC,ATC7,32,ground stop
DE0000000280,F00000456,09-09-2024 04:35,TRAFFIC,WX01,2,
DE0000000281,F00000456,09-09-2024 05:58,airport,WX01,3,deicing
DE0000000282,F00000456,09-09-2024 06:22,CREW,OPS9,25m,deicing
DE0000000283,F00000464,03-04-2024 04:48,CREW,ATC7,15,late inbound
DE0000000284,F00000466,07/14/2024 23:16,CREW,MX5,5,late inbound
DE0000000285,F00000466,14-07-2024 22:47,atc,CR02,22,
DE0000000286,F00000467,18-09-2024 00:08,atc,WX01,-25,
DE0000000287,F00000467,2024-09-17T23:15:00,TRAFFIC,CR02,3,deicing
DE0000000288,F00000467,09/18/2024 00:15,WEATHER,GT3,7,deicing
DE0000000289,F00000473,25-05-2024 00:28,TRAFFIC,WX01,11m,gate hold
DE0000000290,F00000475,2025-01-21T21:23:00,WEATHER,CR02,13,maintenance check
DE0000000291,F00000479,02-02-2024 08:19,atc,,47,gate hold
DE0000000292,F00000479,02-02-2024 09:42,OPS,WX01,23m,late inbound
DE0000000293,F00000484,30-11-2025 23:35,crew,,6,ground stop
DE0000000294,F00000485,03-11-2024 05:15,CREW,,-2,crew swap
DE0000000295,F00000485,11-03-2024 05:09,GATE,ATC7,1,
DE0000000296,F00000485,03-11-2024 05:49,weather,,1,maintenance check
DE0000000297,F00000489,10-12-2025 02:14,other,WX01,3,maintenance check
DE0000000298,F00000489,10-12-2025 01:39,TRAFFIC,CR02,8,deicing
DE0000000299,F00000489,12-10-2025 01:51,WEATHER,ATC7,6,ground stop
DE0000000300,F00000492,02-12-2024 04:20,OPS,OPS9,15,gate hold
DE0000000301,F00000492,12-02-2024 05:08,OPS,CR02,4,late inbound
DE0000000302,F00000492,12-02-2024 04:58,other,GT3,17,gate hold
DE0000000303,F00000496,16-12-2024 10:21,WX,CR02,18,
DE0000000304,F00000500,18-09-2024 17:26,weather,ATC7,28,ground stop
DE0000000305,F00000503,07/16/2024 03:51,MAINT,OPS9,6,
DE0000000306,F00000503,16-07-2024 03:06,TRAFFIC,CR02,12,deicing
DE0000000307,F00000503,16-07-2024 04:15,MX,OPS9,47m,deicing
DE0000000308,F00000504,23-11-2025 06:39,crew,MX5,4,ground stop
DE0000000309,F00000504,11/23/2025 05:19,AIRPORT,OPS9,10,
DE0000000310,F00000504,23-11-2025 07:18,TRAFFIC,OPS9,3,crew swap
DE0000000311,F00000505,29-12-2025 20:36,OPS,CR02,12,gate hold
DE0000000312,F00000507,05-03-2025 07:46,weather,OPS9,1,deicing
DE0000000313,F00000507,05-03-2025 07:36,ATC,MX5,6,deicing
DE0000000314,F00000512,08-02-2024 08:47,airport,CR02,4,late inbound
DE0000000315,F00000512,08-02-2024 06:45,OPS,ATC7,-14,late inbound
DE0000000316,F00000514,26-09-2024 16:15,ATC,WX01,5,
DE0000000317,F00000514,26-09-2024 16:03,atc,GT3,20m,ground stop
DE0000000318,F00000514,26-09-2024 16:40,AIRPORT,WX01,29,
DE0000000319,F00000516,06-11-2025 23:23,other,,21,ground stop
DE0000000320,F00000518,22-08-2025 06:32,WX,GT3,3,gate hold
DE0000000321,F00000518,22-08-2025 05:12,airport,CR02,4,late inbound
DE0000000322,F00000518,22-08-2025 07:39,GATE,ATC7,13,maintenance check
DE0000000323,F00000520,29-08-2024 14:05,CREW,WX01,12,late inbound
DE0000000324,F00000520,08/29/2024 12:50,WEATHER,ATC7,12,
DE0000000325,F00000528,19-04-2025 06:21,crew,OPS9,12,crew swap
DE0000000326,F00000528,19-04-2025 07:09,GATE,WX01,1,
DE0000000327,F00000529,04-12-2025 15:01,MAINT,ATC7,1,crew swap
DE0000000328,F00000529,04-12-2025 17:33,atc,MX5,2,late inbound
DE0000000329,F00000529,04-12-2025 14:54,MX,OPS9,4,maintenance check
DE0000000330,F00000531,05-08-2025 08:15,OPS,WX01,18,maintenance check
DE0000000331,F00000531,08-05-2025 07:18,WEATHER,WX01,2m,deicing
DE0000000332,F00000531,05-08-2025 06:14,crew,CR02,3,late inbound
DE0000000333,F00000536,28-04-2024 10:52,MX,GT3,7,ground stop
DE0000000334,F00000541,01/22/2025 18:25,OPS,MX5,3,
DE0000000335,F00000541,22-01-2025 16:17,AIRPORT,MX5,69,late inbound
DE0000000336,F00000543,12-05-2025 03:42,CRW,GT3,5m,gate hold
DE0000000337,F00000543,05-12-2025 06:09,ATC,CR02,18,ground stop
DE0000000338,F00000543,05-12-2025 06:15,GATE,MX5,1,gate hold
DE0000000339,F00000544,04-05-2024 14:53,crew,CR02,34,gate hold
DE0000000340,F00000547,2025-01-12T05:13:00,TRAFFIC,OPS9,3,maintenance check
DE0000000341,F00000547,12-01-2025 07:44,atc,ATC7,18,ground stop
DE0000000342,F00000552,2025-02-13T08:20:00,crew,CR02,19,late inbound
DE0000000343,F00000552,13-02-2025 08:14,crew,WX01,6,gate hold
DE0000000344,F00000552,02/13/2025 08:01,airport,CR02,4,late inbound
DE0000000345,F00000554,10-12-2024 16:01,ATC,GT3,15,ground stop
DE0000000346,F00000554,10-12-2024 16:43,airport,ATC7,-4,
DE0000000347,F00000556,31-05-2025 08:21,GATE,WX01,13,
DE0000000348,F00000556,31-05-2025 08:17,CREW,MX5,2,crew swap
DE0000000349,F00000559,20-09-2024 03:43,other,MX5,10,gate hold
DE0000000350,F00000559,20-09-2024 03:07,CRW,ATC7,1,maintenance check
DE0000000351,F00000565,30-03-2025 17:42,OPS,OPS9,13,ground stop
DE0000000352,F00000566,2024-07-20T03:02:00,WX,MX5,11,
DE0000000353,F00000567,12-07-2025 01:38,WEATHER,,0,deicing
DE0000000354,F00000567,11-07-2025 23:47,other,OPS9,1,crew swap
DE0000000355,F00000570,26-09-2024 01:59,ATC,GT3,17,crew swap
DE0000000356,F00000570,26-09-2024 02:46,GATE,,13,late inbound
DE0000000357,F00000570,26-09-2024 00:23,atc,OPS9,9,
DE0000000358,F00000572,07-04-2025 06:08,atc,OPS9,1,deicing
DE0000000359,F00000572,04-07-2025 04:29,crew,MX5,1,ground stop
DE0000000360,F00000572,04-07-2025 06:06,TRAFFIC,OPS9,5,ground stop
DE0000000361,F00000575,2025-01-21T19:39:00,WEATHER,OPS9,0,ground stop
DE0000000362,F00000575,2025-01-21T19:02:00,WEATHER,OPS9,1,gate hold
DE0000000363,F00000583,08/23/2024 20:37,maint,MX5,28,
DE0000000364,F00000590,01/15/2025 22:29,CRW,OPS9,24,deicing
DE0000000365,F00000593,2025-03-28T01:59:00,GATE,,3,
DE0000000366,F00000593,27-03-2025 23:55,OPS,MX5,7,ground stop
DE0000000367,F00000594,27-11-2024 19:54,WEATHER,WX01,-1,deicing
DE0000000368,F00000594,27-11-2024 19:17,OTHER,CR02,1,
DE0000000369,F00000594,27-11-2024 19:50,TRAFFIC,OPS9,1,
DE0000000370,F00000598,24-03-2025 01:42,other,WX01,1,ground stop
DE0000000371,F00000598,24-03-2025 00:04,ATC,WX01,6,gate hold
DE0000000372,F00000601,2024-11-07T14:42:00,CRW,MX5,5,gate hold
DE0000000373,F00000603,18-08-2024 18:41,WEATHER,,38,crew swap
DE0000000374,F00000605,04-12-2024 07:08,TRAFFIC,WX01,60,ground stop
DE0000000375,F00000605,04-12-2024 07:08,other,WX01,7,late inbound
DE0000000376,F00000610,12-11-2024 16:38,crew,OPS9,1,maintenance check
DE0000000377,F00000610,12-11-2024 17:03,MAINT,ATC7,7,ground stop
DE0000000378,F00000610,12-11-2024 15:25,OTHER,MX5,15,gate hold
DE0000000379,F00000615,18-09-2025 01:59,atc,,48,gate hold
DE0000000380,F00000615,18-09-2025 00:19,MAINT,GT3,6,
DE0000000381,F00000616,17-01-2025 21:53,ATC,CR02,1,
DE0000000382,F00000616,2025-01-17T19:53:00,GATE,ATC7,1,late inbound
DE0000000383,F00000616,17-01-2025 20:23,crew,GT3,3,gate hold
DE0000000384,F00000619,03-08-2024 08:58,crew,GT3,6,gate hold
DE0000000385,F00000625,04-09-2024 23:47,crew,WX01,7,maintenance check
DE0000000386,F00000625,04-09-2024 21:53,MAINT,OPS9,3,crew swap
DE0000000387,F00000628,02/21/2025 12:05,maint,OPS9,27,ground stop
DE0000000388,F00000628,21-02-2025 13:03,OTHER,,2,deicing
DE0000000389,F00000636,12/14/2024 06:48,AIRPORT,GT3,1,maintenance check
DE0000000390,F00000636,14-12-2024 07:00,atc,ATC7,4,
DE0000000391,F00000637,2025-02-16T17:47:00,ATC,ATC7,1,gate hold
DE0000000392,F00000638,13-06-2024 04:31,AIRPORT,MX5,1,deicing
DE0000000393,F00000638,06/13/2024 06:41,GATE,,1,late inbound
DE0000000394,F00000638,13-06-2024 05:51,TRAFFIC,OPS9,2,late inbound
DE0000000395,F00000639,20-02-2025 13:09,TRAFFIC,CR02,3,deicing
DE0000000396,F00000643,04-04-2025 20:37,WEATHER,GT3,10m,
DE0000000397,F00000643,04-04-2025 19:28,GATE,GT3,1,deicing
DE0000000398,F00000643,04-04-2025 19:04,MX,,8,maintenance check
DE0000000399,F00000649,06-01-2026 01:25,CRW,OPS9,0,late inbound
DE0000000400,F00000649,06-01-2026 02:30,crew,MX5,2,deicing
DE0000000401,F00000649,06-01-2026 02:27,crew,CR02,1,gate hold
DE0000000402,F00000650,2025-06-28T10:40:00,MAINT,GT3,51,deicing
DE0000000403,F00000650,06/28/2025 11:21,WX,,16,
DE0000000404,F00000650,28-06-2025 12:00,weather,MX5,69m,crew swap
DE0000000405,F00000652,12/25/2025 13:10,MX,ATC7,36,maintenance check
DE0000000406,F00000653,13-11-2024 18:35,airport,WX01,4,gate hold
DE0000000407,F00000653,13-11-2024 18:03,ATC,ATC7,9,maintenance check
DE0000000408,F00000653,13-11-2024 17:06,OTHER,OPS9,17m,gate hold
DE0000000409,F00000655,2025-05-08T06:51:00,ATC,WX01,56,crew swap
DE0000000410,F00000655,05-08-2025 05:52,maint,,5m,deicing
DE0000000411,F00000657,15-02-2024 20:24,maint,OPS9,2,maintenance check
DE0000000412,F00000657,15-02-2024 18:06,MAINT,ATC7,7m,crew swap
DE0000000413,F00000657,2024-02-15T18:20:00,MX,,3m,ground stop
DE0000000414,F00000659,2025-03-14T07:45:00,OTHER,OPS9,43,late inbound
DE0000000415,F00000660,10/28/2024 02:50,maint,,5,deicing
DE0000000416,F00000662,22-04-2024 06:52,TRAFFIC,ATC7,21,late inbound
DE0000000417,F00000663,02-12-2025 22:26,GATE,WX01,0,gate hold
DE0000000418,F00000663,02-12-2025 23:58,crew,OPS9,2,gate hold
DE0000000419,F00000664,18-09-2024 15:08,airport,WX01,5,maintenance check
DE0000000420,F00000664,18-09-2024 14:08,GATE,OPS9,2,deicing
DE0000000421,F00000664,18-09-2024 15:09,OTHER,,-7,late inbound
DE0000000422,F00000666,20-04-2024 10:35,atc,GT3,6,maintenance check
DE0000000423,F00000666,20-04-2024 10:17,TRAFFIC,GT3,4,late inbound
DE0000000424,F00000666,20-04-2024 08:34,GATE,WX01,5,
DE0000000425,F00000667,31-10-2024 05:48,MX,MX5,5,late inbound
DE0000000426,F00000667,31-10-2024 05:41,OTHER,OPS9,1,
DE0000000427,F00000669,11/30/2024 22:42,CREW,OPS9,1,crew swap
DE0000000428,F00000669,11/30/2024 23:26,atc,OPS9,16,
DE0000000429,F00000669,30-11-2024 23:48,WX,ATC7,2,late inbound
DE0000000430,F00000672,13-05-2025 21:59,airport,,11m,
DE0000000431,F00000675,22-05-2024 13:08,CRW,GT3,0,gate hold
DE0000000432,F00000675,22-05-2024 14:22,crew,MX5,2,crew swap
DE0000000433,F00000675,22-05-2024 14:41,OTHER,ATC7,1,
DE0000000434,F00000677,10/13/2024 04:02,OTHER,MX5,-2,deicing
DE0000000435,F00000677,2024-10-13T05:37:00,OPS,,3,crew swap
DE0000000436,F00000677,10/13/2024 03:12,OPS,MX5,-1,
DE0000000437,F00000678,21-11-2024 20:58,atc,MX5,29,ground stop
DE0000000438,F00000680,05-02-2024 05:13,atc,WX01,29,ground stop
DE0000000439,F00000681,2024-06-28T04:12:00,AIRPORT,OPS9,17,late inbound
DE0000000440,F00000682,27-10-2025 15:03,AIRPORT,CR02,19,
DE0000000441,F00000682,2025-10-27T15:38:00,CREW,CR02,1,deicing
DE0000000442,F00000682,27-10-2025 14:03,crew,CR02,20,ground stop
DE0000000443,F00000686,03/16/2025 17:19,GATE,MX5,34,deicing
DE0000000444,F00000686,16-03-2025 17:43,AIRPORT,MX5,20,gate hold
DE0000000445,F00000694,30-03-2024 09:13,AIRPORT,MX5,0,late inbound
DE0000000446,F00000694,2024-03-30T11:41:00,OTHER,MX5,13,late inbound
DE0000000447,F00000694,30-03-2024 11:00,atc,WX01,-1,late inbound
DE0000000448,F00000695,30-09-2024 08:15,WX,GT3,2,late inbound
DE0000000449,F00000695,30-09-2024 08:34,CREW,GT3,24,ground stop
DE0000000450,F00000695,30-09-2024 07:32,WX,CR02,17,
DE0000000451,F00000696,17-08-2025 07:42,maint,MX5,18,maintenance check
DE0000000452,F00000697,13-03-2025 05:58,weather,GT3,-1,late inbound
DE0000000453,F00000697,13-03-2025 05:20,airport,ATC7,1,crew swap
DE0000000454,F00000697,03/13/2025 08:03,CRW,GT3,2,maintenance check
DE0000000455,F00000700,01-11-2025 00:40,airport,CR02,28,deicing
DE0000000456,F00000700,11-01-2025 00:30,GATE,GT3,8,late inbound
DE0000000457,F00000702,01-01-2025 16:05,MX,ATC7,28m,gate hold
DE0000000458,F00000704,02-10-2024 14:13,MAINT,ATC7,1,
DE0000000459,F00000704,10-02-2024 16:02,other,CR02,5,crew swap
DE0000000460,F00000704,02-10-2024 16:06,CRW,GT3,6,ground stop
DE0000000461,F00000715,15-07-2024 16:31,airport,ATC7,-8,deicing
DE0000000462,F00000715,07/15/2024 17:22,atc,,8,maintenance check
DE0000000463,F00000716,31-07-2025 06:46,maint,MX5,5m,deicing
DE0000000464,F00000719,21-06-2025 20:20,CREW,ATC7,15,ground stop
DE0000000465,F00000719,21-06-2025 19:24,GATE,,25,
DE0000000466,F00000720,30-04-2025 23:35,MX,OPS9,50,late inbound
DE0000000467,F00000720,30-04-2025 23:57,airport,OPS9,9,
DE0000000468,F00000721,18-01-2025 16:18,WEATHER,GT3,1,deicing
DE0000000469,F00000721,18-01-2025 18:42,other,GT3,-10,deicing
DE0000000470,F00000724,06-02-2024 11:52,weather,MX5,27,deicing
DE0000000471,F00000726,06-12-2024 12:10,TRAFFIC,CR02,16,crew swap
DE0000000472,F00000726,12-06-2024 13:33,GATE,GT3,8,maintenance check
DE0000000473,F00000727,13-03-2025 01:36,MAINT,OPS9,9,
DE0000000474,F00000731,06-03-2024 21:02,other,MX5,38,late inbound
DE0000000475,F00000731,06-03-2024 20:38,crew,,2,maintenance check
DE0000000476,F00000732,05-04-2025 09:28,TRAFFIC,GT3,11,crew swap
DE0000000477,F00000732,04-05-2025 09:22,WEATHER,ATC7,7,crew swap
DE0000000478,F00000735,2025-10-01T04:51:00,atc,GT3,0,crew swap
DE0000000479,F00000735,01-10-2025 04:24,CRW,OPS9,1m,
DE0000000480,F00000735,2025-10-01T04:46:00,TRAFFIC,,1,late inbound
DE0000000481,F00000751,04-10-2025 08:56,WX,ATC7,20,crew swap
DE0000000482,F00000751,04-10-2025 09:32,OTHER,ATC7,24,ground stop
DE0000000483,F00000751,04-10-2025 09:01,ATC,GT3,1,maintenance check
DE0000000484,F00000752,10-06-2024 23:47,OPS,WX01,68,crew swap
DE0000000485,F00000755,19-12-2024 08:19,OPS,MX5,1,deicing
DE0000000486,F00000755,19-12-2024 06:37,OTHER,CR02,23,ground stop
DE0000000487,F00000759,13-02-2025 15:00,other,,2m,maintenance check
DE0000000488,F00000759,13-02-2025 14:55,CREW,CR02,12,gate hold
DE0000000489,F00000760,21-12-2024 03:10,WEATHER,OPS9,25,
DE0000000490,F00000760,12/21/2024 05:32,MAINT,ATC7,1,deicing
DE0000000491,F00000760,12/21/2024 05:26,CRW,MX5,4m,maintenance check
DE0000000492,F00000761,16-09-2025 03:48,crew,ATC7,4,
DE0000000493,F00000761,09/16/2025 03:10,airport,MX5,-7,
DE0000000494,F00000762,03-01-2026 13:18,GATE,WX01,2,crew swap
DE0000000495,F00000762,03-01-2026 13:17,weather,GT3,1,crew swap
DE0000000496,F00000764,02/22/2025 02:27,CRW,OPS9,6,crew swap
DE0000000497,F00000764,22-02-2025 00:04,airport,MX5,6,crew swap
DE0000000498,F00000765,03-07-2025 14:11,CRW,GT3,-17,late inbound
DE0000000499,F00000766,29-05-2025 21:10,atc,OPS9,0,deicing
DE0000000500,F00000766,2025-05-29T22:19:00,OPS,OPS9,1,
DE0000000501,F00000766,29-05-2025 21:07,atc,OPS9,1,crew swap
DE0000000502,F00000769,29-04-2024 18:50,TRAFFIC,ATC7,8,ground stop
DE0000000503,F00000769,04/29/2024 17:47,OTHER,OPS9,26,maintenance check
DE0000000504,F00000776,17-07-2024 15:51,other,OPS9,7,ground stop
DE0000000505,F00000777,11-03-2025 04:44,other,OPS9,10,
DE0000000506,F00000777,2025-03-11T06:28:00,CRW,MX5,2,deicing
DE0000000507,F00000778,13-04-2024 01:13,WEATHER,WX01,3,late inbound
DE0000000508,F00000778,13-04-2024 01:28,WX,OPS9,18,
DE0000000509,F00000779,06-02-2024 08:58,crew,WX01,0,gate hold
DE0000000510,F00000779,2024-02-06T09:51:00,maint,,1,gate hold
DE0000000511,F00000782,2025-06-14T10:45:00,OTHER,WX01,1,
DE0000000512,F00000782,14-06-2025 10:50,OPS,MX5,1,maintenance check
DE0000000513,F00000785,11/16/2025 09:33,OPS,GT3,25,
DE0000000514,F00000785,16-11-2025 09:23,CREW,ATC7,7,deicing
DE0000000515,F00000788,2025-05-11T23:05:00,MX,,9,crew swap
DE0000000516,F00000788,11-05-2025 21:36,WX,GT3,11,gate hold
DE0000000517,F00000788,05-11-2025 23:49,CREW,GT3,5m,ground stop
DE0000000518,F00000792,06-09-2024 03:24,OPS,ATC7,3,maintenance check
DE0000000519,F00000792,2024-09-06T03:12:00,atc,WX01,4,gate hold
DE0000000520,F00000792,06-09-2024 04:21,atc,,14,maintenance check
DE0000000521,F00000796,04-01-2026 15:27,maint,OPS9,30m,
DE0000000522,F00000802,03/14/2025 08:37,OTHER,WX01,3,crew swap
DE0000000523,F00000802,03/14/2025 06:54,OTHER,GT3,10,gate hold
DE0000000524,F00000804,11-04-2025 09:55,atc,MX5,6m,gate hold
DE0000000525,F00000804,11-04-2025 09:51,TRAFFIC,CR02,31,gate hold
DE0000000526,F00000805,09-02-2024 09:59,crew,OPS9,-11,crew swap
DE0000000527,F00000807,2024-09-06T08:04:00,OTHER,ATC7,25,ground stop
DE0000000528,F00000808,2025-12-05T16:35:00,crew,ATC7,12m,late inbound
DE0000000529,F00000808,2025-12-05T18:47:00,WX,GT3,1,gate hold
DE0000000530,F00000808,12-05-2025 18:13,WEATHER,,17,late inbound
DE0000000531,F00000809,17-06-2025 07:07,AIRPORT,WX01,12,
DE0000000532,F00000810,30-12-2024 11:18,GATE,ATC7,6m,late inbound
DE0000000533,F00000810,12/30/2024 08:54,GATE,,6,ground stop
DE0000000534,F00000812,07/24/2025 23:20,OTHER,OPS9,2,late inbound
DE0000000535,F00000812,07/25/2025 00:06,GATE,OPS9,1,late inbound
DE0000000536,F00000813,08-02-2024 13:51,TRAFFIC,WX01,3,late inbound
DE0000000537,F00000813,08-02-2024 13:40,GATE,GT3,7m,gate hold
DE0000000538,F00000816,29-04-2025 00:29,atc,OPS9,0,ground stop
DE0000000539,F00000816,28-04-2025 22:31,CRW,WX01,1,ground stop
DE0000000540,F00000816,28-04-2025 23:22,crew,GT3,5m,deicing
DE0000000541,F00000820,14-12-2025 05:40,airport,WX01,27,ground stop
DE0000000542,F00000820,14-12-2025 04:21,ATC,MX5,2,
DE0000000543,F00000821,10/14/2024 05:57,OPS,CR02,2,late inbound
DE0000000544,F00000822,29-01-2025 09:27,TRAFFIC,CR02,16,deicing
DE0000000545,F00000826,22-05-2024 21:21,other,OPS9,22,maintenance check
DE0000000546,F00000826,22-05-2024 22:54,GATE,CR02,13,gate hold
DE0000000547,F00000827,25-12-2024 22:55,GATE,,16,crew swap
DE0000000548,F00000827,25-12-2024 22:21,maint,WX01,1,late inbound
DE0000000549,F00000827,2024-12-25T22:59:00,airport,MX5,13,deicing
DE0000000550,F00000828,07-06-2024 09:07,OTHER,MX5,18,ground stop
DE0000000551,F00000830,2025-09-13T18:34:00,WEATHER,,1,gate hold
DE0000000552,F00000830,13-09-2025 18:15,WEATHER,,4,maintenance check
DE0000000553,F00000830,13-09-2025 19:30,WX,ATC7,13,late inbound
DE0000000554,F00000846,29-11-2025 12:17,other,WX01,4,crew swap
DE0000000555,F00000846,29-11-2025 10:56,MX,,1,ground stop
DE0000000556,F00000846,29-11-2025 11:14,airport,MX5,1,maintenance check
DE0000000557,F00000848,25-09-2024 17:24,other,WX01,18,deicing
DE0000000558,F00000848,25-09-2024 16:05,OPS,ATC7,12,deicing
DE0000000559,F00000851,22-06-2025 03:38,crew,MX5,34,crew swap
DE0000000560,F00000851,22-06-2025 05:19,ATC,GT3,15,deicing
DE0000000561,F00000852,10-03-2024 17:25,WEATHER,MX5,35,gate hold
DE0000000562,F00000852,03-10-2024 16:30,OPS,WX01,5,maintenance check
DE0000000563,F00000856,04/28/2025 19:37,WEATHER,MX5,1,deicing
DE0000000564,F00000856,28-04-2025 21:11,MX,GT3,4m,deicing
DE0000000565,F00000856,28-04-2025 20:11,CREW,OPS9,1m,late inbound
DE0000000566,F00000857,23-04-2024 08:18,atc,MX5,5,maintenance check
DE0000000567,F00000857,23-04-2024 08:25,TRAFFIC,WX01,19,deicing
DE0000000568,F00000858,08-03-2024 21:31,GATE,MX5,5,deicing
DE0000000569,F00000867,20-11-2025 15:10,OTHER,WX01,2m,
DE0000000570,F00000867,20-11-2025 13:56,MX,,4,gate hold
DE0000000571,F00000867,11/20/2025 15:45,GATE,WX01,7,late inbound
DE0000000572,F00000871,09-07-2025 15:28,OPS,GT3,4,crew swap
DE0000000573,F00000871,07-09-2025 18:23,OTHER,ATC7,1,maintenance check
DE0000000574,F00000871,09-07-2025 17:09,ATC,WX01,21,ground stop
DE0000000575,F00000876,2024-10-18T03:50:00,crew,,30,gate hold
DE0000000576,F00000878,23-12-2024 07:07,atc,ATC7,59,crew swap
DE0000000577,F00000879,2026-01-19T14:29:00,CRW,GT3,1,maintenance check
DE0000000578,F00000879,19-01-2026 13:36,MAINT,GT3,1,gate hold
DE0000000579,F00000879,19-01-2026 15:10,MAINT,MX5,2,crew swap
DE0000000580,F00000880,21-09-2024 03:59,OPS,,21,late inbound
DE0000000581,F00000880,21-09-2024 06:28,MX,CR02,25,gate hold
DE0000000582,F00000881,17-02-2025 00:48,crew,GT3,-17,late inbound
DE0000000583,F00000881,17-02-2025 00:18,GATE,OPS9,-13,ground stop
DE0000000584,F00000881,17-02-2025 00:38,maint,,4,late inbound
DE0000000585,F00000887,29-05-2025 06:25,airport,OPS9,3,deicing
DE0000000586,F00000888,2025-12-30T07:58:00,TRAFFIC,MX5,1,gate hold
DE0000000587,F00000888,30-12-2025 06:28,MAINT,OPS9,1,maintenance check
DE0000000588,F00000889,09-07-2024 13:58,weather,,1,deicing
DE0000000589,F00000891,03-02-2025 05:46,OTHER,GT3,7,deicing
DE0000000590,F00000891,03-02-2025 04:34,GATE,WX01,14,late inbound
DE0000000591,F00000893,06-09-2025 22:57,atc,WX01,20,maintenance check
DE0000000592,F00000893,06-09-2025 22:19,OTHER,MX5,-17,crew swap
DE0000000593,F00000896,17-08-2024 21:40,other,,22m,crew swap
DE0000000594,F00000896,17-08-2024 21:05,WEATHER,MX5,1,ground stop
DE0000000595,F00000897,14-09-2025 12:45,CREW,GT3,0,ground stop
DE0000000596,F00000897,2025-09-14T13:39:00,WX,OPS9,1,late inbound
DE0000000597,F00000909,19-05-2024 01:15,GATE,OPS9,30,
DE0000000598,F00000910,2024-04-10T00:03:00,CREW,GT3,23,maintenance check
DE0000000599,F00000915,18-11-2024 07:57,MAINT,CR02,-3,maintenance check
DE0000000600,F00000915,18-11-2024 09:39,other,MX5,1,gate hold
DE0000000601,F00000919,10-12-2024 06:21,crew,,6,ground stop
DE0000000602,F00000919,10-12-2024 05:17,WX,MX5,5,maintenance check
DE0000000603,F00000920,02-08-2024 12:31,weather,,-4,crew swap
DE0000000604,F00000920,02-08-2024 12:00,AIRPORT,WX01,7,ground stop
DE0000000605,F00000920,08-02-2024 13:26,WX,ATC7,8,ground stop
DE0000000606,F00000925,2025-10-26T04:59:00,airport,WX01,3,crew swap
DE0000000607,F00000925,26-10-2025 06:27,other,MX5,27m,
DE0000000608,F00000932,13-06-2024 13:10,airport,WX01,13,deicing
DE0000000609,F00000933,07/31/2024 08:31,OPS,WX01,16,
DE0000000610,F00000936,11-09-2025 19:15,OTHER,MX5,8,ground stop
DE0000000611,F00000940,05-06-2025 10:41,CRW,WX01,7,late inbound
DE0000000612,F00000946,29-04-2025 14:28,crew,ATC7,1,ground stop
DE0000000613,F00000946,29-04-2025 13:41,maint,MX5,24,ground stop
DE0000000614,F00000946,29-04-2025 13:49,WX,CR02,2,
DE0000000615,F00000950,26-07-2025 03:19,maint,WX01,42,deicing
DE0000000616,F00000950,26-07-2025 03:22,TRAFFIC,CR02,2,deicing
DE0000000617,F00000952,06-01-2025 07:38,atc,GT3,7,
DE0000000618,F00000956,27-06-2025 22:16,TRAFFIC,CR02,3,
DE0000000619,F00000956,28-06-2025 01:02,MX,MX5,9,late inbound
DE0000000620,F00000958,24-11-2025 08:36,atc,MX5,-1,maintenance check
DE0000000621,F00000958,24-11-2025 07:52,OTHER,ATC7,2,
DE0000000622,F00000960,04-02-2025 13:49,WEATHER,MX5,18,crew swap
DE0000000623,F00000960,04-02-2025 14:15,CREW,MX5,27,crew swap
DE0000000624,F00000963,21-01-2026 15:52,OTHER,WX01,17,
DE0000000625,F00000963,21-01-2026 14:26,airport,MX5,-9,late inbound
DE0000000626,F00000963,21-01-2026 13:28,TRAFFIC,ATC7,10,late inbound
DE0000000627,F00000966,10/15/2025 20:39,other,OPS9,4,crew swap
DE0000000628,F00000966,15-10-2025 21:23,OTHER,GT3,1,
DE0000000629,F00000966,15-10-2025 21:19,OTHER,MX5,9,gate hold
DE0000000630,F00000968,13-12-2024 00:43,OTHER,CR02,26,ground stop
DE0000000631,F00000970,2025-07-09T00:22:00,airport,MX5,8,gate hold
DE0000000632,F00000970,08-07-2025 22:49,MAINT,OPS9,9,ground stop
DE0000000633,F00000970,08-07-2025 22:09,atc,CR02,13,gate hold
DE0000000634,F00000971,08-05-2024 01:45,airport,,0,deicing
DE0000000635,F00000971,08-05-2024 02:41,OTHER,WX01,14,late inbound
DE0000000636,F00000974,31-07-2025 13:53,CREW,MX5,7,maintenance check
DE0000000637,F00000974,31-07-2025 14:18,other,CR02,13,crew swap
DE0000000638,F00000975,24-12-2025 06:36,WEATHER,WX01,2,deicing
DE0000000639,F00000975,24-12-2025 04:57,atc,OPS9,9,gate hold
DE0000000640,F00000978,03-10-2025 15:23,GATE,MX5,0,
DE0000000641,F00000978,10-03-2025 13:55,MX,MX5,2,maintenance check
DE0000000642,F00000978,03-10-2025 15:52,WX,GT3,6,gate hold
DE0000000643,F00000980,2025-12-12T02:02:00,WEATHER,CR02,4,late inbound
DE0000000644,F00000981,13-08-2024 11:44,weather,MX5,11,gate hold
DE0000000645,F00000982,05/25/2024 18:54,CREW,,12,crew swap
DE0000000646,F00000982,25-05-2024 19:49,CRW,ATC7,11,
DE0000000647,F00000988,12-07-2025 20:10,airport,ATC7,7,crew swap
DE0000000648,F00000988,12-07-2025 20:43,weather,,5,deicing
DE0000000649,F00000989,24-11-2025 18:30,maint,CR02,29,maintenance check
DE0000000650,F00000991,04-08-2024 18:30,other,OPS9,18,gate hold
DE0000000651,F00000991,04-08-2024 20:24,crew,GT3,3,
DE0000000652,F00000993,31-05-2024 12:06,MX,OPS9,3,deicing
DE0000000653,F00000993,31-05-2024 12:40,MX,,6,ground stop
DE0000000654,F00000993,31-05-2024 11:02,ATC,MX5,30,crew swap
DE0000000655,F00000997,09/25/2024 18:47,CREW,MX5,0,crew swap
DE0000000656,F00000997,25-09-2024 20:09,maint,MX5,9,late inbound
DE0000000657,F00000997,2024-09-25T19:34:00,ATC,GT3,1,crew swap
DE0000000658,F00000999,11/26/2024 02:43,WX,,23,maintenance check
DE0000000659,F00001002,2025-12-27T18:31:00,WX,WX01,9m,ground stop
DE0000000660,F00001003,22-04-2024 17:41,airport,,9,crew swap
DE0000000661,F00001003,22-04-2024 18:25,weather,ATC7,-3,maintenance check
DE0000000662,F00001004,06/29/2024 12:46,crew,MX5,13,late inbound
DE0000000663,F00001004,2024-06-29T12:39:00,AIRPORT,GT3,-19,maintenance check
DE0000000664,F00001005,04-07-2025 00:03,WX,OPS9,2,gate hold
DE0000000665,F00001005,03-07-2025 22:47,airport,WX01,1,ground stop
DE0000000666,F00001005,04-07-2025 00:17,airport,OPS9,1,
DE0000000667,F00001006,26-04-2024 12:22,TRAFFIC,MX5,4,late inbound
DE0000000668,F00001006,04/26/2024 12:43,weather,MX5,7,
DE0000000669,F00001010,31-01-2025 20:59,airport,GT3,15,deicing
DE0000000670,F00001010,31-01-2025 21:56,MAINT,OPS9,1m,late inbound
DE0000000671,F00001013,27-10-2025 21:47,OPS,,0,ground stop
DE0000000672,F00001013,27-10-2025 23:24,other,ATC7,1,late inbound
DE0000000673,F00001020,13-08-2025 08:49,MAINT,MX5,25,deicing
DE0000000674,F00001020,13-08-2025 09:23,TRAFFIC,CR02,7,ground stop
DE0000000675,F00001022,26-04-2024 14:19,weather,MX5,62,gate hold
DE0000000676,F00001022,26-04-2024 15:05,atc,,12,ground stop
DE0000000677,F00001025,07-10-2024 23:56,WX,WX01,6,maintenance check
DE0000000678,F00001025,10-07-2024 23:52,OTHER,ATC7,4,ground stop
DE0000000679,F00001026,29-03-2025 13:04,maint,WX01,0,
DE0000000680,F00001026,29-03-2025 14:08,airport,CR02,2,deicing
DE0000000681,F00001026,29-03-2025 14:11,ATC,MX5,4m,deicing
DE0000000682,F00001027,02-02-2025 05:17,weather,WX01,42,deicing
DE0000000683,F00001027,02-02-2025 05:41,GATE,GT3,4,deicing
DE0000000684,F00001030,21-05-2025 02:55,weather,WX01,22m,maintenance check
DE0000000685,F00001030,21-05-2025 01:56,CREW,MX5,6,gate hold
DE0000000686,F00001030,21-05-2025 00:41,airport,CR02,8,late inbound
DE0000000687,F00001033,04-09-2025 03:38,CRW,OPS9,16,gate hold
DE0000000688,F00001033,04-09-2025 03:58,crew,MX5,10,late inbound
DE0000000689,F00001033,09-04-2025 02:52,OTHER,,4,gate hold
DE0000000690,F00001034,01/16/2026 07:21,TRAFFIC,OPS9,-4,deicing
DE0000000691,F00001035,28-12-2025 21:19,OTHER,ATC7,15,late inbound
DE0000000692,F00001035,28-12-2025 19:48,GATE,,3,ground stop
DE0000000693,F00001036,07-05-2025 02:27,other,ATC7,6,crew swap
DE0000000694,F00001037,17-02-2024 21:02,OTHER,MX5,2,deicing
DE0000000695,F00001037,17-02-2024 21:34,other,WX01,4,
DE0000000696,F00001037,17-02-2024 22:00,other,OPS9,1,late inbound
DE0000000697,F00001041,07-03-2025 16:24,atc,GT3,4,deicing
DE0000000698,F00001041,2025-03-07T16:55:00,MX,WX01,-18,gate hold
DE0000000699,F00001041,07-03-2025 18:32,maint,CR02,8,
DE0000000700,F00001045,16-09-2025 06:56,WEATHER,MX5,0,deicing
DE0000000701,F00001045,09/16/2025 08:02,atc,CR02,-1,gate hold
DE0000000702,F00001045,16-09-2025 06:49,CREW,WX01,1,crew swap
DE0000000703,F00001048,03/16/2025 18:08,CREW,MX5,1,late inbound
DE0000000704,F00001048,03/16/2025 18:25,other,OPS9,4m,ground stop
DE0000000705,F00001048,16-03-2025 19:30,crew,,1,
DE0000000706,F00001049,04/25/2024 05:44,GATE,MX5,8,deicing
DE0000000707,F00001049,25-04-2024 05:41,atc,ATC7,11,late inbound
DE0000000708,F00001049,25-04-2024 05:27,atc,CR02,9m,
DE0000000709,F00001051,2025-12-28T07:09:00,weather,,-1,deicing
DE0000000710,F00001051,2025-12-28T07:05:00,WX,GT3,1,maintenance check
DE0000000711,F00001051,12/28/2025 04:19,AIRPORT,OPS9,1,
DE0000000712,F00001053,01-09-2025 20:57,atc,,2m,maintenance check
DE0000000713,F00001053,09-01-2025 20:20,AIRPORT,WX01,15,deicing
DE0000000714,F00001053,01-09-2025 21:15,atc,,23,ground stop
DE0000000715,F00001054,08/18/2024 01:37,OTHER,OPS9,30,crew swap
DE0000000716,F00001057,11-05-2025 12:47,GATE,ATC7,17,deicing
DE0000000717,F00001057,11-05-2025 12:51,AIRPORT,,14,late inbound
DE0000000718,F00001059,2025-09-06T21:13:00,MX,CR02,1,late inbound
DE0000000719,F00001059,09-06-2025 19:48,TRAFFIC,MX5,1,maintenance check
DE0000000720,F00001059,2025-09-06T20:43:00,WX,,2,ground stop
DE0000000721,F00001061,31-12-2024 22:28,CRW,ATC7,14,deicing
DE0000000722,F00001061,31-12-2024 20:40,OTHER,ATC7,14,ground stop
DE0000000723,F00001061,31-12-2024 21:46,crew,MX5,1,
DE0000000724,F00001063,04-12-2025 12:24,airport,CR02,25,
DE0000000725,F00001065,01/24/2025 20:09,weather,,1,maintenance check
DE0000000726,F00001065,24-01-2025 21:23,MAINT,MX5,1,maintenance check
DE0000000727,F00001065,24-01-2025 19:08,CREW,GT3,1,late inbound
DE0000000728,F00001067,22-02-2025 10:36,ATC,WX01,5,ground stop
DE0000000729,F00001067,22-02-2025 11:45,TRAFFIC,,1,deicing
DE0000000730,F00001068,28-08-2025 13:20,AIRPORT,MX5,12,late inbound
DE0000000731,F00001069,26-01-2026 03:58,WEATHER,ATC7,6,late inbound
DE0000000732,F00001069,26-01-2026 03:20,MX,ATC7,30,late inbound
DE0000000733,F00001076,10/26/2025 01:06,airport,ATC7,8m,crew swap
DE0000000734,F00001076,10/26/2025 02:39,AIRPORT,CR02,28,crew swap
DE0000000735,F00001081,04-08-2025 09:41,weather,GT3,8,maintenance check
DE0000000736,F00001081,08-04-2025 08:37,CREW,ATC7,18,crew swap
DE0000000737,F00001081,04-08-2025 08:57,OTHER,WX01,4,
DE0000000738,F00001083,18-04-2024 18:59,OTHER,ATC7,5m,deicing
DE0000000739,F00001083,18-04-2024 19:21,ATC,ATC7,17,late inbound
DE0000000740,F00001084,03-01-2025 14:40,GATE,WX01,1m,maintenance check
DE0000000741,F00001084,03-01-2025 16:50,OTHER,OPS9,1,maintenance check
DE0000000742,F00001084,03-01-2025 17:06,CREW,WX01,1,
DE0000000743,F00001087,06-09-2025 14:46,WX,ATC7,29,maintenance check
DE0000000744,F00001088,13-06-2024 18:58,airport,ATC7,15,maintenance check
DE0000000745,F00001089,09-04-2024 14:13,OPS,GT3,1,gate hold
DE0000000746,F00001089,09-04-2024 15:18,atc,WX01,23,crew swap
DE0000000747,F00001089,09-04-2024 15:39,WEATHER,,2,maintenance check
DE0000000748,F00001090,08-12-2024 22:56,GATE,CR02,0,
DE0000000749,F00001090,12-08-2024 21:41,other,ATC7,21,maintenance check
DE0000000750,F00001091,15-06-2025 22:14,atc,WX01,2,crew swap
DE0000000751,F00001093,17-04-2024 01:39,TRAFFIC,CR02,1,ground stop
DE0000000752,F00001093,17-04-2024 02:34,airport,,9,maintenance check
DE0000000753,F00001097,30-09-2024 22:11,WX,WX01,21,maintenance check
DE0000000754,F00001100,11-11-2025 07:52,other,GT3,45,deicing
DE0000000755,F00001106,05-10-2024 11:18,maint,GT3,30,late inbound
DE0000000756,F00001106,05-10-2024 09:09,CREW,CR02,19,gate hold
DE0000000757,F00001106,05-10-2024 11:39,CREW,CR02,20,gate hold
DE0000000758,F00001107,03-11-2025 04:46,AIRPORT,,-8,
DE0000000759,F00001107,03-11-2025 06:38,ATC,,-2,maintenance check
DE0000000760,F00001109,23-01-2026 02:50,OTHER,GT3,10,crew swap
DE0000000761,F00001109,23-01-2026 01:37,OTHER,WX01,8,
DE0000000762,F00001109,23-01-2026 01:05,WX,GT3,8,late inbound
DE0000000763,F00001110,09/23/2025 07:24,MX,CR02,39,crew swap
DE0000000764,F00001110,2025-09-23T09:04:00,MAINT,WX01,3,deicing
DE0000000765,F00001111,30-11-2025 20:10,airport,WX01,12m,gate hold
DE0000000766,F00001111,30-11-2025 20:48,CREW,GT3,12,crew swap
DE0000000767,F00001116,17-11-2025 08:07,MX,CR02,23,crew swap
DE0000000768,F00001119,09-08-2024 07:24,AIRPORT,WX01,12,crew swap
DE0000000769,F00001122,10/14/2025 19:26,CREW,CR02,15,deicing
DE0000000770,F00001122,14-10-2025 19:48,AIRPORT,WX01,3m,late inbound
DE0000000771,F00001122,14-10-2025 17:52,CRW,OPS9,6,deicing
DE0000000772,F00001123,29-01-2026 07:17,WEATHER,OPS9,22,deicing
DE0000000773,F00001123,01/29/2026 04:50,crew,GT3,6,crew swap
DE0000000774,F00001129,06-07-2025 08:10,WEATHER,MX5,5,crew swap
DE0000000775,F00001136,17-04-2024 15:27,maint,MX5,28,deicing
DE0000000776,F00001137,06-02-2025 19:20,OTHER,,24,deicing
DE0000000777,F00001137,06-02-2025 18:43,OPS,MX5,1m,maintenance check
DE0000000778,F00001138,01/20/2026 23:44,CRW,OPS9,4,
DE0000000779,F00001139,31-07-2024 21:45,TRAFFIC,MX5,10,maintenance check
DE0000000780,F00001139,31-07-2024 21:42,AIRPORT,GT3,15,maintenance check
DE0000000781,F00001139,2024-07-31T20:12:00,crew,MX5,3,
DE0000000782,F00001140,09-07-2025 08:49,MX,WX01,0,crew swap
DE0000000783,F00001140,09-07-2025 09:25,airport,OPS9,8,maintenance check
DE0000000784,F00001145,22-10-2025 21:47,WX,GT3,14m,maintenance check
DE0000000785,F00001146,18-10-2025 15:18,atc,MX5,0,
DE0000000786,F00001146,18-10-2025 14:30,AIRPORT,MX5,5,late inbound
DE0000000787,F00001147,08/25/2025 17:03,CRW,MX5,1,maintenance check
DE0000000788,F00001147,25-08-2025 15:17,WX,OPS9,4,late inbound
DE0000000789,F00001148,09-03-2025 04:38,CRW,GT3,-8,crew swap
DE0000000790,F00001148,09-03-2025 04:23,weather,GT3,11,
DE0000000791,F00001148,09-03-2025 04:20,maint,WX01,20,ground stop
DE0000000792,F00001151,13-07-2025 03:38,atc,OPS9,1m,late inbound
DE0000000793,F00001151,13-07-2025 02:58,MX,OPS9,2,deicing
DE0000000794,F00001151,13-07-2025 02:56,crew,MX5,15,maintenance check
DE0000000795,F00001154,02-05-2025 12:36,ATC,WX01,1m,ground stop
DE0000000796,F00001154,02-05-2025 12:37,OPS,OPS9,3m,gate hold
DE0000000797,F00001154,02-05-2025 12:25,other,MX5,2,crew swap
DE0000000798,F00001160,18-04-2024 13:46,weather,GT3,7,ground stop
DE0000000799,F00001160,2024-04-18T13:29:00,CREW,MX5,24,maintenance check
DE0000000800,F00001160,04/18/2024 14:37,MAINT,WX01,14,ground stop
DE0000000801,F00001162,02-11-2025 00:50,WX,GT3,5,deicing
DE0000000802,F00001162,02-11-2025 02:21,MX,MX5,12,deicing
DE0000000803,F00001164,05-07-2025 04:59,MAINT,WX01,14,gate hold
DE0000000804,F00001166,20-12-2024 05:35,atc,GT3,34,late inbound
DE0000000805,F00001169,25-03-2025 05:49,TRAFFIC,MX5,1,maintenance check
DE0000000806,F00001172,30-05-2024 21:49,ATC,OPS9,10,gate hold
DE0000000807,F00001172,30-05-2024 21:30,CREW,ATC7,17,deicing
DE0000000808,F00001173,2024-09-16T17:22:00,weather,MX5,16,crew swap
DE0000000809,F00001176,24-10-2024 18:11,TRAFFIC,CR02,2,maintenance check
DE0000000810,F00001176,24-10-2024 17:39,weather,ATC7,8,late inbound
DE0000000811,F00001176,24-10-2024 16:36,WEATHER,MX5,2,gate hold
DE0000000812,F00001179,16-03-2024 11:56,WX,,6,crew swap
DE0000000813,F00001179,16-03-2024 13:07,OTHER,GT3,79,crew swap
DE0000000814,F00001183,04-01-2026 01:34,CRW,OPS9,3,
DE0000000815,F00001183,04-01-2026 01:51,atc,CR02,24,
DE0000000816,F00001185,22-10-2024 22:04,OTHER,,29,crew swap
DE0000000817,F00001188,11-05-2024 22:32,TRAFFIC,WX01,2,gate hold
DE0000000818,F00001188,05-11-2024 22:14,TRAFFIC,WX01,2,
DE0000000819,F00001188,05-11-2024 21:42,ATC,CR02,2,late inbound
DE0000000820,F00001192,23-08-2024 14:16,TRAFFIC,OPS9,46,
DE0000000821,F00001192,23-08-2024 13:21,other,CR02,-16,ground stop
DE0000000822,F00001192,2024-08-23T13:09:00,maint,OPS9,10,late inbound
DE0000000823,F00001193,20-09-2025 23:01,maint,WX01,3,ground stop
DE0000000824,F00001202,2025-11-07T21:43:00,other,OPS9,2,deicing
DE0000000825,F00001203,09-03-2025 06:42,ATC,ATC7,5,deicing
DE0000000826,F00001207,15-02-2025 22:32,WEATHER,GT3,2m,crew swap
DE0000000827,F00001209,18-04-2025 03:21,CREW,MX5,4,late inbound
DE0000000828,F00001209,18-04-2025 02:22,WEATHER,,3,deicing
DE0000000829,F00001209,18-04-2025 03:41,weather,GT3,1,late inbound
DE0000000830,F00001214,04/21/2025 01:42,CREW,MX5,29,gate hold
DE0000000831,F00001216,13-11-2025 12:17,airport,GT3,-4,gate hold
DE0000000832,F00001219,04/20/2025 13:33,WEATHER,GT3,0,gate hold
DE0000000833,F00001219,20-04-2025 11:35,airport,WX01,2,crew swap
DE0000000834,F00001225,04-01-2026 06:06,MX,WX01,-30,maintenance check
DE0000000835,F00001228,15-04-2024 01:14,airport,ATC7,1m,deicing
DE0000000836,F00001228,15-04-2024 03:02,CRW,CR02,6,maintenance check
DE0000000837,F00001230,08-02-2024 06:33,atc,MX5,0,late inbound
DE0000000838,F00001230,02-08-2024 06:44,crew,MX5,1,maintenance check
DE0000000839,F00001231,26-09-2025 10:24,MAINT,ATC7,6,crew swap
DE0000000840,F00001234,08-10-2025 05:12,maint,GT3,4,maintenance check
DE0000000841,F00001234,10-08-2025 05:21,MX,CR02,2,
DE0000000842,F00001234,10-08-2025 05:50,AIRPORT,OPS9,9,ground stop
DE0000000843,F00001237,24-01-2026 14:21,OPS,,4,
DE0000000844,F00001238,21-04-2025 02:33,CREW,WX01,3,gate hold
DE0000000845,F00001238,21-04-2025 01:37,MX,,10,crew swap
DE0000000846,F00001241,2025-09-07T05:38:00,WX,MX5,11,ground stop
DE0000000847,F00001244,2025-03-19T19:28:00,WEATHER,ATC7,21m,ground stop
DE0000000848,F00001249,15-09-2024 08:06,AIRPORT,,7,
DE0000000849,F00001249,15-09-2024 07:50,MX,,25,deicing
DE0000000850,F00001249,15-09-2024 06:40,other,,2,gate hold
DE0000000851,F00001250,2025-09-23T13:04:00,MX,GT3,-6,deicing
DE0000000852,F00001250,23-09-2025 11:00,OTHER,GT3,5,
DE0000000853,F00001255,10-03-2024 22:07,weather,CR02,8,
DE0000000854,F00001255,10-03-2024 23:08,maint,OPS9,1,deicing
DE0000000855,F00001256,07-11-2025 12:03,WX,MX5,11,deicing
DE0000000856,F00001256,07-11-2025 11:13,ATC,GT3,5,gate hold
DE0000000857,F00001256,11-07-2025 11:18,TRAFFIC,CR02,7,ground stop
DE0000000858,F00001257,09/20/2024 17:29,CRW,OPS9,8,
DE0000000859,F00001259,16-07-2024 20:22,crew,,2,
DE0000000860,F00001259,07/16/2024 19:09,atc,CR02,5,deicing
DE0000000861,F00001260,23-02-2025 22:58,OPS,,3,maintenance check
DE0000000862,F00001260,02/23/2025 23:05,OPS,ATC7,2,gate hold
DE0000000863,F00001266,16-12-2025 15:20,atc,OPS9,0,
DE0000000864,F00001266,16-12-2025 17:36,crew,,11,crew swap
DE0000000865,F00001266,16-12-2025 15:35,weather,,1,
DE0000000866,F00001267,20-07-2025 04:24,CREW,ATC7,20,crew swap
DE0000000867,F00001272,18-12-2024 14:29,TRAFFIC,MX5,-1,ground stop
DE0000000868,F00001272,18-12-2024 14:36,OPS,,-1,deicing
DE0000000869,F00001272,18-12-2024 14:04,TRAFFIC,MX5,1,gate hold
DE0000000870,F00001274,2025-06-11T23:53:00,weather,MX5,37,late inbound
DE0000000871,F00001277,11-12-2024 01:09,CREW,GT3,12,gate hold
DE0000000872,F00001277,11-12-2024 00:41,airport,GT3,8,ground stop
DE0000000873,F00001277,11-12-2024 00:40,ATC,MX5,-8,late inbound
DE0000000874,F00001278,30-12-2024 18:27,WX,MX5,9,maintenance check
DE0000000875,F00001278,2024-12-30T20:20:00,other,OPS9,1,crew swap
DE0000000876,F00001278,12/30/2024 20:38,ATC,MX5,2,deicing
DE0000000877,F00001282,21-08-2025 23:10,CRW,CR02,-1,crew swap
DE0000000878,F00001282,08/22/2025 00:48,CRW,OPS9,1,ground stop
DE0000000879,F00001282,22-08-2025 00:38,OTHER,CR02,2,ground stop
DE0000000880,F00001284,03-12-2025 18:01,ATC,MX5,9,maintenance check
DE0000000881,F00001286,06-07-2025 13:29,other,MX5,8m,deicing
DE0000000882,F00001286,06-07-2025 15:53,atc,GT3,9,maintenance check
DE0000000883,F00001286,07-06-2025 14:28,ATC,CR02,4,crew swap
DE0000000884,F00001293,26-02-2025 00:26,maint,WX01,7,ground stop
DE0000000885,F00001293,25-02-2025 23:54,crew,MX5,11,late inbound
DE0000000886,F00001294,28-06-2024 04:45,TRAFFIC,,5,late inbound
DE0000000887,F00001294,06/28/2024 04:18,crew,ATC7,1,late inbound
DE0000000888,F00001303,2025-12-11T03:00:00,MAINT,GT3,2,maintenance check
DE0000000889,F00001303,11-12-2025 05:00,TRAFFIC,ATC7,3,ground stop
DE0000000890,F00001303,11-12-2025 04:45,AIRPORT,MX5,4,gate hold
DE0000000891,F00001304,30-05-2025 02:11,WX,GT3,11,maintenance check
DE0000000892,F00001304,29-05-2025 23:41,MX,,4,crew swap
DE0000000893,F00001307,04-05-2024 04:22,WX,ATC7,19,late inbound
DE0000000894,F00001307,05-04-2024 05:58,ATC,ATC7,21,late inbound
DE0000000895,F00001308,10-02-2024 21:36,atc,MX5,1,ground stop
DE0000000896,F00001308,10-02-2024 21:35,weather,MX5,4,deicing
DE0000000897,F00001308,10-02-2024 23:29,CRW,MX5,1,gate hold
DE0000000898,F00001309,30-10-2025 13:55,TRAFFIC,WX01,20,ground stop
DE0000000899,F00001309,30-10-2025 14:05,other,ATC7,4,
DE0000000900,F00001309,30-10-2025 14:10,TRAFFIC,CR02,-1,maintenance check
DE0000000901,F00001310,07-02-2025 03:08,maint,CR02,8,
DE0000000902,F00001313,07/24/2024 15:49,crew,GT3,35,
DE0000000903,F00001313,24-07-2024 15:41,maint,OPS9,1,maintenance check
DE0000000904,F00001313,24-07-2024 17:42,ATC,MX5,2,
DE0000000905,F00001314,04-02-2024 22:15,CRW,WX01,6,crew swap
DE0000000906,F00001314,02-04-2024 19:56,MX,GT3,2,maintenance check
DE0000000907,F00001314,04-02-2024 21:25,atc,OPS9,13,late inbound
DE0000000908,F00001315,08-04-2024 14:42,ATC,CR02,7,deicing
DE0000000909,F00001316,01-01-2025 14:17,TRAFFIC,MX5,1,deicing
DE0000000910,F00001316,01-01-2025 13:30,ATC,WX01,1,deicing
DE0000000911,F00001320,26-10-2025 22:52,TRAFFIC,OPS9,4m,crew swap
DE0000000912,F00001320,26-10-2025 22:33,CRW,,17,
DE0000000913,F00001320,27-10-2025 00:26,ATC,ATC7,5,gate hold
DE0000000914,F00001324,25-11-2024 22:25,crew,MX5,10,gate hold
DE0000000915,F00001324,11/25/2024 23:31,WX,MX5,1,gate hold
DE0000000916,F00001324,2024-11-26T00:56:00,GATE,CR02,4,late inbound
DE0000000917,F00001330,27-06-2025 16:20,crew,OPS9,28,crew swap
DE0000000918,F00001332,01-02-2024 18:37,maint,GT3,0,
DE0000000919,F00001332,01-02-2024 18:41,CREW,ATC7,1,maintenance check
DE0000000920,F00001335,04-11-2025 22:54,other,CR02,9,
DE0000000921,F00001337,07/25/2025 06:18,GATE,GT3,2,late inbound
DE0000000922,F00001337,2025-07-25T06:03:00,crew,WX01,7m,maintenance check
DE0000000923,F00001337,25-07-2025 06:23,maint,WX01,6,crew swap
DE0000000924,F00001338,09-12-2024 09:13,weather,MX5,13,crew swap
DE0000000925,F00001339,2024-02-26T19:22:00,MAINT,MX5,5,gate hold
DE0000000926,F00001339,2024-02-26T20:12:00,GATE,MX5,24,gate hold
DE0000000927,F00001343,05-07-2025 21:18,CRW,CR02,6,
DE0000000928,F00001343,05-07-2025 20:13,AIRPORT,WX01,7,gate hold
DE0000000929,F00001344,11-11-2025 06:39,maint,GT3,12,
DE0000000930,F00001344,11-11-2025 05:48,CRW,ATC7,4,crew swap
DE0000000931,F00001344,2025-11-11T03:47:00,ATC,GT3,1,
DE0000000932,F00001345,03/27/2025 06:17,CREW,,8,ground stop
DE0000000933,F00001345,27-03-2025 03:48,GATE,OPS9,-1,crew swap
DE0000000934,F00001347,29-04-2024 06:35,other,WX01,10,
DE0000000935,F00001347,29-04-2024 08:34,OTHER,WX01,20,gate hold
DE0000000936,F00001355,07-06-2025 19:37,airport,GT3,30,ground stop
DE0000000937,F00001357,18-09-2025 17:05,airport,CR02,9m,
DE0000000938,F00001357,18-09-2025 17:19,other,,-3,late inbound
DE0000000939,F00001358,23-05-2025 16:33,maint,,22,ground stop
DE0000000940,F00001358,23-05-2025 16:06,MAINT,WX01,13,gate hold
DE0000000941,F00001358,05/23/2025 16:43,MAINT,OPS9,5,maintenance check
DE0000000942,F00001364,20-07-2024 21:17,CRW,MX5,15,gate hold
DE0000000943,F00001364,20-07-2024 19:40,airport,GT3,-8,
DE0000000944,F00001364,20-07-2024 22:00,other,WX01,10,late inbound
DE0000000945,F00001365,29-12-2025 04:49,airport,WX01,25,
DE0000000946,F00001366,26-02-2025 20:41,GATE,ATC7,-1,deicing
DE0000000947,F00001366,02/26/2025 21:03,AIRPORT,WX01,1,crew swap
DE0000000948,F00001366,26-02-2025 22:58,MAINT,ATC7,1,deicing
DE0000000949,F00001369,20-11-2024 18:44,ATC,,21,deicing
DE0000000950,F00001372,2025-02-12T13:34:00,WEATHER,WX01,2,deicing
DE0000000951,F00001372,12-02-2025 14:50,atc,,20,gate hold
DE0000000952,F00001372,12-02-2025 12:25,crew,ATC7,5,late inbound
DE0000000953,F00001380,08-10-2024 15:59,GATE,MX5,1,maintenance check
DE0000000954,F00001380,08-10-2024 18:24,OTHER,WX01,6,ground stop
DE0000000955,F00001382,10-12-2025 11:07,OTHER,GT3,4,late inbound
DE0000000956,F00001382,12-10-2025 10:24,other,OPS9,-2,
DE0000000957,F00001382,12-10-2025 11:02,AIRPORT,MX5,5,gate hold
DE0000000958,F00001383,2025-09-06T19:51:00,weather,WX01,8m,gate hold
DE0000000959,F00001383,2025-09-06T20:35:00,WEATHER,MX5,4,crew swap
DE0000000960,F00001383,2025-09-06T21:02:00,weather,CR02,5,
DE0000000961,F00001395,2024-05-20T01:44:00,OPS,CR02,-2,
DE0000000962,F00001395,20-05-2024 02:57,MAINT,CR02,6,
DE0000000963,F00001402,08-12-2024 04:57,MAINT,OPS9,11,crew swap
DE0000000964,F00001402,2024-12-08T05:01:00,other,OPS9,4,maintenance check
DE0000000965,F00001405,06/18/2024 09:44,maint,GT3,11,late inbound
DE0000000966,F00001407,06-02-2025 22:07,MX,ATC7,0,crew swap
DE0000000967,F00001407,06-02-2025 19:51,airport,MX5,2,late inbound
DE0000000968,F00001408,10-10-2024 14:46,AIRPORT,GT3,5,maintenance check
DE0000000969,F00001408,10-10-2024 14:15,weather,WX01,1,crew swap
DE0000000970,F00001408,10-10-2024 13:59,TRAFFIC,GT3,3,
DE0000000971,F00001409,05-09-2025 08:36,GATE,OPS9,9,maintenance check
DE0000000972,F00001417,03-09-2025 02:32,AIRPORT,OPS9,2,crew swap
DE0000000973,F00001417,03-09-2025 04:05,GATE,ATC7,1m,crew swap
DE0000000974,F00001420,08-10-2024 01:41,maint,MX5,2,
DE0000000975,F00001420,08-10-2024 02:36,GATE,CR02,16,gate hold
DE0000000976,F00001420,10-08-2024 02:05,MAINT,,66,late inbound
DE0000000977,F00001432,2026-01-02T22:08:00,MX,OPS9,10,late inbound
DE0000000978,F00001432,02-01-2026 22:04,WEATHER,MX5,10m,gate hold
DE0000000979,F00001432,02-01-2026 20:20,airport,,5,crew swap
DE0000000980,F00001433,11/29/2025 05:14,TRAFFIC,GT3,4m,gate hold
DE0000000981,F00001433,11/29/2025 07:46,MX,ATC7,9,deicing
DE0000000982,F00001433,29-11-2025 06:12,MAINT,CR02,5,gate hold
DE0000000983,F00001434,26-02-2025 02:10,other,ATC7,15,deicing
DE0000000984,F00001435,01-07-2025 03:14,airport,,14,maintenance check
DE0000000985,F00001436,30-07-2025 07:02,AIRPORT,ATC7,12,late inbound
DE0000000986,F00001442,14-10-2024 16:44,atc,GT3,26,
DE0000000987,F00001450,20-03-2024 12:17,GATE,GT3,2,late inbound
DE0000000988,F00001450,03/20/2024 12:47,maint,MX5,1,
DE0000000989,F00001450,03/20/2024 13:27,OPS,CR02,3,gate hold
DE0000000990,F00001453,11-03-2024 03:55,TRAFFIC,WX01,1m,deicing
DE0000000991,F00001453,03-11-2024 04:09,GATE,ATC7,3,gate hold
DE0000000992,F00001456,13-09-2025 01:42,AIRPORT,CR02,23,deicing
DE0000000993,F00001456,13-09-2025 01:02,airport,ATC7,-1,gate hold
DE0000000994,F00001458,21-04-2024 15:30,crew,GT3,21,late inbound
DE0000000995,F00001458,21-04-2024 16:43,MX,,4m,crew swap
DE0000000996,F00001459,02-10-2025 05:44,CRW,OPS9,30,maintenance check
DE0000000997,F00001459,02-10-2025 06:41,MAINT,WX01,7,crew swap
DE0000000998,F00001459,02-10-2025 04:42,MAINT,GT3,8m,maintenance check
DE0000000999,F00001460,10/23/2025 18:26,MAINT,GT3,40,maintenance check
DE0000001000,F00001461,13-04-2025 12:22,MAINT,MX5,43,late inbound
DE0000001001,F00001463,03/14/2024 06:36,WX,OPS9,30,gate hold
DE0000001002,F00001466,08-07-2024 09:33,OTHER,CR02,2,gate hold
DE0000001003,F00001466,08-07-2024 10:37,TRAFFIC,ATC7,28,late inbound
DE0000001004,F00001474,06-01-2024 02:54,other,OPS9,2,crew swap
DE0000001005,F00001474,06-01-2024 01:17,WEATHER,WX01,2,late inbound
DE0000001006,F00001474,01-06-2024 02:19,WEATHER,ATC7,5,ground stop
DE0000001007,F00001475,07-06-2024 18:41,weather,GT3,11,gate hold
DE0000001008,F00001475,07-06-2024 16:54,CREW,WX01,2,ground stop
DE0000001009,F00001477,16-01-2025 02:53,OTHER,,26,gate hold
DE0000001010,F00001479,2025-02-05T06:45:00,MAINT,CR02,30,late inbound
DE0000001011,F00001482,04-09-2024 03:58,AIRPORT,GT3,17,deicing
DE0000001012,F00001484,12-04-2024 11:03,MX,WX01,10,late inbound
DE0000001013,F00001484,04-12-2024 09:00,OPS,OPS9,26,deicing
DE0000001014,F00001485,24-11-2024 22:39,MX,OPS9,6,gate hold
DE0000001015,F00001485,11/24/2024 22:42,CRW,ATC7,3,crew swap
DE0000001016,F00001493,22-07-2024 21:38,maint,WX01,4,gate hold
DE0000001017,F00001493,22-07-2024 20:43,other,CR02,9,maintenance check
DE0000001018,F00001493,22-07-2024 21:54,OTHER,OPS9,4,maintenance check
DE0000001019,F00001495,09-05-2024 09:02,MX,,10,ground stop
DE0000001020,F00001497,13-10-2025 14:21,CRW,MX5,3,ground stop
DE0000001021,F00001497,13-10-2025 15:29,OPS,MX5,-13,gate hold
DE0000001022,F00001497,13-10-2025 13:44,OPS,CR02,1,ground stop
DE0000001023,F00001499,09-09-2025 16:56,GATE,GT3,3m,deicing
DE0000001024,F00001499,09-09-2025 15:10,WEATHER,WX01,9,maintenance check
DE0000001025,F00001502,07-04-2024 02:50,crew,OPS9,0m,late inbound
DE0000001026,F00001502,2024-07-04T01:50:00,ATC,GT3,1,maintenance check
DE0000001027,F00001507,17-07-2024 08:25,MAINT,WX01,6,
DE0000001028,F00001507,17-07-2024 09:07,ATC,CR02,-12,ground stop
DE0000001029,F00001508,04/17/2024 22:42,CRW,OPS9,9,maintenance check
DE0000001030,F00001511,15-08-2024 00:28,MX,GT3,2,gate hold
DE0000001031,F00001511,2024-08-15T00:32:00,ATC,,10,late inbound
DE0000001032,F00001511,14-08-2024 23:23,other,GT3,8,crew swap
DE0000001033,F00001512,10-11-2024 19:16,AIRPORT,GT3,2,
DE0000001034,F00001512,11-10-2024 19:31,other,CR02,1,crew swap
DE0000001035,F00001512,2024-11-10T18:44:00,other,MX5,1,gate hold
DE0000001036,F00001514,23-02-2024 15:00,airport,,14,crew swap
DE0000001037,F00001514,23-02-2024 13:31,MX,,15,deicing
DE0000001038,F00001515,06-02-2025 05:23,other,CR02,2,maintenance check
DE0000001039,F00001515,06-02-2025 04:04,MX,GT3,21,late inbound
DE0000001040,F00001515,06-02-2025 06:48,atc,,7,late inbound
DE0000001041,F00001517,27-02-2024 14:49,crew,OPS9,-48,gate hold
DE0000001042,F00001518,24-11-2025 01:54,CREW,WX01,-1,deicing
DE0000001043,F00001518,11/24/2025 04:46,CREW,ATC7,1,crew swap
DE0000001044,F00001518,24-11-2025 03:59,TRAFFIC,ATC7,1,ground stop
DE0000001045,F00001520,20-04-2024 18:24,weather,OPS9,14,late inbound
DE0000001046,F00001520,04/20/2024 18:05,airport,MX5,20,gate hold
DE0000001047,F00001529,2026-01-12T11:37:00,CREW,WX01,4,gate hold
DE0000001048,F00001529,01-12-2026 12:57,weather,MX5,7m,crew swap
DE0000001049,F00001531,01/17/2025 14:22,airport,WX01,1,ground stop
DE0000001050,F00001531,17-01-2025 14:50,CREW,ATC7,34,maintenance check
DE0000001051,F00001531,2025-01-17T14:59:00,AIRPORT,ATC7,16,gate hold
DE0000001052,F00001532,03-09-2024 02:20,AIRPORT,ATC7,30,ground stop
DE0000001053,F00001536,2024-09-18T06:29:00,weather,OPS9,0,crew swap
DE0000001054,F00001536,18-09-2024 05:38,MAINT,,1,maintenance check
DE0000001055,F00001536,18-09-2024 04:59,atc,ATC7,11,maintenance check
DE0000001056,F00001539,23-12-2024 05:14,AIRPORT,,10,maintenance check
DE0000001057,F00001539,23-12-2024 05:30,ATC,,3,maintenance check
DE0000001058,F00001541,27-09-2025 11:44,atc,CR02,52,maintenance check
DE0000001059,F00001548,2025-12-08T15:49:00,atc,WX01,1,crew swap
DE0000001060,F00001548,12-08-2025 15:32,TRAFFIC,CR02,1,late inbound
DE0000001061,F00001548,08-12-2025 14:06,other,OPS9,1m,crew swap
DE0000001062,F00001550,08-06-2024 23:20,MAINT,,5,gate hold
DE0000001063,F00001550,09-06-2024 01:08,TRAFFIC,ATC7,23,crew swap
DE0000001064,F00001551,26-04-2025 00:34,crew,MX5,5,gate hold
DE0000001065,F00001551,26-04-2025 00:41,ATC,WX01,7,gate hold
DE0000001066,F00001551,04/26/2025 01:05,ATC,CR02,2,late inbound
DE0000001067,F00001557,2024-08-31T19:00:00,GATE,GT3,47,
DE0000001068,F00001557,2024-08-31T19:39:00,MX,,2,ground stop
DE0000001069,F00001561,02-12-2025 17:00,MAINT,,25,ground stop
DE0000001070,F00001562,14-08-2025 05:30,AIRPORT,WX01,3,gate hold
DE0000001071,F00001562,14-08-2025 05:26,MAINT,GT3,27,late inbound
DE0000001072,F00001564,20-06-2024 17:12,OTHER,MX5,14,late inbound
DE0000001073,F00001565,18-04-2025 15:32,OTHER,WX01,0,
DE0000001074,F00001565,18-04-2025 13:25,atc,WX01,1,late inbound
DE0000001075,F00001565,18-04-2025 12:45,WEATHER,CR02,1,
DE0000001076,F00001566,04-10-2024 16:36,CRW,ATC7,14,
DE0000001077,F00001566,04-10-2024 17:09,CREW,MX5,9,gate hold
DE0000001078,F00001566,10-04-2024 17:05,WEATHER,ATC7,5,
DE0000001079,F00001567,26-05-2024 11:19,other,OPS9,12,late inbound
DE0000001080,F00001570,19-08-2025 21:07,CRW,WX01,2,late inbound
DE0000001081,F00001570,19-08-2025 21:51,ATC,OPS9,5,maintenance check
DE0000001082,F00001570,19-08-2025 22:47,airport,OPS9,21,
DE0000001083,F00001572,23-11-2025 00:27,crew,CR02,48,
DE0000001084,F00001574,20-03-2024 15:11,WEATHER,WX01,1,crew swap
DE0000001085,F00001574,20-03-2024 16:52,weather,WX01,12,
DE0000001086,F00001574,20-03-2024 14:41,WX,OPS9,11,late inbound
DE0000001087,F00001578,18-10-2024 08:47,other,,2,
DE0000001088,F00001578,18-10-2024 07:56,OTHER,MX5,1,ground stop
DE0000001089,F00001578,10/18/2024 09:12,WX,GT3,2m,deicing
DE0000001090,F00001581,03/14/2025 12:19,ATC,ATC7,7,gate hold
DE0000001091,F00001581,14-03-2025 10:21,airport,ATC7,6,deicing
DE0000001092,F00001583,03-04-2024 04:20,CREW,MX5,0,deicing
DE0000001093,F00001583,03-04-2024 03:54,AIRPORT,CR02,1,gate hold
DE0000001094,F00001584,27-01-2025 19:14,TRAFFIC,OPS9,8,
DE0000001095,F00001584,27-01-2025 19:24,crew,CR02,20,deicing
DE0000001096,F00001588,26-02-2025 16:40,AIRPORT,OPS9,1,crew swap
DE0000001097,F00001588,26-02-2025 17:23,MX,,1,maintenance check
DE0000001098,F00001588,26-02-2025 16:55,MX,CR02,6m,crew swap
DE0000001099,F00001592,2024-12-22T19:46:00,WEATHER,ATC7,27,gate hold
DE0000001100,F00001592,22-12-2024 17:40,CRW,WX01,27,maintenance check
DE0000001101,F00001592,22-12-2024 18:21,AIRPORT,ATC7,1,late inbound
DE0000001102,F00001595,25-05-2024 06:42,crew,MX5,1,deicing
DE0000001103,F00001596,19-04-2025 17:53,MAINT,,10,
DE0000001104,F00001600,20-11-2024 04:00,WX,CR02,29,
DE0000001105,F00001600,20-11-2024 03:15,atc,ATC7,6,deicing
DE0000001106,F00001601,09-12-2024 03:35,weather,OPS9,22,gate hold
DE0000001107,F00001601,12-09-2024 02:43,crew,GT3,14,maintenance check
DE0000001108,F00001608,02-10-2025 07:08,OTHER,OPS9,-1,late inbound
DE0000001109,F00001608,02-10-2025 05:43,crew,GT3,2,maintenance check
DE0000001110,F00001608,2025-10-02T05:28:00,weather,ATC7,1,
DE0000001111,F00001609,2024-07-07T05:02:00,CREW,WX01,0,maintenance check
DE0000001112,F00001609,07-07-2024 06:23,weather,GT3,1,crew swap
DE0000001113,F00001610,14-07-2025 03:15,GATE,ATC7,2,ground stop
DE0000001114,F00001610,14-07-2025 02:51,airport,OPS9,-7,late inbound
DE0000001115,F00001610,14-07-2025 03:55,WEATHER,CR02,10,ground stop
DE0000001116,F00001612,13-06-2025 23:27,crew,GT3,7m,maintenance check
DE0000001117,F00001614,12-12-2025 07:25,MX,MX5,7,
DE0000001118,F00001614,12-12-2025 07:21,other,,2,deicing
DE0000001119,F00001614,12-12-2025 07:23,atc,OPS9,9,ground stop
DE0000001120,F00001617,2024-07-10T01:47:00,WEATHER,GT3,8,deicing
DE0000001121,F00001627,26-06-2024 02:07,weather,ATC7,8m,gate hold
DE0000001122,F00001627,06/26/2024 03:35,maint,ATC7,2m,
DE0000001123,F00001627,26-06-2024 03:45,crew,WX01,3,maintenance check
DE0000001124,F00001628,2025-02-16T09:15:00,MX,,2,late inbound
DE0000001125,F00001628,02/16/2025 09:27,MX,MX5,6,
DE0000001126,F00001628,16-02-2025 09:44,other,ATC7,1,ground stop
DE0000001127,F00001635,07-11-2024 03:00,weather,,3,deicing
DE0000001128,F00001635,2024-11-07T03:28:00,CRW,MX5,1,crew swap
DE0000001129,F00001635,07-11-2024 05:12,MX,ATC7,7,crew swap
DE0000001130,F00001637,09/26/2025 10:21,CRW,OPS9,29,
DE0000001131,F00001637,26-09-2025 10:50,WX,CR02,41,
DE0000001132,F00001639,15-04-2025 03:02,CREW,GT3,37,deicing
DE0000001133,F00001644,30-09-2025 06:01,CRW,OPS9,2,maintenance check
DE0000001134,F00001644,30-09-2025 07:13,weather,GT3,6,
DE0000001135,F00001644,2025-09-30T05:19:00,crew,MX5,17,crew swap
DE0000001136,F00001647,15-10-2024 06:39,ATC,ATC7,3,ground stop
DE0000001137,F00001647,10/15/2024 07:20,CREW,MX5,2,
DE0000001138,F00001648,08-02-2024 06:31,CRW,WX01,21,gate hold
DE0000001139,F00001652,30-11-2025 15:49,crew,GT3,10,ground stop
DE0000001140,F00001652,2025-11-30T16:21:00,MAINT,,3,ground stop
DE0000001141,F00001654,13-12-2025 07:00,WEATHER,MX5,1,late inbound
DE0000001142,F00001654,13-12-2025 08:23,maint,GT3,-4,ground stop
DE0000001143,F00001654,13-12-2025 06:42,atc,ATC7,15,ground stop
DE0000001144,F00001655,29-02-2024 19:36,ATC,WX01,10,deicing
DE0000001145,F00001655,29-02-2024 20:25,airport,OPS9,28,ground stop
DE0000001146,F00001656,05/28/2024 12:39,OPS,CR02,5,crew swap
DE0000001147,F00001656,2024-05-28T10:28:00,MX,WX01,14,crew swap
DE0000001148,F00001656,28-05-2024 13:00,crew,,4,deicing
DE0000001149,F00001658,2025-04-07T11:34:00,TRAFFIC,,12,deicing
DE0000001150,F00001658,07-04-2025 12:05,crew,ATC7,3,ground stop
DE0000001151,F00001658,04-07-2025 11:30,WX,CR02,1,ground stop
DE0000001152,F00001660,2025-05-08T06:41:00,TRAFFIC,CR02,1,deicing
DE0000001153,F00001660,08-05-2025 06:47,CREW,OPS9,3,
DE0000001154,F00001660,08-05-2025 07:10,GATE,WX01,1,maintenance check
DE0000001155,F00001665,07-07-2025 01:27,AIRPORT,CR02,10,ground stop
DE0000001156,F00001670,05-05-2025 23:43,CRW,WX01,1,late inbound
DE0000001157,F00001670,05-05-2025 22:07,maint,CR02,2m,crew swap
DE0000001158,F00001674,05-02-2025 10:16,MX,OPS9,1,
DE0000001159,F00001680,12/20/2024 18:03,atc,,5,crew swap
DE0000001160,F00001680,12/20/2024 18:04,airport,,4,gate hold
DE0000001161,F00001685,2024-09-18T04:37:00,weather,WX01,2,late inbound
DE0000001162,F00001685,18-09-2024 06:50,maint,WX01,5,
DE0000001163,F00001685,18-09-2024 06:07,OPS,MX5,2,
DE0000001164,F00001686,28-08-2024 14:58,GATE,OPS9,4,deicing
DE0000001165,F00001690,2024-03-05T23:42:00,CREW,ATC7,19,late inbound
DE0000001166,F00001690,05-03-2024 23:41,CRW,WX01,12,late inbound
DE0000001167,F00001693,21-09-2025 05:36,GATE,MX5,12,crew swap
DE0000001168,F00001693,21-09-2025 05:58,atc,MX5,16,
DE0000001169,F00001697,27-12-2024 06:25,maint,ATC7,-1,
DE0000001170,F00001697,27-12-2024 06:04,crew,ATC7,19,gate hold
DE0000001171,F00001697,27-12-2024 07:54,atc,GT3,3,gate hold
DE0000001172,F00001698,2024-09-07T11:35:00,ATC,CR02,1,late inbound
DE0000001173,F00001698,07-09-2024 09:40,maint,MX5,23,maintenance check
DE0000001174,F00001698,09-07-2024 10:45,airport,ATC7,-21,gate hold
DE0000001175,F00001702,07-12-2025 15:54,atc,GT3,15,deicing
DE0000001176,F00001706,01-09-2025 19:24,weather,WX01,23,
DE0000001177,F00001712,31-05-2025 11:51,other,CR02,4,crew swap
DE0000001178,F00001712,05/31/2025 11:01,GATE,ATC7,2,
DE0000001179,F00001712,05/31/2025 11:55,MAINT,ATC7,5,ground stop
DE0000001180,F00001713,29-12-2025 01:54,WEATHER,WX01,23,crew swap
DE0000001181,F00001714,23-05-2024 03:13,OPS,ATC7,28,ground stop
DE0000001182,F00001718,12-01-2024 17:04,airport,,4,ground stop
DE0000001183,F00001718,01-12-2024 17:12,ATC,,9,ground stop
DE0000001184,F00001719,28-11-2024 09:50,WEATHER,MX5,1,gate hold
DE0000001185,F00001719,11/28/2024 10:56,WX,MX5,1,maintenance check
DE0000001186,F00001722,01-07-2025 06:07,OPS,CR02,22,deicing
DE0000001187,F00001722,2025-07-01T06:34:00,crew,MX5,8,crew swap
DE0000001188,F00001723,10-06-2024 23:38,WEATHER,MX5,2,
DE0000001189,F00001723,11-06-2024 01:21,atc,CR02,8,maintenance check
DE0000001190,F00001723,10-06-2024 23:43,GATE,ATC7,14,gate hold
DE0000001191,F00001725,2025-11-21T13:56:00,ATC,GT3,2,crew swap
DE0000001192,F00001725,21-11-2025 11:59,crew,GT3,28,late inbound
DE0000001193,F00001734,29-08-2024 06:29,TRAFFIC,GT3,-11,deicing
DE0000001194,F00001734,29-08-2024 07:50,crew,,11,deicing
DE0000001195,F00001739,19-09-2025 15:41,OPS,GT3,32,ground stop
DE0000001196,F00001740,02/29/2024 21:45,OTHER,ATC7,0,maintenance check
DE0000001197,F00001740,2024-02-29T21:48:00,OPS,MX5,7,ground stop
DE0000001198,F00001740,29-02-2024 22:36,OPS,ATC7,1,crew swap
DE0000001199,F00001742,2025-07-15T04:23:00,crew,OPS9,-8,crew swap
DE0000001200,F00001742,15-07-2025 05:17,CREW,CR02,10,
DE0000001201,F00001743,10-02-2025 18:14,atc,OPS9,3,late inbound
DE0000001202,F00001743,10-02-2025 17:43,WX,,1,gate hold
DE0000001203,F00001743,02-10-2025 17:03,AIRPORT,OPS9,8,late inbound
DE0000001204,F00001747,16-01-2026 21:17,OPS,CR02,6,gate hold
DE0000001205,F00001747,16-01-2026 21:00,WX,GT3,25,crew swap
DE0000001206,F00001747,16-01-2026 21:16,atc,,8,late inbound
DE0000001207,F00001749,18-09-2024 17:43,OPS,OPS9,43m,crew swap
DE0000001208,F00001752,09-03-2024 02:35,WX,GT3,18,deicing
DE0000001209,F00001752,09-03-2024 00:51,AIRPORT,MX5,1,maintenance check
DE0000001210,F00001752,09-03-2024 02:12,MX,,10,maintenance check
DE0000001211,F00001758,29-12-2024 03:58,AIRPORT,WX01,13,late inbound
DE0000001212,F00001761,27-06-2025 07:16,airport,ATC7,0,late inbound
DE0000001213,F00001761,2025-06-27T05:33:00,MAINT,OPS9,2,late inbound
DE0000001214,F00001761,2025-06-27T05:20:00,TRAFFIC,ATC7,2,crew swap
DE0000001215,F00001764,23-06-2024 13:43,atc,OPS9,12,gate hold
DE0000001216,F00001767,08/15/2024 05:45,WX,,8,ground stop
DE0000001217,F00001767,08/15/2024 06:39,OPS,ATC7,12,gate hold
DE0000001218,F00001769,25-01-2025 05:29,ATC,ATC7,-2,late inbound
DE0000001219,F00001769,25-01-2025 06:31,weather,GT3,1,late inbound
DE0000001220,F00001772,03-06-2025 22:26,maint,ATC7,1,
DE0000001221,F00001772,03-06-2025 20:21,WX,,5,deicing
DE0000001222,F00001772,03-06-2025 21:44,TRAFFIC,MX5,-6,ground stop
DE0000001223,F00001773,04/14/2025 06:14,maint,,28m,late inbound
DE0000001224,F00001776,19-02-2025 23:10,WEATHER,,3,late inbound
DE0000001225,F00001776,19-02-2025 21:41,other,ATC7,29,crew swap
DE0000001226,F00001776,2025-02-19T22:33:00,WEATHER,CR02,5,maintenance check
DE0000001227,F00001781,03-02-2025 17:36,CRW,WX01,17,crew swap
DE0000001228,F00001781,02-03-2025 19:05,CREW,,4,ground stop
DE0000001229,F00001781,02-03-2025 16:56,AIRPORT,CR02,5,deicing
DE0000001230,F00001782,05-04-2024 17:27,OPS,,8,maintenance check
DE0000001231,F00001786,23-05-2024 03:07,GATE,WX01,20,ground stop
DE0000001232,F00001786,23-05-2024 03:26,WEATHER,WX01,-2,gate hold
DE0000001233,F00001786,23-05-2024 04:14,airport,MX5,4,deicing
DE0000001234,F00001788,31-03-2024 12:25,WX,OPS9,2,crew swap
DE0000001235,F00001788,2024-03-31T10:11:00,AIRPORT,WX01,2,crew swap
DE0000001236,F00001788,03/31/2024 12:33,ATC,MX5,3,
DE0000001237,F00001794,17-09-2024 04:58,TRAFFIC,ATC7,14,crew swap
DE0000001238,F00001794,17-09-2024 03:49,WX,ATC7,1,
DE0000001239,F00001795,29-04-2025 11:02,MX,GT3,1,ground stop
DE0000001240,F00001797,23-11-2025 13:11,MAINT,MX5,-1,crew swap
DE0000001241,F00001797,2025-11-23T14:06:00,CREW,OPS9,1,
DE0000001242,F00001797,23-11-2025 13:44,MAINT,OPS9,1,crew swap
DE0000001243,F00001801,25-05-2025 21:31,OPS,ATC7,1,
DE0000001244,F00001801,25-05-2025 21:40,WX,WX01,2,
DE0000001245,F00001801,25-05-2025 20:47,crew,MX5,11,
DE0000001246,F00001804,20-01-2025 03:49,atc,ATC7,21,
DE0000001247,F00001804,20-01-2025 02:54,OTHER,GT3,6,crew swap
DE0000001248,F00001806,07-06-2025 17:11,ATC,MX5,3,gate hold
DE0000001249,F00001806,07-06-2025 19:19,WEATHER,GT3,2,
DE0000001250,F00001806,2025-06-07T16:58:00,TRAFFIC,ATC7,1,
DE0000001251,F00001810,26-10-2025 03:29,other,GT3,-1,late inbound
DE0000001252,F00001810,26-10-2025 03:08,CREW,OPS9,1,crew swap
DE0000001253,F00001810,10/26/2025 02:13,AIRPORT,ATC7,4,late inbound
DE0000001254,F00001811,2026-01-05T23:47:00,WEATHER,WX01,-11,late inbound
DE0000001255,F00001812,07-10-2025 23:58,GATE,WX01,-19,gate hold
DE0000001256,F00001814,2024-02-10T17:48:00,crew,WX01,26,ground stop
DE0000001257,F00001814,02-10-2024 17:54,weather,,-8,gate hold
DE0000001258,F00001819,04-05-2024 02:38,ATC,ATC7,6m,crew swap
DE0000001259,F00001819,04-05-2024 02:47,CRW,GT3,1,maintenance check
DE0000001260,F00001819,04-05-2024 02:51,OTHER,ATC7,23,deicing
DE0000001261,F00001821,15-10-2025 05:09,CREW,GT3,34,maintenance check
DE0000001262,F00001828,30-04-2025 20:02,WEATHER,WX01,2,deicing
DE0000001263,F00001828,30-04-2025 20:30,airport,MX5,7,late inbound
DE0000001264,F00001828,2025-04-30T17:48:00,WEATHER,GT3,3,deicing
DE0000001265,F00001835,16-09-2025 10:13,MAINT,MX5,10,maintenance check
DE0000001266,F00001837,18-12-2024 21:40,CRW,ATC7,10,deicing
DE0000001267,F00001838,07/24/2024 13:20,airport,MX5,22,maintenance check
DE0000001268,F00001838,24-07-2024 14:53,crew,GT3,1,ground stop
DE0000001269,F00001843,05/21/2025 04:31,maint,CR02,2,maintenance check
DE0000001270,F00001843,21-05-2025 03:58,WEATHER,WX01,1,ground stop
DE0000001271,F00001843,2025-05-21T03:39:00,OPS,GT3,5,maintenance check
DE0000001272,F00001844,2024-05-24T04:06:00,MAINT,CR02,5,late inbound
DE0000001273,F00001844,05/24/2024 01:36,ATC,OPS9,3,ground stop
DE0000001274,F00001846,21-01-2026 14:00,GATE,,3,crew swap
DE0000001275,F00001846,21-01-2026 12:56,maint,WX01,1,crew swap
DE0000001276,F00001847,05-10-2025 14:05,other,CR02,2,ground stop
DE0000001277,F00001847,10-05-2025 14:13,MX,CR02,-3,maintenance check
DE0000001278,F00001847,05-10-2025 14:34,airport,CR02,6,
DE0000001279,F00001849,31-07-2025 12:30,other,MX5,30,maintenance check
DE0000001280,F00001857,01/31/2026 17:31,OTHER,WX01,3,ground stop
DE0000001281,F00001857,31-01-2026 17:49,OTHER,,27,deicing
DE0000001282,F00001858,05-04-2024 00:12,GATE,CR02,16,
DE0000001283,F00001858,04-04-2024 22:47,airport,WX01,83,late inbound
DE0000001284,F00001859,06-06-2024 13:30,airport,WX01,3,crew swap
DE0000001285,F00001860,16-03-2024 00:46,AIRPORT,GT3,12,maintenance check
DE0000001286,F00001860,16-03-2024 00:48,MAINT,OPS9,13,late inbound
DE0000001287,F00001860,16-03-2024 01:04,WEATHER,CR02,8,late inbound
DE0000001288,F00001861,2026-01-20T02:51:00,ATC,ATC7,5,
DE0000001289,F00001861,20-01-2026 03:02,OPS,,14,gate hold
DE0000001290,F00001861,01/20/2026 03:33,OTHER,GT3,8,crew swap
DE0000001291,F00001865,18-10-2024 15:50,MAINT,MX5,13,late inbound
DE0000001292,F00001865,18-10-2024 16:26,ATC,ATC7,17,maintenance check
DE0000001293,F00001866,12-04-2025 18:46,crew,,7,
DE0000001294,F00001866,04-12-2025 19:24,CRW,GT3,2,
DE0000001295,F00001866,04-12-2025 21:01,OPS,GT3,4,late inbound
DE0000001296,F00001867,04-11-2025 11:23,airport,ATC7,4,crew swap
DE0000001297,F00001867,2025-11-04T11:48:00,AIRPORT,ATC7,1,deicing
DE0000001298,F00001868,30-12-2025 15:09,maint,GT3,1,deicing
DE0000001299,F00001868,30-12-2025 16:45,MAINT,GT3,6,ground stop
DE0000001300,F00001868,2025-12-30T16:40:00,airport,CR02,1,ground stop
DE0000001301,F00001869,13-05-2024 22:37,airport,ATC7,3m,gate hold
DE0000001302,F00001869,13-05-2024 20:58,CRW,MX5,1,crew swap
DE0000001303,F00001869,2024-05-13T20:35:00,GATE,OPS9,25m,gate hold
DE0000001304,F00001873,09-08-2025 11:28,OTHER,CR02,24,crew swap
DE0000001305,F00001873,2025-08-09T09:12:00,atc,GT3,9,ground stop
DE0000001306,F00001873,09-08-2025 10:56,WX,CR02,6,late inbound
DE0000001307,F00001874,23-02-2025 19:24,maint,,6,deicing
DE0000001308,F00001874,23-02-2025 19:18,OPS,CR02,2,gate hold
DE0000001309,F00001874,23-02-2025 17:49,OPS,GT3,3,crew swap
DE0000001310,F00001875,26-01-2026 11:55,maint,ATC7,55,deicing
DE0000001311,F00001876,13-06-2025 15:01,MX,OPS9,16,maintenance check
DE0000001312,F00001877,12-04-2024 02:53,airport,ATC7,1,deicing
DE0000001313,F00001877,2024-04-12T03:39:00,weather,,5,ground stop
DE0000001314,F00001881,20-04-2024 10:35,CREW,MX5,2,crew swap
DE0000001315,F00001881,20-04-2024 09:21,CREW,ATC7,12,gate hold
DE0000001316,F00001883,07-03-2024 08:54,CRW,OPS9,12,deicing
DE0000001317,F00001885,02-01-2026 06:04,atc,GT3,1,gate hold
DE0000001318,F00001885,01-02-2026 07:19,crew,OPS9,8,gate hold
DE0000001319,F00001887,10/28/2024 04:30,other,,2m,
DE0000001320,F00001887,28-10-2024 03:52,airport,,2,
DE0000001321,F00001887,28-10-2024 03:59,TRAFFIC,ATC7,1,deicing
DE0000001322,F00001888,27-02-2025 06:35,CRW,CR02,0,deicing
DE0000001323,F00001888,27-02-2025 06:53,TRAFFIC,MX5,1,late inbound
DE0000001324,F00001890,22-06-2025 03:50,maint,MX5,11m,late inbound
DE0000001325,F00001890,22-06-2025 05:57,TRAFFIC,WX01,1,late inbound
DE0000001326,F00001890,2025-06-22T04:50:00,weather,CR02,16,maintenance check
DE0000001327,F00001892,13-06-2025 23:20,other,ATC7,18,ground stop
DE0000001328,F00001899,21-01-2026 04:40,maint,MX5,7,ground stop
DE0000001329,F00001899,01/21/2026 05:48,WEATHER,MX5,7m,late inbound
DE0000001330,F00001904,11/14/2024 01:32,OTHER,,8,crew swap
DE0000001331,F00001909,28-02-2025 12:23,maint,GT3,5,crew swap
DE0000001332,F00001909,28-02-2025 13:26,WEATHER,GT3,3,maintenance check
DE0000001333,F00001912,25-04-2025 06:18,TRAFFIC,MX5,7,
DE0000001334,F00001917,12-03-2025 03:22,atc,OPS9,16,maintenance check
DE0000001335,F00001921,05-07-2024 05:14,airport,,9,deicing
DE0000001336,F00001921,07-05-2024 04:25,other,ATC7,20m,deicing
DE0000001337,F00001925,06-08-2024 08:50,GATE,,2,crew swap
DE0000001338,F00001925,06-08-2024 09:35,GATE,ATC7,1,ground stop
DE0000001339,F00001925,08-06-2024 08:09,atc,,2,deicing
DE0000001340,F00001929,24-03-2024 01:07,GATE,,51,ground stop
DE0000001341,F00001929,23-03-2024 23:22,weather,WX01,-3,late inbound
DE0000001342,F00001932,05-11-2025 05:07,TRAFFIC,WX01,46,maintenance check
DE0000001343,F00001937,29-08-2024 07:48,crew,MX5,14,late inbound
DE0000001344,F00001938,08-06-2024 17:56,OPS,,1,deicing
DE0000001345,F00001938,08-06-2024 15:53,WEATHER,,1,maintenance check
DE0000001346,F00001938,08-06-2024 16:48,WX,,1m,gate hold
DE0000001347,F00001939,03-09-2024 04:11,WX,CR02,3,
DE0000001348,F00001939,09-03-2024 03:29,maint,WX01,1,ground stop
DE0000001349,F00001939,03-09-2024 03:45,crew,MX5,9,late inbound
DE0000001350,F00001944,24-03-2025 20:23,CRW,GT3,77,late inbound
DE0000001351,F00001948,13-03-2025 11:14,MAINT,,1,crew swap
DE0000001352,F00001948,13-03-2025 11:38,AIRPORT,CR02,7,maintenance check
DE0000001353,F00001948,03/13/2025 10:09,WEATHER,,9,crew swap
DE0000001354,F00001951,09-03-2024 03:32,WEATHER,CR02,2,ground stop
DE0000001355,F00001951,09-03-2024 04:52,CRW,WX01,4,maintenance check
DE0000001356,F00001952,22-04-2024 08:34,WX,,6,maintenance check
DE0000001357,F00001952,22-04-2024 07:04,MX,GT3,8,deicing
DE0000001358,F00001955,14-01-2026 04:08,other,MX5,-2,gate hold
DE0000001359,F00001955,14-01-2026 01:50,maint,GT3,9,crew swap
DE0000001360,F00001961,31-10-2024 22:23,CREW,ATC7,8,crew swap
DE0000001361,F00001967,16-12-2024 10:53,AIRPORT,,24,crew swap
DE0000001362,F00001967,16-12-2024 11:36,ATC,ATC7,6,maintenance check
DE0000001363,F00001976,12-07-2025 20:39,weather,,1,gate hold
DE0000001364,F00001977,05-06-2024 23:36,WX,ATC7,10m,crew swap
DE0000001365,F00001977,06-06-2024 00:14,ATC,,4,late inbound
DE0000001366,F00001977,05-06-2024 23:24,CRW,,5,late inbound
DE0000001367,F00001979,21-06-2025 20:41,OPS,CR02,30,ground stop
DE0000001368,F00001981,12/24/2024 21:54,WX,,5m,deicing
DE0000001369,F00001981,24-12-2024 22:59,airport,WX01,-1,late inbound
DE0000001370,F00001984,11-10-2025 00:03,other,GT3,19,late inbound
DE0000001371,F00001985,2024-09-01T04:08:00,atc,GT3,3,late inbound
DE0000001372,F00001985,01-09-2024 03:47,airport,CR02,7,deicing
DE0000001373,F00001988,2024-06-19T01:31:00,crew,CR02,21,
DE0000001374,F00001988,19-06-2024 01:03,other,OPS9,1,gate hold
DE0000001375,F00001989,09/27/2025 21:45,TRAFFIC,OPS9,0,crew swap
DE0000001376,F00001989,27-09-2025 21:15,CREW,WX01,3,ground stop
DE0000001377,F00001989,09/27/2025 21:02,MX,WX01,3,ground stop
DE0000001378,F00001990,17-09-2025 02:44,TRAFFIC,WX01,1,maintenance check
DE0000001379,F00001990,17-09-2025 00:39,other,ATC7,5,late inbound
DE0000001380,F00001990,17-09-2025 00:41,airport,CR02,1,ground stop
DE0000001381,F00001991,02-01-2026 03:54,GATE,MX5,55,deicing
DE0000001382,F00001997,19-08-2025 13:56,crew,WX01,22,maintenance check
DE0000001383,F00001997,19-08-2025 12:54,crew,WX01,3,
DE0000001384,F00001997,19-08-2025 13:57,GATE,GT3,12,gate hold
DE0000001385,F00001998,11-09-2024 17:16,airport,GT3,-2,ground stop
DE0000001386,F00001998,2024-09-11T17:33:00,WEATHER,MX5,1,ground stop
DE0000001387,F00001998,11-09-2024 18:36,CREW,,3,gate hold
DE0000001388,F00001999,2024-09-10T22:19:00,ATC,WX01,43,crew swap
DE0000001389,F00002004,19-09-2024 23:10,TRAFFIC,,5,crew swap
DE0000001390,F00002004,19-09-2024 23:36,GATE,,14,late inbound
DE0000001391,F00002004,09/19/2024 23:28,atc,,6,gate hold
DE0000001392,F00002006,04-08-2025 04:15,crew,OPS9,12,gate hold
DE0000001393,F00002006,04-08-2025 03:31,GATE,WX01,35,maintenance check
DE0000001394,F00002007,20-11-2024 06:55,CRW,OPS9,-38,maintenance check
DE0000001395,F00002007,20-11-2024 05:35,CREW,OPS9,39,
DE0000001396,F00002008,17-07-2025 16:13,weather,WX01,10,ground stop
DE0000001397,F00002008,17-07-2025 16:44,WX,,10,maintenance check
DE0000001398,F00002009,11-05-2024 06:19,WEATHER,WX01,3,crew swap
DE0000001399,F00002010,12-09-2025 22:38,CREW,OPS9,1,late inbound
DE0000001400,F00002010,09-12-2025 22:26,CRW,OPS9,2,late inbound
DE0000001401,F00002010,12-09-2025 23:57,atc,CR02,1,ground stop
DE0000001402,F00002011,29-08-2024 01:20,OPS,MX5,0,late inbound
DE0000001403,F00002011,2024-08-29T00:10:00,weather,WX01,1,deicing
DE0000001404,F00002011,29-08-2024 01:06,atc,,1,deicing
DE0000001405,F00002012,01-07-2026 15:13,ATC,,-1,ground stop
DE0000001406,F00002012,07-01-2026 13:51,OPS,OPS9,1,gate hold
DE0000001407,F00002012,07-01-2026 14:35,MAINT,WX01,1,late inbound
DE0000001408,F00002013,18-05-2025 00:45,atc,GT3,17,deicing
DE0000001409,F00002013,05/18/2025 01:09,WX,GT3,6m,ground stop
DE0000001410,F00002013,18-05-2025 01:03,AIRPORT,OPS9,23m,gate hold
DE0000001411,F00002017,30-05-2025 04:30,crew,GT3,4m,gate hold
DE0000001412,F00002028,2024-03-29T12:02:00,CREW,OPS9,-2,gate hold
DE0000001413,F00002028,29-03-2024 11:55,MAINT,GT3,5,late inbound
DE0000001414,F00002029,16-03-2024 08:42,other,CR02,1,late inbound
DE0000001415,F00002029,03/16/2024 08:32,CREW,ATC7,1,
DE0000001416,F00002037,19-06-2024 18:40,AIRPORT,,5,crew swap
DE0000001417,F00002037,06/19/2024 16:40,WEATHER,OPS9,3,ground stop
DE0000001418,F00002038,07-10-2024 18:48,ATC,MX5,3,
DE0000001419,F00002038,07-10-2024 20:17,ATC,OPS9,22,late inbound
DE0000001420,F00002039,26-12-2024 11:26,CRW,CR02,28m,ground stop
DE0000001421,F00002045,07-12-2025 03:15,airport,MX5,1,crew swap
DE0000001422,F00002046,25-02-2024 22:30,atc,MX5,28,deicing
DE0000001423,F00002047,30-09-2025 07:48,OTHER,GT3,0,gate hold
DE0000001424,F00002047,30-09-2025 08:01,OPS,WX01,1,late inbound
DE0000001425,F00002054,27-07-2024 03:47,crew,WX01,2,gate hold
DE0000001426,F00002054,27-07-2024 03:19,WEATHER,ATC7,6,gate hold
DE0000001427,F00002054,27-07-2024 04:16,airport,WX01,5,maintenance check
DE0000001428,F00002058,09-07-2025 23:33,atc,GT3,7,maintenance check
DE0000001429,F00002058,10-07-2025 00:17,MX,ATC7,31m,late inbound
DE0000001430,F00002060,31-08-2025 00:59,ATC,ATC7,1,maintenance check
DE0000001431,F00002060,2025-08-30T23:49:00,other,CR02,6,ground stop
DE0000001432,F00002060,31-08-2025 00:02,MX,OPS9,65,maintenance check
DE0000001433,F00002063,10/30/2025 20:24,AIRPORT,ATC7,19,ground stop
DE0000001434,F00002069,26-11-2025 16:51,MAINT,WX01,3,crew swap
DE0000001435,F00002069,2025-11-26T16:25:00,OTHER,OPS9,15,maintenance check
DE0000001436,F00002069,26-11-2025 17:20,TRAFFIC,MX5,1m,maintenance check
DE0000001437,F00002071,28-10-2024 23:55,OTHER,CR02,0,
DE0000001438,F00002071,28-10-2024 22:57,WEATHER,,-5,ground stop
DE0000001439,F00002071,28-10-2024 21:49,OPS,GT3,1,deicing
DE0000001440,F00002072,08-06-2024 09:04,crew,,14,late inbound
DE0000001441,F00002072,08-06-2024 08:54,GATE,GT3,18,maintenance check
DE0000001442,F00002074,05-10-2025 20:55,weather,OPS9,1m,maintenance check
DE0000001443,F00002074,05-10-2025 22:45,TRAFFIC,,1m,gate hold
DE0000001444,F00002074,05-10-2025 21:02,OTHER,ATC7,14,late inbound
DE0000001445,F00002076,20-09-2025 13:21,MX,GT3,16,crew swap
DE0000001446,F00002077,26-06-2025 00:51,ATC,WX01,0,
DE0000001447,F00002077,06/26/2025 01:25,atc,OPS9,9,ground stop
DE0000001448,F00002077,26-06-2025 01:44,MX,OPS9,26,
DE0000001449,F00002087,06-06-2024 10:05,other,ATC7,15,deicing
DE0000001450,F00002090,22-08-2024 17:01,CREW,OPS9,4,maintenance check
DE0000001451,F00002090,08/22/2024 15:27,OTHER,CR02,5,maintenance check
DE0000001452,F00002090,22-08-2024 16:04,ATC,CR02,1,late inbound
DE0000001453,F00002091,04-01-2026 09:44,AIRPORT,CR02,1,gate hold
DE0000001454,F00002091,04-01-2026 07:24,atc,OPS9,11,maintenance check
DE0000001455,F00002093,04-07-2025 23:11,OPS,WX01,10,maintenance check
DE0000001456,F00002098,24-05-2024 11:18,MAINT,,24,late inbound
DE0000001457,F00002107,12-06-2024 06:15,crew,OPS9,5,late inbound
DE0000001458,F00002108,11-04-2025 21:33,MAINT,ATC7,-13,
DE0000001459,F00002108,11-04-2025 22:54,other,OPS9,3,maintenance check
DE0000001460,F00002108,12-04-2025 00:01,CREW,OPS9,12,ground stop
DE0000001461,F00002109,14-10-2025 20:49,AIRPORT,GT3,14m,maintenance check
DE0000001462,F00002109,2025-10-14T20:37:00,WEATHER,OPS9,6,maintenance check
DE0000001463,F00002112,18-04-2025 23:19,airport,CR02,16m,crew swap
DE0000001464,F00002114,16-05-2024 09:44,CRW,WX01,1,gate hold
DE0000001465,F00002114,16-05-2024 10:41,other,OPS9,4,late inbound
DE0000001466,F00002114,16-05-2024 12:11,weather,CR02,11,maintenance check
DE0000001467,F00002116,10/23/2025 18:27,AIRPORT,ATC7,9,late inbound
DE0000001468,F00002116,2025-10-23T18:35:00,MX,ATC7,2m,ground stop
DE0000001469,F00002116,23-10-2025 18:44,atc,CR02,7,gate hold
DE0000001470,F00002118,2025-01-02T10:37:00,TRAFFIC,WX01,8,deicing
DE0000001471,F00002122,2025-03-25T14:25:00,weather,MX5,0,crew swap
DE0000001472,F00002122,25-03-2025 13:58,atc,ATC7,-1,maintenance check
DE0000001473,F00002122,25-03-2025 14:20,MX,,1,late inbound
DE0000001474,F00002123,08-05-2024 06:39,crew,OPS9,19,gate hold
DE0000001475,F00002123,08-05-2024 05:15,MX,MX5,2,ground stop
DE0000001476,F00002126,18-03-2025 05:48,CRW,WX01,2,late inbound
DE0000001477,F00002126,18-03-2025 06:50,weather,OPS9,3,
DE0000001478,F00002127,04-08-2024 11:38,WEATHER,GT3,6,crew swap
DE0000001479,F00002127,04-08-2024 11:07,crew,CR02,25,deicing
DE0000001480,F00002129,11-04-2025 19:22,airport,MX5,13,
DE0000001481,F00002130,20-03-2025 11:03,CRW,MX5,15,crew swap
DE0000001482,F00002132,04-02-2024 09:59,CREW,ATC7,3,ground stop
DE0000001483,F00002132,04-02-2024 10:10,OPS,CR02,14,ground stop
DE0000001484,F00002133,05/30/2025 07:54,CREW,GT3,5,gate hold
DE0000001485,F00002133,30-05-2025 07:25,weather,ATC7,1,gate hold
DE0000001486,F00002134,03-12-2024 10:48,MAINT,,3,gate hold
DE0000001487,F00002134,03-12-2024 08:57,GATE,GT3,2,gate hold
DE0000001488,F00002136,02/18/2024 00:31,crew,CR02,16,crew swap
DE0000001489,F00002136,02/18/2024 01:13,TRAFFIC,WX01,14,
DE0000001490,F00002138,07-09-2024 00:56,CRW,MX5,1,crew swap
DE0000001491,F00002138,09-07-2024 00:55,CRW,CR02,1,deicing
DE0000001492,F00002138,09-07-2024 00:15,MAINT,ATC7,6,
DE0000001493,F00002142,04-11-2024 11:21,WX,,0,gate hold
DE0000001494,F00002142,04-11-2024 10:51,MX,MX5,1,maintenance check
DE0000001495,F00002144,09/20/2025 02:25,ATC,WX01,1,maintenance check
DE0000001496,F00002144,20-09-2025 03:49,airport,GT3,8,ground stop
DE0000001497,F00002144,20-09-2025 02:27,WX,MX5,1,
DE0000001498,F00002148,01/13/2026 22:34,CREW,ATC7,10,deicing
DE0000001499,F00002148,01/13/2026 23:40,TRAFFIC,CR02,1,late inbound
DE0000001500,F00002150,27-09-2024 01:01,MAINT,MX5,22,maintenance check
DE0000001501,F00002150,26-09-2024 23:45,MX,MX5,2,deicing
DE0000001502,F00002153,08/17/2025 17:09,ATC,MX5,12,ground stop
DE0000001503,F00002153,17-08-2025 17:40,CRW,ATC7,1,
DE0000001504,F00002153,17-08-2025 17:18,MAINT,OPS9,1m,deicing
DE0000001505,F00002157,09-03-2025 22:31,GATE,ATC7,12,
DE0000001506,F00002160,06-01-2026 03:50,GATE,,-1,maintenance check
DE0000001507,F00002160,01-06-2026 03:37,GATE,WX01,3,ground stop
DE0000001508,F00002160,2026-01-06T04:17:00,crew,,10,maintenance check
DE0000001509,F00002162,19-07-2024 21:08,CREW,,1,gate hold
DE0000001510,F00002163,08-02-2024 17:25,GATE,ATC7,4,ground stop
DE0000001511,F00002163,02-08-2024 17:15,TRAFFIC,WX01,3,ground stop
DE0000001512,F00002165,2024-09-24T19:02:00,maint,OPS9,2,deicing
DE0000001513,F00002165,24-09-2024 21:03,CRW,CR02,4,
DE0000001514,F00002166,10-06-2024 17:49,weather,OPS9,43,ground stop
DE0000001515,F00002169,07-04-2025 18:23,maint,GT3,15,gate hold
DE0000001516,F00002169,2025-04-07T18:52:00,OPS,GT3,1,
DE0000001517,F00002169,2025-04-07T16:27:00,MX,MX5,6m,gate hold
DE0000001518,F00002170,11-05-2024 00:59,TRAFFIC,CR02,157,maintenance check
DE0000001519,F00002170,11-05-2024 03:28,airport,,11,deicing
DE0000001520,F00002178,06-03-2025 07:32,MAINT,,-1,deicing
DE0000001521,F00002178,03-06-2025 05:40,airport,OPS9,1,gate hold
DE0000001522,F00002178,03-06-2025 06:34,maint,GT3,1,maintenance check
DE0000001523,F00002179,10/17/2025 09:48,crew,CR02,28,
DE0000001524,F00002181,03/18/2024 01:18,MX,MX5,0,
DE0000001525,F00002181,18-03-2024 03:23,airport,ATC7,1,
DE0000001526,F00002181,18-03-2024 01:21,GATE,,8,ground stop
DE0000001527,F00002182,2024-06-15T23:37:00,OTHER,GT3,35,
DE0000001528,F00002182,16-06-2024 00:19,airport,,1m,
DE0000001529,F00002184,29-12-2024 19:39,OPS,WX01,0,deicing
DE0000001530,F00002184,29-12-2024 20:03,ATC,GT3,12,maintenance check
DE0000001531,F00002184,12/29/2024 18:34,TRAFFIC,GT3,1,ground stop
DE0000001532,F00002185,25-03-2025 12:39,CREW,CR02,9,gate hold
DE0000001533,F00002185,2025-03-25T10:12:00,atc,OPS9,12,ground stop
DE0000001534,F00002185,2025-03-25T10:52:00,airport,OPS9,6,gate hold
DE0000001535,F00002189,02/13/2025 07:17,MAINT,,4,maintenance check
DE0000001536,F00002189,2025-02-13T07:25:00,atc,GT3,6,
DE0000001537,F00002189,13-02-2025 07:51,atc,CR02,3,maintenance check
DE0000001538,F00002190,26-05-2024 05:40,OTHER,WX01,5,late inbound
DE0000001539,F00002190,26-05-2024 05:57,other,ATC7,-4,
DE0000001540,F00002190,26-05-2024 03:22,CREW,ATC7,8,ground stop
DE0000001541,F00002194,2025-07-07T22:06:00,maint,ATC7,12,maintenance check
DE0000001542,F00002194,07-07-2025 21:40,AIRPORT,OPS9,1,ground stop
DE0000001543,F00002195,12/20/2024 08:17,TRAFFIC,MX5,-3,gate hold
DE0000001544,F00002195,2024-12-20T07:16:00,OTHER,CR02,14m,maintenance check
DE0000001545,F00002195,20-12-2024 09:15,TRAFFIC,ATC7,11m,crew swap
DE0000001546,F00002196,31-08-2025 17:13,airport,GT3,0,deicing
DE0000001547,F00002196,31-08-2025 17:57,other,ATC7,1,gate hold
DE0000001548,F00002197,29-11-2024 19:41,CRW,OPS9,20,
DE0000001549,F00002197,29-11-2024 19:40,MAINT,MX5,10,crew swap
DE0000001550,F00002207,06/24/2024 20:19,ATC,,6,crew swap
DE0000001551,F00002207,24-06-2024 20:34,WX,GT3,1,maintenance check
DE0000001552,F00002208,20-02-2024 06:27,CRW,WX01,16,deicing
DE0000001553,F00002208,20-02-2024 06:06,OTHER,MX5,6,deicing
DE0000001554,F00002208,02/20/2024 05:42,CREW,OPS9,1,ground stop
DE0000001555,F00002213,10-10-2024 11:15,maint,OPS9,8,crew swap
DE0000001556,F00002216,03-01-2025 11:14,WX,,21,maintenance check
DE0000001557,F00002216,01-03-2025 13:07,TRAFFIC,WX01,2,gate hold
DE0000001558,F00002216,03-01-2025 11:03,CREW,CR02,7,gate hold
DE0000001559,F00002218,22-01-2025 15:29,CRW,MX5,15,crew swap
DE0000001560,F00002220,25-07-2024 23:53,MX,MX5,7,crew swap
DE0000001561,F00002223,02-10-2024 05:17,crew,CR02,4,late inbound
DE0000001562,F00002223,10-02-2024 02:30,airport,WX01,6m,crew swap
DE0000001563,F00002223,02-10-2024 05:07,OTHER,ATC7,4,
DE0000001564,F00002224,15-09-2025 00:50,CRW,WX01,16,deicing
DE0000001565,F00002224,15-09-2025 01:12,crew,CR02,4m,maintenance check
DE0000001566,F00002225,01-08-2024 01:37,crew,CR02,-3,
DE0000001567,F00002231,10-09-2025 22:39,MX,OPS9,83,maintenance check
DE0000001568,F00002232,29-04-2025 22:57,maint,CR02,8m,late inbound
DE0000001569,F00002232,29-04-2025 23:22,crew,ATC7,16,ground stop
DE0000001570,F00002235,11-05-2025 00:03,airport,OPS9,6,gate hold
DE0000001571,F00002235,10-05-2025 23:01,OTHER,GT3,10,late inbound
DE0000001572,F00002238,20-11-2024 17:20,airport,WX01,1,late inbound
DE0000001573,F00002238,20-11-2024 16:38,airport,CR02,1,crew swap
DE0000001574,F00002241,02/25/2025 01:15,airport,,13,
DE0000001575,F00002241,2025-02-24T23:56:00,CRW,ATC7,5,late inbound
DE0000001576,F00002241,25-02-2025 00:02,OPS,,11,
DE0000001577,F00002244,2026-01-27T15:54:00,OPS,CR02,8,deicing
DE0000001578,F00002253,12/13/2025 10:27,atc,WX01,1,gate hold
DE0000001579,F00002254,08/31/2024 19:26,TRAFFIC,CR02,24,deicing
DE0000001580,F00002254,2024-08-31T16:44:00,other,,13,ground stop
DE0000001581,F00002255,11-04-2024 08:26,airport,OPS9,4,gate hold
DE0000001582,F00002255,04-11-2024 08:02,AIRPORT,,1,gate hold
DE0000001583,F00002264,31-01-2026 22:35,CREW,GT3,0,maintenance check
DE0000001584,F00002264,01/31/2026 21:09,MAINT,ATC7,1,ground stop
DE0000001585,F00002264,01/31/2026 23:23,CRW,,1,gate hold
DE0000001586,F00002265,24-01-2025 03:19,MAINT,,11,crew swap
DE0000001587,F00002269,04-04-2025 23:15,airport,ATC7,0,
DE0000001588,F00002269,04-04-2025 23:50,OTHER,OPS9,1,deicing
DE0000001589,F00002269,04-04-2025 23:03,maint,,-2,maintenance check
DE0000001590,F00002270,2025-08-11T18:54:00,ATC,GT3,1,ground stop
DE0000001591,F00002270,11-08-2025 19:55,OTHER,CR02,1,ground stop
DE0000001592,F00002270,11-08-2025 19:50,CRW,OPS9,20,gate hold
DE0000001593,F00002271,07-02-2025 15:55,other,GT3,0,
DE0000001594,F00002271,07-02-2025 16:27,crew,WX01,1,
DE0000001595,F00002272,09-05-2025 17:14,OPS,,14,
DE0000001596,F00002272,09-05-2025 17:25,weather,,22,crew swap
DE0000001597,F00002276,04-05-2024 00:30,weather,MX5,16,
DE0000001598,F00002276,03-05-2024 23:32,MX,CR02,2,ground stop
DE0000001599,F00002276,04-05-2024 00:08,ATC,ATC7,2,
DE0000001600,F00002277,2025-06-16T09:16:00,GATE,WX01,1,late inbound
DE0000001601,F00002277,2025-06-16T09:34:00,OPS,CR02,10m,late inbound
DE0000001602,F00002280,05/14/2025 16:35,AIRPORT,MX5,11m,ground stop
DE0000001603,F00002280,05/14/2025 15:38,MAINT,WX01,2,maintenance check
DE0000001604,F00002280,05/14/2025 16:14,WEATHER,,2,
DE0000001605,F00002281,20-11-2024 05:12,WX,GT3,4m,ground stop
DE0000001606,F00002281,2024-11-20T03:59:00,weather,GT3,8m,gate hold
DE0000001607,F00002283,2024-02-17T20:15:00,GATE,OPS9,0,deicing
DE0000001608,F00002283,17-02-2024 21:11,MX,WX01,1,crew swap
DE0000001609,F00002283,02/17/2024 19:52,MAINT,OPS9,4,
DE0000001610,F00002286,27-09-2024 17:08,CRW,ATC7,15,gate hold
DE0000001611,F00002286,27-09-2024 18:18,CRW,WX01,5,deicing
DE0000001612,F00002286,27-09-2024 18:56,airport,WX01,2,ground stop
DE0000001613,F00002290,11-10-2024 04:42,WEATHER,CR02,1,
DE0000001614,F00002290,11-10-2024 04:39,airport,CR02,9,crew swap
DE0000001615,F00002290,2024-10-11T06:04:00,atc,CR02,59,
DE0000001616,F00002292,10-01-2026 00:04,CRW,CR02,1,late inbound
DE0000001617,F00002295,20-04-2025 01:04,OPS,OPS9,20m,maintenance check
DE0000001618,F00002297,01-10-2025 22:51,atc,WX01,5,ground stop
DE0000001619,F00002297,10-02-2025 00:55,airport,MX5,1,crew swap
DE0000001620,F00002297,01-10-2025 23:00,airport,GT3,29,ground stop
DE0000001621,F00002299,2025-03-29T10:11:00,MX,,1,ground stop
DE0000001622,F00002299,29-03-2025 08:19,WX,MX5,4,crew swap
DE0000001623,F00002301,16-02-2024 15:11,airport,CR02,1,ground stop
DE0000001624,F00002301,02/16/2024 15:46,AIRPORT,WX01,6,ground stop
DE0000001625,F00002302,12-06-2025 17:16,atc,,9,late inbound
DE0000001626,F00002304,28-01-2026 03:11,OPS,CR02,17,deicing
DE0000001627,F00002305,06-03-2025 22:22,CRW,WX01,57,maintenance check
DE0000001628,F00002322,20-12-2024 14:48,CRW,CR02,4,gate hold
DE0000001629,F00002322,20-12-2024 13:53,WEATHER,GT3,1,ground stop
DE0000001630,F00002322,20-12-2024 13:14,OTHER,OPS9,4,maintenance check
DE0000001631,F00002323,27-05-2025 08:07,WEATHER,WX01,30,late inbound
DE0000001632,F00002328,20-08-2025 14:05,other,OPS9,2,maintenance check
DE0000001633,F00002332,08-07-2024 20:19,other,ATC7,0,gate hold
DE0000001634,F00002332,08-07-2024 20:39,GATE,GT3,2,crew swap
DE0000001635,F00002332,08-07-2024 19:02,ATC,GT3,2,late inbound
DE0000001636,F00002333,04-08-2025 09:40,ATC,CR02,-5,crew swap
DE0000001637,F00002333,04-08-2025 11:04,MAINT,OPS9,5,late inbound
DE0000001638,F00002335,27-12-2025 16:05,MAINT,OPS9,18m,deicing
DE0000001639,F00002335,12/27/2025 15:10,WX,GT3,3,deicing
DE0000001640,F00002335,27-12-2025 17:08,crew,ATC7,5,
DE0000001641,F00002336,12/13/2025 01:03,OPS,CR02,7m,late inbound
DE0000001642,F00002336,12-12-2025 23:29,MAINT,GT3,1m,late inbound
DE0000001643,F00002336,13-12-2025 01:02,GATE,WX01,3,
DE0000001644,F00002341,08-05-2025 08:29,WEATHER,ATC7,21,
DE0000001645,F00002346,19-03-2024 11:25,TRAFFIC,MX5,13,gate hold
DE0000001646,F00002346,19-03-2024 12:10,CRW,,1,deicing
DE0000001647,F00002346,19-03-2024 12:33,WX,,3,gate hold
DE0000001648,F00002349,12-10-2025 05:57,crew,OPS9,9,late inbound
DE0000001649,F00002349,12-10-2025 04:58,CREW,CR02,2,late inbound
DE0000001650,F00002349,12-10-2025 05:28,other,CR02,16,gate hold
DE0000001651,F00002350,08-09-2025 01:02,maint,CR02,18,deicing
DE0000001652,F00002358,19-07-2025 19:53,other,WX01,4,gate hold
DE0000001653,F00002358,19-07-2025 19:36,CREW,MX5,-22,
DE0000001654,F00002362,30-08-2025 09:23,WEATHER,,15,
DE0000001655,F00002365,12-02-2025 10:59,AIRPORT,OPS9,9,
DE0000001656,F00002368,05/15/2024 09:05,other,MX5,21,
DE0000001657,F00002368,15-05-2024 10:52,AIRPORT,,1m,ground stop
DE0000001658,F00002370,09-08-2024 08:41,atc,GT3,3,crew swap
DE0000001659,F00002370,08-09-2024 08:09,MX,OPS9,1,maintenance check
DE0000001660,F00002371,20-04-2024 07:25,weather,,10,deicing
DE0000001661,F00002371,20-04-2024 05:43,crew,MX5,7,
DE0000001662,F00002379,08-11-2025 16:27,maint,MX5,-10,ground stop
DE0000001663,F00002379,08-11-2025 16:48,OPS,WX01,1,ground stop
DE0000001664,F00002379,08-11-2025 18:06,crew,WX01,1,crew swap
DE0000001665,F00002380,25-05-2024 15:28,WX,MX5,27,gate hold
DE0000001666,F00002381,04-05-2025 10:22,OTHER,MX5,6,crew swap
DE0000001667,F00002384,07/28/2025 19:39,ATC,GT3,30,deicing
DE0000001668,F00002386,15-11-2024 13:17,crew,MX5,2m,maintenance check
DE0000001669,F00002386,11/15/2024 13:12,GATE,ATC7,1,gate hold
DE0000001670,F00002386,15-11-2024 15:19,crew,MX5,8,late inbound
DE0000001671,F00002390,13-02-2024 11:57,WX,GT3,3,gate hold
DE0000001672,F00002390,02/13/2024 13:40,airport,CR02,1,late inbound
DE0000001673,F00002390,13-02-2024 13:40,OPS,MX5,4,deicing
DE0000001674,F00002394,01/19/2025 03:38,CRW,ATC7,22,deicing
DE0000001675,F00002394,19-01-2025 01:49,OPS,ATC7,10,maintenance check
DE0000001676,F00002394,01/19/2025 03:12,AIRPORT,CR02,7,maintenance check
DE0000001677,F00002395,01/20/2025 21:59,MX,GT3,17,crew swap
DE0000001678,F00002395,20-01-2025 22:22,WX,OPS9,5,crew swap
DE0000001679,F00002395,01/20/2025 22:37,MX,MX5,6,maintenance check
DE0000001680,F00002400,2024-07-11T19:32:00,OTHER,OPS9,2,deicing
DE0000001681,F00002400,11-07-2024 19:54,OTHER,ATC7,18,crew swap
DE0000001682,F00002400,07-11-2024 19:40,MX,WX01,-7,deicing
DE0000001683,F00002405,2025-07-19T03:14:00,ATC,OPS9,0,ground stop
DE0000001684,F00002405,19-07-2025 03:04,GATE,ATC7,1,crew swap
DE0000001685,F00002410,06/19/2025 18:25,ATC,WX01,20,maintenance check
DE0000001686,F00002411,14-10-2025 17:13,AIRPORT,ATC7,3,maintenance check
DE0000001687,F00002411,10/14/2025 16:22,MX,OPS9,15,crew swap
DE0000001688,F00002411,14-10-2025 15:36,GATE,GT3,12,late inbound
DE0000001689,F00002413,2025-12-16T21:38:00,GATE,MX5,24,maintenance check
DE0000001690,F00002413,16-12-2025 21:34,AIRPORT,,28,ground stop
DE0000001691,F00002413,16-12-2025 21:14,CRW,CR02,14,maintenance check
DE0000001692,F00002414,13-10-2024 15:38,OTHER,ATC7,6,gate hold
DE0000001693,F00002414,13-10-2024 14:21,MX,CR02,4,crew swap
DE0000001694,F00002418,02-02-2025 08:31,airport,WX01,6,late inbound
DE0000001695,F00002418,02-02-2025 07:09,crew,ATC7,5,crew swap
DE0000001696,F00002424,2024-10-23T18:25:00,CRW,ATC7,6,crew swap
DE0000001697,F00002425,16-12-2024 09:19,MX,,6,ground stop
DE0000001698,F00002425,16-12-2024 11:19,other,ATC7,5,gate hold
DE0000001699,F00002425,16-12-2024 10:08,other,ATC7,2,late inbound
DE0000001700,F00002426,03/22/2024 01:22,airport,MX5,3,gate hold
DE0000001701,F00002426,22-03-2024 00:16,crew,CR02,11,gate hold
DE0000001702,F00002429,2024-06-21T02:27:00,AIRPORT,MX5,9,gate hold
DE0000001703,F00002429,21-06-2024 04:28,OPS,,2,gate hold
DE0000001704,F00002431,2024-04-19T01:19:00,weather,MX5,2m,deicing
DE0000001705,F00002431,04/19/2024 01:14,maint,GT3,6,
DE0000001706,F00002431,18-04-2024 23:21,WEATHER,MX5,4,maintenance check
DE0000001707,F00002432,01-07-2024 02:26,maint,ATC7,40,deicing
DE0000001708,F00002434,28-07-2025 10:42,atc,ATC7,-1,ground stop
DE0000001709,F00002434,2025-07-28T08:20:00,other,,3,late inbound
DE0000001710,F00002434,28-07-2025 09:40,CREW,WX01,13,maintenance check
DE0000001711,F00002436,26-12-2024 10:57,MX,CR02,7,maintenance check
DE0000001712,F00002436,26-12-2024 10:07,airport,OPS9,12,ground stop
DE0000001713,F00002444,2025-07-03T07:48:00,TRAFFIC,GT3,1,maintenance check
DE0000001714,F00002444,03-07-2025 07:52,WX,GT3,8,crew swap
DE0000001715,F00002445,15-12-2024 09:41,GATE,MX5,7,maintenance check
DE0000001716,F00002445,15-12-2024 07:01,other,WX01,13,ground stop
DE0000001717,F00002446,24-03-2025 03:46,CRW,OPS9,2,ground stop
DE0000001718,F00002446,24-03-2025 03:49,CREW,GT3,1,gate hold
DE0000001719,F00002446,2025-03-24T04:08:00,WX,,9,crew swap
DE0000001720,F00002449,06/21/2025 15:26,GATE,ATC7,22,gate hold
DE0000001721,F00002450,06-04-2024 03:33,ATC,CR02,1,ground stop
DE0000001722,F00002455,11-07-2024 07:08,OPS,GT3,2,maintenance check
DE0000001723,F00002455,07-11-2024 06:21,GATE,MX5,21,deicing
DE0000001724,F00002455,11-07-2024 06:40,CREW,ATC7,21,deicing
DE0000001725,F00002457,20-05-2025 05:25,OPS,GT3,8,deicing
DE0000001726,F00002458,23-02-2025 05:24,CREW,GT3,46,gate hold
DE0000001727,F00002458,02/23/2025 05:56,AIRPORT,WX01,1,ground stop
DE0000001728,F00002458,23-02-2025 04:46,other,,-5,
DE0000001729,F00002459,06-09-2025 22:54,crew,,15,maintenance check
DE0000001730,F00002459,2025-09-06T22:54:00,crew,ATC7,8,deicing
DE0000001731,F00002459,06-09-2025 20:49,maint,ATC7,21,ground stop
DE0000001732,F00002463,30-09-2025 05:41,MAINT,ATC7,8,late inbound
DE0000001733,F00002463,30-09-2025 04:29,MAINT,WX01,50,late inbound
DE0000001734,F00002464,09-11-2024 02:31,other,CR02,5,ground stop
DE0000001735,F00002464,11-09-2024 01:10,ATC,MX5,2,ground stop
DE0000001736,F00002465,18-08-2025 23:28,AIRPORT,,18,crew swap
DE0000001737,F00002467,04-02-2025 12:02,WEATHER,ATC7,1,late inbound
DE0000001738,F00002467,2025-02-04T13:44:00,CREW,WX01,-1,late inbound
DE0000001739,F00002467,04-02-2025 12:48,AIRPORT,WX01,1,late inbound
DE0000001740,F00002468,16-03-2024 09:45,CREW,CR02,4,crew swap
DE0000001741,F00002468,16-03-2024 09:16,WX,ATC7,10,deicing
DE0000001742,F00002471,12-03-2025 12:34,OTHER,,23,deicing
DE0000001743,F00002473,11-10-2025 22:52,other,OPS9,3,ground stop
DE0000001744,F00002473,10-11-2025 22:55,WEATHER,GT3,8,
DE0000001745,F00002474,25-12-2025 04:26,TRAFFIC,CR02,12,gate hold
DE0000001746,F00002475,25-05-2025 14:08,CRW,WX01,7,maintenance check
DE0000001747,F00002475,05/25/2025 12:26,CREW,,3,deicing
DE0000001748,F00002478,29-09-2025 15:28,WEATHER,CR02,14,
DE0000001749,F00002478,29-09-2025 15:28,crew,,27m,late inbound
DE0000001750,F00002480,2024-05-01T03:39:00,maint,WX01,-39,late inbound
DE0000001751,F00002487,10/18/2025 11:27,CREW,MX5,20,late inbound
DE0000001752,F00002492,08-02-2024 08:36,maint,CR02,-5,ground stop
DE0000001753,F00002492,02-08-2024 06:26,OTHER,WX01,22,ground stop
DE0000001754,F00002492,08-02-2024 08:06,AIRPORT,,2,
DE0000001755,F00002494,10-09-2024 23:57,GATE,,38,gate hold
DE0000001756,F00002495,18-11-2024 22:56,WX,,2,deicing
DE0000001757,F00002495,11/18/2024 23:06,crew,ATC7,1,late inbound
DE0000001758,F00002497,2025-10-21T13:09:00,OPS,MX5,35,gate hold
DE0000001759,F00002499,04-09-2024 09:52,AIRPORT,ATC7,11,
DE0000001760,F00002499,04-09-2024 08:59,WEATHER,GT3,9,late inbound
DE0000001761,F00002505,07-05-2025 12:57,WX,,6,late inbound
DE0000001762,F00002505,07-05-2025 11:53,weather,,24,maintenance check
DE0000001763,F00002506,24-08-2024 07:17,WEATHER,MX5,6,late inbound
DE0000001764,F00002506,24-08-2024 05:30,airport,CR02,12,crew swap
DE0000001765,F00002507,19-04-2024 21:49,WX,WX01,6,late inbound
DE0000001766,F00002508,19-03-2024 08:06,OPS,ATC7,1,ground stop
DE0000001767,F00002508,2024-03-19T07:38:00,WX,ATC7,1,crew swap
DE0000001768,F00002508,03/19/2024 09:58,atc,OPS9,2m,deicing
DE0000001769,F00002515,12-04-2024 06:53,ATC,,4,gate hold
DE0000001770,F00002515,12-04-2024 08:25,MAINT,MX5,5,maintenance check
DE0000001771,F00002515,12-04-2024 08:31,CREW,MX5,28,late inbound
DE0000001772,F00002516,30-03-2025 06:43,atc,CR02,0,deicing
DE0000001773,F00002516,2025-03-30T05:34:00,MX,WX01,1,late inbound
DE0000001774,F00002520,02-03-2024 00:55,OTHER,MX5,1,gate hold
DE0000001775,F00002520,2024-02-03T01:10:00,MAINT,MX5,2,deicing
DE0000001776,F00002524,10-09-2024 05:13,MAINT,GT3,11,crew swap
DE0000001777,F00002524,10-09-2024 05:36,AIRPORT,WX01,2,ground stop
DE0000001778,F00002529,16-01-2025 21:55,CREW,ATC7,2,
DE0000001779,F00002529,16-01-2025 21:09,atc,OPS9,3,deicing
DE0000001780,F00002535,23-03-2025 10:24,atc,ATC7,24,maintenance check
DE0000001781,F00002535,03/23/2025 10:47,TRAFFIC,ATC7,10,ground stop
DE0000001782,F00002535,23-03-2025 09:50,weather,CR02,-4,late inbound
DE0000001783,F00002538,01-03-2026 01:18,CRW,MX5,28,late inbound
DE0000001784,F00002538,03-01-2026 02:29,MAINT,CR02,8,crew swap
DE0000001785,F00002542,2024-06-21T14:41:00,AIRPORT,GT3,3,late inbound
DE0000001786,F00002542,21-06-2024 16:21,MAINT,MX5,1,late inbound
DE0000001787,F00002542,21-06-2024 16:35,CREW,ATC7,1,gate hold
DE0000001788,F00002543,2025-04-30T06:29:00,WX,,18,gate hold
DE0000001789,F00002544,02-02-2024 18:36,AIRPORT,CR02,12,ground stop
DE0000001790,F00002544,02-02-2024 18:28,maint,,14,deicing
DE0000001791,F00002544,2024-02-02T18:35:00,OPS,ATC7,4,ground stop
DE0000001792,F00002546,09/28/2024 05:45,WX,WX01,13m,crew swap
DE0000001793,F00002546,28-09-2024 05:25,GATE,MX5,5,gate hold
DE0000001794,F00002561,13-10-2024 08:04,GATE,WX01,32,
DE0000001795,F00002565,12-03-2025 13:17,atc,CR02,3,deicing
DE0000001796,F00002565,12-03-2025 12:43,OPS,CR02,6,ground stop
DE0000001797,F00002566,14-05-2025 18:29,GATE,WX01,12,late inbound
DE0000001798,F00002567,18-09-2024 11:13,TRAFFIC,OPS9,8,crew swap
DE0000001799,F00002567,09/18/2024 10:36,MX,OPS9,-10,late inbound
DE0000001800,F00002571,04/29/2025 19:56,ATC,MX5,0,
DE0000001801,F00002571,04/29/2025 21:47,weather,MX5,12,gate hold
DE0000001802,F00002573,09-05-2025 13:48,OPS,MX5,8m,maintenance check
DE0000001803,F00002573,09-05-2025 13:36,maint,GT3,3m,
DE0000001804,F00002573,09-05-2025 12:50,airport,ATC7,6,crew swap
DE0000001805,F00002574,08-04-2024 12:52,weather,ATC7,30,crew swap
DE0000001806,F00002575,25-03-2024 12:03,other,OPS9,0,crew swap
DE0000001807,F00002575,25-03-2024 12:33,MAINT,CR02,13,gate hold
DE0000001808,F00002575,25-03-2024 10:31,GATE,WX01,24,ground stop
DE0000001809,F00002582,2025-01-04T16:39:00,airport,MX5,2,deicing
DE0000001810,F00002582,04-01-2025 17:05,OTHER,MX5,4,deicing
DE0000001811,F00002582,04-01-2025 16:08,ATC,,4,gate hold
DE0000001812,F00002583,13-01-2025 18:01,CREW,CR02,-1,crew swap
DE0000001813,F00002583,13-01-2025 17:18,atc,CR02,9,ground stop
DE0000001814,F00002587,2024-12-01T09:52:00,MAINT,WX01,8,late inbound
DE0000001815,F00002587,01-12-2024 09:20,WX,WX01,22,deicing
DE0000001816,F00002588,12/15/2024 22:35,CRW,,2,deicing
DE0000001817,F00002588,15-12-2024 21:08,TRAFFIC,WX01,3,crew swap
DE0000001818,F00002588,15-12-2024 21:40,maint,WX01,4,deicing
DE0000001819,F00002589,20-03-2025 23:37,weather,CR02,5,late inbound
DE0000001820,F00002590,10-06-2025 04:48,OPS,MX5,1,maintenance check
DE0000001821,F00002591,17-10-2025 19:31,maint,GT3,-3,crew swap
DE0000001822,F00002591,10/17/2025 19:25,WX,CR02,3,gate hold
DE0000001823,F00002591,17-10-2025 18:28,atc,GT3,6,
DE0000001824,F00002596,03/20/2024 00:30,atc,CR02,7,late inbound
DE0000001825,F00002596,03/20/2024 00:18,ATC,MX5,7,ground stop
DE0000001826,F00002600,07/22/2025 01:27,WEATHER,ATC7,3,late inbound
DE0000001827,F00002603,04-08-2025 04:19,airport,CR02,12,crew swap
DE0000001828,F00002603,2025-04-08T06:18:00,CRW,,28,maintenance check
DE0000001829,F00002608,12/21/2025 05:41,weather,,2,gate hold
DE0000001830,F00002608,12/21/2025 06:07,crew,ATC7,-5,
DE0000001831,F00002611,2025-09-05T06:45:00,atc,CR02,5,gate hold
DE0000001832,F00002611,05-09-2025 07:40,GATE,MX5,9,late inbound
DE0000001833,F00002612,22-09-2025 00:42,GATE,CR02,19,maintenance check
DE0000001834,F00002612,09/22/2025 02:01,GATE,,2,gate hold
DE0000001835,F00002612,22-09-2025 00:24,GATE,CR02,41,maintenance check
DE0000001836,F00002615,04-06-2025 21:08,weather,GT3,278,crew swap
DE0000001837,F00002616,20-10-2025 09:37,CRW,,32,maintenance check
DE0000001838,F00002616,20-10-2025 10:21,ATC,ATC7,1,deicing
DE0000001839,F00002616,10/20/2025 07:53,other,CR02,18,maintenance check
DE0000001840,F00002623,01-02-2024 04:42,crew,WX01,3,deicing
DE0000001841,F00002623,02-01-2024 05:16,AIRPORT,ATC7,1,late inbound
DE0000001842,F00002623,01-02-2024 05:56,MAINT,WX01,3,late inbound
DE0000001843,F00002624,2024-09-22T00:42:00,other,,-1,deicing
DE0000001844,F00002624,22-09-2024 00:23,maint,WX01,1,deicing
DE0000001845,F00002624,22-09-2024 01:11,airport,ATC7,1,gate hold
DE0000001846,F00002627,23-12-2024 19:41,atc,,7,gate hold
DE0000001847,F00002627,23-12-2024 21:08,TRAFFIC,MX5,2m,crew swap
DE0000001848,F00002627,23-12-2024 20:55,atc,ATC7,4,late inbound
DE0000001849,F00002628,2024-02-22T00:19:00,ATC,GT3,-13,ground stop
DE0000001850,F00002633,23-01-2025 07:03,atc,CR02,54,ground stop
DE0000001851,F00002634,08/19/2025 00:41,atc,GT3,11,ground stop
DE0000001852,F00002634,18-08-2025 23:29,MX,GT3,20,ground stop
DE0000001853,F00002638,23-08-2024 08:20,WEATHER,GT3,10,deicing
DE0000001854,F00002639,12-12-2025 20:39,CRW,OPS9,7,
DE0000001855,F00002639,12-12-2025 19:49,MX,WX01,1,gate hold
DE0000001856,F00002640,20-08-2025 12:11,WX,OPS9,6,ground stop
DE0000001857,F00002640,20-08-2025 12:32,MAINT,WX01,10m,
DE0000001858,F00002640,20-08-2025 12:34,maint,,10,maintenance check
DE0000001859,F00002642,01-08-2024 16:09,WX,,2,gate hold
DE0000001860,F00002644,29-11-2025 05:05,ATC,ATC7,5,gate hold
DE0000001861,F00002649,2025-06-21T08:20:00,AIRPORT,WX01,18m,ground stop
DE0000001862,F00002650,20-08-2024 03:06,MX,CR02,7,maintenance check
DE0000001863,F00002651,15-05-2024 01:17,MX,GT3,10,
DE0000001864,F00002652,10-04-2025 14:24,TRAFFIC,OPS9,3,deicing
DE0000001865,F00002653,11-05-2025 01:50,MX,,18,ground stop
DE0000001866,F00002653,11-05-2025 02:23,MAINT,CR02,2,gate hold
DE0000001867,F00002653,11-05-2025 01:57,other,ATC7,-1,
DE0000001868,F00002662,19-10-2024 15:43,MX,CR02,6,crew swap
DE0000001869,F00002662,19-10-2024 14:45,maint,MX5,6,gate hold
DE0000001870,F00002665,01-07-2026 11:46,MAINT,ATC7,1,ground stop
DE0000001871,F00002665,2026-01-07T11:22:00,ATC,OPS9,4,
DE0000001872,F00002665,07-01-2026 11:42,airport,,1,maintenance check
DE0000001873,F00002667,06-06-2024 06:38,AIRPORT,CR02,22,crew swap
DE0000001874,F00002667,06-06-2024 07:27,maint,GT3,-6,ground stop
DE0000001875,F00002671,10-07-2025 21:27,AIRPORT,GT3,14,crew swap
DE0000001876,F00002671,10-07-2025 21:41,AIRPORT,WX01,6,maintenance check
DE0000001877,F00002673,22-08-2024 06:09,ATC,WX01,19,late inbound
DE0000001878,F00002676,10-12-2024 06:59,WX,OPS9,69,deicing
DE0000001879,F00002676,10-12-2024 04:56,OTHER,MX5,4,crew swap
DE0000001880,F00002677,19-08-2025 19:47,atc,ATC7,30,maintenance check
DE0000001881,F00002678,24-09-2025 21:23,WX,ATC7,21,maintenance check
DE0000001882,F00002678,24-09-2025 23:53,other,MX5,9,maintenance check
DE0000001883,F00002680,07-03-2025 15:33,ATC,GT3,1,
DE0000001884,F00002680,07-03-2025 16:35,WEATHER,GT3,6,crew swap
DE0000001885,F00002680,03-07-2025 16:16,MX,GT3,5,
DE0000001886,F00002682,10-02-2024 09:00,crew,ATC7,7,late inbound
DE0000001887,F00002682,02-10-2024 11:35,crew,ATC7,3,crew swap
DE0000001888,F00002682,10-02-2024 09:31,OPS,MX5,5m,gate hold
DE0000001889,F00002683,08/13/2024 08:25,ATC,CR02,15,late inbound
DE0000001890,F00002683,13-08-2024 08:23,CRW,ATC7,6,ground stop
DE0000001891,F00002683,13-08-2024 07:37,WEATHER,OPS9,23,
DE0000001892,F00002686,02-01-2026 09:57,OPS,WX01,2,maintenance check
DE0000001893,F00002688,30-09-2024 13:02,GATE,WX01,5,gate hold
DE0000001894,F00002688,30-09-2024 15:03,MAINT,GT3,2,maintenance check
DE0000001895,F00002691,12-03-2024 15:04,MX,WX01,4,ground stop
DE0000001896,F00002692,10-05-2024 06:07,WEATHER,CR02,42,crew swap
DE0000001897,F00002692,10-05-2024 05:56,OTHER,CR02,23m,late inbound
DE0000001898,F00002693,25-01-2026 01:58,MAINT,OPS9,6,gate hold
DE0000001899,F00002693,25-01-2026 01:29,GATE,,1,deicing
DE0000001900,F00002693,25-01-2026 01:04,MX,GT3,16,
DE0000001901,F00002694,04-10-2024 03:26,TRAFFIC,CR02,18,
DE0000001902,F00002694,2024-10-04T05:11:00,WX,ATC7,2m,crew swap
DE0000001903,F00002694,10-04-2024 05:32,airport,ATC7,15,ground stop
DE0000001904,F00002695,13-03-2025 04:35,CRW,WX01,5,
DE0000001905,F00002695,13-03-2025 04:54,AIRPORT,,8m,gate hold
DE0000001906,F00002702,04-03-2024 16:01,MX,CR02,-25,
DE0000001907,F00002704,30-11-2024 08:13,WEATHER,OPS9,11,crew swap
DE0000001908,F00002704,30-11-2024 08:01,CRW,MX5,20,deicing
DE0000001909,F00002704,30-11-2024 06:13,OPS,,44,crew swap
DE0000001910,F00002714,03-09-2024 01:31,CREW,OPS9,2,deicing
DE0000001911,F00002714,03-09-2024 01:22,maint,CR02,4,late inbound
DE0000001912,F00002716,2025-03-18T12:57:00,WX,WX01,14,gate hold
DE0000001913,F00002716,18-03-2025 14:10,WEATHER,WX01,4,ground stop
DE0000001914,F00002718,17-06-2025 11:52,maint,ATC7,22,ground stop
DE0000001915,F00002718,17-06-2025 12:49,weather,GT3,4,
DE0000001916,F00002718,17-06-2025 11:42,CRW,OPS9,48,deicing
DE0000001917,F00002721,11-01-2025 04:40,CRW,ATC7,8,
DE0000001918,F00002721,11-01-2025 03:15,airport,ATC7,2,
DE0000001919,F00002721,11-01-2025 03:15,MX,OPS9,1,late inbound
DE0000001920,F00002722,05-12-2024 01:43,WX,CR02,8m,deicing
DE0000001921,F00002722,12-05-2024 01:34,WEATHER,MX5,-10,gate hold
DE0000001922,F00002723,01-08-2024 13:23,other,,5,
DE0000001923,F00002727,19-07-2025 11:56,maint,WX01,1,maintenance check
DE0000001924,F00002727,19-07-2025 11:49,MX,,1,gate hold
DE0000001925,F00002728,01/16/2025 12:43,CREW,GT3,6,gate hold
DE0000001926,F00002734,01-09-2024 16:07,AIRPORT,,6,
DE0000001927,F00002734,01-09-2024 18:48,crew,WX01,40,gate hold
DE0000001928,F00002734,01-09-2024 16:44,MX,GT3,15,gate hold
DE0000001929,F00002735,03-04-2024 11:34,airport,CR02,10,gate hold
DE0000001930,F00002735,03-04-2024 12:38,CRW,,21,crew swap
DE0000001931,F00002735,03-04-2024 13:50,AIRPORT,GT3,2m,crew swap
DE0000001932,F00002736,13-11-2024 01:28,WEATHER,CR02,1,gate hold
DE0000001933,F00002736,13-11-2024 03:02,airport,WX01,11,crew swap
DE0000001934,F00002736,13-11-2024 02:36,WX,MX5,5,maintenance check
DE0000001935,F00002739,19-12-2025 19:03,WEATHER,ATC7,10,maintenance check
DE0000001936,F00002739,19-12-2025 18:09,airport,WX01,-16,
DE0000001937,F00002739,19-12-2025 17:53,OTHER,GT3,-9,
DE0000001938,F00002744,03/20/2024 04:21,WEATHER,MX5,9,
DE0000001939,F00002744,2024-03-20T05:01:00,TRAFFIC,ATC7,9,maintenance check
DE0000001940,F00002744,03/20/2024 04:53,CRW,WX01,11,ground stop
DE0000001941,F00002748,05-03-2024 02:46,weather,CR02,7,late inbound
DE0000001942,F00002748,05-03-2024 04:32,AIRPORT,MX5,-17,
DE0000001943,F00002749,08/23/2024 03:23,WX,CR02,11,deicing
DE0000001944,F00002749,23-08-2024 00:48,WX,OPS9,5,late inbound
DE0000001945,F00002749,23-08-2024 02:01,AIRPORT,,13,ground stop
DE0000001946,F00002750,07-08-2024 11:18,weather,,0,gate hold
DE0000001947,F00002750,08-07-2024 12:51,crew,,3,deicing
DE0000001948,F00002755,01-06-2024 05:39,CREW,ATC7,14,maintenance check
DE0000001949,F00002756,05-03-2025 02:09,atc,,4,ground stop
DE0000001950,F00002756,03-05-2025 01:29,OTHER,CR02,13,ground stop
DE0000001951,F00002758,2025-08-20T16:05:00,TRAFFIC,CR02,6,
DE0000001952,F00002758,20-08-2025 17:52,AIRPORT,,16,deicing
DE0000001953,F00002758,20-08-2025 15:52,OTHER,ATC7,8,ground stop
DE0000001954,F00002761,03/18/2024 09:59,MAINT,OPS9,14,deicing
DE0000001955,F00002762,13-03-2024 14:14,crew,WX01,8,crew swap
DE0000001956,F00002763,25-04-2024 17:46,GATE,ATC7,30,gate hold
DE0000001957,F00002764,06-11-2025 23:13,CREW,OPS9,5,maintenance check
DE0000001958,F00002764,11-06-2025 22:18,atc,,3,crew swap
DE0000001959,F00002764,07-11-2025 00:29,airport,,16,ground stop
DE0000001960,F00002766,22-10-2025 08:06,crew,WX01,27m,crew swap
DE0000001961,F00002768,10-09-2024 03:20,MAINT,OPS9,40,maintenance check
DE0000001962,F00002770,19-12-2025 02:48,MX,ATC7,7,maintenance check
DE0000001963,F00002770,2025-12-19T03:28:00,MAINT,MX5,4,maintenance check
DE0000001964,F00002776,25-03-2024 07:25,airport,,9,maintenance check
DE0000001965,F00002779,30-08-2024 18:38,weather,,-33,
DE0000001966,F00002781,04-03-2025 10:05,GATE,OPS9,15,crew swap
DE0000001967,F00002784,01-03-2024 16:31,MAINT,ATC7,33,ground stop
DE0000001968,F00002785,04/13/2024 05:13,WX,MX5,20,maintenance check
DE0000001969,F00002785,04/13/2024 03:59,weather,MX5,6,maintenance check
DE0000001970,F00002785,13-04-2024 04:23,ATC,MX5,18,late inbound
DE0000001971,F00002795,25-09-2024 10:05,AIRPORT,ATC7,13,
DE0000001972,F00002795,09/25/2024 10:27,WEATHER,WX01,-16,crew swap
DE0000001973,F00002797,28-09-2024 15:40,CREW,OPS9,1,late inbound
DE0000001974,F00002797,28-09-2024 14:21,OTHER,OPS9,-2,ground stop
DE0000001975,F00002797,28-09-2024 16:11,ATC,OPS9,8,ground stop
DE0000001976,F00002799,05-09-2025 15:20,CRW,,17,gate hold
DE0000001977,F00002801,16-05-2025 07:54,weather,OPS9,1,deicing
DE0000001978,F00002801,16-05-2025 05:46,crew,MX5,1,ground stop
DE0000001979,F00002803,04-05-2025 20:00,crew,GT3,19m,deicing
DE0000001980,F00002803,04-05-2025 20:37,MAINT,,2,deicing
DE0000001981,F00002803,04-05-2025 21:27,GATE,GT3,21,ground stop
DE0000001982,F00002806,05-05-2024 06:07,TRAFFIC,WX01,10m,gate hold
DE0000001983,F00002807,20-12-2025 02:53,ATC,,9,maintenance check
DE0000001984,F00002807,20-12-2025 05:28,CRW,GT3,8m,gate hold
DE0000001985,F00002807,20-12-2025 03:29,atc,CR02,1,gate hold
DE0000001986,F00002808,30-05-2024 10:33,TRAFFIC,WX01,30,late inbound
DE0000001987,F00002817,18-05-2025 05:11,weather,,170,late inbound
DE0000001988,F00002817,05/18/2025 04:13,AIRPORT,,39m,gate hold
DE0000001989,F00002818,25-07-2025 15:07,maint,ATC7,12,ground stop
DE0000001990,F00002822,18-05-2025 01:30,TRAFFIC,OPS9,27,crew swap
DE0000001991,F00002827,2025-12-19T12:17:00,TRAFFIC,GT3,11,maintenance check
DE0000001992,F00002833,03-11-2025 06:42,ATC,,-7,maintenance check
DE0000001993,F00002833,11-03-2025 07:30,GATE,MX5,12,crew swap
DE0000001994,F00002835,24-05-2024 18:02,other,GT3,11,crew swap
DE0000001995,F00002835,05/24/2024 19:10,other,WX01,12,ground stop
DE0000001996,F00002835,24-05-2024 19:57,MAINT,OPS9,2,
DE0000001997,F00002836,10-07-2024 14:16,GATE,CR02,35,
DE0000001998,F00002836,10-07-2024 13:27,MX,MX5,3,crew swap
DE0000001999,F00002836,10-07-2024 13:41,crew,ATC7,8,ground stop
DE0000002000,F00002841,16-11-2024 20:38,airport,WX01,15,gate hold
DE0000002001,F00002842,07-06-2024 04:48,MAINT,,47,deicing
DE0000002002,F00002845,2025-01-25T18:20:00,crew,MX5,2m,ground stop
DE0000002003,F00002852,28-01-2026 19:08,MX,WX01,-4,crew swap
DE0000002004,F00002852,28-01-2026 20:38,WEATHER,GT3,3,
DE0000002005,F00002852,01/28/2026 20:28,crew,CR02,1,deicing
DE0000002006,F00002856,01/20/2026 16:17,GATE,ATC7,5,late inbound
DE0000002007,F00002856,2026-01-20T15:20:00,CRW,OPS9,9,deicing
DE0000002008,F00002856,01/20/2026 17:24,CREW,CR02,6,crew swap
DE0000002009,F00002858,28-07-2025 17:49,TRAFFIC,CR02,11,deicing
DE0000002010,F00002861,09/30/2025 14:20,maint,MX5,25m,
DE0000002011,F00002861,2025-09-30T14:02:00,OTHER,,16,maintenance check
DE0000002012,F00002870,01-09-2024 07:32,WEATHER,WX01,19,late inbound
DE0000002013,F00002872,17-06-2025 21:19,ATC,CR02,4,deicing
DE0000002014,F00002872,17-06-2025 22:45,CRW,CR02,7,
DE0000002015,F00002872,17-06-2025 23:29,weather,WX01,6,crew swap
DE0000002016,F00002873,02-10-2025 11:33,maint,ATC7,11,gate hold
DE0000002017,F00002878,16-08-2024 13:21,OTHER,WX01,4,gate hold
DE0000002018,F00002878,16-08-2024 13:24,GATE,,1,gate hold
DE0000002019,F00002879,15-03-2025 10:18,TRAFFIC,OPS9,10m,late inbound
DE0000002020,F00002879,15-03-2025 10:21,ATC,OPS9,14,deicing
DE0000002021,F00002882,12-08-2025 14:08,TRAFFIC,GT3,0,gate hold
DE0000002022,F00002882,12-08-2025 14:46,GATE,MX5,1,maintenance check
DE0000002023,F00002882,12-08-2025 15:38,ATC,GT3,2,maintenance check
DE0000002024,F00002883,12-11-2024 05:24,OPS,,9,ground stop
DE0000002025,F00002883,12-11-2024 03:26,MAINT,CR02,5,maintenance check
DE0000002026,F00002883,12-11-2024 03:36,WX,,4,gate hold
DE0000002027,F00002889,11/24/2025 21:50,atc,ATC7,11,crew swap
DE0000002028,F00002889,24-11-2025 20:35,AIRPORT,GT3,6,maintenance check
DE0000002029,F00002893,2024-09-11T19:45:00,ATC,ATC7,5,
DE0000002030,F00002893,11-09-2024 20:57,TRAFFIC,ATC7,4m,ground stop
DE0000002031,F00002894,29-05-2025 08:32,maint,,7,
DE0000002032,F00002894,29-05-2025 10:00,MX,WX01,25,crew swap
DE0000002033,F00002894,29-05-2025 09:58,AIRPORT,CR02,3,maintenance check
DE0000002034,F00002895,06-02-2025 02:58,CREW,MX5,29,late inbound
DE0000002035,F00002898,15-02-2025 11:02,crew,CR02,30,ground stop
DE0000002036,F00002899,13-06-2025 18:56,airport,,11,deicing
DE0000002037,F00002899,13-06-2025 17:52,CRW,,8m,late inbound
DE0000002038,F00002899,06/13/2025 18:14,maint,,5,deicing
DE0000002039,F00002900,04/21/2024 01:28,other,CR02,8,crew swap
DE0000002040,F00002900,04/21/2024 01:27,CREW,ATC7,13,gate hold
DE0000002041,F00002900,04/21/2024 01:00,WX,CR02,6,ground stop
DE0000002042,F00002903,04-09-2025 23:50,GATE,WX01,1m,maintenance check
DE0000002043,F00002903,09-04-2025 23:37,maint,CR02,14,
DE0000002044,F00002903,09-04-2025 23:48,other,,11,maintenance check
DE0000002045,F00002904,06-04-2024 03:53,TRAFFIC,GT3,1,crew swap
DE0000002046,F00002904,2024-06-04T04:03:00,CREW,CR02,22,maintenance check
DE0000002047,F00002904,04-06-2024 03:33,TRAFFIC,,1,maintenance check
DE0000002048,F00002906,10-05-2025 12:59,MX,GT3,3,
DE0000002049,F00002910,09-05-2025 23:26,maint,GT3,1,deicing
DE0000002050,F00002910,09-05-2025 23:11,TRAFFIC,WX01,1,gate hold
DE0000002051,F00002910,09-05-2025 23:12,OTHER,GT3,5m,maintenance check
DE0000002052,F00002911,22-07-2024 09:12,atc,WX01,30,
DE0000002053,F00002912,17-08-2025 02:49,atc,OPS9,1m,deicing
DE0000002054,F00002912,2025-08-17T03:32:00,WEATHER,WX01,1,
DE0000002055,F00002912,17-08-2025 04:06,MX,GT3,1,crew swap
DE0000002056,F00002914,2025-01-02T01:49:00,weather,OPS9,3,
DE0000002057,F00002914,01-01-2025 23:36,GATE,WX01,20,maintenance check
DE0000002058,F00002914,02-01-2025 02:26,CRW,CR02,29m,gate hold
DE0000002059,F00002917,14-01-2025 07:08,MAINT,WX01,0,maintenance check
DE0000002060,F00002917,01/14/2025 08:56,other,ATC7,1,gate hold
DE0000002061,F00002918,04/30/2024 22:47,MX,ATC7,14m,late inbound
DE0000002062,F00002919,03/29/2024 18:28,weather,WX01,11,ground stop
DE0000002063,F00002925,01/18/2025 15:42,CREW,ATC7,9,ground stop
DE0000002064,F00002928,11-06-2024 19:08,CRW,ATC7,-4,
DE0000002065,F00002931,18-11-2025 06:17,MAINT,CR02,36,crew swap
DE0000002066,F00002931,18-11-2025 05:58,OTHER,ATC7,1,ground stop
DE0000002067,F00002933,24-05-2024 01:15,atc,ATC7,1,deicing
DE0000002068,F00002933,2024-05-24T01:28:00,GATE,CR02,8,maintenance check
DE0000002069,F00002936,27-11-2025 01:37,OTHER,GT3,47,ground stop
DE0000002070,F00002941,11-03-2025 13:52,OPS,ATC7,5,deicing
DE0000002071,F00002941,11-03-2025 13:47,atc,OPS9,10m,crew swap
DE0000002072,F00002943,2025-08-12T02:07:00,crew,GT3,11,deicing
DE0000002073,F00002948,04-02-2025 19:10,OPS,MX5,0,gate hold
DE0000002074,F00002948,04-02-2025 19:55,other,GT3,3,late inbound
DE0000002075,F00002948,04-02-2025 21:20,OTHER,,7,ground stop
DE0000002076,F00002950,25-04-2025 08:33,WEATHER,WX01,11,deicing
DE0000002077,F00002950,2025-04-25T09:18:00,maint,MX5,12,gate hold
DE0000002078,F00002950,25-04-2025 08:27,WEATHER,MX5,7,maintenance check
DE0000002079,F00002952,10-06-2025 06:32,weather,CR02,2,gate hold
DE0000002080,F00002954,03/16/2025 10:30,ATC,GT3,1,crew swap
DE0000002081,F00002954,03/16/2025 10:52,MAINT,WX01,-1,maintenance check
DE0000002082,F00002954,16-03-2025 11:54,WX,MX5,-5,
DE0000002083,F00002960,18-06-2024 00:26,atc,,27,ground stop
DE0000002084,F00002961,02-09-2024 07:34,airport,CR02,5,ground stop
DE0000002085,F00002961,02-09-2024 05:57,GATE,OPS9,10m,gate hold
DE0000002086,F00002965,31-07-2024 23:38,CRW,WX01,15,maintenance check
DE0000002087,F00002965,31-07-2024 22:38,atc,GT3,4,ground stop
DE0000002088,F00002965,31-07-2024 22:00,CREW,MX5,6,crew swap
DE0000002089,F00002968,24-10-2024 14:41,maint,,14,maintenance check
DE0000002090,F00002968,24-10-2024 14:00,crew,GT3,46,crew swap
DE0000002091,F00002968,24-10-2024 13:52,AIRPORT,ATC7,5,
DE0000002092,F00002969,08-11-2025 12:59,crew,CR02,16,maintenance check
DE0000002093,F00002985,23-09-2025 20:33,CREW,GT3,37,maintenance check
DE0000002094,F00002987,12-12-2025 09:28,CREW,,4,late inbound
DE0000002095,F00002987,12-12-2025 08:32,AIRPORT,OPS9,5,
DE0000002096,F00002987,12-12-2025 09:40,atc,GT3,8,late inbound
DE0000002097,F00002992,08-07-2025 02:02,CRW,WX01,1,late inbound
DE0000002098,F00002992,08-07-2025 00:25,other,MX5,1,crew swap
DE0000002099,F00002993,2025-05-01T10:54:00,airport,,11,maintenance check
DE0000002100,F00002995,02-03-2024 17:24,crew,WX01,-10,crew swap
DE0000002101,F00002995,02-03-2024 18:46,OPS,MX5,6,crew swap
DE0000002102,F00002995,02-03-2024 18:30,ATC,MX5,1m,
DE0000002103,F00002996,20-06-2025 00:42,CRW,OPS9,2,ground stop
DE0000002104,F00002996,06/20/2025 00:49,TRAFFIC,MX5,21,deicing
DE0000002105,F00002996,19-06-2025 22:36,airport,WX01,5,gate hold
DE0000002106,F00003005,13-01-2025 17:54,atc,MX5,5,deicing
DE0000002107,F00003005,01/13/2025 18:52,atc,MX5,2,
DE0000002108,F00003005,13-01-2025 19:39,other,ATC7,9,ground stop
DE0000002109,F00003007,10-03-2025 06:39,maint,ATC7,4,maintenance check
DE0000002110,F00003007,03-10-2025 08:04,ATC,,2,deicing
DE0000002111,F00003008,2025-08-23T17:55:00,maint,,2m,maintenance check
DE0000002112,F00003008,23-08-2025 16:25,OPS,ATC7,1,crew swap
DE0000002113,F00003008,23-08-2025 16:08,CREW,OPS9,5m,ground stop
DE0000002114,F00003009,30-04-2025 17:35,crew,GT3,8,maintenance check
DE0000002115,F00003009,30-04-2025 18:27,ATC,,16,gate hold
DE0000002116,F00003010,13-07-2025 05:06,WX,CR02,15,maintenance check
DE0000002117,F00003010,13-07-2025 04:39,OTHER,,1,late inbound
DE0000002118,F00003012,09-07-2025 06:36,WX,MX5,20,late inbound
DE0000002119,F00003014,01-10-2024 15:31,other,GT3,6,ground stop
DE0000002120,F00003017,05/23/2024 14:49,GATE,WX01,18,late inbound
DE0000002121,F00003020,18-12-2024 13:03,other,ATC7,17,
DE0000002122,F00003022,22-03-2025 02:24,other,CR02,20,gate hold
DE0000002123,F00003024,20-05-2024 23:06,WEATHER,CR02,7,maintenance check
DE0000002124,F00003024,20-05-2024 22:39,crew,WX01,10,ground stop
DE0000002125,F00003025,01-09-2024 19:36,WEATHER,GT3,12,crew swap
DE0000002126,F00003025,09-01-2024 19:05,crew,GT3,2,maintenance check
DE0000002127,F00003025,01-09-2024 18:05,atc,CR02,3,late inbound
DE0000002128,F00003029,2025-07-30T16:08:00,AIRPORT,ATC7,-1,maintenance check
DE0000002129,F00003029,07/30/2025 18:00,other,GT3,1,maintenance check
DE0000002130,F00003029,30-07-2025 16:09,TRAFFIC,CR02,1,late inbound
DE0000002131,F00003037,08-03-2024 16:46,MAINT,CR02,2,maintenance check
DE0000002132,F00003037,03-08-2024 16:38,MX,GT3,10,crew swap
DE0000002133,F00003038,24-06-2025 17:36,ATC,ATC7,11,deicing
DE0000002134,F00003038,24-06-2025 19:11,airport,GT3,11,gate hold
DE0000002135,F00003038,24-06-2025 19:06,ATC,ATC7,8,crew swap
DE0000002136,F00003041,03-01-2025 19:12,CREW,GT3,0,maintenance check
DE0000002137,F00003041,03-01-2025 19:47,MAINT,,1,deicing
DE0000002138,F00003041,03-01-2025 20:36,ATC,MX5,2,
DE0000002139,F00003044,18-03-2025 16:10,CRW,GT3,23,gate hold
DE0000002140,F00003044,18-03-2025 13:30,GATE,GT3,26,
DE0000002141,F00003045,29-09-2024 06:59,AIRPORT,WX01,2,
DE0000002142,F00003045,2024-09-29T05:37:00,MX,GT3,28,gate hold
DE0000002143,F00003046,05-03-2025 05:09,MX,MX5,4,gate hold
DE0000002144,F00003046,05-03-2025 05:18,airport,MX5,7,
DE0000002145,F00003047,09-11-2025 05:34,AIRPORT,WX01,26,crew swap
DE0000002146,F00003053,24-03-2025 01:03,CRW,ATC7,15,ground stop
DE0000002147,F00003053,24-03-2025 00:27,ATC,,15,gate hold
DE0000002148,F00003055,04-12-2024 09:47,CREW,OPS9,8,deicing
DE0000002149,F00003060,25-09-2025 21:04,CREW,OPS9,9,late inbound
DE0000002150,F00003060,09/25/2025 21:55,weather,OPS9,3,ground stop
DE0000002151,F00003060,25-09-2025 21:05,AIRPORT,GT3,18,maintenance check
DE0000002152,F00003062,10-10-2024 04:04,weather,WX01,-1,
DE0000002153,F00003062,10-10-2024 05:01,CRW,,1,
DE0000002154,F00003062,10-10-2024 03:40,other,CR02,1,maintenance check
DE0000002155,F00003065,16-08-2025 15:36,CREW,GT3,2,ground stop
DE0000002156,F00003065,16-08-2025 14:22,WX,,12,maintenance check
DE0000002157,F00003065,16-08-2025 15:27,maint,WX01,5,
DE0000002158,F00003068,01-08-2025 16:32,weather,WX01,13,deicing
DE0000002159,F00003068,08-01-2025 18:04,other,WX01,1m,deicing
DE0000002160,F00003071,19-10-2025 16:19,weather,ATC7,3,crew swap
DE0000002161,F00003071,19-10-2025 16:44,MX,MX5,2,gate hold
DE0000002162,F00003073,2025-05-25T03:19:00,CRW,,-13,
DE0000002163,F00003078,07-04-2024 13:22,WX,,34,
DE0000002164,F00003078,04-07-2024 13:43,OTHER,,24m,gate hold
DE0000002165,F00003078,04-07-2024 14:17,CRW,CR02,5m,crew swap
DE0000002166,F00003079,13-08-2024 23:18,ATC,CR02,20,late inbound
DE0000002167,F00003085,06-01-2025 05:20,TRAFFIC,MX5,-9,deicing
DE0000002168,F00003085,06-01-2025 06:00,OTHER,CR02,2,crew swap
DE0000002169,F00003089,04/28/2024 20:49,WX,GT3,49,late inbound
DE0000002170,F00003093,17-10-2025 17:40,AIRPORT,,27,ground stop
DE0000002171,F00003093,10/17/2025 18:11,CRW,WX01,10,maintenance check
DE0000002172,F00003100,25-11-2025 13:45,CRW,WX01,0,maintenance check
DE0000002173,F00003100,25-11-2025 13:07,MAINT,WX01,1,deicing
DE0000002174,F00003100,25-11-2025 11:43,atc,GT3,2,gate hold
DE0000002175,F00003104,18-07-2025 10:24,maint,ATC7,18,gate hold
DE0000002176,F00003107,14-02-2025 02:09,weather,GT3,14m,late inbound
DE0000002177,F00003107,14-02-2025 01:59,CREW,WX01,7,maintenance check
DE0000002178,F00003107,14-02-2025 01:54,OTHER,MX5,4,crew swap
DE0000002179,F00003111,04-02-2024 11:56,MX,,53,gate hold
DE0000002180,F00003112,12/25/2025 01:03,OTHER,WX01,22,maintenance check
DE0000002181,F00003117,11-02-2025 11:16,airport,WX01,15,deicing
DE0000002182,F00003117,02-11-2025 09:43,AIRPORT,CR02,8,ground stop
DE0000002183,F00003118,16-11-2025 02:46,other,WX01,1m,ground stop
DE0000002184,F00003118,16-11-2025 03:37,weather,OPS9,1,deicing
DE0000002185,F00003118,16-11-2025 02:33,AIRPORT,CR02,1,deicing
DE0000002186,F00003124,24-08-2025 19:43,OPS,OPS9,5,maintenance check
DE0000002187,F00003124,24-08-2025 19:01,maint,CR02,13,
DE0000002188,F00003126,15-03-2024 03:16,MX,MX5,4,
DE0000002189,F00003126,03/15/2024 03:25,atc,ATC7,-8,late inbound
DE0000002190,F00003126,15-03-2024 03:31,GATE,,18,deicing
DE0000002191,F00003127,07-07-2025 07:59,OPS,OPS9,-11,crew swap
DE0000002192,F00003127,07-07-2025 07:27,WEATHER,CR02,17,deicing
DE0000002193,F00003127,07-07-2025 07:02,airport,OPS9,6,deicing
DE0000002194,F00003128,09-07-2024 10:11,ATC,CR02,2,crew swap
DE0000002195,F00003128,09-07-2024 08:58,other,,13,
DE0000002196,F00003130,17-09-2024 17:01,weather,WX01,12,gate hold
DE0000002197,F00003130,17-09-2024 16:49,MX,,2,ground stop
DE0000002198,F00003130,09/17/2024 17:12,atc,ATC7,-11,late inbound
DE0000002199,F00003131,12-01-2025 15:18,OPS,,33m,maintenance check
DE0000002200,F00003131,12-01-2025 15:56,maint,GT3,43,gate hold
DE0000002201,F00003131,01-12-2025 15:16,WX,MX5,5,gate hold
DE0000002202,F00003132,2025-08-13T08:32:00,other,GT3,0,late inbound
DE0000002203,F00003132,13-08-2025 09:16,TRAFFIC,OPS9,1,
DE0000002204,F00003134,2025-04-24T05:41:00,other,MX5,52,deicing
DE0000002205,F00003134,24-04-2025 04:59,MX,ATC7,7,late inbound
DE0000002206,F00003137,20-04-2024 20:10,crew,MX5,2,
DE0000002207,F00003137,20-04-2024 20:46,MAINT,ATC7,4,gate hold
DE0000002208,F00003137,20-04-2024 21:49,WEATHER,MX5,5,gate hold
DE0000002209,F00003140,06-06-2025 06:58,AIRPORT,GT3,26,crew swap
DE0000002210,F00003141,23-07-2024 18:00,OPS,MX5,47,late inbound
DE0000002211,F00003147,30-11-2025 06:59,WEATHER,MX5,21,gate hold
DE0000002212,F00003149,21-03-2025 00:14,ATC,GT3,2,ground stop
DE0000002213,F00003149,20-03-2025 23:13,MAINT,OPS9,4,ground stop
DE0000002214,F00003149,20-03-2025 23:42,AIRPORT,,3,gate hold
DE0000002215,F00003151,02/18/2024 07:00,WEATHER,ATC7,17,
DE0000002216,F00003151,18-02-2024 06:42,airport,CR02,40,ground stop
DE0000002217,F00003151,18-02-2024 07:17,MAINT,ATC7,4,late inbound
DE0000002218,F00003153,24-03-2025 13:16,maint,ATC7,-9,
DE0000002219,F00003160,2024-09-03T02:30:00,MAINT,ATC7,38,
DE0000002220,F00003163,04/14/2024 18:07,MAINT,GT3,39,maintenance check
DE0000002221,F00003165,07-11-2024 14:57,CRW,ATC7,5,deicing
DE0000002222,F00003165,07-11-2024 13:32,WX,WX01,3,late inbound
DE0000002223,F00003165,11-07-2024 13:37,airport,ATC7,3,maintenance check
DE0000002224,F00003166,13-12-2025 19:09,OPS,ATC7,2,deicing
DE0000002225,F00003166,12/13/2025 16:40,WX,,1,
DE0000002226,F00003166,2025-12-13T17:22:00,maint,ATC7,1m,deicing
DE0000002227,F00003169,13-07-2024 20:32,MAINT,,25,
DE0000002228,F00003169,13-07-2024 20:40,maint,GT3,2,
DE0000002229,F00003170,04-01-2026 19:29,airport,CR02,8,crew swap
DE0000002230,F00003170,04-01-2026 18:39,AIRPORT,MX5,3,gate hold
DE0000002231,F00003174,25-01-2025 17:49,atc,ATC7,4,gate hold
DE0000002232,F00003174,01/25/2025 19:54,WEATHER,GT3,28,maintenance check
DE0000002233,F00003174,25-01-2025 19:28,ATC,GT3,5,gate hold
DE0000002234,F00003178,23-10-2024 22:24,weather,,15,maintenance check
DE0000002235,F00003179,26-02-2025 21:59,atc,MX5,1,gate hold
DE0000002236,F00003184,19-01-2026 23:22,other,WX01,-7,
DE0000002237,F00003184,2026-01-20T00:58:00,atc,MX5,16,
DE0000002238,F00003185,21-01-2026 18:29,GATE,GT3,7,deicing
DE0000002239,F00003185,21-01-2026 19:20,other,CR02,3,late inbound
DE0000002240,F00003187,20-03-2024 14:48,GATE,CR02,24,crew swap
DE0000002241,F00003191,12/23/2025 19:39,atc,ATC7,21m,maintenance check
DE0000002242,F00003191,23-12-2025 19:36,ATC,OPS9,1,late inbound
DE0000002243,F00003194,21-08-2024 19:14,CREW,ATC7,20,maintenance check
DE0000002244,F00003194,21-08-2024 16:57,OTHER,WX01,9,deicing
DE0000002245,F00003195,22-05-2024 02:57,OTHER,WX01,5,late inbound
DE0000002246,F00003195,22-05-2024 04:41,crew,WX01,-25,gate hold
DE0000002247,F00003196,20-11-2025 01:15,crew,CR02,-14,crew swap
DE0000002248,F00003196,20-11-2025 01:30,WEATHER,OPS9,8,
DE0000002249,F00003197,18-01-2025 13:52,other,WX01,10,
DE0000002250,F00003197,18-01-2025 13:08,CRW,OPS9,5,ground stop
DE0000002251,F00003200,19-03-2024 00:24,GATE,WX01,1,ground stop
DE0000002252,F00003200,03/18/2024 23:54,MAINT,MX5,2,late inbound
DE0000002253,F00003200,19-03-2024 01:05,WX,,3,gate hold
DE0000002254,F00003201,2026-01-23T14:55:00,WEATHER,WX01,6,gate hold
DE0000002255,F00003201,23-01-2026 13:45,other,OPS9,6,maintenance check
DE0000002256,F00003208,2024-12-12T04:05:00,ATC,GT3,0m,deicing
DE0000002257,F00003208,12-12-2024 05:16,OTHER,GT3,3,late inbound
DE0000002258,F00003208,2024-12-12T03:24:00,CREW,,1,late inbound
DE0000002259,F00003210,27-12-2025 07:17,CRW,CR02,6,deicing
DE0000002260,F00003210,27-12-2025 08:42,MAINT,OPS9,1,crew swap
DE0000002261,F00003211,2025-05-22T04:16:00,CRW,OPS9,4,deicing
DE0000002262,F00003216,01-04-2026 01:06,GATE,ATC7,3,gate hold
DE0000002263,F00003216,04-01-2026 02:36,weather,,16,maintenance check
DE0000002264,F00003216,04-01-2026 03:26,atc,MX5,3,ground stop
DE0000002265,F00003231,28-10-2025 09:22,CRW,MX5,45,crew swap
DE0000002266,F00003234,2025-06-02T01:08:00,CREW,GT3,37,gate hold
DE0000002267,F00003235,14-06-2025 15:59,weather,WX01,9,deicing
DE0000002268,F00003235,14-06-2025 13:53,OPS,OPS9,5,maintenance check
DE0000002269,F00003235,14-06-2025 14:33,airport,,16,
DE0000002270,F00003241,12-07-2024 22:10,WEATHER,ATC7,4,deicing
DE0000002271,F00003241,12-07-2024 20:33,GATE,ATC7,1,deicing
DE0000002272,F00003241,12-07-2024 21:13,atc,GT3,-1,gate hold
DE0000002273,F00003244,13-09-2024 21:35,other,MX5,6,gate hold
DE0000002274,F00003244,13-09-2024 20:56,GATE,GT3,2,maintenance check
DE0000002275,F00003244,09/13/2024 21:51,OTHER,CR02,7,deicing
DE0000002276,F00003245,24-09-2024 07:27,maint,OPS9,1,crew swap
DE0000002277,F00003245,24-09-2024 08:04,MX,GT3,1,
DE0000002278,F00003246,12-07-2024 08:01,WX,MX5,52,crew swap
DE0000002279,F00003247,10-09-2024 20:27,WX,MX5,5,deicing
DE0000002280,F00003247,09-10-2024 20:48,airport,CR02,1,deicing
DE0000002281,F00003253,20-11-2025 05:04,CRW,GT3,1,deicing
DE0000002282,F00003253,20-11-2025 03:57,GATE,MX5,1,late inbound
DE0000002283,F00003254,05-06-2024 12:25,weather,CR02,17,late inbound
DE0000002284,F00003254,2024-06-05T10:36:00,crew,CR02,4,maintenance check
DE0000002285,F00003258,17-12-2024 22:09,atc,MX5,6,maintenance check
DE0000002286,F00003259,12-11-2025 11:35,crew,ATC7,13,gate hold
DE0000002287,F00003259,12-11-2025 11:21,MAINT,MX5,6,late inbound
DE0000002288,F00003265,17-05-2024 10:45,WEATHER,GT3,18,
DE0000002289,F00003267,26-05-2024 13:18,MX,GT3,15,ground stop
DE0000002290,F00003269,12-05-2025 04:28,crew,CR02,4,crew swap
DE0000002291,F00003269,12-05-2025 04:40,other,GT3,-11,deicing
DE0000002292,F00003270,21-02-2024 10:16,maint,MX5,10,maintenance check
DE0000002293,F00003270,21-02-2024 11:50,MAINT,,4,late inbound
DE0000002294,F00003271,30-12-2024 23:04,other,GT3,10,late inbound
DE0000002295,F00003271,31-12-2024 00:23,ATC,OPS9,1,crew swap
DE0000002296,F00003282,27-05-2025 20:58,ATC,CR02,1,maintenance check
DE0000002297,F00003282,27-05-2025 19:46,atc,GT3,17,gate hold
DE0000002298,F00003283,2024-08-06T21:52:00,OTHER,WX01,11,crew swap
DE0000002299,F00003283,08-06-2024 22:15,OPS,GT3,4,deicing
DE0000002300,F00003283,06-08-2024 21:27,WX,MX5,10,crew swap
DE0000002301,F00003288,17-01-2026 01:33,atc,,2,
DE0000002302,F00003288,17-01-2026 00:36,OPS,ATC7,5,late inbound
DE0000002303,F00003288,2026-01-17T00:50:00,GATE,,2,
DE0000002304,F00003289,02-03-2025 04:39,OPS,GT3,14m,deicing
DE0000002305,F00003289,02-03-2025 04:34,TRAFFIC,CR02,15,ground stop
DE0000002306,F00003290,20-07-2024 08:27,crew,OPS9,-4,maintenance check
DE0000002307,F00003292,13-05-2024 04:52,TRAFFIC,,2,
DE0000002308,F00003292,13-05-2024 04:40,weather,,2m,maintenance check
DE0000002309,F00003305,21-11-2024 18:19,TRAFFIC,CR02,6m,late inbound
DE0000002310,F00003309,19-02-2024 02:56,MX,ATC7,13,ground stop
DE0000002311,F00003309,02/19/2024 01:24,WX,CR02,17,
DE0000002312,F00003314,07/22/2025 18:33,GATE,CR02,45,maintenance check
DE0000002313,F00003316,03/31/2024 08:36,atc,,17,gate hold
DE0000002314,F00003316,31-03-2024 08:33,WEATHER,MX5,1,deicing
DE0000002315,F00003318,05-06-2025 03:07,maint,OPS9,8m,
DE0000002316,F00003318,2025-06-05T00:42:00,ATC,MX5,1m,crew swap
DE0000002317,F00003318,2025-06-05T01:26:00,atc,,16,late inbound
DE0000002318,F00003319,30-09-2025 23:46,MX,CR02,0,gate hold
DE0000002319,F00003319,30-09-2025 22:20,MAINT,OPS9,1,maintenance check
DE0000002320,F00003319,01-10-2025 00:10,airport,MX5,4,
DE0000002321,F00003320,2024-07-08T09:01:00,MX,MX5,32m,crew swap
DE0000002322,F00003321,06-09-2024 08:56,GATE,OPS9,9,gate hold
DE0000002323,F00003326,2024-10-03T17:43:00,other,OPS9,34,crew swap
DE0000002324,F00003326,03-10-2024 17:42,weather,WX01,1m,maintenance check
DE0000002325,F00003327,2025-06-08T00:43:00,GATE,MX5,30,crew swap
DE0000002326,F00003330,2024-04-03T15:26:00,AIRPORT,CR02,30m,ground stop
DE0000002327,F00003335,30-01-2026 06:58,AIRPORT,OPS9,1,gate hold
DE0000002328,F00003335,01/30/2026 06:22,crew,OPS9,3,gate hold
DE0000002329,F00003336,21-12-2025 06:59,WX,ATC7,37,maintenance check
DE0000002330,F00003338,03/20/2024 00:54,weather,GT3,6,
DE0000002331,F00003338,20-03-2024 01:31,WEATHER,WX01,3,maintenance check
DE0000002332,F00003339,24-08-2025 15:58,crew,,9,crew swap
DE0000002333,F00003340,2025-03-17T02:19:00,MX,MX5,29,deicing
DE0000002334,F00003342,19-04-2024 21:29,MAINT,GT3,-1,ground stop
DE0000002335,F00003342,2024-04-19T22:07:00,OPS,ATC7,13,maintenance check
DE0000002336,F00003347,03-07-2025 13:37,ATC,,0,maintenance check
DE0000002337,F00003347,07-03-2025 14:29,ATC,MX5,8,gate hold
DE0000002338,F00003347,03-07-2025 16:13,GATE,OPS9,13,deicing
DE0000002339,F00003349,06/30/2024 10:49,GATE,ATC7,44,
DE0000002340,F00003351,18-06-2025 15:54,crew,,21,late inbound
DE0000002341,F00003351,18-06-2025 14:29,WX,CR02,22,late inbound
DE0000002342,F00003353,08/26/2025 07:34,OTHER,OPS9,13,deicing
DE0000002343,F00003353,08/26/2025 09:37,weather,ATC7,9,
DE0000002344,F00003354,13-06-2024 09:33,CREW,WX01,4,gate hold
DE0000002345,F00003354,13-06-2024 08:03,weather,,11,maintenance check
DE0000002346,F00003358,05-11-2025 01:07,ATC,CR02,7,ground stop
DE0000002347,F00003358,05-11-2025 00:57,MAINT,WX01,4,maintenance check
DE0000002348,F00003358,05-11-2025 00:33,maint,WX01,1m,maintenance check
DE0000002349,F00003359,01/23/2025 05:47,GATE,ATC7,16,deicing
DE0000002350,F00003359,23-01-2025 04:48,airport,,18,crew swap
DE0000002351,F00003360,11/14/2025 09:42,TRAFFIC,CR02,15,ground stop
DE0000002352,F00003362,05/15/2024 23:33,OPS,,1,late inbound
DE0000002353,F00003362,05/16/2024 02:01,MAINT,WX01,15,ground stop
DE0000002354,F00003368,29-04-2025 11:24,ATC,,13,maintenance check
DE0000002355,F00003370,18-07-2025 05:29,WX,GT3,0,maintenance check
DE0000002356,F00003370,18-07-2025 06:19,WEATHER,OPS9,-1,crew swap
DE0000002357,F00003372,24-08-2024 15:29,other,CR02,8,
DE0000002358,F00003373,15-08-2025 04:46,ATC,OPS9,30,deicing
DE0000002359,F00003378,19-10-2025 02:17,other,GT3,9,ground stop
DE0000002360,F00003378,10/19/2025 03:20,OPS,ATC7,9,
DE0000002361,F00003379,21-06-2025 06:02,TRAFFIC,WX01,8,ground stop
DE0000002362,F00003382,18-04-2025 20:03,crew,MX5,33,gate hold
DE0000002363,F00003389,08-09-2024 20:48,OPS,,8,late inbound
DE0000002364,F00003389,09-08-2024 23:15,CRW,MX5,-8,late inbound
DE0000002365,F00003397,09-09-2024 22:59,atc,ATC7,11,
DE0000002366,F00003399,13-12-2025 05:05,WEATHER,MX5,16,crew swap
DE0000002367,F00003399,12/13/2025 05:23,CRW,WX01,5,late inbound
DE0000002368,F00003399,13-12-2025 05:08,AIRPORT,MX5,9,maintenance check
DE0000002369,F00003403,05/16/2024 02:13,OPS,MX5,3,crew swap
DE0000002370,F00003408,10-01-2026 05:25,CRW,CR02,2,deicing
DE0000002371,F00003408,10-01-2026 03:55,MAINT,WX01,1,gate hold
DE0000002372,F00003408,10-01-2026 05:17,WX,GT3,3,gate hold
DE0000002373,F00003414,2025-11-21T10:40:00,OPS,OPS9,0,gate hold
DE0000002374,F00003414,11/21/2025 11:06,CREW,WX01,1,gate hold
DE0000002375,F00003414,11/21/2025 11:08,GATE,WX01,1,gate hold
DE0000002376,F00003415,07-10-2025 00:10,AIRPORT,CR02,24,deicing
DE0000002377,F00003415,10-07-2025 00:30,ATC,OPS9,-30,crew swap
DE0000002378,F00003416,16-11-2025 18:38,AIRPORT,WX01,56,deicing
DE0000002379,F00003422,27-10-2025 18:15,MX,,8m,
DE0000002380,F00003422,27-10-2025 16:39,atc,WX01,5,ground stop
DE0000002381,F00003422,27-10-2025 16:24,airport,,3,
DE0000002382,F00003424,12-05-2024 01:08,weather,GT3,3m,gate hold
DE0000002383,F00003425,04/19/2025 09:56,crew,CR02,4,ground stop
DE0000002384,F00003425,19-04-2025 11:50,CRW,CR02,4,
DE0000002385,F00003428,01-03-2025 09:27,MX,WX01,13,ground stop
DE0000002386,F00003432,23-09-2024 08:04,airport,CR02,3,
DE0000002387,F00003435,05/18/2024 13:39,CREW,WX01,5,deicing
DE0000002388,F00003435,18-05-2024 13:12,other,GT3,3,deicing
DE0000002389,F00003435,18-05-2024 13:42,GATE,,82,gate hold
DE0000002390,F00003436,16-11-2024 11:31,CREW,CR02,2,deicing
DE0000002391,F00003436,16-11-2024 10:24,MAINT,CR02,2,late inbound
DE0000002392,F00003436,16-11-2024 10:23,AIRPORT,OPS9,1,gate hold
DE0000002393,F00003438,19-09-2025 06:55,crew,WX01,15,
DE0000002394,F00003438,19-09-2025 07:35,maint,CR02,8,maintenance check
DE0000002395,F00003439,25-05-2024 04:08,CRW,,2,deicing
DE0000002396,F00003441,20-08-2025 10:57,weather,CR02,29,
DE0000002397,F00003444,2024-12-12T15:08:00,GATE,WX01,7,late inbound
DE0000002398,F00003444,12-12-2024 14:01,weather,,5,late inbound
DE0000002399,F00003445,07-05-2024 10:29,atc,,25,maintenance check
DE0000002400,F00003446,22-05-2025 08:32,TRAFFIC,OPS9,2,maintenance check
DE0000002401,F00003446,05/22/2025 09:27,WEATHER,CR02,-4,ground stop
DE0000002402,F00003446,05/22/2025 08:20,atc,,4,maintenance check
DE0000002403,F00003452,18-06-2025 23:56,TRAFFIC,,9,late inbound
DE0000002404,F00003452,19-06-2025 01:47,CRW,CR02,4,deicing
DE0000002405,F00003454,02-02-2025 05:32,CRW,MX5,34,ground stop
DE0000002406,F00003457,30-07-2025 07:23,MX,ATC7,1,crew swap
DE0000002407,F00003457,30-07-2025 06:34,MX,ATC7,14,crew swap
DE0000002408,F00003463,10-02-2024 23:36,other,CR02,2,gate hold
DE0000002409,F00003463,11-02-2024 00:36,AIRPORT,CR02,11,deicing
DE0000002410,F00003463,2024-02-11T00:41:00,ATC,GT3,11,maintenance check
DE0000002411,F00003469,06/13/2024 19:48,OPS,MX5,17m,maintenance check
DE0000002412,F00003469,13-06-2024 19:27,MAINT,CR02,1,crew swap
DE0000002413,F00003469,13-06-2024 19:25,TRAFFIC,ATC7,12,
DE0000002414,F00003470,05-07-2025 01:26,MX,CR02,-27,deicing
DE0000002415,F00003472,24-08-2025 03:28,maint,GT3,9,deicing
DE0000002416,F00003472,08/24/2025 03:48,MX,ATC7,5,ground stop
DE0000002417,F00003474,26-07-2024 01:24,maint,,4,crew swap
DE0000002418,F00003475,14-04-2025 08:09,ATC,GT3,-48,crew swap
DE0000002419,F00003477,29-04-2025 20:28,atc,GT3,2,ground stop
DE0000002420,F00003477,29-04-2025 19:35,WX,ATC7,15,late inbound
DE0000002421,F00003484,05/31/2024 19:08,airport,MX5,2,crew swap
DE0000002422,F00003484,2024-05-31T18:54:00,weather,CR02,-1,late inbound
DE0000002423,F00003486,24-07-2024 03:50,maint,CR02,8,gate hold
DE0000002424,F00003486,07/24/2024 04:22,other,OPS9,6,
DE0000002425,F00003486,07/24/2024 03:00,MAINT,GT3,-3,crew swap
DE0000002426,F00003490,2025-12-24T05:03:00,maint,ATC7,2,ground stop
DE0000002427,F00003490,24-12-2025 03:03,WEATHER,ATC7,1m,deicing
DE0000002428,F00003490,24-12-2025 03:40,GATE,WX01,1,crew swap
DE0000002429,F00003495,31-10-2025 08:28,GATE,,6,gate hold
DE0000002430,F00003495,10/31/2025 10:19,AIRPORT,CR02,1,late inbound
DE0000002431,F00003495,10/31/2025 08:48,WEATHER,GT3,1,
DE0000002432,F00003496,08-06-2025 01:01,OTHER,GT3,0,maintenance check
DE0000002433,F00003496,2025-06-07T23:50:00,crew,MX5,1,
DE0000002434,F00003497,01-08-2026 07:01,airport,,6m,crew swap
DE0000002435,F00003497,08-01-2026 04:46,AIRPORT,WX01,17,gate hold
DE0000002436,F00003498,20-01-2025 14:37,WX,WX01,11,
DE0000002437,F00003498,20-01-2025 13:51,MX,ATC7,6,
DE0000002438,F00003498,20-01-2025 16:15,MAINT,OPS9,16,gate hold
DE0000002439,F00003500,19-09-2025 06:40,WX,ATC7,22,deicing
DE0000002440,F00003502,2025-02-27T07:03:00,OPS,CR02,3,late inbound
DE0000002441,F00003502,27-02-2025 07:16,OPS,OPS9,37,
DE0000002442,F00003505,10-08-2025 10:09,weather,ATC7,-4,gate hold
DE0000002443,F00003505,10-08-2025 10:28,TRAFFIC,OPS9,15,ground stop
DE0000002444,F00003507,27-11-2024 12:30,other,GT3,16,ground stop
DE0000002445,F00003509,12-06-2024 05:49,CRW,WX01,16,ground stop
DE0000002446,F00003510,05-11-2024 15:31,CRW,WX01,25,deicing
DE0000002447,F00003510,05-11-2024 14:41,OTHER,OPS9,4,late inbound
DE0000002448,F00003510,05-11-2024 16:08,WX,ATC7,1,deicing
DE0000002449,F00003512,09-08-2024 06:54,GATE,WX01,11,gate hold
DE0000002450,F00003516,2024-12-01T21:29:00,OPS,GT3,0,maintenance check
DE0000002451,F00003516,01-12-2024 22:15,CREW,ATC7,7,
DE0000002452,F00003518,13-04-2025 16:35,WX,ATC7,6m,crew swap
DE0000002453,F00003518,04/13/2025 16:09,WEATHER,ATC7,15,ground stop
DE0000002454,F00003521,11-02-2025 01:04,atc,OPS9,1m,ground stop
DE0000002455,F00003521,11-02-2025 00:59,OPS,WX01,8,late inbound
DE0000002456,F00003521,02-11-2025 01:31,weather,,1,maintenance check
DE0000002457,F00003524,18-05-2024 05:31,CRW,OPS9,5,late inbound
DE0000002458,F00003524,18-05-2024 04:19,WX,,10,ground stop
DE0000002459,F00003525,23-03-2025 09:05,MAINT,ATC7,17,gate hold
DE0000002460,F00003535,22-10-2025 05:54,GATE,WX01,0,late inbound
DE0000002461,F00003535,22-10-2025 05:31,AIRPORT,OPS9,1,late inbound
DE0000002462,F00003535,22-10-2025 06:38,MX,ATC7,1,late inbound
DE0000002463,F00003540,29-03-2024 23:05,CREW,WX01,13,gate hold
DE0000002464,F00003541,06-05-2024 14:30,OPS,OPS9,7,ground stop
DE0000002465,F00003541,2024-05-06T15:32:00,OPS,MX5,20,crew swap
DE0000002466,F00003543,18-05-2024 02:43,MAINT,,-6,gate hold
DE0000002467,F00003546,2024-03-04T23:32:00,weather,MX5,15,
DE0000002468,F00003546,04-03-2024 23:55,WX,OPS9,9,crew swap
DE0000002469,F00003548,26-10-2024 17:59,WEATHER,MX5,19,ground stop
DE0000002470,F00003552,05-03-2025 01:34,TRAFFIC,CR02,30,crew swap
DE0000002471,F00003553,09-11-2024 12:00,WEATHER,OPS9,13,deicing
DE0000002472,F00003553,09-11-2024 11:41,maint,GT3,1m,gate hold
DE0000002473,F00003558,08/16/2024 09:52,weather,WX01,31,maintenance check
DE0000002474,F00003563,01-02-2024 09:33,airport,OPS9,2m,gate hold
DE0000002475,F00003565,05-12-2025 08:25,CRW,OPS9,7m,
DE0000002476,F00003567,02-04-2024 00:38,atc,WX01,2,deicing
DE0000002477,F00003567,01-04-2024 23:05,CREW,MX5,1,late inbound
DE0000002478,F00003567,2024-04-02T00:52:00,crew,GT3,2,late inbound
DE0000002479,F00003568,03-05-2025 09:07,OTHER,ATC7,2,
DE0000002480,F00003568,03-05-2025 08:59,other,,10,ground stop
DE0000002481,F00003570,02-08-2024 03:07,other,ATC7,8,deicing
DE0000002482,F00003570,02-08-2024 03:25,CREW,ATC7,18,crew swap
DE0000002483,F00003570,02-08-2024 02:53,OTHER,GT3,4,crew swap
DE0000002484,F00003571,08-04-2025 18:15,WEATHER,CR02,1,gate hold
DE0000002485,F00003571,04-08-2025 16:23,MAINT,ATC7,1,gate hold
DE0000002486,F00003571,2025-08-04T18:18:00,airport,MX5,1,ground stop
DE0000002487,F00003574,04-03-2024 09:30,MAINT,WX01,-6,ground stop
DE0000002488,F00003574,03-04-2024 09:50,maint,CR02,-21,late inbound
DE0000002489,F00003576,25-04-2025 21:55,ATC,,18,late inbound
DE0000002490,F00003578,17-03-2025 14:46,crew,CR02,4,gate hold
DE0000002491,F00003578,17-03-2025 15:06,GATE,,10,
DE0000002492,F00003578,17-03-2025 14:54,OPS,GT3,11,
DE0000002493,F00003581,02-06-2024 00:15,atc,OPS9,142,deicing
DE0000002494,F00003581,02-06-2024 00:07,ATC,OPS9,161,ground stop
DE0000002495,F00003582,04-03-2024 12:19,OTHER,,1,crew swap
DE0000002496,F00003582,03-04-2024 12:11,TRAFFIC,ATC7,1,deicing
DE0000002497,F00003582,04-03-2024 11:09,GATE,ATC7,6,
DE0000002498,F00003583,20-07-2024 10:09,TRAFFIC,,30,ground stop
DE0000002499,F00003583,07/20/2024 10:43,AIRPORT,GT3,6,
DE0000002500,F00003589,07-04-2024 08:07,WX,ATC7,6,crew swap
DE0000002501,F00003589,04-07-2024 10:26,TRAFFIC,ATC7,3,gate hold
DE0000002502,F00003589,04-07-2024 10:13,WX,CR02,1,crew swap
DE0000002503,F00003590,03-02-2024 12:25,airport,,2m,
DE0000002504,F00003590,03-02-2024 11:38,OPS,WX01,-3,ground stop
DE0000002505,F00003590,2024-02-03T11:04:00,maint,,14m,late inbound
DE0000002506,F00003591,28-04-2024 12:33,crew,ATC7,14,ground stop
DE0000002507,F00003591,28-04-2024 13:04,CREW,CR02,7,
DE0000002508,F00003593,03/23/2024 08:22,GATE,ATC7,0,crew swap
DE0000002509,F00003593,03/23/2024 06:40,ATC,MX5,5,maintenance check
DE0000002510,F00003594,10-02-2025 00:38,AIRPORT,GT3,2,deicing
DE0000002511,F00003594,02-09-2025 23:21,OTHER,,22,deicing
DE0000002512,F00003594,02-10-2025 00:41,weather,,1,maintenance check
DE0000002513,F00003595,23-06-2025 23:00,WX,GT3,20,late inbound
DE0000002514,F00003595,2025-06-23T22:41:00,crew,ATC7,8,
DE0000002515,F00003596,28-07-2024 15:24,AIRPORT,MX5,6,crew swap
DE0000002516,F00003598,11/17/2025 12:46,WX,MX5,13,late inbound
DE0000002517,F00003598,17-11-2025 14:18,WX,WX01,-1,ground stop
DE0000002518,F00003598,17-11-2025 11:38,CREW,,1,crew swap
DE0000002519,F00003602,23-07-2024 06:58,MAINT,GT3,15,ground stop
DE0000002520,F00003604,2024-02-24T16:30:00,weather,MX5,1,ground stop
DE0000002521,F00003605,2025-02-09T22:18:00,weather,OPS9,26,
DE0000002522,F00003607,21-10-2025 16:08,GATE,CR02,-1,
DE0000002523,F00003607,21-10-2025 15:56,other,GT3,1,ground stop
DE0000002524,F00003607,21-10-2025 17:42,MAINT,GT3,1,crew swap
DE0000002525,F00003612,20-01-2026 17:29,atc,GT3,19,late inbound
DE0000002526,F00003616,24-11-2024 19:07,WEATHER,OPS9,-10,gate hold
DE0000002527,F00003616,24-11-2024 21:23,other,OPS9,10,
DE0000002528,F00003617,03-07-2025 08:49,weather,,5,late inbound
DE0000002529,F00003617,03-07-2025 09:18,GATE,ATC7,55,deicing
DE0000002530,F00003617,03-07-2025 09:27,CREW,WX01,2m,
DE0000002531,F00003620,23-08-2025 14:34,MAINT,MX5,10,maintenance check
DE0000002532,F00003620,08/23/2025 16:07,GATE,MX5,1m,
DE0000002533,F00003620,23-08-2025 16:18,maint,WX01,-8,crew swap
DE0000002534,F00003621,14-09-2025 15:10,atc,WX01,30,late inbound
DE0000002535,F00003623,2024-06-15T15:39:00,ATC,WX01,-14,late inbound
DE0000002536,F00003623,15-06-2024 13:57,OPS,GT3,15,crew swap
DE0000002537,F00003623,06/15/2024 14:59,TRAFFIC,GT3,5m,ground stop
DE0000002538,F00003627,22-12-2024 20:52,WEATHER,ATC7,42,gate hold
DE0000002539,F00003629,17-05-2025 22:43,GATE,WX01,3,deicing
DE0000002540,F00003629,05/17/2025 21:37,weather,CR02,10m,maintenance check
DE0000002541,F00003629,2025-05-17T20:52:00,ATC,OPS9,18,gate hold
DE0000002542,F00003630,09-07-2025 11:24,CREW,,12,crew swap
DE0000002543,F00003630,09-07-2025 12:18,MX,MX5,1,maintenance check
DE0000002544,F00003632,25-12-2024 00:48,CRW,MX5,5m,deicing
DE0000002545,F00003632,12/25/2024 01:44,CREW,WX01,3,deicing
DE0000002546,F00003632,25-12-2024 01:44,TRAFFIC,GT3,5,ground stop
DE0000002547,F00003636,24-11-2024 08:44,TRAFFIC,OPS9,22m,deicing
DE0000002548,F00003637,11/15/2024 22:50,TRAFFIC,,-7,deicing
DE0000002549,F00003638,08-07-2025 12:36,TRAFFIC,GT3,23,
DE0000002550,F00003639,18-10-2025 18:08,WX,MX5,18,gate hold
DE0000002551,F00003639,18-10-2025 18:32,weather,,5,gate hold
DE0000002552,F00003639,18-10-2025 18:22,crew,ATC7,2,
DE0000002553,F00003640,05-07-2024 19:26,AIRPORT,OPS9,28,gate hold
DE0000002554,F00003641,10/20/2025 14:36,ATC,GT3,11,ground stop
DE0000002555,F00003641,20-10-2025 14:22,WX,MX5,27,gate hold
DE0000002556,F00003643,23-10-2025 08:36,CRW,MX5,3,
DE0000002557,F00003646,13-07-2025 17:20,MX,OPS9,50,ground stop
DE0000002558,F00003648,2025-08-02T17:15:00,airport,ATC7,38,late inbound
DE0000002559,F00003651,18-02-2025 06:19,ATC,WX01,5,gate hold
DE0000002560,F00003651,18-02-2025 06:59,weather,CR02,225,maintenance check
DE0000002561,F00003652,06-09-2025 22:59,CREW,CR02,30,gate hold
DE0000002562,F00003652,06-09-2025 21:06,MX,OPS9,8,maintenance check
DE0000002563,F00003653,12-12-2025 21:37,airport,MX5,6,late inbound
DE0000002564,F00003653,12-12-2025 20:57,AIRPORT,GT3,13,crew swap
DE0000002565,F00003654,20-08-2025 04:10,WX,WX01,14,deicing
DE0000002566,F00003654,20-08-2025 04:34,WEATHER,WX01,4,ground stop
DE0000002567,F00003656,19-04-2024 23:01,OPS,CR02,1,late inbound
DE0000002568,F00003658,11-11-2025 17:34,airport,,24,
DE0000002569,F00003658,11-11-2025 19:07,WX,CR02,2,deicing
DE0000002570,F00003659,05-10-2024 14:13,MAINT,,30,crew swap
DE0000002571,F00003662,18-07-2025 17:26,TRAFFIC,WX01,0,maintenance check
DE0000002572,F00003662,18-07-2025 17:59,CRW,GT3,-2,gate hold
DE0000002573,F00003664,25-03-2024 18:46,airport,CR02,33,late inbound
DE0000002574,F00003664,25-03-2024 21:30,weather,GT3,4,ground stop
DE0000002575,F00003664,25-03-2024 19:01,MX,WX01,13,maintenance check
DE0000002576,F00003666,07/13/2024 09:26,crew,GT3,10,
DE0000002577,F00003668,10-08-2025 02:44,WEATHER,OPS9,41,crew swap
DE0000002578,F00003671,14-02-2024 21:15,other,OPS9,0,maintenance check
DE0000002579,F00003671,14-02-2024 20:53,CRW,WX01,3,late inbound
DE0000002580,F00003672,05/27/2024 18:23,maint,,6,maintenance check
DE0000002581,F00003672,05/27/2024 17:14,GATE,WX01,3,deicing
DE0000002582,F00003673,28-09-2025 09:43,other,GT3,3,
DE0000002583,F00003673,2025-09-28T08:16:00,AIRPORT,MX5,4,
DE0000002584,F00003673,28-09-2025 09:33,WX,CR02,5,crew swap
DE0000002585,F00003678,28-02-2024 13:57,TRAFFIC,MX5,-2,crew swap
DE0000002586,F00003678,28-02-2024 13:13,crew,,1m,
DE0000002587,F00003678,2024-02-28T12:07:00,other,OPS9,2,maintenance check
DE0000002588,F00003685,03-12-2025 09:45,TRAFFIC,,4m,gate hold
DE0000002589,F00003685,2025-03-12T09:02:00,WX,MX5,-14,deicing
DE0000002590,F00003686,13-03-2025 08:23,OTHER,,49,
DE0000002591,F00003688,24-07-2024 21:36,GATE,WX01,8,gate hold
DE0000002592,F00003688,07/24/2024 22:29,MX,OPS9,3,maintenance check
DE0000002593,F00003692,2025-12-30T01:19:00,CREW,GT3,2m,crew swap
DE0000002594,F00003692,30-12-2025 04:11,crew,CR02,-30,deicing
DE0000002595,F00003694,19-10-2024 16:06,AIRPORT,OPS9,1,deicing
DE0000002596,F00003694,19-10-2024 18:26,CRW,ATC7,26,gate hold
DE0000002597,F00003696,31-12-2024 00:44,weather,MX5,16m,ground stop
DE0000002598,F00003696,31-12-2024 01:58,MX,GT3,12,gate hold
DE0000002599,F00003696,31-12-2024 02:50,WX,GT3,1,gate hold
DE0000002600,F00003697,06-07-2024 18:32,WEATHER,CR02,3,late inbound
DE0000002601,F00003697,07-06-2024 19:40,weather,MX5,1,ground stop
DE0000002602,F00003697,07-06-2024 21:06,atc,GT3,1,maintenance check
DE0000002603,F00003699,10-04-2025 09:54,GATE,ATC7,-1,gate hold
DE0000002604,F00003699,10-04-2025 09:53,TRAFFIC,OPS9,1,
DE0000002605,F00003699,10-04-2025 08:49,TRAFFIC,OPS9,9m,
DE0000002606,F00003702,01-08-2024 00:00,GATE,ATC7,4,ground stop
DE0000002607,F00003706,2025-01-26T14:30:00,WEATHER,MX5,-74,late inbound
DE0000002608,F00003706,01/26/2025 14:57,atc,,37,deicing
DE0000002609,F00003706,26-01-2025 14:37,CREW,MX5,29,late inbound
DE0000002610,F00003709,22-02-2024 07:50,maint,,9,late inbound
DE0000002611,F00003711,02-07-2024 03:00,other,MX5,10,gate hold
DE0000002612,F00003711,07-02-2024 04:35,weather,GT3,4,late inbound
DE0000002613,F00003712,01/23/2026 06:33,WX,GT3,9,ground stop
DE0000002614,F00003714,06-06-2024 19:51,WX,,7,gate hold
DE0000002615,F00003716,25-01-2026 10:32,MAINT,MX5,4,deicing
DE0000002616,F00003716,25-01-2026 09:27,weather,WX01,3,crew swap
DE0000002617,F00003716,25-01-2026 09:41,ATC,ATC7,1,crew swap
DE0000002618,F00003718,01-08-2025 19:15,CREW,CR02,14,ground stop
DE0000002619,F00003718,01-08-2025 21:29,WX,GT3,1,late inbound
DE0000002620,F00003718,08-01-2025 20:48,WX,,6,maintenance check
DE0000002621,F00003719,15-06-2025 08:38,CRW,,11,late inbound
DE0000002622,F00003719,15-06-2025 08:45,weather,,15,deicing
DE0000002623,F00003720,01-08-2025 09:14,OTHER,WX01,1,late inbound
DE0000002624,F00003720,2025-08-01T12:01:00,crew,MX5,1,late inbound
DE0000002625,F00003721,06-05-2024 20:44,GATE,CR02,28,maintenance check
DE0000002626,F00003721,06-05-2024 22:01,OTHER,ATC7,12,crew swap
DE0000002627,F00003722,09-02-2025 21:35,AIRPORT,,3,gate hold
DE0000002628,F00003722,09-02-2025 22:34,crew,MX5,7,late inbound
DE0000002629,F00003723,11-02-2024 05:05,CRW,WX01,39,late inbound
DE0000002630,F00003724,04-04-2024 22:04,WEATHER,WX01,3,gate hold
DE0000002631,F00003724,04-04-2024 22:45,CREW,ATC7,11,
DE0000002632,F00003730,17-07-2025 06:48,TRAFFIC,ATC7,2,maintenance check
DE0000002633,F00003730,07/17/2025 06:39,CRW,WX01,2,gate hold
DE0000002634,F00003733,21-06-2025 14:19,OTHER,CR02,11m,maintenance check
DE0000002635,F00003733,21-06-2025 13:06,MX,,1,gate hold
DE0000002636,F00003734,12-08-2024 04:56,CRW,ATC7,25,
DE0000002637,F00003734,12-08-2024 04:42,WEATHER,CR02,5,deicing
DE0000002638,F00003739,07-08-2024 08:20,airport,WX01,2,
DE0000002639,F00003739,08-07-2024 09:20,OTHER,,22,deicing
DE0000002640,F00003742,18-06-2025 22:03,CREW,MX5,4,ground stop
DE0000002641,F00003742,18-06-2025 22:54,AIRPORT,GT3,15,late inbound
DE0000002642,F00003742,06/18/2025 23:52,airport,MX5,2,late inbound
DE0000002643,F00003743,22-01-2025 22:39,MAINT,,13,
DE0000002644,F00003745,07-09-2025 12:13,maint,,26,crew swap
DE0000002645,F00003751,15-11-2024 09:32,AIRPORT,CR02,36,gate hold
DE0000002646,F00003752,06/20/2024 23:39,CRW,GT3,-2,late inbound
DE0000002647,F00003752,20-06-2024 22:07,OPS,ATC7,13m,gate hold
DE0000002648,F00003753,17-10-2025 12:48,other,ATC7,10,deicing
DE0000002649,F00003755,02-09-2024 19:23,atc,GT3,14,deicing
DE0000002650,F00003755,02-09-2024 18:13,airport,WX01,5,gate hold
DE0000002651,F00003755,02-09-2024 17:38,weather,CR02,19,maintenance check
DE0000002652,F00003758,09/21/2025 23:45,ATC,MX5,7,maintenance check
DE0000002653,F00003758,21-09-2025 23:31,GATE,MX5,7,ground stop
DE0000002654,F00003760,11-04-2024 08:00,CREW,CR02,32,gate hold
DE0000002655,F00003761,13-02-2025 07:37,ATC,,2,gate hold
DE0000002656,F00003761,2025-02-13T09:56:00,maint,MX5,3,crew swap
DE0000002657,F00003761,13-02-2025 08:25,CREW,CR02,26,late inbound
DE0000002658,F00003764,2025-10-15T07:49:00,MAINT,MX5,6,late inbound
DE0000002659,F00003764,15-10-2025 06:04,weather,,1,ground stop
DE0000002660,F00003764,2025-10-15T07:21:00,CRW,ATC7,17,late inbound
DE0000002661,F00003765,08-09-2024 20:38,WEATHER,WX01,6,crew swap
DE0000002662,F00003765,09-08-2024 20:06,WX,CR02,6,gate hold
DE0000002663,F00003771,23-07-2024 02:08,atc,,1,late inbound
DE0000002664,F00003771,2024-07-22T23:46:00,MAINT,GT3,6,
DE0000002665,F00003782,05-10-2025 23:12,airport,WX01,2,maintenance check
DE0000002666,F00003782,11-05-2025 00:22,WEATHER,ATC7,10,
DE0000002667,F00003782,10-05-2025 22:10,crew,OPS9,1m,gate hold
DE0000002668,F00003786,21-06-2025 09:25,weather,OPS9,-22,late inbound
DE0000002669,F00003786,21-06-2025 10:13,ATC,OPS9,6,crew swap
DE0000002670,F00003789,04-08-2024 16:12,MX,GT3,2,deicing
DE0000002671,F00003789,04-08-2024 17:34,ATC,CR02,4,maintenance check
DE0000002672,F00003790,2025-07-16T07:12:00,airport,CR02,3,crew swap
DE0000002673,F00003790,16-07-2025 08:15,OTHER,OPS9,1,late inbound
DE0000002674,F00003790,16-07-2025 07:17,atc,,1,maintenance check
DE0000002675,F00003791,14-03-2024 21:49,WX,GT3,14,
DE0000002676,F00003791,2024-03-14T23:13:00,OPS,CR02,10,crew swap
DE0000002677,F00003791,14-03-2024 22:37,WEATHER,WX01,2m,
DE0000002678,F00003793,01-04-2026 17:45,other,,11,late inbound
DE0000002679,F00003796,20-04-2024 09:25,weather,WX01,11m,maintenance check
DE0000002680,F00003796,04/20/2024 10:01,crew,CR02,4,crew swap
DE0000002681,F00003798,30-07-2025 21:16,CREW,ATC7,11m,gate hold
DE0000002682,F00003798,30-07-2025 22:05,CRW,WX01,3m,late inbound
DE0000002683,F00003800,09/14/2025 09:35,atc,GT3,4,crew swap
DE0000002684,F00003800,14-09-2025 07:37,other,CR02,11m,ground stop
DE0000002685,F00003805,12-10-2025 18:04,weather,,14,
DE0000002686,F00003805,2025-10-12T18:25:00,maint,ATC7,2,maintenance check
DE0000002687,F00003805,12-10-2025 18:32,other,CR02,2,crew swap
DE0000002688,F00003808,23-05-2025 20:47,GATE,CR02,18,crew swap
DE0000002689,F00003808,23-05-2025 22:15,crew,CR02,3,crew swap
DE0000002690,F00003809,21-08-2024 05:46,other,WX01,16,deicing
DE0000002691,F00003810,16-07-2024 07:29,CREW,CR02,-1,late inbound
DE0000002692,F00003810,16-07-2024 07:58,MAINT,CR02,1,ground stop
DE0000002693,F00003810,07/16/2024 08:18,OTHER,GT3,4,crew swap
DE0000002694,F00003811,19-09-2025 10:53,airport,GT3,1,deicing
DE0000002695,F00003811,19-09-2025 10:08,GATE,CR02,2,
DE0000002696,F00003811,19-09-2025 11:46,GATE,,27,maintenance check
DE0000002697,F00003816,21-08-2024 11:42,crew,,4,deicing
DE0000002698,F00003817,10-08-2025 08:36,OTHER,ATC7,12,late inbound
DE0000002699,F00003819,08/26/2025 08:56,MX,GT3,21,
DE0000002700,F00003819,26-08-2025 06:54,MX,,16,ground stop
DE0000002701,F00003821,06-12-2024 02:38,CRW,MX5,49,
DE0000002702,F00003821,06-12-2024 01:55,CRW,OPS9,17,maintenance check
DE0000002703,F00003821,06-12-2024 01:32,maint,MX5,7,crew swap
DE0000002704,F00003822,25-12-2024 07:12,airport,ATC7,14,gate hold
DE0000002705,F00003822,12/25/2024 06:46,CRW,,21,deicing
DE0000002706,F00003823,04-12-2025 18:55,crew,MX5,5,ground stop
DE0000002707,F00003823,04-12-2025 20:25,WEATHER,OPS9,4,
DE0000002708,F00003823,2025-12-04T18:29:00,OTHER,OPS9,2,crew swap
DE0000002709,F00003833,2024-06-21T14:47:00,GATE,OPS9,8,deicing
DE0000002710,F00003836,11/17/2025 23:40,airport,WX01,15,late inbound
DE0000002711,F00003836,18-11-2025 00:24,MX,GT3,4,late inbound
DE0000002712,F00003836,11/17/2025 23:08,MX,WX01,-13,gate hold
DE0000002713,F00003837,24-10-2025 01:35,airport,GT3,28,
DE0000002714,F00003838,11-08-2025 10:07,WX,WX01,-1,maintenance check
DE0000002715,F00003838,11-08-2025 07:22,MAINT,CR02,27,
DE0000002716,F00003839,04-02-2024 22:35,GATE,MX5,3,maintenance check
DE0000002717,F00003839,02-04-2024 20:31,GATE,WX01,4m,crew swap
DE0000002718,F00003839,02-04-2024 20:18,WEATHER,WX01,5,
DE0000002719,F00003845,09-12-2025 17:40,CREW,,8,late inbound
DE0000002720,F00003845,09-12-2025 18:12,TRAFFIC,WX01,6,deicing
DE0000002721,F00003845,12-09-2025 18:35,weather,CR02,25,crew swap
DE0000002722,F00003846,14-12-2025 11:17,CRW,MX5,17m,
DE0000002723,F00003846,12/14/2025 09:59,MAINT,,8,maintenance check
DE0000002724,F00003846,14-12-2025 09:29,airport,GT3,1,gate hold
DE0000002725,F00003853,19-03-2025 16:21,WX,GT3,2,gate hold
DE0000002726,F00003853,19-03-2025 16:48,weather,WX01,1,deicing
DE0000002727,F00003853,03/19/2025 16:09,airport,,2,deicing
DE0000002728,F00003854,15-09-2024 17:49,CREW,ATC7,16,maintenance check
DE0000002729,F00003854,15-09-2024 18:26,WX,OPS9,6,
DE0000002730,F00003855,06/24/2025 08:33,CREW,ATC7,10,ground stop
DE0000002731,F00003855,24-06-2025 09:14,TRAFFIC,OPS9,1,late inbound
DE0000002732,F00003855,24-06-2025 08:39,TRAFFIC,,7,ground stop
DE0000002733,F00003859,30-04-2025 00:37,airport,ATC7,0,ground stop
DE0000002734,F00003859,29-04-2025 23:22,AIRPORT,CR02,8,maintenance check
DE0000002735,F00003859,30-04-2025 00:45,GATE,WX01,5,gate hold
DE0000002736,F00003862,21-09-2024 06:08,crew,WX01,4,late inbound
DE0000002737,F00003868,08-11-2025 08:02,airport,GT3,0m,maintenance check
DE0000002738,F00003868,08-11-2025 06:31,MAINT,WX01,2,ground stop
DE0000002739,F00003868,08-11-2025 07:44,MAINT,GT3,-3,crew swap
DE0000002740,F00003869,13-04-2025 01:19,CRW,MX5,18,crew swap
DE0000002741,F00003869,13-04-2025 01:51,WEATHER,,7,gate hold
DE0000002742,F00003873,09-06-2025 04:07,weather,GT3,11m,maintenance check
DE0000002743,F00003873,06-09-2025 03:59,TRAFFIC,MX5,14,crew swap
DE0000002744,F00003879,12/22/2025 14:22,CREW,,27,deicing
DE0000002745,F00003879,12/22/2025 14:26,OTHER,CR02,20,ground stop
DE0000002746,F00003882,17-04-2024 21:12,ATC,CR02,17,gate hold
DE0000002747,F00003883,01-12-2025 13:52,CRW,GT3,6,gate hold
DE0000002748,F00003883,01-12-2025 13:32,OPS,,11,crew swap
DE0000002749,F00003883,01-12-2025 12:46,weather,GT3,1,
DE0000002750,F00003886,04-03-2024 22:30,ATC,,1,deicing
DE0000002751,F00003890,25-05-2025 03:46,OPS,GT3,3,maintenance check
DE0000002752,F00003890,25-05-2025 03:58,ATC,MX5,13,late inbound
DE0000002753,F00003892,06/30/2024 15:00,TRAFFIC,OPS9,0,late inbound
DE0000002754,F00003892,06/30/2024 13:56,WX,MX5,2,maintenance check
DE0000002755,F00003892,30-06-2024 14:34,CRW,,22,gate hold
DE0000002756,F00003897,08-03-2025 03:44,atc,,4,maintenance check
DE0000002757,F00003897,08-03-2025 04:30,weather,OPS9,2,gate hold
DE0000002758,F00003898,10/27/2025 23:02,CRW,CR02,12,ground stop
DE0000002759,F00003902,03-09-2024 07:59,maint,WX01,5,gate hold
DE0000002760,F00003905,2024-09-16T18:38:00,CRW,WX01,0,crew swap
DE0000002761,F00003905,16-09-2024 16:30,OPS,,1,late inbound
DE0000002762,F00003905,16-09-2024 16:31,weather,CR02,3,deicing
DE0000002763,F00003911,01/13/2026 09:18,crew,OPS9,68,
DE0000002764,F00003911,13-01-2026 09:38,maint,GT3,7,late inbound
DE0000002765,F00003911,13-01-2026 07:50,WEATHER,OPS9,2m,late inbound
DE0000002766,F00003915,17-01-2026 09:10,OPS,,0,late inbound
DE0000002767,F00003915,17-01-2026 08:45,airport,WX01,1,ground stop
DE0000002768,F00003915,2026-01-17T07:39:00,TRAFFIC,OPS9,-15,maintenance check
DE0000002769,F00003919,24-11-2024 03:28,other,ATC7,1,crew swap
DE0000002770,F00003921,01-04-2025 05:36,other,WX01,10,crew swap
DE0000002771,F00003921,01-04-2025 04:18,MX,,1m,maintenance check
DE0000002772,F00003921,2025-04-01T05:12:00,MAINT,ATC7,7,ground stop
DE0000002773,F00003929,24-03-2024 18:52,TRAFFIC,GT3,13,maintenance check
DE0000002774,F00003929,2024-03-24T17:11:00,weather,WX01,8,ground stop
DE0000002775,F00003929,24-03-2024 18:26,weather,OPS9,4,ground stop
DE0000002776,F00003937,17-07-2024 04:34,WX,OPS9,-1,deicing
DE0000002777,F00003937,17-07-2024 04:05,maint,CR02,1,gate hold
DE0000002778,F00003937,2024-07-17T03:42:00,weather,OPS9,1,maintenance check
DE0000002779,F00003942,18-09-2025 01:03,maint,OPS9,6,gate hold
DE0000002780,F00003943,17-04-2024 17:46,MX,GT3,17,maintenance check
DE0000002781,F00003952,15-10-2025 07:05,ATC,ATC7,2,maintenance check
DE0000002782,F00003952,15-10-2025 06:16,AIRPORT,ATC7,5,late inbound
DE0000002783,F00003952,15-10-2025 07:20,other,MX5,7,late inbound
DE0000002784,F00003953,14-12-2025 13:32,atc,,42,maintenance check
DE0000002785,F00003953,14-12-2025 11:28,OTHER,ATC7,125,crew swap
DE0000002786,F00003953,12/14/2025 13:39,TRAFFIC,GT3,126,late inbound
DE0000002787,F00003958,28-07-2024 07:00,MAINT,GT3,16m,deicing
DE0000002788,F00003958,28-07-2024 06:32,crew,MX5,4,maintenance check
DE0000002789,F00003958,28-07-2024 06:08,MAINT,OPS9,10,deicing
DE0000002790,F00003960,09-11-2024 20:59,CREW,CR02,10,crew swap
DE0000002791,F00003961,04-01-2025 10:51,other,MX5,7,maintenance check
DE0000002792,F00003964,09/25/2025 15:32,CREW,OPS9,41,
DE0000002793,F00003967,05-02-2025 00:29,atc,CR02,2,deicing
DE0000002794,F00003967,2025-05-02T00:27:00,ATC,CR02,-2,maintenance check
DE0000002795,F00003969,19-10-2025 04:54,WEATHER,GT3,1,deicing
DE0000002796,F00003969,19-10-2025 05:36,CRW,ATC7,21,deicing
DE0000002797,F00003970,29-09-2024 16:14,CREW,CR02,3,deicing
DE0000002798,F00003973,21-11-2025 21:06,WEATHER,MX5,23,late inbound
DE0000002799,F00003978,07-11-2025 02:55,other,MX5,1m,late inbound
DE0000002800,F00003978,07-11-2025 02:05,maint,WX01,3,crew swap
DE0000002801,F00003978,2025-11-07T02:03:00,WX,WX01,-21,maintenance check
DE0000002802,F00003979,05/27/2024 06:54,TRAFFIC,WX01,2,deicing
DE0000002803,F00003979,27-05-2024 06:20,OTHER,ATC7,7,maintenance check
DE0000002804,F00003979,27-05-2024 07:38,GATE,MX5,1,crew swap
DE0000002805,F00003980,20-01-2025 03:20,AIRPORT,ATC7,4,gate hold
DE0000002806,F00003980,01/20/2025 04:11,OTHER,ATC7,15,ground stop
DE0000002807,F00003983,12-05-2025 02:40,CREW,GT3,2,crew swap
DE0000002808,F00003983,12-05-2025 04:16,airport,ATC7,3,late inbound
DE0000002809,F00003983,2025-05-12T04:03:00,crew,WX01,2,ground stop
DE0000002810,F00003985,19-07-2024 11:29,airport,OPS9,12m,crew swap
DE0000002811,F00003985,19-07-2024 11:52,CREW,ATC7,9,late inbound
DE0000002812,F00003988,16-03-2025 06:47,WEATHER,OPS9,11,maintenance check
DE0000002813,F00003988,03/16/2025 05:15,CRW,GT3,2,gate hold
DE0000002814,F00003993,2024-06-05T15:12:00,weather,CR02,47,ground stop
DE0000002815,F00003993,05-06-2024 15:43,WEATHER,WX01,1,crew swap
DE0000002816,F00003997,03-05-2024 09:28,GATE,WX01,1,crew swap
DE0000002817,F00003997,05-03-2024 09:17,GATE,,2,
DE0000002818,F00003997,2024-05-03T10:22:00,CRW,ATC7,9,deicing
DE0000002819,F00004001,02-08-2025 08:06,WX,MX5,28,maintenance check
DE0000002820,F00004001,02-08-2025 08:38,TRAFFIC,OPS9,2,gate hold
DE0000002821,F00004002,14-05-2025 01:37,MX,WX01,-16,late inbound
DE0000002822,F00004007,28-06-2024 08:17,crew,,7,gate hold
DE0000002823,F00004009,30-05-2025 03:12,airport,ATC7,0,deicing
DE0000002824,F00004009,2025-05-30T04:30:00,CRW,GT3,1,late inbound
DE0000002825,F00004010,07-03-2025 00:24,OTHER,GT3,5,late inbound
DE0000002826,F00004010,06-03-2025 23:57,GATE,ATC7,21,gate hold
DE0000002827,F00004011,21-05-2025 12:31,MX,CR02,0,deicing
DE0000002828,F00004011,05/21/2025 11:43,CREW,ATC7,-21,
DE0000002829,F00004011,21-05-2025 13:58,AIRPORT,ATC7,16,maintenance check
DE0000002830,F00004018,27-04-2025 16:57,CREW,WX01,8,ground stop
DE0000002831,F00004021,08-02-2024 15:02,airport,ATC7,0,ground stop
DE0000002832,F00004021,08-02-2024 15:11,MAINT,OPS9,1,ground stop
DE0000002833,F00004021,02-08-2024 16:19,ATC,CR02,1,late inbound
DE0000002834,F00004027,10-08-2024 08:38,WX,OPS9,-20,
DE0000002835,F00004028,16-09-2024 04:50,crew,CR02,15,late inbound
DE0000002836,F00004031,04-12-2025 19:23,atc,MX5,1,crew swap
DE0000002837,F00004031,04-12-2025 19:19,WX,,1,ground stop
DE0000002838,F00004031,12-04-2025 17:34,WEATHER,,2m,ground stop
DE0000002839,F00004035,21-01-2025 18:47,WEATHER,OPS9,12,late inbound
DE0000002840,F00004035,21-01-2025 18:14,WEATHER,GT3,9,gate hold
DE0000002841,F00004035,21-01-2025 18:01,CREW,ATC7,22,ground stop
DE0000002842,F00004039,05-08-2025 02:43,weather,GT3,1,crew swap
DE0000002843,F00004041,15-10-2024 14:37,MX,OPS9,43,maintenance check
DE0000002844,F00004041,2024-10-15T13:39:00,crew,OPS9,33,deicing
DE0000002845,F00004043,01-09-2025 01:08,other,MX5,6,crew swap
DE0000002846,F00004044,05-05-2025 01:46,CREW,,2,deicing
DE0000002847,F00004044,05-05-2025 03:25,atc,GT3,40,ground stop
DE0000002848,F00004045,10/21/2024 06:20,atc,ATC7,5,gate hold
DE0000002849,F00004045,10/21/2024 07:27,WX,WX01,-4,
DE0000002850,F00004045,21-10-2024 05:13,AIRPORT,MX5,1,gate hold
DE0000002851,F00004046,2024-03-21T23:46:00,crew,,1,ground stop
DE0000002852,F00004046,22-03-2024 01:49,AIRPORT,OPS9,19,maintenance check
DE0000002853,F00004048,17-04-2025 10:29,crew,GT3,19,deicing
DE0000002854,F00004048,17-04-2025 11:17,crew,CR02,11,
DE0000002855,F00004049,24-04-2025 05:53,maint,WX01,11,maintenance check
DE0000002856,F00004053,22-04-2025 06:42,OPS,OPS9,53,crew swap
DE0000002857,F00004055,14-03-2024 23:29,atc,GT3,7,maintenance check
DE0000002858,F00004056,29-03-2024 00:45,OPS,CR02,7,gate hold
DE0000002859,F00004056,03/29/2024 03:40,crew,ATC7,2,maintenance check
DE0000002860,F00004056,2024-03-29T02:51:00,ATC,OPS9,1,ground stop
DE0000002861,F00004058,21-02-2025 17:48,other,WX01,14m,crew swap
DE0000002862,F00004058,02/21/2025 19:40,OTHER,,3,late inbound
DE0000002863,F00004058,21-02-2025 20:32,weather,MX5,1,maintenance check
DE0000002864,F00004065,11/13/2024 01:47,other,ATC7,8,ground stop
DE0000002865,F00004072,07-04-2025 20:21,CREW,ATC7,7,
DE0000002866,F00004072,07-04-2025 21:34,CRW,OPS9,5,deicing
DE0000002867,F00004072,07-04-2025 20:49,AIRPORT,CR02,1,deicing
DE0000002868,F00004078,25-02-2024 05:37,OTHER,CR02,10,late inbound
DE0000002869,F00004078,25-02-2024 05:10,CRW,GT3,2,late inbound
DE0000002870,F00004083,11-04-2025 11:58,WEATHER,OPS9,1m,
DE0000002871,F00004083,2025-04-11T11:23:00,airport,MX5,1,gate hold
DE0000002872,F00004083,04-11-2025 11:52,WX,OPS9,1,late inbound
DE0000002873,F00004086,2025-08-19T07:50:00,TRAFFIC,,-49,gate hold
DE0000002874,F00004086,19-08-2025 08:38,MX,WX01,8,
DE0000002875,F00004089,2025-06-29T20:08:00,crew,GT3,7,
DE0000002876,F00004089,29-06-2025 20:13,CREW,CR02,11,deicing
DE0000002877,F00004093,08-09-2024 12:41,AIRPORT,,1,
DE0000002878,F00004093,08-09-2024 13:48,CRW,GT3,1,late inbound
DE0000002879,F00004101,03-08-2025 02:09,GATE,OPS9,1,ground stop
DE0000002880,F00004103,31-03-2025 04:54,CREW,OPS9,-2,maintenance check
DE0000002881,F00004103,2025-03-31T03:14:00,ATC,GT3,1,maintenance check
DE0000002882,F00004103,31-03-2025 03:29,other,WX01,2,ground stop
DE0000002883,F00004107,15-10-2025 10:41,TRAFFIC,MX5,1,deicing
DE0000002884,F00004111,20-04-2024 15:34,weather,WX01,9,gate hold
DE0000002885,F00004113,09-11-2024 10:51,OTHER,GT3,8,
DE0000002886,F00004113,09-11-2024 11:11,AIRPORT,CR02,16,gate hold
DE0000002887,F00004113,09-11-2024 11:47,MX,,1,deicing
DE0000002888,F00004115,08/30/2024 01:50,CRW,CR02,36,deicing
DE0000002889,F00004118,03/20/2024 21:39,WX,WX01,79,maintenance check
DE0000002890,F00004124,09-08-2025 00:39,airport,WX01,41,gate hold
DE0000002891,F00004124,08-09-2025 00:17,OTHER,,47m,ground stop
DE0000002892,F00004125,07-10-2024 22:34,GATE,MX5,7,gate hold
DE0000002893,F00004126,30-12-2025 01:57,OTHER,GT3,2,maintenance check
DE0000002894,F00004126,30-12-2025 01:25,OTHER,ATC7,1,ground stop
DE0000002895,F00004126,30-12-2025 03:10,AIRPORT,OPS9,18,ground stop
DE0000002896,F00004130,17-09-2024 13:36,GATE,ATC7,5,maintenance check
DE0000002897,F00004130,17-09-2024 14:08,weather,CR02,-23,crew swap
DE0000002898,F00004131,19-05-2024 02:57,OPS,,0,late inbound
DE0000002899,F00004131,19-05-2024 02:46,maint,GT3,1,
DE0000002900,F00004139,24-11-2024 06:35,GATE,MX5,0,deicing
DE0000002901,F00004139,24-11-2024 06:25,AIRPORT,CR02,1,
DE0000002902,F00004141,08-07-2025 15:26,AIRPORT,OPS9,10,deicing
DE0000002903,F00004144,10/14/2025 00:06,AIRPORT,,5,
DE0000002904,F00004146,09-12-2024 16:05,crew,OPS9,2,crew swap
DE0000002905,F00004146,12-09-2024 18:29,crew,MX5,1,gate hold
DE0000002906,F00004146,12-09-2024 17:30,GATE,CR02,1m,ground stop
DE0000002907,F00004151,11-08-2024 07:10,maint,GT3,4,gate hold
DE0000002908,F00004152,08-06-2024 00:17,atc,,0,
DE0000002909,F00004152,08-06-2024 01:47,airport,GT3,36,maintenance check
DE0000002910,F00004152,08-06-2024 01:04,OTHER,CR02,12,
DE0000002911,F00004154,2024-12-24T11:48:00,other,GT3,4,gate hold
DE0000002912,F00004154,24-12-2024 13:09,ATC,GT3,5,gate hold
DE0000002913,F00004158,03-10-2024 21:01,TRAFFIC,GT3,27m,ground stop
DE0000002914,F00004159,16-08-2024 15:56,MX,GT3,10,
DE0000002915,F00004162,12-09-2024 16:36,AIRPORT,OPS9,23m,crew swap
DE0000002916,F00004165,28-04-2024 23:35,CREW,CR02,18,deicing
DE0000002917,F00004165,29-04-2024 01:06,other,ATC7,6,maintenance check
DE0000002918,F00004165,28-04-2024 23:40,GATE,OPS9,25,late inbound
DE0000002919,F00004168,09/19/2024 23:00,other,,62,deicing
DE0000002920,F00004168,20-09-2024 00:47,MX,GT3,8,crew swap
DE0000002921,F00004169,07-04-2024 10:50,ATC,MX5,16,
DE0000002922,F00004169,07-04-2024 10:22,GATE,CR02,-1,late inbound
DE0000002923,F00004170,09-04-2025 03:21,AIRPORT,WX01,2,crew swap
DE0000002924,F00004170,09-04-2025 02:58,atc,CR02,1,deicing
DE0000002925,F00004171,12-08-2024 08:09,WEATHER,ATC7,31,crew swap
DE0000002926,F00004173,04-08-2024 10:00,CREW,GT3,3,maintenance check
DE0000002927,F00004173,08-04-2024 08:59,ATC,OPS9,1,gate hold
DE0000002928,F00004173,08-04-2024 08:01,CREW,MX5,6,late inbound
DE0000002929,F00004175,2024-08-21T23:46:00,OPS,OPS9,30,maintenance check
DE0000002930,F00004179,01-12-2025 11:43,other,WX01,16,maintenance check
DE0000002931,F00004180,28-01-2025 21:27,GATE,CR02,7,late inbound
DE0000002932,F00004182,12-12-2025 23:06,atc,CR02,1,maintenance check
DE0000002933,F00004190,12-02-2025 03:38,GATE,GT3,22,ground stop
DE0000002934,F00004190,02-12-2025 04:11,other,,6,crew swap
DE0000002935,F00004190,02-12-2025 05:05,CREW,WX01,2,deicing
DE0000002936,F00004196,15-10-2025 23:29,other,ATC7,21m,
DE0000002937,F00004200,2024-05-21T07:31:00,CRW,WX01,0,
DE0000002938,F00004200,05/21/2024 07:40,maint,WX01,8,late inbound
DE0000002939,F00004200,21-05-2024 07:16,GATE,GT3,10m,ground stop
DE0000002940,F00004208,06/18/2024 00:07,atc,CR02,0,crew swap
DE0000002941,F00004208,18-06-2024 01:17,AIRPORT,MX5,1,maintenance check
DE0000002942,F00004208,2024-06-18T02:51:00,CRW,OPS9,1,late inbound
DE0000002943,F00004209,13-01-2025 11:32,TRAFFIC,ATC7,28,late inbound
DE0000002944,F00004211,20-03-2025 21:09,CRW,MX5,1,maintenance check
DE0000002945,F00004211,20-03-2025 21:08,CREW,CR02,9,gate hold
DE0000002946,F00004222,05-02-2025 01:27,CRW,CR02,6,
DE0000002947,F00004222,05-02-2025 00:11,OPS,GT3,1,
DE0000002948,F00004222,2025-02-05T01:28:00,atc,,1,late inbound
DE0000002949,F00004225,2025-07-24T09:19:00,CREW,,26,ground stop
DE0000002950,F00004226,12-05-2024 18:10,MAINT,CR02,-3,
DE0000002951,F00004226,2024-05-12T16:42:00,CREW,ATC7,1,
DE0000002952,F00004226,12-05-2024 18:56,OTHER,WX01,5,maintenance check
DE0000002953,F00004231,06/17/2024 20:26,MX,WX01,26,late inbound
DE0000002954,F00004231,17-06-2024 18:17,CREW,,2m,deicing
DE0000002955,F00004231,17-06-2024 19:25,WEATHER,CR02,1,maintenance check
DE0000002956,F00004233,06-07-2024 20:06,weather,ATC7,4,ground stop
DE0000002957,F00004233,06-07-2024 21:53,atc,WX01,12,deicing
DE0000002958,F00004233,06-07-2024 20:03,WX,MX5,27,crew swap
DE0000002959,F00004234,02/16/2025 08:34,TRAFFIC,ATC7,15,
DE0000002960,F00004234,16-02-2025 08:57,CREW,WX01,2,deicing
DE0000002961,F00004238,01-07-2024 03:09,crew,CR02,30,ground stop
DE0000002962,F00004240,06-12-2025 15:43,AIRPORT,,3,maintenance check
DE0000002963,F00004240,12-06-2025 16:12,other,ATC7,6m,late inbound
DE0000002964,F00004241,19-07-2024 14:05,atc,GT3,1,gate hold
DE0000002965,F00004241,19-07-2024 14:53,other,CR02,24,late inbound
DE0000002966,F00004241,19-07-2024 13:59,MAINT,,4,
DE0000002967,F00004243,18-03-2024 03:51,GATE,GT3,7,crew swap
DE0000002968,F00004244,24-11-2024 18:34,ATC,WX01,14,ground stop
DE0000002969,F00004246,02-05-2025 04:54,ATC,ATC7,0,ground stop
DE0000002970,F00004246,02-05-2025 05:09,WX,WX01,2,deicing
DE0000002971,F00004246,02-05-2025 03:51,GATE,ATC7,1,ground stop
DE0000002972,F00004250,21-06-2025 11:55,crew,WX01,5,late inbound
DE0000002973,F00004250,21-06-2025 11:33,airport,WX01,1,
DE0000002974,F00004251,22-06-2024 13:18,OPS,GT3,4,deicing
DE0000002975,F00004251,22-06-2024 12:36,other,OPS9,19,deicing
DE0000002976,F00004251,22-06-2024 12:59,AIRPORT,GT3,1,deicing
DE0000002977,F00004252,21-10-2024 17:54,maint,WX01,38,maintenance check
DE0000002978,F00004253,18-10-2024 07:04,ATC,WX01,1,crew swap
DE0000002979,F00004253,10/18/2024 07:28,airport,MX5,1,late inbound
DE0000002980,F00004253,18-10-2024 05:37,GATE,,3,crew swap
DE0000002981,F00004258,02-07-2024 07:05,TRAFFIC,CR02,2,deicing
DE0000002982,F00004258,2024-07-02T09:00:00,TRAFFIC,GT3,1,ground stop
DE0000002983,F00004258,02-07-2024 08:26,crew,CR02,11,late inbound
DE0000002984,F00004262,08-11-2024 02:35,WEATHER,,9,maintenance check
DE0000002985,F00004262,11-08-2024 03:13,crew,OPS9,6,deicing
DE0000002986,F00004265,09/19/2025 06:34,airport,,7,gate hold
DE0000002987,F00004265,09/19/2025 06:44,MX,OPS9,5,maintenance check
DE0000002988,F00004265,19-09-2025 08:24,maint,GT3,18,maintenance check
DE0000002989,F00004267,05/27/2025 04:17,CREW,ATC7,1,deicing
DE0000002990,F00004269,06-09-2025 03:59,GATE,CR02,18,crew swap
DE0000002991,F00004269,06-09-2025 03:20,TRAFFIC,MX5,10,gate hold
DE0000002992,F00004270,29-09-2024 16:35,WX,GT3,9,deicing
DE0000002993,F00004270,09/29/2024 18:56,AIRPORT,,39,late inbound
DE0000002994,F00004279,01-06-2026 01:02,AIRPORT,GT3,36,crew swap
DE0000002995,F00004282,04/27/2025 22:00,AIRPORT,GT3,0,maintenance check
DE0000002996,F00004282,27-04-2025 22:26,MX,WX01,1,
DE0000002997,F00004282,27-04-2025 21:09,CREW,MX5,3,crew swap
DE0000002998,F00004283,11/24/2025 22:23,AIRPORT,OPS9,10,maintenance check
DE0000002999,F00004284,11/20/2024 18:13,WX,ATC7,35,late inbound
DE0000003000,F00004286,18-10-2024 21:06,airport,,1,gate hold
DE0000003001,F00004286,18-10-2024 19:27,MAINT,CR02,2,maintenance check
DE0000003002,F00004286,18-10-2024 22:04,TRAFFIC,ATC7,-17,maintenance check
DE0000003003,F00004288,06-03-2025 07:54,GATE,,9,deicing
DE0000003004,F00004292,11/28/2024 01:05,CRW,GT3,16,crew swap
DE0000003005,F00004292,28-11-2024 00:01,AIRPORT,OPS9,4,gate hold
DE0000003006,F00004292,28-11-2024 00:03,ATC,CR02,9,
DE0000003007,F00004294,20-12-2025 17:47,GATE,CR02,1,late inbound
DE0000003008,F00004294,20-12-2025 17:49,maint,CR02,4,late inbound
DE0000003009,F00004295,16-04-2024 22:58,maint,ATC7,7,gate hold
DE0000003010,F00004299,04-11-2025 05:50,CRW,MX5,6,gate hold
DE0000003011,F00004299,11-04-2025 07:55,AIRPORT,MX5,18m,maintenance check
DE0000003012,F00004299,04-11-2025 08:02,TRAFFIC,MX5,59,maintenance check
DE0000003013,F00004301,15-07-2025 04:11,airport,,2,maintenance check
DE0000003014,F00004301,15-07-2025 05:25,AIRPORT,WX01,3,ground stop
DE0000003015,F00004306,05-04-2025 23:18,OPS,ATC7,1,gate hold
DE0000003016,F00004306,05-04-2025 23:35,TRAFFIC,GT3,40m,maintenance check
DE0000003017,F00004308,03-12-2025 14:02,OPS,,17m,ground stop
DE0000003018,F00004308,03-12-2025 12:21,AIRPORT,CR02,9,gate hold
DE0000003019,F00004310,14-10-2025 04:19,MX,MX5,12,late inbound
DE0000003020,F00004310,14-10-2025 06:18,airport,ATC7,4,gate hold
DE0000003021,F00004310,2025-10-14T04:08:00,MX,WX01,4,deicing
DE0000003022,F00004311,21-01-2026 20:41,MX,OPS9,0,
DE0000003023,F00004311,01/21/2026 20:03,other,WX01,1,deicing
DE0000003024,F00004312,16-10-2024 03:19,airport,GT3,18,maintenance check
DE0000003025,F00004312,16-10-2024 01:10,other,OPS9,22,maintenance check
DE0000003026,F00004313,19-07-2025 07:28,WEATHER,GT3,8,crew swap
DE0000003027,F00004313,19-07-2025 08:23,CREW,,6,deicing
DE0000003028,F00004313,19-07-2025 09:00,TRAFFIC,WX01,25,maintenance check
DE0000003029,F00004314,03-04-2025 22:53,GATE,,10m,crew swap
DE0000003030,F00004316,21-08-2024 20:47,CRW,GT3,16,gate hold
DE0000003031,F00004317,2025-04-28T10:06:00,WEATHER,ATC7,13,ground stop
DE0000003032,F00004317,28-04-2025 08:34,other,ATC7,-6,crew swap
DE0000003033,F00004317,28-04-2025 08:56,OPS,ATC7,11,ground stop
DE0000003034,F00004320,14-08-2024 18:57,WX,WX01,12,deicing
DE0000003035,F00004321,18-09-2025 07:56,MAINT,CR02,0,gate hold
DE0000003036,F00004321,18-09-2025 06:35,WEATHER,CR02,4,late inbound
DE0000003037,F00004321,18-09-2025 07:37,ATC,CR02,1,crew swap
DE0000003038,F00004323,26-08-2025 23:07,TRAFFIC,MX5,13,crew swap
DE0000003039,F00004323,26-08-2025 22:42,ATC,WX01,6,ground stop
DE0000003040,F00004323,26-08-2025 22:20,OTHER,OPS9,-1,maintenance check
DE0000003041,F00004324,02-09-2024 07:34,atc,GT3,4,deicing
DE0000003042,F00004324,02-09-2024 09:32,MAINT,CR02,1,
DE0000003043,F00004324,02-09-2024 07:11,MX,OPS9,25,
DE0000003044,F00004326,11/15/2025 09:02,MAINT,WX01,24,late inbound
DE0000003045,F00004326,11/15/2025 07:01,MX,OPS9,1,late inbound
DE0000003046,F00004329,13-11-2024 10:33,WEATHER,,1,ground stop
DE0000003047,F00004329,13-11-2024 10:28,MAINT,MX5,2,maintenance check
DE0000003048,F00004329,13-11-2024 10:09,weather,,3,maintenance check
DE0000003049,F00004330,07/21/2025 09:23,CRW,MX5,12,crew swap
DE0000003050,F00004334,2026-01-25T23:13:00,OPS,ATC7,3m,
DE0000003051,F00004334,25-01-2026 21:58,WX,OPS9,11,crew swap
DE0000003052,F00004334,25-01-2026 23:27,MX,WX01,7,late inbound
DE0000003053,F00004342,08-07-2025 19:46,WX,GT3,11m,deicing
DE0000003054,F00004342,08-07-2025 20:53,ATC,CR02,17m,ground stop
DE0000003055,F00004343,08-07-2025 04:21,MAINT,MX5,6,crew swap
DE0000003056,F00004343,2025-07-08T03:07:00,OPS,MX5,1,ground stop
DE0000003057,F00004346,18-11-2024 19:26,crew,MX5,5,gate hold
DE0000003058,F00004346,11/18/2024 20:22,OTHER,OPS9,2,late inbound
DE0000003059,F00004349,11-03-2025 13:38,WX,OPS9,8,ground stop
DE0000003060,F00004349,11-03-2025 15:39,MX,MX5,16,gate hold
DE0000003061,F00004350,2024-08-01T00:58:00,GATE,GT3,8,
DE0000003062,F00004351,24-01-2026 12:47,MAINT,WX01,6,
DE0000003063,F00004352,25-01-2026 07:52,ATC,WX01,26,late inbound
DE0000003064,F00004352,25-01-2026 07:51,weather,CR02,3,crew swap
DE0000003065,F00004352,25-01-2026 08:54,OPS,CR02,1,deicing
DE0000003066,F00004357,16-08-2024 19:53,OPS,,0,deicing
DE0000003067,F00004357,2024-08-16T20:36:00,atc,MX5,1m,gate hold
DE0000003068,F00004362,08/19/2025 19:20,AIRPORT,WX01,26,crew swap
DE0000003069,F00004362,19-08-2025 18:58,airport,WX01,3,crew swap
DE0000003070,F00004362,19-08-2025 18:09,WX,WX01,30,
DE0000003071,F00004365,07-02-2025 10:37,maint,WX01,3,crew swap
DE0000003072,F00004368,27-12-2025 09:23,crew,WX01,0,ground stop
DE0000003073,F00004368,27-12-2025 11:07,airport,ATC7,1,late inbound
DE0000003074,F00004368,27-12-2025 10:53,MAINT,,11m,late inbound
DE0000003075,F00004374,05/20/2024 09:26,GATE,WX01,6,late inbound
DE0000003076,F00004374,20-05-2024 10:00,WEATHER,ATC7,11,maintenance check
DE0000003077,F00004374,05/20/2024 09:34,MAINT,,10,ground stop
DE0000003078,F00004375,14-08-2025 15:58,maint,OPS9,15,
DE0000003079,F00004375,08/14/2025 15:15,OPS,CR02,16,ground stop
DE0000003080,F00004377,09-08-2024 21:02,OPS,GT3,3,late inbound
DE0000003081,F00004377,09-08-2024 20:42,ATC,OPS9,2,ground stop
DE0000003082,F00004377,08-09-2024 19:42,OTHER,ATC7,-1,crew swap
DE0000003083,F00004378,31-03-2025 11:08,maint,MX5,8,late inbound
DE0000003084,F00004378,03/31/2025 10:46,other,GT3,-13,ground stop
DE0000003085,F00004378,31-03-2025 10:24,atc,,5,ground stop
DE0000003086,F00004380,29-05-2024 22:13,MAINT,GT3,2,
DE0000003087,F00004380,2024-05-29T20:06:00,MAINT,WX01,2,gate hold
DE0000003088,F00004381,24-03-2024 08:04,TRAFFIC,OPS9,5,maintenance check
DE0000003089,F00004381,24-03-2024 05:59,weather,MX5,1,late inbound
DE0000003090,F00004381,2024-03-24T06:30:00,TRAFFIC,,6,maintenance check
DE0000003091,F00004387,09-07-2024 07:50,atc,MX5,24,gate hold
DE0000003092,F00004387,09-07-2024 05:55,ATC,,19,deicing
DE0000003093,F00004388,30-05-2024 02:56,OTHER,GT3,8m,late inbound
DE0000003094,F00004388,05/30/2024 02:55,MAINT,MX5,7,gate hold
DE0000003095,F00004388,2024-05-30T00:50:00,CREW,,9,
DE0000003096,F00004389,14-07-2024 14:01,AIRPORT,GT3,30,ground stop
DE0000003097,F00004389,14-07-2024 13:55,WX,WX01,1,late inbound
DE0000003098,F00004389,14-07-2024 14:08,airport,CR02,1,gate hold
DE0000003099,F00004391,09/25/2025 02:46,weather,,3,ground stop
DE0000003100,F00004391,09/25/2025 03:08,ATC,OPS9,7,crew swap
DE0000003101,F00004391,25-09-2025 04:53,CRW,GT3,17,
DE0000003102,F00004399,08/31/2025 03:27,MX,CR02,0m,deicing
DE0000003103,F00004399,31-08-2025 02:55,TRAFFIC,WX01,6,deicing
DE0000003104,F00004399,31-08-2025 01:44,maint,ATC7,1,ground stop
DE0000003105,F00004400,10/15/2024 05:36,CRW,ATC7,-2,deicing
DE0000003106,F00004400,2024-10-15T04:35:00,weather,CR02,1,gate hold
DE0000003107,F00004400,15-10-2024 04:22,airport,OPS9,3,maintenance check
DE0000003108,F00004402,21-01-2025 03:32,crew,MX5,4,maintenance check
DE0000003109,F00004402,21-01-2025 02:55,ATC,CR02,13,maintenance check
DE0000003110,F00004403,09/19/2024 05:23,WEATHER,GT3,192,ground stop
DE0000003111,F00004405,27-01-2025 09:48,MAINT,GT3,44,late inbound
DE0000003112,F00004405,27-01-2025 09:23,WX,,7,deicing
DE0000003113,F00004406,01/28/2025 15:58,CRW,OPS9,23,maintenance check
DE0000003114,F00004408,10/18/2025 02:31,MAINT,ATC7,9,crew swap
DE0000003115,F00004408,18-10-2025 03:29,OPS,GT3,5,crew swap
DE0000003116,F00004410,07/20/2025 18:24,GATE,ATC7,1,late inbound
DE0000003117,F00004410,2025-07-20T17:23:00,ATC,WX01,2m,maintenance check
DE0000003118,F00004410,07/20/2025 16:37,ATC,OPS9,2,late inbound
DE0000003119,F00004417,22-07-2025 01:46,airport,,20,crew swap
DE0000003120,F00004417,22-07-2025 01:10,weather,OPS9,51,
DE0000003121,F00004418,11/20/2025 06:41,airport,OPS9,-52,gate hold
DE0000003122,F00004418,2025-11-20T08:37:00,CRW,OPS9,27,
DE0000003123,F00004418,20-11-2025 05:55,OPS,OPS9,53,
DE0000003124,F00004419,07-09-2025 09:17,WX,CR02,0m,maintenance check
DE0000003125,F00004419,07-09-2025 08:03,GATE,OPS9,-16,maintenance check
DE0000003126,F00004419,07-09-2025 08:41,TRAFFIC,MX5,1,crew swap
DE0000003127,F00004422,13-07-2024 02:50,MX,,20,
DE0000003128,F00004422,07/13/2024 00:55,crew,WX01,1,crew swap
DE0000003129,F00004426,14-02-2024 21:33,airport,WX01,3,ground stop
DE0000003130,F00004426,14-02-2024 20:49,GATE,CR02,17,late inbound
DE0000003131,F00004427,09-11-2024 00:04,GATE,MX5,16,late inbound
DE0000003132,F00004427,2024-11-09T01:07:00,OTHER,CR02,12,crew swap
DE0000003133,F00004431,29-08-2025 05:30,OTHER,OPS9,6,gate hold
DE0000003134,F00004431,29-08-2025 03:37,CRW,OPS9,12,deicing
DE0000003135,F00004431,08/29/2025 03:05,airport,CR02,-5,maintenance check
DE0000003136,F00004435,01-07-2024 18:24,AIRPORT,MX5,2,
DE0000003137,F00004435,01-07-2024 17:34,WEATHER,GT3,1,
DE0000003138,F00004435,01-07-2024 18:44,ATC,WX01,3,
DE0000003139,F00004439,03-04-2025 08:28,MX,ATC7,0,maintenance check
DE0000003140,F00004439,04-03-2025 08:29,OPS,WX01,2,
DE0000003141,F00004439,04-03-2025 10:57,GATE,ATC7,3,late inbound
DE0000003142,F00004442,02-05-2024 02:33,ATC,OPS9,1,ground stop
DE0000003143,F00004442,02-05-2024 03:28,MX,OPS9,22,crew swap
DE0000003144,F00004442,2024-05-02T01:41:00,other,CR02,1,late inbound
DE0000003145,F00004444,23-04-2025 05:18,maint,OPS9,11,gate hold
DE0000003146,F00004444,23-04-2025 04:41,CRW,WX01,11,
DE0000003147,F00004444,23-04-2025 05:10,atc,WX01,38,gate hold
DE0000003148,F00004452,30-05-2024 09:39,atc,OPS9,2,deicing
DE0000003149,F00004452,05/30/2024 09:54,CREW,WX01,4,deicing
DE0000003150,F00004458,06-02-2024 16:32,MAINT,OPS9,2,gate hold
DE0000003151,F00004458,06-02-2024 17:39,airport,WX01,2,gate hold
DE0000003152,F00004458,06-02-2024 17:55,MAINT,,4,crew swap
DE0000003153,F00004459,06-01-2026 00:45,CREW,ATC7,33,deicing
DE0000003154,F00004465,01/15/2026 01:37,crew,ATC7,1,ground stop
DE0000003155,F00004465,15-01-2026 00:25,airport,CR02,14,crew swap
DE0000003156,F00004465,15-01-2026 01:21,AIRPORT,WX01,6,crew swap
DE0000003157,F00004466,05-11-2024 10:28,CRW,,-3,late inbound
DE0000003158,F00004466,11-05-2024 12:41,GATE,MX5,1,crew swap
DE0000003159,F00004466,11-05-2024 11:33,MAINT,WX01,1,maintenance check
DE0000003160,F00004467,10/19/2025 15:48,MX,ATC7,0,late inbound
DE0000003161,F00004467,10/19/2025 16:33,ATC,,1,late inbound
DE0000003162,F00004467,19-10-2025 17:31,weather,MX5,1,late inbound
DE0000003163,F00004468,2024-06-08T01:40:00,TRAFFIC,WX01,28m,
DE0000003164,F00004469,18-04-2024 11:00,TRAFFIC,GT3,1,crew swap
DE0000003165,F00004472,04/20/2025 16:04,crew,ATC7,12,crew swap
DE0000003166,F00004472,20-04-2025 14:24,other,ATC7,-18,ground stop
DE0000003167,F00004473,06-06-2025 16:29,OTHER,OPS9,6,late inbound
DE0000003168,F00004475,22-05-2024 02:11,ATC,CR02,9,
DE0000003169,F00004475,22-05-2024 01:18,CREW,MX5,7,maintenance check
DE0000003170,F00004476,03-03-2024 22:52,OTHER,CR02,22,ground stop
DE0000003171,F00004478,11-06-2025 13:29,GATE,CR02,7,maintenance check
DE0000003172,F00004479,2024-12-29T07:58:00,weather,GT3,14,
DE0000003173,F00004479,29-12-2024 09:44,AIRPORT,OPS9,2,deicing
DE0000003174,F00004484,25-08-2025 10:42,WX,WX01,1,gate hold
DE0000003175,F00004487,21-11-2025 04:55,atc,,2,
DE0000003176,F00004487,21-11-2025 05:48,OTHER,ATC7,7,
DE0000003177,F00004489,30-12-2024 11:09,maint,ATC7,27,
DE0000003178,F00004489,30-12-2024 09:45,OPS,,1,deicing
DE0000003179,F00004497,19-11-2025 23:23,MAINT,MX5,11m,gate hold
DE0000003180,F00004497,19-11-2025 23:21,CRW,,-27,
DE0000003181,F00004499,12/13/2024 18:03,crew,WX01,21,deicing
DE0000003182,F00004499,13-12-2024 18:22,MX,WX01,1,late inbound
DE0000003183,F00004503,16-09-2024 01:54,ATC,GT3,3,late inbound
DE0000003184,F00004503,16-09-2024 03:40,AIRPORT,CR02,8,
DE0000003185,F00004503,16-09-2024 02:49,ATC,CR02,1,
DE0000003186,F00004504,23-12-2024 08:39,WEATHER,MX5,1,ground stop
DE0000003187,F00004504,12/23/2024 08:53,MX,WX01,32,gate hold
DE0000003188,F00004507,2025-08-12T19:23:00,ATC,CR02,6,gate hold
DE0000003189,F00004507,2025-08-12T19:57:00,CRW,,9,late inbound
DE0000003190,F00004509,15-10-2024 09:04,CREW,,50,late inbound
DE0000003191,F00004510,18-05-2024 02:54,MX,OPS9,16,ground stop
DE0000003192,F00004510,2024-05-18T02:20:00,OTHER,,14,maintenance check
DE0000003193,F00004510,18-05-2024 01:22,OPS,GT3,6,maintenance check
DE0000003194,F00004511,05-02-2024 23:17,MX,OPS9,10,late inbound
DE0000003195,F00004511,05-02-2024 22:48,MX,,4,late inbound
DE0000003196,F00004513,12-05-2025 18:22,TRAFFIC,WX01,32,
DE0000003197,F00004513,05-12-2025 18:47,ATC,GT3,8,gate hold
DE0000003198,F00004518,26-04-2025 11:18,ATC,OPS9,13,
DE0000003199,F00004518,26-04-2025 11:08,weather,,7,
DE0000003200,F00004520,09-01-2024 15:39,AIRPORT,OPS9,19,gate hold
DE0000003201,F00004527,2026-01-16T10:58:00,AIRPORT,,13,deicing
DE0000003202,F00004527,16-01-2026 10:46,atc,OPS9,7,
DE0000003203,F00004527,2026-01-16T11:21:00,AIRPORT,OPS9,8,late inbound
DE0000003204,F00004532,08-04-2025 22:02,CRW,GT3,0,late inbound
DE0000003205,F00004532,08-04-2025 21:44,WX,ATC7,-4,deicing
DE0000003206,F00004535,23-09-2024 17:53,maint,,22,gate hold
DE0000003207,F00004535,2024-09-23T18:08:00,other,GT3,1,late inbound
DE0000003208,F00004535,23-09-2024 17:13,ATC,OPS9,3,gate hold
DE0000003209,F00004540,09/24/2024 08:17,weather,OPS9,31,gate hold
DE0000003210,F00004541,2025-02-06T03:08:00,WX,MX5,10,deicing
DE0000003211,F00004541,06-02-2025 02:54,CREW,OPS9,-11,maintenance check
DE0000003212,F00004541,06-02-2025 03:05,OPS,OPS9,1,maintenance check
DE0000003213,F00004543,2025-06-01T04:42:00,MAINT,WX01,-3,late inbound
DE0000003214,F00004543,06-01-2025 04:31,airport,,-2,late inbound
DE0000003215,F00004548,29-07-2024 21:20,WX,GT3,10,gate hold
DE0000003216,F00004548,07/29/2024 22:12,MAINT,MX5,2m,gate hold
DE0000003217,F00004550,25-09-2025 07:15,crew,MX5,-31,gate hold
DE0000003218,F00004550,25-09-2025 08:13,OPS,MX5,1,late inbound
DE0000003219,F00004551,2025-01-29T11:20:00,WEATHER,,0,maintenance check
DE0000003220,F00004551,29-01-2025 11:09,WX,MX5,4,late inbound
DE0000003221,F00004556,16-10-2025 17:02,weather,ATC7,46,late inbound
DE0000003222,F00004557,25-10-2024 13:23,airport,ATC7,9,deicing
DE0000003223,F00004562,25-11-2024 02:35,AIRPORT,,10m,gate hold
DE0000003224,F00004563,04/26/2024 10:55,MX,,2,deicing
DE0000003225,F00004565,20-10-2025 19:33,ATC,,17,
DE0000003226,F00004565,20-10-2025 19:59,atc,ATC7,4,maintenance check
DE0000003227,F00004571,07-02-2024 08:56,MX,MX5,21,ground stop
DE0000003228,F00004573,30-08-2025 21:22,CRW,MX5,0,crew swap
DE0000003229,F00004573,30-08-2025 22:50,TRAFFIC,MX5,1,gate hold
DE0000003230,F00004574,12/20/2025 03:43,ATC,CR02,3,deicing
DE0000003231,F00004574,2025-12-20T05:37:00,ATC,,17,maintenance check
DE0000003232,F00004576,05/13/2025 12:25,CREW,WX01,48,crew swap
DE0000003233,F00004576,05/13/2025 14:03,airport,GT3,89,crew swap
DE0000003234,F00004581,16-06-2024 23:48,other,ATC7,11,ground stop
DE0000003235,F00004583,27-06-2024 21:10,weather,GT3,19,ground stop
DE0000003236,F00004584,2025-04-12T13:28:00,crew,MX5,2,gate hold
DE0000003237,F00004584,12-04-2025 13:45,WEATHER,CR02,8,maintenance check
DE0000003238,F00004584,12-04-2025 12:10,AIRPORT,WX01,2,
DE0000003239,F00004586,20-06-2024 23:39,OTHER,GT3,0,crew swap
DE0000003240,F00004586,06/21/2024 00:16,WEATHER,WX01,3,maintenance check
DE0000003241,F00004586,20-06-2024 22:05,other,GT3,3,ground stop
DE0000003242,F00004589,01-10-2024 19:39,other,GT3,3,ground stop
DE0000003243,F00004589,01-10-2024 22:36,WX,,6,late inbound
DE0000003244,F00004590,20-10-2025 20:14,ATC,MX5,25,late inbound
DE0000003245,F00004597,2024-07-05T02:02:00,other,CR02,7,deicing
DE0000003246,F00004597,05-07-2024 00:49,crew,ATC7,5,maintenance check
DE0000003247,F00004599,24-04-2024 21:04,CRW,WX01,5,ground stop
DE0000003248,F00004599,04/24/2024 19:36,GATE,WX01,12,
DE0000003249,F00004601,01-08-2025 14:08,MAINT,,60,crew swap
DE0000003250,F00004602,10-10-2024 17:07,crew,,24,maintenance check
DE0000003251,F00004602,10-10-2024 16:18,weather,OPS9,6,deicing
DE0000003252,F00004603,10-11-2024 17:23,OPS,,0,crew swap
DE0000003253,F00004603,11-10-2024 17:02,atc,OPS9,1m,ground stop
DE0000003254,F00004605,07-09-2025 17:29,CRW,CR02,2,
DE0000003255,F00004605,07-09-2025 17:23,crew,,8,gate hold
DE0000003256,F00004609,12-06-2024 03:42,TRAFFIC,OPS9,7,crew swap
DE0000003257,F00004609,06-12-2024 05:30,OPS,OPS9,5,
DE0000003258,F00004611,30-10-2025 06:32,airport,CR02,37,maintenance check
DE0000003259,F00004614,2024-11-18T01:47:00,MAINT,CR02,6,late inbound
DE0000003260,F00004614,18-11-2024 02:34,MAINT,WX01,6,
DE0000003261,F00004616,10-04-2025 14:42,TRAFFIC,,18,ground stop
DE0000003262,F00004616,10-04-2025 14:58,AIRPORT,,15,crew swap
DE0000003263,F00004617,30-01-2025 07:25,WEATHER,WX01,30,
DE0000003264,F00004618,04-05-2024 12:01,weather,MX5,10,crew swap
DE0000003265,F00004628,04-07-2025 03:38,ATC,MX5,-3,crew swap
DE0000003266,F00004628,07-04-2025 01:43,MX,MX5,7,maintenance check
DE0000003267,F00004628,07-04-2025 04:06,CREW,CR02,2,
DE0000003268,F00004630,12/20/2025 10:18,MAINT,ATC7,5,late inbound
DE0000003269,F00004630,20-12-2025 10:09,other,WX01,28,
DE0000003270,F00004633,08-05-2025 12:32,CREW,GT3,3,crew swap
DE0000003271,F00004633,08-05-2025 10:19,crew,MX5,2,crew swap
DE0000003272,F00004633,08-05-2025 10:21,crew,OPS9,1,maintenance check
DE0000003273,F00004634,09-01-2026 13:12,MAINT,GT3,7,maintenance check
DE0000003274,F00004634,09-01-2026 15:28,OTHER,,1,ground stop
DE0000003275,F00004636,18-06-2025 06:23,OTHER,MX5,9,crew swap
DE0000003276,F00004636,18-06-2025 05:01,TRAFFIC,OPS9,2,late inbound
DE0000003277,F00004636,18-06-2025 04:26,CREW,GT3,6,ground stop
DE0000003278,F00004638,06-08-2024 18:33,WX,OPS9,16,gate hold
DE0000003279,F00004638,06-08-2024 18:47,crew,OPS9,17,maintenance check
DE0000003280,F00004638,06-08-2024 16:50,maint,MX5,4,
DE0000003281,F00004639,04-04-2024 16:08,OTHER,ATC7,76,crew swap
DE0000003282,F00004640,03-10-2024 16:58,MX,CR02,7m,crew swap
DE0000003283,F00004641,24-03-2024 00:32,MAINT,OPS9,23,maintenance check
DE0000003284,F00004641,24-03-2024 02:37,GATE,,21,deicing
DE0000003285,F00004643,17-06-2024 14:47,CRW,,2,
DE0000003286,F00004643,17-06-2024 15:06,OPS,OPS9,6,maintenance check
DE0000003287,F00004647,06/14/2025 23:14,OTHER,,22,late inbound
DE0000003288,F00004647,14-06-2025 23:37,WEATHER,WX01,2,
DE0000003289,F00004647,15-06-2025 00:20,WX,CR02,6,
DE0000003290,F00004653,14-05-2024 21:27,MX,,20,
DE0000003291,F00004653,14-05-2024 21:35,MAINT,ATC7,46,crew swap
DE0000003292,F00004653,14-05-2024 21:39,OTHER,CR02,17,maintenance check
DE0000003293,F00004657,2025-05-25T10:16:00,MAINT,MX5,29,deicing
DE0000003294,F00004657,25-05-2025 10:17,MX,WX01,282,deicing
DE0000003295,F00004663,2025-09-13T08:26:00,WEATHER,CR02,0,
DE0000003296,F00004663,13-09-2025 08:06,WEATHER,WX01,22,ground stop
DE0000003297,F00004663,13-09-2025 07:47,OTHER,ATC7,2,ground stop
DE0000003298,F00004664,06/22/2025 03:00,AIRPORT,WX01,3,late inbound
DE0000003299,F00004664,22-06-2025 02:41,airport,ATC7,4,late inbound
DE0000003300,F00004664,22-06-2025 01:36,MX,OPS9,1,maintenance check
DE0000003301,F00004668,23-09-2024 13:52,atc,GT3,25m,deicing
DE0000003302,F00004668,23-09-2024 13:55,MX,MX5,6,gate hold
DE0000003303,F00004670,10-06-2024 08:03,GATE,WX01,-1,crew swap
DE0000003304,F00004670,2024-06-10T05:17:00,TRAFFIC,ATC7,1,deicing
DE0000003305,F00004670,10-06-2024 07:13,maint,GT3,-3,crew swap
DE0000003306,F00004671,28-07-2025 02:17,weather,WX01,-14,ground stop
DE0000003307,F00004671,28-07-2025 02:29,maint,,5,
DE0000003308,F00004671,28-07-2025 01:25,MAINT,OPS9,9,gate hold
DE0000003309,F00004673,18-04-2025 13:41,other,CR02,55,
DE0000003310,F00004673,2025-04-18T14:34:00,WEATHER,GT3,100,ground stop
DE0000003311,F00004674,06-06-2025 13:21,CRW,MX5,30,maintenance check
DE0000003312,F00004677,2024-02-06T15:28:00,crew,WX01,-15,gate hold
DE0000003313,F00004677,06-02-2024 14:33,MX,CR02,14,ground stop
DE0000003314,F00004678,27-05-2025 13:41,CRW,MX5,10,late inbound
DE0000003315,F00004680,22-11-2025 15:00,OPS,,2,deicing
DE0000003316,F00004680,11/22/2025 14:28,OTHER,GT3,3,ground stop
DE0000003317,F00004680,22-11-2025 12:21,WEATHER,ATC7,1,
DE0000003318,F00004683,08-06-2025 08:52,WX,MX5,-2,crew swap
DE0000003319,F00004683,2025-06-08T09:27:00,AIRPORT,OPS9,8,
DE0000003320,F00004683,08-06-2025 09:28,OTHER,CR02,1,maintenance check
DE0000003321,F00004687,03/15/2024 05:07,AIRPORT,WX01,0,ground stop
DE0000003322,F00004687,15-03-2024 07:06,airport,,27,
DE0000003323,F00004687,03/15/2024 04:43,MAINT,GT3,2,late inbound
DE0000003324,F00004688,19-03-2024 21:31,CRW,GT3,5,ground stop
DE0000003325,F00004688,19-03-2024 19:29,CREW,CR02,2,ground stop
DE0000003326,F00004688,19-03-2024 21:38,ATC,,16,gate hold
DE0000003327,F00004689,2024-06-23T16:30:00,other,ATC7,16,deicing
DE0000003328,F00004689,23-06-2024 15:14,WEATHER,WX01,2,late inbound
DE0000003329,F00004690,06-01-2025 02:50,other,,8,ground stop
DE0000003330,F00004690,06-01-2025 01:02,TRAFFIC,ATC7,-17,crew swap
DE0000003331,F00004690,01-06-2025 01:19,GATE,ATC7,1,gate hold
DE0000003332,F00004691,2024-08-21T21:48:00,MAINT,OPS9,-8,
DE0000003333,F00004691,21-08-2024 22:54,WX,WX01,60,ground stop
DE0000003334,F00004691,21-08-2024 23:53,airport,CR02,8,late inbound
DE0000003335,F00004693,2026-01-15T10:04:00,GATE,MX5,8,ground stop
DE0000003336,F00004694,12-02-2025 23:42,GATE,MX5,8m,maintenance check
DE0000003337,F00004699,30-07-2024 23:03,airport,,10,ground stop
DE0000003338,F00004699,07/30/2024 22:48,MX,WX01,23,deicing
DE0000003339,F00004702,09-11-2024 01:54,TRAFFIC,CR02,24,crew swap
DE0000003340,F00004704,17-11-2024 00:54,CRW,GT3,52,deicing
DE0000003341,F00004705,08-09-2025 08:02,MX,GT3,1,late inbound
DE0000003342,F00004705,08-09-2025 06:27,CREW,MX5,1,deicing
DE0000003343,F00004711,2025-07-02T04:35:00,MX,,11,late inbound
DE0000003344,F00004712,12-04-2024 00:31,AIRPORT,,1m,crew swap
DE0000003345,F00004712,11-04-2024 23:58,AIRPORT,CR02,2,maintenance check
DE0000003346,F00004712,11-04-2024 22:49,atc,WX01,1,deicing
DE0000003347,F00004713,24-07-2024 10:15,weather,,18m,
DE0000003348,F00004713,24-07-2024 09:40,airport,GT3,-8,crew swap
DE0000003349,F00004713,24-07-2024 10:55,GATE,WX01,13,crew swap
DE0000003350,F00004715,06-07-2024 11:20,ATC,WX01,12,deicing
DE0000003351,F00004715,06-07-2024 12:03,airport,CR02,1,late inbound
DE0000003352,F00004715,06-07-2024 11:59,MX,GT3,8,deicing
DE0000003353,F00004717,01-12-2025 17:15,OPS,MX5,7,deicing
DE0000003354,F00004717,01-12-2025 17:58,other,WX01,1m,gate hold
DE0000003355,F00004717,12-01-2025 18:57,CREW,,16,
DE0000003356,F00004719,2025-06-29T16:23:00,TRAFFIC,GT3,5,ground stop
DE0000003357,F00004719,29-06-2025 16:32,weather,ATC7,7,deicing
DE0000003358,F00004719,29-06-2025 18:03,OTHER,WX01,1,maintenance check
DE0000003359,F00004731,06-08-2024 18:24,other,GT3,17,maintenance check
DE0000003360,F00004734,27-09-2025 18:53,WX,,-6,maintenance check
DE0000003361,F00004738,04-05-2025 17:23,CRW,OPS9,25,gate hold
DE0000003362,F00004741,2025-06-08T15:12:00,AIRPORT,OPS9,-1,
DE0000003363,F00004741,08-06-2025 16:41,weather,MX5,1,deicing
DE0000003364,F00004741,08-06-2025 15:55,ATC,MX5,1,deicing
DE0000003365,F00004750,2025-04-21T05:11:00,OPS,CR02,-4,ground stop
DE0000003366,F00004753,12-04-2025 05:05,weather,,20,deicing
DE0000003367,F00004753,04-12-2025 03:42,crew,OPS9,10,deicing
DE0000003368,F00004755,21-06-2025 21:31,atc,ATC7,18,ground stop
DE0000003369,F00004755,21-06-2025 20:40,maint,,33,gate hold
DE0000003370,F00004756,08-12-2025 04:28,AIRPORT,ATC7,0,ground stop
DE0000003371,F00004756,08-12-2025 04:14,MX,MX5,1,crew swap
DE0000003372,F00004756,08-12-2025 04:23,crew,ATC7,1,ground stop
DE0000003373,F00004759,07-10-2024 05:16,WX,WX01,18,
DE0000003374,F00004759,07-10-2024 03:05,TRAFFIC,ATC7,9,
DE0000003375,F00004759,07-10-2024 04:42,MX,MX5,3,deicing
DE0000003376,F00004761,01-07-2024 21:27,atc,,19,deicing
DE0000003377,F00004762,05-07-2024 05:51,atc,CR02,11,maintenance check
DE0000003378,F00004771,20-08-2024 02:17,AIRPORT,,15,late inbound
DE0000003379,F00004771,2024-08-20T02:35:00,WEATHER,MX5,9,maintenance check
DE0000003380,F00004775,2025-05-29T16:39:00,WEATHER,ATC7,16,deicing
DE0000003381,F00004775,29-05-2025 15:34,maint,WX01,4,late inbound
DE0000003382,F00004775,29-05-2025 15:33,weather,WX01,11,deicing
DE0000003383,F00004777,10/29/2024 11:31,OPS,,4,deicing
DE0000003384,F00004782,22-04-2024 03:24,MAINT,ATC7,2,deicing
DE0000003385,F00004782,2024-04-22T03:35:00,MAINT,GT3,1,
DE0000003386,F00004782,22-04-2024 05:01,OPS,MX5,4,
DE0000003387,F00004783,08/29/2024 03:54,CRW,,2,deicing
DE0000003388,F00004783,29-08-2024 04:32,maint,OPS9,13m,gate hold
DE0000003389,F00004786,25-08-2024 10:58,OPS,MX5,0,late inbound
DE0000003390,F00004786,25-08-2024 10:12,AIRPORT,MX5,22m,deicing
DE0000003391,F00004792,21-11-2025 05:27,OTHER,MX5,20m,crew swap
DE0000003392,F00004792,11/21/2025 06:14,CRW,,6,crew swap
DE0000003393,F00004792,21-11-2025 07:40,GATE,,4,gate hold
DE0000003394,F00004793,18-11-2025 17:04,airport,ATC7,10,deicing
DE0000003395,F00004798,25-06-2024 16:57,AIRPORT,GT3,14,gate hold
DE0000003396,F00004799,06-05-2024 08:32,MX,GT3,30,maintenance check
DE0000003397,F00004803,03-01-2026 21:35,WEATHER,OPS9,-31,ground stop
DE0000003398,F00004803,2026-01-03T22:08:00,MAINT,GT3,6,deicing
DE0000003399,F00004804,31-08-2024 19:14,WEATHER,OPS9,16,late inbound
DE0000003400,F00004808,18-04-2025 10:23,CREW,GT3,2m,
DE0000003401,F00004808,2025-04-18T09:27:00,OPS,WX01,1,crew swap
DE0000003402,F00004808,04/18/2025 09:13,ATC,CR02,4,deicing
DE0000003403,F00004809,11-04-2025 19:20,CREW,WX01,200,gate hold
DE0000003404,F00004809,11-04-2025 18:07,other,GT3,22,ground stop
DE0000003405,F00004809,04-11-2025 18:45,OTHER,CR02,81,deicing
DE0000003406,F00004817,10-03-2024 14:34,ATC,MX5,23,maintenance check
DE0000003407,F00004817,10-03-2024 15:24,other,GT3,7,deicing
DE0000003408,F00004818,14-03-2024 14:56,airport,MX5,1,maintenance check
DE0000003409,F00004818,14-03-2024 15:43,WX,MX5,14,ground stop
DE0000003410,F00004818,03/14/2024 15:56,WEATHER,OPS9,1,late inbound
DE0000003411,F00004819,01-08-2025 03:42,OPS,MX5,3,ground stop
DE0000003412,F00004819,01-08-2025 04:52,crew,CR02,5,gate hold
DE0000003413,F00004819,01-08-2025 03:46,MX,MX5,8,crew swap
DE0000003414,F00004822,2025-06-11T06:01:00,atc,ATC7,24,late inbound
DE0000003415,F00004822,2025-06-11T07:32:00,airport,WX01,1,maintenance check
DE0000003416,F00004823,25-04-2025 16:59,airport,CR02,15,gate hold
DE0000003417,F00004826,05-05-2025 22:21,airport,CR02,0,crew swap
DE0000003418,F00004826,05-05-2025 20:57,OPS,MX5,1m,deicing
DE0000003419,F00004828,07/26/2024 06:43,CRW,CR02,-30,crew swap
DE0000003420,F00004831,05-10-2025 18:52,MAINT,WX01,5,deicing
DE0000003421,F00004832,03-01-2026 08:53,CRW,CR02,10,crew swap
DE0000003422,F00004832,03-01-2026 08:32,WX,ATC7,1,late inbound
DE0000003423,F00004832,03-01-2026 06:43,GATE,GT3,11,crew swap
DE0000003424,F00004833,11-02-2025 05:29,other,OPS9,3,
DE0000003425,F00004833,02-11-2025 04:29,MX,,17,
DE0000003426,F00004836,04-05-2025 22:27,TRAFFIC,ATC7,24,late inbound
DE0000003427,F00004836,2025-05-04T20:46:00,crew,MX5,6,
DE0000003428,F00004839,25-02-2025 16:11,maint,CR02,5,late inbound
DE0000003429,F00004839,25-02-2025 14:58,MAINT,WX01,1,ground stop
DE0000003430,F00004839,02/25/2025 15:28,maint,CR02,7,gate hold
DE0000003431,F00004841,02-05-2024 16:58,atc,,8,crew swap
DE0000003432,F00004843,08/24/2025 09:01,crew,MX5,10,deicing
DE0000003433,F00004843,24-08-2025 06:13,CREW,GT3,12,
DE0000003434,F00004843,24-08-2025 08:54,GATE,ATC7,8m,deicing
DE0000003435,F00004846,11-03-2025 14:22,AIRPORT,MX5,7,
DE0000003436,F00004846,03-11-2025 14:11,AIRPORT,ATC7,16m,ground stop
DE0000003437,F00004847,05-05-2025 20:11,MAINT,WX01,25,ground stop
DE0000003438,F00004852,2025-05-11T08:55:00,ATC,,1,ground stop
DE0000003439,F00004852,05-11-2025 09:38,WX,WX01,2,maintenance check
DE0000003440,F00004852,11-05-2025 09:48,crew,ATC7,3,deicing
DE0000003441,F00004855,29-06-2025 17:55,MX,,1,deicing
DE0000003442,F00004855,29-06-2025 15:15,MX,CR02,9,ground stop
DE0000003443,F00004855,29-06-2025 16:20,OPS,OPS9,1,crew swap
DE0000003444,F00004863,23-03-2024 13:05,maint,ATC7,30,maintenance check
DE0000003445,F00004865,26-07-2024 04:30,MAINT,MX5,0,crew swap
DE0000003446,F00004865,26-07-2024 02:59,GATE,ATC7,1,ground stop
DE0000003447,F00004865,26-07-2024 04:06,weather,ATC7,-6,maintenance check
DE0000003448,F00004867,07-02-2024 17:57,CREW,ATC7,0,
DE0000003449,F00004867,02-07-2024 17:14,atc,MX5,1,crew swap
DE0000003450,F00004867,02-07-2024 18:48,crew,,1,deicing
DE0000003451,F00004868,16-01-2025 19:25,WEATHER,CR02,11,late inbound
DE0000003452,F00004868,16-01-2025 19:15,TRAFFIC,GT3,4,gate hold
DE0000003453,F00004869,07/22/2024 05:45,AIRPORT,CR02,24,crew swap
DE0000003454,F00004869,2024-07-22T05:58:00,OTHER,OPS9,3m,
DE0000003455,F00004872,24-03-2024 06:31,other,ATC7,0,maintenance check
DE0000003456,F00004872,03/24/2024 08:59,MAINT,GT3,26,crew swap
DE0000003457,F00004873,2025-08-28T02:59:00,WX,CR02,5,deicing
DE0000003458,F00004873,28-08-2025 03:52,WX,WX01,1,late inbound
DE0000003459,F00004877,21-04-2025 06:03,airport,OPS9,6,
DE0000003460,F00004877,21-04-2025 07:17,atc,GT3,-4,crew swap
DE0000003461,F00004877,21-04-2025 07:17,WEATHER,,20,late inbound
DE0000003462,F00004878,06-03-2025 14:21,MX,CR02,34,
DE0000003463,F00004881,24-06-2024 10:59,crew,OPS9,3,
DE0000003464,F00004885,12-01-2025 21:00,maint,ATC7,0,gate hold
DE0000003465,F00004885,12-01-2025 22:02,CREW,,2,late inbound
DE0000003466,F00004885,01-12-2025 21:32,OTHER,OPS9,3,maintenance check
DE0000003467,F00004886,02/24/2024 05:53,MX,CR02,15,gate hold
DE0000003468,F00004892,15-07-2025 06:04,MAINT,ATC7,14,ground stop
DE0000003469,F00004892,15-07-2025 07:05,OTHER,GT3,2,late inbound
DE0000003470,F00004895,05-09-2024 19:25,maint,WX01,40,ground stop
DE0000003471,F00004899,06-09-2025 10:29,WX,OPS9,4,
DE0000003472,F00004900,25-05-2025 21:58,MAINT,,62,ground stop
DE0000003473,F00004900,25-05-2025 23:07,airport,GT3,5,ground stop
DE0000003474,F00004900,25-05-2025 20:42,GATE,CR02,4,gate hold
DE0000003475,F00004901,25-04-2024 12:20,OTHER,OPS9,3,deicing
DE0000003476,F00004901,25-04-2024 10:40,OTHER,ATC7,15,deicing
DE0000003477,F00004901,2024-04-25T11:43:00,other,MX5,3,
DE0000003478,F00004905,16-11-2024 18:37,crew,GT3,3,crew swap
DE0000003479,F00004905,16-11-2024 19:02,GATE,WX01,1,gate hold
DE0000003480,F00004905,16-11-2024 20:19,crew,WX01,12,late inbound
DE0000003481,F00004906,11-11-2024 04:20,weather,OPS9,-19,maintenance check
DE0000003482,F00004906,11-11-2024 06:33,crew,CR02,1,deicing
DE0000003483,F00004906,11-11-2024 06:25,weather,OPS9,8,
DE0000003484,F00004907,12-08-2025 14:57,weather,WX01,16,maintenance check
DE0000003485,F00004909,29-04-2025 15:04,weather,CR02,12,maintenance check
DE0000003486,F00004909,04/29/2025 15:10,CREW,OPS9,5,
DE0000003487,F00004909,29-04-2025 15:00,MAINT,,5,gate hold
DE0000003488,F00004910,18-07-2024 19:06,GATE,GT3,13,gate hold
DE0000003489,F00004910,18-07-2024 19:42,AIRPORT,MX5,11,ground stop
DE0000003490,F00004912,08-03-2025 15:04,WEATHER,GT3,0,crew swap
DE0000003491,F00004912,08-03-2025 17:19,CREW,,14,crew swap
DE0000003492,F00004917,17-05-2024 13:14,airport,,24,late inbound
DE0000003493,F00004917,17-05-2024 14:08,weather,OPS9,25,deicing
DE0000003494,F00004918,08-11-2024 12:20,atc,ATC7,14,maintenance check
DE0000003495,F00004919,02-04-2025 10:50,weather,GT3,31,ground stop
DE0000003496,F00004921,24-05-2025 12:55,OPS,GT3,0,maintenance check
DE0000003497,F00004921,24-05-2025 13:00,weather,GT3,-12,
DE0000003498,F00004922,05/31/2024 20:07,TRAFFIC,CR02,5,crew swap
DE0000003499,F00004922,31-05-2024 21:13,AIRPORT,WX01,8,crew swap
DE0000003500,F00004929,07-08-2025 00:02,OTHER,GT3,-1,late inbound
DE0000003501,F00004929,2025-08-07T00:21:00,WX,CR02,1,deicing
DE0000003502,F00004929,07-08-2025 02:21,OPS,MX5,1,gate hold
DE0000003503,F00004934,05/16/2025 02:18,GATE,WX01,1,crew swap
DE0000003504,F00004935,18-08-2024 02:45,airport,GT3,7,late inbound
DE0000003505,F00004935,18-08-2024 03:52,MAINT,MX5,10,ground stop
DE0000003506,F00004935,2024-08-18T03:36:00,OTHER,OPS9,6,gate hold
DE0000003507,F00004938,17-02-2024 18:44,CREW,,11,deicing
DE0000003508,F00004940,08-03-2024 21:29,maint,ATC7,57,
DE0000003509,F00004941,10-09-2024 05:56,MAINT,,1,deicing
DE0000003510,F00004941,09-10-2024 07:10,OTHER,MX5,12,gate hold
DE0000003511,F00004942,06-01-2026 15:33,atc,CR02,3,maintenance check
DE0000003512,F00004942,01-06-2026 17:42,MX,,1,maintenance check
DE0000003513,F00004942,06-01-2026 17:20,OPS,,1,gate hold
DE0000003514,F00004945,20-03-2025 02:58,weather,ATC7,1,ground stop
DE0000003515,F00004945,2025-03-20T04:30:00,airport,WX01,1,maintenance check
DE0000003516,F00004945,20-03-2025 02:27,MX,CR02,2,crew swap
DE0000003517,F00004948,28-01-2025 00:29,maint,GT3,19m,maintenance check
DE0000003518,F00004949,2025-09-13T18:10:00,GATE,,30,ground stop
DE0000003519,F00004950,03-11-2025 13:54,OTHER,GT3,57,gate hold
DE0000003520,F00004950,03-11-2025 13:57,weather,ATC7,136,late inbound
DE0000003521,F00004953,02-10-2024 07:17,atc,WX01,6,
DE0000003522,F00004955,04-12-2025 06:41,other,WX01,30,crew swap
DE0000003523,F00004957,08-07-2025 18:01,WEATHER,GT3,4,
DE0000003524,F00004957,08-07-2025 20:14,CRW,CR02,-2,late inbound
DE0000003525,F00004957,08-07-2025 19:38,OPS,MX5,7,
DE0000003526,F00004958,31-07-2025 19:50,other,CR02,35,maintenance check
DE0000003527,F00004959,07-10-2024 20:45,crew,WX01,10,ground stop
DE0000003528,F00004959,2024-10-07T21:33:00,airport,,8,maintenance check
DE0000003529,F00004959,2024-10-07T19:38:00,WX,WX01,12,maintenance check
DE0000003530,F00004960,14-01-2026 18:33,MAINT,ATC7,30,gate hold
DE0000003531,F00004962,24-10-2025 11:31,WEATHER,GT3,21,ground stop
DE0000003532,F00004966,12/17/2025 19:35,crew,OPS9,1,gate hold
DE0000003533,F00004966,17-12-2025 19:20,OPS,WX01,1,maintenance check
DE0000003534,F00004967,2024-07-01T09:33:00,CRW,WX01,6,late inbound
DE0000003535,F00004967,01-07-2024 10:14,CREW,WX01,26,late inbound
DE0000003536,F00004968,19-04-2024 20:40,AIRPORT,GT3,11,gate hold
DE0000003537,F00004968,19-04-2024 21:54,MX,ATC7,25,maintenance check
DE0000003538,F00004968,19-04-2024 21:24,TRAFFIC,MX5,7,
DE0000003539,F00004970,11/27/2025 12:50,MX,GT3,9,ground stop
DE0000003540,F00004975,08-03-2024 00:08,ATC,OPS9,7,
DE0000003541,F00004975,03-08-2024 00:18,MX,OPS9,5,gate hold
DE0000003542,F00004975,08-03-2024 00:53,CREW,CR02,13,gate hold
DE0000003543,F00004978,2025-06-17T00:54:00,AIRPORT,CR02,10,crew swap
DE0000003544,F00004983,09-07-2025 18:11,MAINT,GT3,18,crew swap
DE0000003545,F00004991,2024-02-11T18:13:00,MX,GT3,9,late inbound
DE0000003546,F00004992,2025-06-22T16:02:00,ATC,MX5,41,crew swap
DE0000003547,F00004999,2024-03-04T05:40:00,OTHER,CR02,1,late inbound
DE0000003548,F00004999,2024-03-04T06:58:00,maint,ATC7,6,crew swap
DE0000003549,F00005003,05-12-2025 22:46,weather,OPS9,6,late inbound
DE0000003550,F00005003,06-12-2025 00:48,MAINT,OPS9,1,gate hold
DE0000003551,F00005006,28-05-2024 22:55,atc,,-4,late inbound
DE0000003552,F00005006,05/28/2024 22:54,TRAFFIC,WX01,-5,
DE0000003553,F00005008,02-10-2025 04:34,other,,10,maintenance check
DE0000003554,F00005012,07-07-2025 20:32,CRW,OPS9,9,late inbound
DE0000003555,F00005012,07-07-2025 18:51,MX,,5,maintenance check
DE0000003556,F00005012,2025-07-07T20:16:00,ATC,GT3,1,crew swap
DE0000003557,F00005016,2025-10-05T01:32:00,ATC,OPS9,27,crew swap
DE0000003558,F00005018,16-12-2024 01:58,WEATHER,ATC7,2,deicing
DE0000003559,F00005018,15-12-2024 23:42,ATC,,4,crew swap
DE0000003560,F00005018,12/16/2024 01:52,CREW,ATC7,6,gate hold
DE0000003561,F00005020,11-08-2024 14:56,MAINT,CR02,9,deicing
DE0000003562,F00005020,11-08-2024 15:30,CRW,OPS9,11,gate hold
DE0000003563,F00005020,11-08-2024 16:15,WEATHER,,-1,deicing
DE0000003564,F00005025,22-09-2025 04:16,AIRPORT,OPS9,11,crew swap
DE0000003565,F00005029,21-05-2025 04:47,TRAFFIC,GT3,37,ground stop
DE0000003566,F00005031,13-09-2025 10:47,WEATHER,MX5,14,late inbound
DE0000003567,F00005031,13-09-2025 12:09,airport,CR02,5m,
DE0000003568,F00005034,01/18/2025 18:17,WX,,12,
DE0000003569,F00005039,28-11-2024 21:26,AIRPORT,MX5,1,crew swap
DE0000003570,F00005039,28-11-2024 19:37,CREW,ATC7,1,deicing
DE0000003571,F00005039,2024-11-28T21:48:00,CREW,MX5,52,maintenance check
DE0000003572,F00005040,22-12-2024 21:36,WEATHER,MX5,23,crew swap
DE0000003573,F00005041,06/17/2025 08:52,weather,GT3,33,maintenance check
DE0000003574,F00005041,17-06-2025 08:22,airport,,5,
DE0000003575,F00005049,24-02-2025 19:15,atc,CR02,18,deicing
DE0000003576,F00005050,22-02-2024 09:10,AIRPORT,GT3,12,
DE0000003577,F00005050,02/22/2024 07:59,WX,GT3,24,late inbound
DE0000003578,F00005055,22-09-2025 06:43,TRAFFIC,OPS9,2,
DE0000003579,F00005055,22-09-2025 04:58,ATC,WX01,15,
DE0000003580,F00005055,22-09-2025 06:46,CREW,OPS9,9,maintenance check
DE0000003581,F00005056,05-03-2024 20:38,CREW,OPS9,2,deicing
DE0000003582,F00005056,05-03-2024 21:17,WX,MX5,7,
DE0000003583,F00005056,03-05-2024 21:35,MX,MX5,10,deicing
DE0000003584,F00005059,12-04-2024 12:14,WX,CR02,17,deicing
DE0000003585,F00005062,27-12-2025 20:34,WX,WX01,20,gate hold
DE0000003586,F00005062,27-12-2025 20:02,CRW,MX5,29m,maintenance check
DE0000003587,F00005062,27-12-2025 22:04,CREW,WX01,27,gate hold
DE0000003588,F00005063,18-02-2024 22:28,AIRPORT,OPS9,19,
DE0000003589,F00005066,08/24/2025 01:07,CRW,MX5,10,crew swap
DE0000003590,F00005067,22-05-2025 00:50,CREW,ATC7,-21,ground stop
DE0000003591,F00005068,27-11-2025 08:28,CREW,CR02,25,ground stop
DE0000003592,F00005069,19-04-2024 04:10,CRW,ATC7,22,
DE0000003593,F00005071,14-06-2024 08:49,weather,MX5,0,gate hold
DE0000003594,F00005071,14-06-2024 06:39,GATE,,1,
DE0000003595,F00005072,24-06-2025 08:39,OTHER,MX5,5,ground stop
DE0000003596,F00005074,17-12-2024 21:17,AIRPORT,CR02,10,crew swap
DE0000003597,F00005074,17-12-2024 22:01,other,MX5,7m,
DE0000003598,F00005075,02/25/2025 02:22,weather,MX5,7,deicing
DE0000003599,F00005075,25-02-2025 03:36,MAINT,ATC7,8,gate hold
DE0000003600,F00005077,12-01-2025 03:16,CRW,,28,late inbound
DE0000003601,F00005083,17-02-2024 00:03,WEATHER,CR02,9,
DE0000003602,F00005083,02/17/2024 02:19,CRW,CR02,33,
DE0000003603,F00005085,15-05-2024 13:16,OPS,MX5,5,ground stop
DE0000003604,F00005085,2024-05-15T12:02:00,other,ATC7,1,deicing
DE0000003605,F00005085,05/15/2024 13:15,weather,OPS9,2,gate hold
DE0000003606,F00005091,30-11-2025 18:41,crew,ATC7,1,deicing
DE0000003607,F00005092,27-05-2024 14:08,CRW,OPS9,19m,
DE0000003608,F00005095,02-01-2026 16:09,WX,GT3,35m,maintenance check
DE0000003609,F00005095,02-01-2026 17:03,MX,MX5,5,maintenance check
DE0000003610,F00005098,09-02-2024 15:56,AIRPORT,CR02,1,gate hold
DE0000003611,F00005098,02-09-2024 17:25,WEATHER,ATC7,1,ground stop
DE0000003612,F00005098,02-09-2024 16:19,MX,,2,crew swap
DE0000003613,F00005100,12-11-2025 16:16,weather,OPS9,9,maintenance check
DE0000003614,F00005100,2025-11-12T18:10:00,GATE,ATC7,14,deicing
DE0000003615,F00005100,12-11-2025 16:04,atc,WX01,4,maintenance check
DE0000003616,F00005101,14-07-2025 10:27,airport,ATC7,38,ground stop
DE0000003617,F00005101,14-07-2025 12:03,TRAFFIC,OPS9,3,
DE0000003618,F00005102,10-10-2024 05:27,OTHER,CR02,11,crew swap
DE0000003619,F00005102,10-10-2024 06:57,GATE,GT3,1,crew swap
DE0000003620,F00005102,10-10-2024 06:10,MX,WX01,-1,crew swap
DE0000003621,F00005107,07-04-2024 09:17,MAINT,GT3,12,crew swap
DE0000003622,F00005107,04-07-2024 11:14,WEATHER,WX01,6m,ground stop
DE0000003623,F00005107,07-04-2024 09:03,WEATHER,ATC7,1,maintenance check
DE0000003624,F00005108,18-01-2026 02:59,GATE,ATC7,4,
DE0000003625,F00005108,18-01-2026 03:53,airport,GT3,1,gate hold
DE0000003626,F00005116,23-08-2024 14:19,AIRPORT,GT3,8m,gate hold
DE0000003627,F00005116,23-08-2024 15:37,airport,WX01,1,maintenance check
DE0000003628,F00005117,02/18/2024 19:00,crew,,30,maintenance check
DE0000003629,F00005117,2024-02-18T19:01:00,ATC,MX5,7,gate hold
DE0000003630,F00005120,12/19/2024 14:27,WEATHER,GT3,21,crew swap
DE0000003631,F00005123,2025-04-18T21:21:00,WX,CR02,6,ground stop
DE0000003632,F00005129,26-08-2024 13:53,OTHER,WX01,6,ground stop
DE0000003633,F00005129,26-08-2024 13:49,CREW,CR02,43,ground stop
DE0000003634,F00005131,05-12-2024 21:08,WX,ATC7,31,crew swap
DE0000003635,F00005131,12-05-2024 21:35,TRAFFIC,MX5,5,deicing
DE0000003636,F00005135,09/19/2025 04:56,OPS,ATC7,18,
DE0000003637,F00005136,30-07-2025 04:11,CRW,MX5,1,crew swap
DE0000003638,F00005136,07/30/2025 03:56,WX,OPS9,21,maintenance check
DE0000003639,F00005137,08-03-2025 22:30,airport,MX5,3,crew swap
DE0000003640,F00005137,08-03-2025 23:49,ATC,CR02,-52,deicing
DE0000003641,F00005139,24-02-2024 17:23,TRAFFIC,OPS9,22,gate hold
DE0000003642,F00005139,24-02-2024 15:29,CRW,,8m,maintenance check
DE0000003643,F00005140,02-08-2024 13:36,TRAFFIC,ATC7,13,
DE0000003644,F00005141,23-03-2024 18:31,OTHER,ATC7,28,ground stop
DE0000003645,F00005144,05-09-2025 11:47,GATE,,12,maintenance check
DE0000003646,F00005144,05-09-2025 11:11,weather,CR02,15,ground stop
DE0000003647,F00005146,17-01-2026 16:45,WX,ATC7,5,ground stop
DE0000003648,F00005149,08-07-2024 08:23,OTHER,OPS9,18,gate hold
DE0000003649,F00005152,03-03-2025 09:45,AIRPORT,WX01,0,ground stop
DE0000003650,F00005152,03-03-2025 11:08,OPS,OPS9,21,maintenance check
DE0000003651,F00005154,05-09-2024 01:57,ATC,ATC7,5,crew swap
DE0000003652,F00005154,09-05-2024 00:59,ATC,,1,ground stop
DE0000003653,F00005154,05-09-2024 00:50,ATC,GT3,18,deicing
DE0000003654,F00005156,2024-11-07T20:10:00,ATC,GT3,0,gate hold
DE0000003655,F00005156,07-11-2024 22:01,TRAFFIC,OPS9,7,
DE0000003656,F00005156,07-11-2024 20:15,OPS,OPS9,1,late inbound
DE0000003657,F00005158,10/15/2025 06:41,weather,MX5,23,gate hold
DE0000003658,F00005159,16-02-2024 07:03,OTHER,ATC7,9,gate hold
DE0000003659,F00005159,02/16/2024 07:25,MX,GT3,2,ground stop
DE0000003660,F00005160,12-07-2025 22:13,maint,CR02,3,ground stop
DE0000003661,F00005160,07-12-2025 22:19,weather,ATC7,-11,deicing
DE0000003662,F00005161,07/28/2024 17:39,OPS,,7,gate hold
DE0000003663,F00005161,07/28/2024 17:09,AIRPORT,GT3,6,ground stop
DE0000003664,F00005161,28-07-2024 17:05,CREW,WX01,3,
DE0000003665,F00005163,13-08-2025 04:59,other,,30,ground stop
DE0000003666,F00005166,2025-01-10T03:24:00,ATC,,11,gate hold
DE0000003667,F00005166,10-01-2025 02:40,crew,,10,
DE0000003668,F00005169,2024-07-09T14:41:00,WEATHER,ATC7,19,late inbound
DE0000003669,F00005170,09-05-2024 02:34,WX,MX5,20,maintenance check
DE0000003670,F00005170,09-05-2024 02:43,TRAFFIC,MX5,1,gate hold
DE0000003671,F00005170,2024-05-09T05:12:00,CREW,ATC7,15m,gate hold
DE0000003672,F00005171,07-08-2025 22:13,ATC,CR02,2m,deicing
DE0000003673,F00005171,07-08-2025 21:23,AIRPORT,WX01,1,crew swap
DE0000003674,F00005171,08-07-2025 23:35,ATC,OPS9,4,
DE0000003675,F00005172,02-08-2025 17:46,atc,,6,crew swap
DE0000003676,F00005172,08-02-2025 17:00,OPS,ATC7,1,late inbound
DE0000003677,F00005172,08-02-2025 16:31,AIRPORT,MX5,1,crew swap
DE0000003678,F00005176,23-12-2025 23:42,GATE,MX5,8,maintenance check
DE0000003679,F00005176,24-12-2025 01:23,ATC,MX5,1,gate hold
DE0000003680,F00005176,24-12-2025 00:44,WEATHER,CR02,-8,late inbound
DE0000003681,F00005177,06/30/2025 07:38,TRAFFIC,,11,deicing
DE0000003682,F00005177,30-06-2025 05:42,WX,OPS9,4,gate hold
DE0000003683,F00005177,30-06-2025 06:47,AIRPORT,MX5,7,maintenance check
DE0000003684,F00005179,07-11-2024 18:35,atc,,1,deicing
DE0000003685,F00005179,07-11-2024 18:14,ATC,,7,deicing
DE0000003686,F00005180,15-11-2025 14:05,OTHER,ATC7,19,crew swap
DE0000003687,F00005181,25-03-2024 23:27,MX,OPS9,2,late inbound
DE0000003688,F00005181,25-03-2024 23:10,other,WX01,2,late inbound
DE0000003689,F00005181,25-03-2024 22:23,ATC,ATC7,15,late inbound
DE0000003690,F00005183,06-09-2024 23:14,OTHER,CR02,-2,deicing
DE0000003691,F00005183,06-09-2024 23:16,MX,WX01,1,deicing
DE0000003692,F00005185,12-04-2024 01:01,TRAFFIC,MX5,5,maintenance check
DE0000003693,F00005185,12-04-2024 00:08,MX,ATC7,5,ground stop
DE0000003694,F00005186,05/22/2024 12:02,OTHER,OPS9,2,gate hold
DE0000003695,F00005186,22-05-2024 10:38,GATE,ATC7,20,late inbound
DE0000003696,F00005186,22-05-2024 11:38,CREW,MX5,-4,gate hold
DE0000003697,F00005190,13-05-2025 04:07,OPS,,5,deicing
DE0000003698,F00005190,05/13/2025 03:47,ATC,MX5,9,late inbound
DE0000003699,F00005197,03/31/2024 16:19,CRW,OPS9,2,maintenance check
DE0000003700,F00005197,03/31/2024 17:08,WEATHER,OPS9,9,gate hold
DE0000003701,F00005203,02/28/2025 22:41,MAINT,CR02,22,deicing
DE0000003702,F00005203,28-02-2025 22:31,CRW,MX5,3,crew swap
DE0000003703,F00005205,19-01-2025 06:38,other,,2,deicing
DE0000003704,F00005208,29-09-2024 10:25,atc,,16,late inbound
DE0000003705,F00005209,03/20/2025 13:50,MAINT,MX5,14,ground stop
DE0000003706,F00005211,14-10-2024 18:33,AIRPORT,,13m,maintenance check
DE0000003707,F00005211,10/14/2024 19:22,atc,GT3,10,
DE0000003708,F00005216,23-11-2025 22:18,CREW,GT3,12,deicing
DE0000003709,F00005218,2025-03-02T15:01:00,other,OPS9,6,deicing
DE0000003710,F00005220,31-01-2026 18:02,WX,ATC7,8,ground stop
DE0000003711,F00005220,31-01-2026 17:46,TRAFFIC,CR02,27,deicing
DE0000003712,F00005223,29-10-2025 01:42,MX,WX01,11,crew swap
DE0000003713,F00005223,29-10-2025 01:57,WX,MX5,5,ground stop
DE0000003714,F00005223,10/29/2025 01:41,WEATHER,,4,
DE0000003715,F00005225,09/22/2024 16:51,CRW,GT3,19,gate hold
DE0000003716,F00005225,22-09-2024 16:36,AIRPORT,CR02,6,
DE0000003717,F00005225,09/22/2024 16:31,OTHER,WX01,15,gate hold
DE0000003718,F00005230,29-04-2025 15:56,atc,ATC7,0,crew swap
DE0000003719,F00005230,29-04-2025 16:40,WEATHER,CR02,1,maintenance check
DE0000003720,F00005230,29-04-2025 16:10,WX,ATC7,6m,crew swap
DE0000003721,F00005232,14-02-2025 16:56,weather,WX01,13,deicing
DE0000003722,F00005232,14-02-2025 19:36,maint,,-6,late inbound
DE0000003723,F00005234,10-08-2025 05:11,MAINT,,7,late inbound
DE0000003724,F00005234,2025-08-10T04:39:00,MAINT,WX01,10,late inbound
DE0000003725,F00005241,02-02-2024 00:50,CREW,,44,late inbound
DE0000003726,F00005246,08/15/2025 23:02,MAINT,WX01,13m,late inbound
DE0000003727,F00005246,15-08-2025 23:33,MAINT,GT3,11,gate hold
DE0000003728,F00005248,18-07-2024 15:33,other,,4,maintenance check
DE0000003729,F00005248,18-07-2024 14:59,AIRPORT,CR02,26,late inbound
DE0000003730,F00005250,02-11-2024 15:08,atc,,112m,late inbound
DE0000003731,F00005250,11-02-2024 14:17,CRW,MX5,85,ground stop
DE0000003732,F00005252,10-05-2025 12:53,maint,GT3,9m,maintenance check
DE0000003733,F00005254,02/14/2025 14:53,CRW,OPS9,8,late inbound
DE0000003734,F00005254,02/14/2025 13:43,WEATHER,MX5,5,gate hold
DE0000003735,F00005258,2025-07-23T07:20:00,AIRPORT,CR02,54m,
DE0000003736,F00005260,23-11-2025 03:18,MX,OPS9,3,gate hold
DE0000003737,F00005260,23-11-2025 00:37,atc,GT3,2,crew swap
DE0000003738,F00005260,23-11-2025 02:28,GATE,WX01,1,
DE0000003739,F00005264,2025-01-07T19:49:00,airport,,-16,
DE0000003740,F00005266,05-09-2024 01:48,weather,MX5,3,maintenance check
DE0000003741,F00005266,2024-09-05T04:11:00,WX,CR02,1,maintenance check
DE0000003742,F00005266,05-09-2024 04:05,GATE,OPS9,18,late inbound
DE0000003743,F00005268,12-05-2024 10:02,maint,CR02,20,crew swap
DE0000003744,F00005269,08-04-2025 09:02,airport,OPS9,27,deicing
DE0000003745,F00005276,09/26/2024 03:12,TRAFFIC,WX01,6,maintenance check
DE0000003746,F00005280,09-02-2024 20:25,CRW,GT3,-9,late inbound
DE0000003747,F00005283,25-04-2024 10:36,CRW,MX5,4,ground stop
DE0000003748,F00005283,25-04-2024 11:43,other,MX5,-19,maintenance check
DE0000003749,F00005290,05/26/2025 03:30,OTHER,CR02,2,maintenance check
DE0000003750,F00005290,26-05-2025 04:21,WEATHER,OPS9,6,gate hold
DE0000003751,F00005295,31-10-2024 05:52,OPS,WX01,7,ground stop
DE0000003752,F00005295,10/31/2024 06:34,CRW,GT3,1,late inbound
DE0000003753,F00005296,10-01-2026 00:51,CRW,MX5,17,crew swap
DE0000003754,F00005296,2026-01-10T00:34:00,OTHER,CR02,9,crew swap
DE0000003755,F00005296,09-01-2026 22:54,TRAFFIC,CR02,4m,ground stop
DE0000003756,F00005298,17-08-2025 04:08,crew,ATC7,-1,maintenance check
DE0000003757,F00005298,17-08-2025 05:00,atc,WX01,6m,ground stop
DE0000003758,F00005299,09-05-2024 07:18,weather,GT3,-35,gate hold
DE0000003759,F00005300,07-06-2024 01:22,GATE,ATC7,-3,
DE0000003760,F00005300,06-07-2024 02:24,MX,WX01,8,
DE0000003761,F00005304,18-12-2025 18:12,weather,GT3,11,crew swap
DE0000003762,F00005309,04-07-2025 07:33,airport,MX5,10,gate hold
DE0000003763,F00005309,04-07-2025 10:00,maint,GT3,13,ground stop
DE0000003764,F00005309,07-04-2025 09:26,AIRPORT,MX5,4,gate hold
DE0000003765,F00005312,07/18/2024 16:21,airport,,2,crew swap
DE0000003766,F00005312,18-07-2024 14:17,WEATHER,,2m,ground stop
DE0000003767,F00005320,2024-08-18T10:09:00,WEATHER,,2,gate hold
DE0000003768,F00005321,10-03-2025 04:08,WX,WX01,0,late inbound
DE0000003769,F00005321,10-03-2025 05:25,GATE,MX5,1,ground stop
DE0000003770,F00005321,10-03-2025 06:19,weather,OPS9,-3,
DE0000003771,F00005326,16-05-2025 04:42,airport,GT3,4,maintenance check
DE0000003772,F00005327,19-09-2025 19:53,CREW,,16,gate hold
DE0000003773,F00005331,19-01-2026 08:16,TRAFFIC,OPS9,38,deicing
DE0000003774,F00005332,28-09-2025 11:24,AIRPORT,GT3,11m,gate hold
DE0000003775,F00005332,28-09-2025 10:32,weather,CR02,14m,
DE0000003776,F00005333,25-04-2025 02:16,WX,MX5,5,ground stop
DE0000003777,F00005335,18-01-2026 09:20,OTHER,WX01,1,gate hold
DE0000003778,F00005335,18-01-2026 09:10,WEATHER,OPS9,1,crew swap
DE0000003779,F00005335,01/18/2026 07:45,TRAFFIC,MX5,1,ground stop
DE0000003780,F00005337,24-11-2024 09:14,WX,,2,gate hold
DE0000003781,F00005337,11/24/2024 08:15,weather,,3,gate hold
DE0000003782,F00005337,24-11-2024 09:18,GATE,GT3,6,maintenance check
DE0000003783,F00005340,05/28/2024 13:07,crew,,11,crew swap
DE0000003784,F00005343,2025-02-17T01:49:00,OTHER,CR02,19,crew swap
DE0000003785,F00005343,17-02-2025 02:49,MX,GT3,6,crew swap
DE0000003786,F00005343,17-02-2025 03:10,airport,WX01,17,maintenance check
DE0000003787,F00005345,11/17/2024 23:49,MAINT,GT3,69,ground stop
DE0000003788,F00005346,01-09-2025 10:15,WEATHER,,8,late inbound
DE0000003789,F00005346,09-01-2025 10:09,OTHER,,-5,late inbound
DE0000003790,F00005347,05-09-2025 00:02,crew,GT3,17,gate hold
DE0000003791,F00005347,09-05-2025 01:06,OPS,CR02,19,maintenance check
DE0000003792,F00005351,18-06-2024 12:12,ATC,OPS9,6,crew swap
DE0000003793,F00005351,18-06-2024 13:36,AIRPORT,ATC7,29,deicing
DE0000003794,F00005351,18-06-2024 14:11,TRAFFIC,OPS9,4,gate hold
DE0000003795,F00005353,06-09-2024 04:16,weather,WX01,7,
DE0000003796,F00005356,30-09-2024 10:54,CREW,GT3,26,maintenance check
DE0000003797,F00005358,19-07-2025 06:56,TRAFFIC,CR02,3,ground stop
DE0000003798,F00005358,19-07-2025 06:14,maint,CR02,19,ground stop
DE0000003799,F00005360,14-04-2024 07:00,airport,,7,ground stop
DE0000003800,F00005360,04/14/2024 07:02,ATC,GT3,14,
DE0000003801,F00005365,24-10-2024 11:53,crew,ATC7,73m,
DE0000003802,F00005365,24-10-2024 11:23,CREW,OPS9,5,crew swap
DE0000003803,F00005367,10-01-2025 12:36,OTHER,CR02,5,maintenance check
DE0000003804,F00005367,10-01-2025 13:42,ATC,CR02,9,maintenance check
DE0000003805,F00005373,2024-12-07T09:00:00,CRW,,20,crew swap
DE0000003806,F00005375,30-12-2025 23:11,MAINT,ATC7,5,crew swap
DE0000003807,F00005376,24-03-2024 14:08,WEATHER,GT3,0,gate hold
DE0000003808,F00005376,24-03-2024 13:47,weather,CR02,20,maintenance check
DE0000003809,F00005376,2024-03-24T15:15:00,WX,MX5,1,deicing
DE0000003810,F00005381,12-05-2025 09:29,MAINT,ATC7,1,crew swap
DE0000003811,F00005381,12-05-2025 08:15,CRW,OPS9,15,deicing
DE0000003812,F00005390,17-05-2025 15:27,ATC,,2,late inbound
DE0000003813,F00005390,17-05-2025 16:35,airport,WX01,8,crew swap
DE0000003814,F00005395,05-12-2025 05:09,OPS,CR02,1,deicing
DE0000003815,F00005395,05-12-2025 04:36,other,ATC7,47,late inbound
DE0000003816,F00005403,02/22/2025 16:19,crew,OPS9,5,deicing
DE0000003817,F00005403,2025-02-22T16:31:00,CREW,WX01,5,crew swap
DE0000003818,F00005403,02/22/2025 15:35,OPS,,2,
DE0000003819,F00005404,23-08-2024 20:34,other,GT3,0,crew swap
DE0000003820,F00005404,23-08-2024 18:11,TRAFFIC,OPS9,1,crew swap
DE0000003821,F00005405,01-05-2024 15:15,weather,CR02,1,
DE0000003822,F00005405,05-01-2024 14:55,TRAFFIC,ATC7,1,
DE0000003823,F00005416,03/17/2025 02:07,weather,MX5,-3,deicing
DE0000003824,F00005416,17-03-2025 03:37,airport,ATC7,3,ground stop
DE0000003825,F00005416,03/17/2025 01:34,GATE,ATC7,10,ground stop
DE0000003826,F00005418,10-05-2024 06:18,WX,,-12,
DE0000003827,F00005418,05-10-2024 07:56,crew,MX5,6,crew swap
DE0000003828,F00005419,25-02-2024 09:48,OTHER,ATC7,9,ground stop
DE0000003829,F00005419,25-02-2024 09:54,atc,WX01,1m,
DE0000003830,F00005420,28-09-2025 15:03,weather,MX5,13,maintenance check
DE0000003831,F00005420,28-09-2025 13:23,MAINT,WX01,57,ground stop
DE0000003832,F00005423,09/25/2025 11:08,airport,,4,maintenance check
DE0000003833,F00005423,2025-09-25T12:21:00,crew,CR02,3,maintenance check
DE0000003834,F00005423,25-09-2025 10:22,CRW,MX5,-5,
DE0000003835,F00005427,06-02-2024 09:20,GATE,WX01,5,
DE0000003836,F00005432,2024-07-13T16:22:00,OTHER,,1,crew swap
DE0000003837,F00005432,2024-07-13T19:02:00,MX,WX01,3,deicing
DE0000003838,F00005432,13-07-2024 16:48,OTHER,WX01,3,maintenance check
DE0000003839,F00005433,09-01-2024 04:21,maint,ATC7,8,late inbound
DE0000003840,F00005433,09-01-2024 01:26,OPS,,1,maintenance check
DE0000003841,F00005433,2024-09-01T03:53:00,ATC,ATC7,-17,gate hold
DE0000003842,F00005435,2025-12-15T09:04:00,OPS,OPS9,2,gate hold
DE0000003843,F00005435,12/15/2025 10:13,maint,ATC7,1,deicing
DE0000003844,F00005435,15-12-2025 08:45,CRW,MX5,1,maintenance check
DE0000003845,F00005438,24-04-2024 19:34,AIRPORT,WX01,1,maintenance check
DE0000003846,F00005438,2024-04-24T20:43:00,airport,MX5,3,
DE0000003847,F00005439,28-07-2025 16:28,atc,WX01,3,ground stop
DE0000003848,F00005439,07/28/2025 15:43,CREW,,-10,
DE0000003849,F00005439,28-07-2025 14:32,crew,GT3,20,maintenance check
DE0000003850,F00005447,02-05-2025 08:14,maint,OPS9,11,gate hold
DE0000003851,F00005447,02-05-2025 09:07,AIRPORT,,3,ground stop
DE0000003852,F00005447,02-05-2025 08:22,MAINT,OPS9,7,ground stop
DE0000003853,F00005450,21-11-2024 10:14,atc,OPS9,41,maintenance check
DE0000003854,F00005450,21-11-2024 10:18,WEATHER,OPS9,1,maintenance check
DE0000003855,F00005463,2025-12-15T13:49:00,MX,CR02,10,ground stop
DE0000003856,F00005463,15-12-2025 15:15,atc,CR02,1,ground stop
DE0000003857,F00005463,15-12-2025 15:56,atc,GT3,2,late inbound
DE0000003858,F00005464,12-04-2025 14:08,weather,CR02,15,maintenance check
DE0000003859,F00005472,03-07-2025 06:03,WX,OPS9,38,gate hold
DE0000003860,F00005480,11-10-2024 20:00,AIRPORT,MX5,36,deicing
DE0000003861,F00005483,11-11-2025 07:41,GATE,OPS9,-1,late inbound
DE0000003862,F00005483,11-11-2025 08:01,MAINT,OPS9,78,maintenance check
DE0000003863,F00005484,03/23/2024 04:39,GATE,OPS9,6,gate hold
DE0000003864,F00005484,23-03-2024 06:57,maint,MX5,3,gate hold
DE0000003865,F00005484,23-03-2024 05:27,MAINT,GT3,5,ground stop
DE0000003866,F00005487,05-12-2025 08:57,WX,OPS9,6,crew swap
DE0000003867,F00005487,2025-12-05T09:23:00,OTHER,,15,
DE0000003868,F00005492,14-11-2024 01:03,ATC,OPS9,3,deicing
DE0000003869,F00005492,13-11-2024 23:45,airport,GT3,1,late inbound
DE0000003870,F00005492,11/14/2024 01:58,TRAFFIC,WX01,17,ground stop
DE0000003871,F00005494,05/17/2024 04:00,OPS,CR02,5,maintenance check
DE0000003872,F00005496,11-07-2024 02:04,TRAFFIC,ATC7,10,maintenance check
DE0000003873,F00005497,05-08-2025 10:54,ATC,GT3,4,
DE0000003874,F00005497,2025-08-05T10:23:00,CREW,CR02,2m,late inbound
DE0000003875,F00005500,12/31/2024 18:50,WEATHER,WX01,3,gate hold
DE0000003876,F00005500,31-12-2024 18:00,ATC,WX01,11,deicing
DE0000003877,F00005500,31-12-2024 17:35,GATE,WX01,7,deicing
DE0000003878,F00005501,13-10-2025 17:26,WX,WX01,42m,ground stop
DE0000003879,F00005503,2025-02-10T18:46:00,maint,,2m,ground stop
DE0000003880,F00005503,10-02-2025 18:52,MAINT,,2,
DE0000003881,F00005503,10-02-2025 19:27,GATE,MX5,8,deicing
DE0000003882,F00005504,13-08-2025 12:44,WEATHER,ATC7,3,
DE0000003883,F00005504,13-08-2025 14:20,CRW,OPS9,1,gate hold
DE0000003884,F00005504,2025-08-13T12:36:00,ATC,OPS9,2,deicing
DE0000003885,F00005506,23-06-2024 10:36,TRAFFIC,MX5,7,late inbound
DE0000003886,F00005506,23-06-2024 09:14,OTHER,ATC7,279,crew swap
DE0000003887,F00005508,14-08-2024 20:51,GATE,MX5,-28,late inbound
DE0000003888,F00005509,31-12-2025 07:35,MAINT,MX5,9,deicing
DE0000003889,F00005509,31-12-2025 06:46,CRW,MX5,2,gate hold
DE0000003890,F00005509,31-12-2025 06:36,atc,OPS9,5,gate hold
DE0000003891,F00005513,09-12-2025 08:47,GATE,,-14,gate hold
DE0000003892,F00005514,09-03-2024 18:46,AIRPORT,ATC7,2,gate hold
DE0000003893,F00005521,28-03-2025 05:40,ATC,CR02,23,deicing
DE0000003894,F00005523,11/23/2024 01:27,other,WX01,12,deicing
DE0000003895,F00005523,23-11-2024 00:52,AIRPORT,CR02,13,
DE0000003896,F00005528,2024-02-03T23:43:00,crew,,-25,crew swap
DE0000003897,F00005530,17-12-2025 21:32,TRAFFIC,WX01,2m,
DE0000003898,F00005539,15-08-2025 08:54,MX,MX5,19,ground stop
DE0000003899,F00005539,15-08-2025 09:32,crew,MX5,3,deicing
DE0000003900,F00005539,08/15/2025 07:05,CRW,,8,crew swap
DE0000003901,F00005541,2026-01-30T10:25:00,WX,GT3,6,
DE0000003902,F00005541,30-01-2026 09:52,CRW,MX5,11,ground stop
DE0000003903,F00005541,30-01-2026 10:27,ATC,GT3,1,crew swap
DE0000003904,F00005542,14-08-2025 18:04,AIRPORT,ATC7,1,ground stop
DE0000003905,F00005542,14-08-2025 18:14,OPS,OPS9,-13,deicing
DE0000003906,F00005544,2024-02-14T19:22:00,MX,GT3,14,late inbound
DE0000003907,F00005547,2025-12-19T00:56:00,weather,,6,gate hold
DE0000003908,F00005547,19-12-2025 00:03,other,OPS9,6,crew swap
DE0000003909,F00005547,12/19/2025 00:33,WX,WX01,1,late inbound
DE0000003910,F00005548,06-05-2025 12:40,CREW,CR02,7,maintenance check
DE0000003911,F00005548,06-05-2025 13:03,AIRPORT,OPS9,-2,ground stop
DE0000003912,F00005551,09-01-2025 15:26,OPS,WX01,12,
DE0000003913,F00005551,09-01-2025 16:00,CREW,MX5,2,
DE0000003914,F00005552,2025-06-03T15:16:00,GATE,,14,gate hold
DE0000003915,F00005552,03-06-2025 13:59,MAINT,MX5,63,gate hold
DE0000003916,F00005554,03/22/2025 07:46,weather,WX01,0,ground stop
DE0000003917,F00005554,2025-03-22T08:59:00,GATE,GT3,1m,late inbound
DE0000003918,F00005555,02-08-2025 06:33,GATE,WX01,1,ground stop
DE0000003919,F00005555,02-08-2025 07:02,OTHER,GT3,2,maintenance check
DE0000003920,F00005555,08-02-2025 06:32,AIRPORT,WX01,1,maintenance check
DE0000003921,F00005556,26-09-2025 06:21,TRAFFIC,WX01,23,maintenance check
DE0000003922,F00005556,26-09-2025 04:56,atc,OPS9,1,maintenance check
DE0000003923,F00005558,02-08-2024 20:54,WEATHER,ATC7,6,crew swap
DE0000003924,F00005558,2024-08-02T18:56:00,CREW,WX01,3,late inbound
DE0000003925,F00005558,02-08-2024 18:15,MAINT,,-3,late inbound
DE0000003926,F00005564,17-08-2025 17:10,MAINT,WX01,25,crew swap
DE0000003927,F00005564,08/17/2025 16:51,CREW,,2,late inbound
DE0000003928,F00005564,17-08-2025 15:31,MAINT,WX01,4m,gate hold
DE0000003929,F00005567,15-08-2024 03:28,MAINT,CR02,20,ground stop
DE0000003930,F00005569,2025-04-01T00:42:00,CRW,WX01,16,deicing
DE0000003931,F00005569,01-04-2025 00:22,weather,GT3,9,late inbound
DE0000003932,F00005571,08/26/2025 19:26,CREW,,2,maintenance check
DE0000003933,F00005571,08/26/2025 19:27,MX,MX5,5,crew swap
DE0000003934,F00005574,01-06-2024 23:11,AIRPORT,CR02,8m,maintenance check
DE0000003935,F00005575,09/29/2025 09:52,CREW,GT3,38,crew swap
DE0000003936,F00005575,29-09-2025 09:25,CRW,,5,maintenance check
DE0000003937,F00005581,08-10-2025 07:10,crew,WX01,14,ground stop
DE0000003938,F00005583,07/25/2024 00:18,MX,,38,maintenance check
DE0000003939,F00005586,15-12-2024 00:25,crew,MX5,1,ground stop
DE0000003940,F00005586,15-12-2024 00:32,airport,MX5,6,gate hold
DE0000003941,F00005587,19-07-2025 14:28,other,,2,gate hold
DE0000003942,F00005587,2025-07-19T14:36:00,crew,GT3,22,ground stop
DE0000003943,F00005587,19-07-2025 16:09,WX,GT3,2,late inbound
DE0000003944,F00005589,09/15/2025 05:49,atc,,0,crew swap
DE0000003945,F00005589,09/15/2025 04:00,OTHER,ATC7,1,gate hold
DE0000003946,F00005589,15-09-2025 04:04,WX,GT3,2m,crew swap
DE0000003947,F00005591,2026-01-22T13:35:00,ATC,,-2,maintenance check
DE0000003948,F00005591,22-01-2026 12:28,WX,GT3,12,gate hold
DE0000003949,F00005591,2026-01-22T11:41:00,CREW,MX5,1,gate hold
DE0000003950,F00005592,23-04-2024 23:17,airport,ATC7,4,late inbound
DE0000003951,F00005592,24-04-2024 00:00,OPS,,4,late inbound
DE0000003952,F00005592,23-04-2024 23:39,weather,,3m,crew swap
DE0000003953,F00005593,17-06-2025 03:49,GATE,,6,
DE0000003954,F00005593,17-06-2025 05:46,atc,CR02,8,late inbound
DE0000003955,F00005597,21-01-2025 13:38,WEATHER,ATC7,18,late inbound
DE0000003956,F00005599,11-06-2025 22:59,AIRPORT,GT3,28,deicing
DE0000003957,F00005609,25-11-2025 11:19,airport,CR02,5m,late inbound
DE0000003958,F00005612,2025-09-06T00:19:00,crew,CR02,28,crew swap
DE0000003959,F00005614,26-08-2025 18:07,airport,CR02,1,gate hold
DE0000003960,F00005614,26-08-2025 17:43,CRW,CR02,7,gate hold
DE0000003961,F00005614,08/26/2025 17:55,TRAFFIC,,1,gate hold
DE0000003962,F00005616,13-10-2024 18:21,airport,ATC7,20,ground stop
DE0000003963,F00005616,13-10-2024 19:12,GATE,GT3,5,gate hold
DE0000003964,F00005616,13-10-2024 18:59,atc,MX5,9,deicing
DE0000003965,F00005619,12-05-2025 06:02,WEATHER,ATC7,7,crew swap
DE0000003966,F00005619,05-12-2025 06:34,MAINT,WX01,24,late inbound
DE0000003967,F00005619,05-12-2025 06:52,TRAFFIC,ATC7,1m,
DE0000003968,F00005622,2024-03-31T07:00:00,maint,GT3,22,ground stop
DE0000003969,F00005625,30-10-2024 06:59,maint,CR02,31,late inbound
DE0000003970,F00005626,31-10-2024 07:24,ATC,GT3,1,maintenance check
DE0000003971,F00005626,31-10-2024 09:14,GATE,OPS9,6,gate hold
DE0000003972,F00005626,10/31/2024 07:05,TRAFFIC,MX5,1,gate hold
DE0000003973,F00005627,2025-05-26T02:16:00,atc,CR02,0,gate hold
DE0000003974,F00005627,26-05-2025 01:36,ATC,MX5,6,deicing
DE0000003975,F00005629,10-12-2025 13:23,WX,WX01,4m,deicing
DE0000003976,F00005629,10-12-2025 12:54,WEATHER,OPS9,9,late inbound
DE0000003977,F00005629,10-12-2025 14:19,crew,MX5,1,gate hold
DE0000003978,F00005631,04-09-2024 21:06,OTHER,MX5,27,late inbound
DE0000003979,F00005631,04-09-2024 21:34,other,OPS9,-3,late inbound
DE0000003980,F00005632,10/27/2025 06:04,MX,OPS9,12,
DE0000003981,F00005632,27-10-2025 06:30,crew,CR02,3,gate hold
DE0000003982,F00005633,27-04-2024 22:19,OTHER,ATC7,53,
DE0000003983,F00005637,02-07-2025 12:54,ATC,MX5,23m,ground stop
DE0000003984,F00005637,07-02-2025 12:20,TRAFFIC,GT3,5,crew swap
DE0000003985,F00005638,19-10-2025 14:47,WX,OPS9,35,maintenance check
DE0000003986,F00005639,06-05-2024 09:51,MX,GT3,5,
DE0000003987,F00005639,05-06-2024 08:44,CRW,GT3,1,late inbound
DE0000003988,F00005639,06-05-2024 09:19,GATE,OPS9,2,ground stop
DE0000003989,F00005640,23-05-2025 02:44,OTHER,ATC7,-13,deicing
DE0000003990,F00005640,23-05-2025 02:14,atc,WX01,1,crew swap
DE0000003991,F00005642,23-03-2024 09:15,TRAFFIC,CR02,2,maintenance check
DE0000003992,F00005643,07-06-2024 06:42,WEATHER,GT3,15,deicing
DE0000003993,F00005644,02-08-2024 15:00,airport,OPS9,3,late inbound
DE0000003994,F00005646,06-05-2024 10:24,WX,WX01,-19,deicing
DE0000003995,F00005647,27-03-2024 13:44,TRAFFIC,MX5,1,deicing
DE0000003996,F00005647,27-03-2024 13:37,crew,,4,maintenance check
DE0000003997,F00005648,09-07-2024 19:19,GATE,GT3,10,late inbound
DE0000003998,F00005650,21-02-2025 18:22,GATE,CR02,21,deicing
DE0000003999,F00005651,2025-04-17T14:58:00,MAINT,WX01,-30,ground stop
DE0000004000,F00005652,02/15/2025 08:39,GATE,GT3,2,crew swap
DE0000004001,F00005654,11-10-2025 00:36,crew,CR02,7,
DE0000004002,F00005654,09-11-2025 23:16,airport,,11,gate hold
DE0000004003,F00005655,03-08-2025 00:10,airport,OPS9,2,deicing
DE0000004004,F00005655,03-08-2025 01:35,airport,CR02,21,ground stop
DE0000004005,F00005656,27-05-2024 09:43,ATC,GT3,17,deicing
DE0000004006,F00005663,26-05-2025 11:22,ATC,MX5,1m,ground stop
DE0000004007,F00005663,26-05-2025 11:48,OPS,,1,crew swap
DE0000004008,F00005663,26-05-2025 11:29,MAINT,MX5,4,
DE0000004009,F00005666,26-01-2025 16:14,OTHER,WX01,38,deicing
DE0000004010,F00005666,01/26/2025 17:15,TRAFFIC,ATC7,20,late inbound
DE0000004011,F00005666,01/26/2025 17:35,CREW,OPS9,1,late inbound
DE0000004012,F00005670,01-03-2025 09:32,maint,OPS9,6,maintenance check
DE0000004013,F00005670,01-03-2025 10:07,CREW,,1,ground stop
DE0000004014,F00005670,01-03-2025 10:21,MAINT,OPS9,2,gate hold
DE0000004015,F00005672,2025-05-24T16:20:00,other,CR02,11,
DE0000004016,F00005672,24-05-2025 17:03,maint,GT3,12,gate hold
DE0000004017,F00005673,06-07-2024 21:02,OTHER,OPS9,5,late inbound
DE0000004018,F00005673,06-07-2024 22:14,other,,5,gate hold
DE0000004019,F00005673,07-06-2024 20:58,CREW,,3,ground stop
DE0000004020,F00005675,01-09-2025 15:53,GATE,GT3,7,gate hold
DE0000004021,F00005678,17-04-2025 11:09,WEATHER,ATC7,4,late inbound
DE0000004022,F00005678,17-04-2025 12:00,CRW,GT3,12,ground stop
DE0000004023,F00005678,04/17/2025 11:28,TRAFFIC,MX5,3,crew swap
DE0000004024,F00005681,05-05-2025 03:06,crew,CR02,3,gate hold
DE0000004025,F00005686,27-07-2025 06:21,CRW,GT3,2,late inbound
DE0000004026,F00005686,27-07-2025 08:01,WX,WX01,1,maintenance check
DE0000004027,F00005686,27-07-2025 06:33,airport,MX5,12m,ground stop
DE0000004028,F00005689,2024-09-23T04:01:00,airport,OPS9,1,
DE0000004029,F00005689,23-09-2024 03:33,GATE,ATC7,8,gate hold
DE0000004030,F00005690,29-04-2024 08:54,maint,,9,deicing
DE0000004031,F00005690,29-04-2024 08:45,GATE,,8,
DE0000004032,F00005690,29-04-2024 09:12,airport,GT3,5,maintenance check
DE0000004033,F00005693,24-09-2025 01:47,maint,WX01,-1,ground stop
DE0000004034,F00005693,24-09-2025 00:43,other,GT3,1,
DE0000004035,F00005693,23-09-2025 23:50,crew,GT3,1,gate hold
DE0000004036,F00005700,30-08-2025 06:18,weather,GT3,4,
DE0000004037,F00005702,03/27/2024 00:57,WEATHER,GT3,4,ground stop
DE0000004038,F00005707,10-08-2024 20:52,ATC,ATC7,11,ground stop
DE0000004039,F00005707,10-08-2024 21:58,OPS,MX5,3,deicing
DE0000004040,F00005707,10-08-2024 21:39,OTHER,ATC7,1,ground stop
DE0000004041,F00005708,24-11-2024 09:49,OTHER,OPS9,1,deicing
DE0000004042,F00005708,24-11-2024 08:53,GATE,WX01,4,
DE0000004043,F00005708,24-11-2024 09:12,WX,WX01,22,deicing
DE0000004044,F00005719,2024-11-11T22:09:00,atc,GT3,13,maintenance check
DE0000004045,F00005724,30-09-2025 17:51,maint,OPS9,9,crew swap
DE0000004046,F00005724,30-09-2025 18:43,WX,,4,crew swap
DE0000004047,F00005724,09/30/2025 19:48,ATC,CR02,3,crew swap
DE0000004048,F00005725,06-06-2025 02:32,CRW,GT3,3,maintenance check
DE0000004049,F00005725,06-06-2025 05:11,OTHER,ATC7,3,crew swap
DE0000004050,F00005725,06-06-2025 04:04,CREW,ATC7,1,maintenance check
DE0000004051,F00005730,23-12-2024 05:21,WEATHER,GT3,6,late inbound
DE0000004052,F00005730,23-12-2024 05:41,WX,OPS9,1,gate hold
DE0000004053,F00005730,12/23/2024 04:44,atc,OPS9,5m,ground stop
DE0000004054,F00005734,2025-10-30T22:55:00,atc,GT3,0,maintenance check
DE0000004055,F00005734,10/30/2025 20:16,OTHER,CR02,1m,
DE0000004056,F00005735,11-10-2025 22:14,OPS,,86,maintenance check
DE0000004057,F00005737,22-01-2025 11:54,CRW,ATC7,3,crew swap
DE0000004058,F00005737,01/22/2025 12:12,MX,MX5,7,gate hold
DE0000004059,F00005737,22-01-2025 13:01,OPS,,4,deicing
DE0000004060,F00005740,09-04-2024 05:35,WEATHER,GT3,3,ground stop
DE0000004061,F00005740,09-04-2024 04:45,AIRPORT,CR02,40,maintenance check
DE0000004062,F00005741,2025-01-17T11:10:00,WX,WX01,22,deicing
DE0000004063,F00005741,17-01-2025 10:58,airport,CR02,1,deicing
DE0000004064,F00005743,2025-01-29T08:39:00,airport,OPS9,24,crew swap
DE0000004065,F00005745,10-05-2025 04:09,OTHER,MX5,48,
DE0000004066,F00005747,12-03-2024 07:19,OPS,MX5,24,ground stop
DE0000004067,F00005748,15-09-2024 09:00,GATE,MX5,27m,
DE0000004068,F00005748,15-09-2024 08:34,other,CR02,22,ground stop
DE0000004069,F00005748,15-09-2024 07:08,CRW,OPS9,-12,deicing
DE0000004070,F00005750,30-12-2025 13:13,WX,ATC7,2,
DE0000004071,F00005750,30-12-2025 14:33,OTHER,OPS9,5,maintenance check
DE0000004072,F00005751,15-05-2024 02:25,ATC,WX01,15,crew swap
DE0000004073,F00005753,26-05-2025 22:43,TRAFFIC,CR02,3,
DE0000004074,F00005753,27-05-2025 01:11,maint,ATC7,27,ground stop
DE0000004075,F00005755,17-02-2024 17:16,crew,ATC7,13,
DE0000004076,F00005755,17-02-2024 17:05,MX,MX5,17,crew swap
DE0000004077,F00005758,09-10-2024 01:56,crew,ATC7,16,maintenance check
DE0000004078,F00005758,09-10-2024 01:12,ATC,MX5,11,gate hold
DE0000004079,F00005759,03-11-2025 23:10,CRW,GT3,28,late inbound
DE0000004080,F00005761,09-11-2024 13:29,OPS,CR02,8,late inbound
DE0000004081,F00005761,09-11-2024 14:56,CREW,CR02,6,
DE0000004082,F00005763,23-07-2024 03:46,AIRPORT,MX5,8,ground stop
DE0000004083,F00005763,07/23/2024 05:11,crew,ATC7,2,deicing
DE0000004084,F00005763,2024-07-23T05:05:00,ATC,,1,
DE0000004085,F00005766,04-02-2025 19:20,MAINT,GT3,2,deicing
DE0000004086,F00005766,04-02-2025 18:24,CREW,ATC7,21,maintenance check
DE0000004087,F00005766,04-02-2025 19:43,airport,CR02,9,gate hold
DE0000004088,F00005771,07-01-2025 23:54,MX,WX01,0,late inbound
DE0000004089,F00005771,07-01-2025 23:24,WX,OPS9,-19,maintenance check
DE0000004090,F00005777,21-10-2025 11:56,GATE,CR02,1,maintenance check
DE0000004091,F00005777,21-10-2025 10:36,OTHER,GT3,4,maintenance check
DE0000004092,F00005778,14-12-2025 01:55,OPS,OPS9,15,maintenance check
DE0000004093,F00005778,12/13/2025 23:14,GATE,,1,gate hold
DE0000004094,F00005786,22-09-2025 08:13,TRAFFIC,CR02,1,late inbound
DE0000004095,F00005786,22-09-2025 07:16,maint,OPS9,10m,gate hold
DE0000004096,F00005786,22-09-2025 07:02,OTHER,CR02,3m,deicing
DE0000004097,F00005787,16-07-2025 18:38,WEATHER,MX5,2,gate hold
DE0000004098,F00005787,2025-07-16T17:59:00,TRAFFIC,CR02,1,
DE0000004099,F00005788,07-03-2024 04:53,MX,WX01,3,crew swap
DE0000004100,F00005788,2024-07-03T04:58:00,AIRPORT,GT3,5,maintenance check
DE0000004101,F00005788,03-07-2024 05:31,AIRPORT,MX5,7,crew swap
DE0000004102,F00005794,16-02-2025 15:13,CREW,WX01,2m,maintenance check
DE0000004103,F00005794,16-02-2025 13:28,WX,OPS9,8,deicing
DE0000004104,F00005794,02/16/2025 14:06,ATC,GT3,9,deicing
DE0000004105,F00005795,05-08-2025 11:13,TRAFFIC,ATC7,6,deicing
DE0000004106,F00005795,08-05-2025 11:22,OTHER,,2,maintenance check
DE0000004107,F00005796,09-11-2024 20:11,atc,GT3,2m,maintenance check
DE0000004108,F00005796,09-11-2024 20:30,crew,CR02,3,deicing
DE0000004109,F00005797,18-10-2025 19:19,WX,CR02,3,ground stop
DE0000004110,F00005797,18-10-2025 19:13,weather,OPS9,1,late inbound
DE0000004111,F00005798,05/21/2025 07:00,airport,,4m,maintenance check
DE0000004112,F00005798,21-05-2025 06:28,OPS,OPS9,4,
DE0000004113,F00005798,21-05-2025 06:41,TRAFFIC,MX5,1m,deicing
DE0000004114,F00005802,12-09-2025 13:44,OPS,MX5,1,gate hold
DE0000004115,F00005802,09-12-2025 13:32,WX,,3,deicing
DE0000004116,F00005802,12-09-2025 13:26,atc,MX5,12,gate hold
DE0000004117,F00005807,31-01-2025 10:19,MAINT,WX01,2,ground stop
DE0000004118,F00005808,12/16/2025 21:36,weather,WX01,13,crew swap
DE0000004119,F00005808,2025-12-16T19:51:00,WEATHER,OPS9,9,late inbound
DE0000004120,F00005808,16-12-2025 22:28,WEATHER,,1,late inbound
DE0000004121,F00005811,05/15/2025 05:12,WX,WX01,36,crew swap
DE0000004122,F00005811,15-05-2025 04:07,TRAFFIC,,21,crew swap
DE0000004123,F00005814,10/24/2025 22:05,GATE,ATC7,1,gate hold
DE0000004124,F00005814,10/24/2025 22:11,maint,ATC7,2,
DE0000004125,F00005814,24-10-2025 21:58,maint,,7,crew swap
DE0000004126,F00005815,02/27/2025 17:45,other,WX01,9,late inbound
DE0000004127,F00005822,2025-04-22T18:26:00,TRAFFIC,ATC7,70,late inbound
DE0000004128,F00005822,22-04-2025 18:30,OPS,MX5,1,crew swap
DE0000004129,F00005824,09-07-2024 07:00,WX,WX01,1,crew swap
DE0000004130,F00005824,09-07-2024 04:12,WX,MX5,4,crew swap
DE0000004131,F00005824,2024-07-09T06:49:00,airport,,1,maintenance check
DE0000004132,F00005826,24-12-2024 12:33,GATE,CR02,8,maintenance check
DE0000004133,F00005830,01-10-2025 15:35,TRAFFIC,MX5,1,maintenance check
DE0000004134,F00005831,19-10-2025 01:44,MX,WX01,23,maintenance check
DE0000004135,F00005831,19-10-2025 01:18,OPS,ATC7,1,gate hold
DE0000004136,F00005831,2025-10-19T03:03:00,MX,ATC7,38,crew swap
DE0000004137,F00005833,10-06-2024 01:39,maint,ATC7,17,maintenance check
DE0000004138,F00005836,12-06-2024 05:49,ATC,ATC7,25,late inbound
DE0000004139,F00005836,12-06-2024 07:51,weather,GT3,3,late inbound
DE0000004140,F00005840,11-10-2024 10:44,CREW,,4,gate hold
DE0000004141,F00005845,20-05-2024 17:46,MX,ATC7,2,gate hold
DE0000004142,F00005845,20-05-2024 17:42,GATE,,7,ground stop
DE0000004143,F00005845,20-05-2024 18:09,AIRPORT,OPS9,21,ground stop
DE0000004144,F00005850,11-09-2025 07:29,WEATHER,ATC7,14,gate hold
DE0000004145,F00005855,30-10-2024 07:22,TRAFFIC,WX01,18,crew swap
DE0000004146,F00005855,30-10-2024 07:41,other,OPS9,19,ground stop
DE0000004147,F00005856,26-06-2024 18:40,weather,CR02,7,gate hold
DE0000004148,F00005856,26-06-2024 18:38,atc,,5,
DE0000004149,F00005858,27-11-2025 08:39,ATC,OPS9,0,
DE0000004150,F00005858,2025-11-27T11:14:00,CRW,CR02,26,gate hold
DE0000004151,F00005869,22-04-2025 04:30,maint,ATC7,2,deicing
DE0000004152,F00005869,22-04-2025 03:10,TRAFFIC,ATC7,10,ground stop
DE0000004153,F00005870,04/17/2024 01:43,other,GT3,2,deicing
DE0000004154,F00005870,17-04-2024 01:24,MX,ATC7,2,crew swap
DE0000004155,F00005873,29-07-2024 15:51,ATC,,0,gate hold
DE0000004156,F00005873,29-07-2024 15:09,ATC,OPS9,1,deicing
DE0000004157,F00005873,2024-07-29T13:24:00,weather,CR02,1,maintenance check
DE0000004158,F00005874,11-05-2025 08:59,OPS,OPS9,30,crew swap
DE0000004159,F00005876,06-01-2025 13:28,CREW,ATC7,22,crew swap
DE0000004160,F00005876,2025-01-06T13:31:00,atc,,1,ground stop
DE0000004161,F00005876,06-01-2025 12:30,maint,MX5,7,late inbound
DE0000004162,F00005877,24-03-2025 00:00,maint,GT3,2,ground stop
DE0000004163,F00005879,10-02-2024 14:54,airport,GT3,2,crew swap
DE0000004164,F00005879,10-02-2024 15:54,maint,CR02,6,late inbound
DE0000004165,F00005881,24-05-2025 05:26,WX,,30,gate hold
DE0000004166,F00005882,30-03-2024 06:16,CRW,ATC7,25,gate hold
DE0000004167,F00005890,07-02-2025 12:57,TRAFFIC,WX01,2,maintenance check
DE0000004168,F00005890,07-02-2025 14:57,MAINT,,25m,crew swap
DE0000004169,F00005890,2025-02-07T13:02:00,crew,ATC7,3,late inbound
DE0000004170,F00005894,17-11-2024 10:59,OPS,,4,late inbound
DE0000004171,F00005894,17-11-2024 12:40,airport,WX01,1,ground stop
DE0000004172,F00005895,14-08-2024 10:50,ATC,WX01,30,late inbound
DE0000004173,F00005896,15-04-2024 06:00,crew,ATC7,-8,gate hold
DE0000004174,F00005902,04-12-2024 04:44,maint,ATC7,7,maintenance check
DE0000004175,F00005902,12-04-2024 05:05,CRW,OPS9,2,crew swap
DE0000004176,F00005902,04-12-2024 06:18,WX,OPS9,1,late inbound
DE0000004177,F00005903,19-06-2025 06:04,airport,,23,ground stop
DE0000004178,F00005908,28-12-2025 20:46,crew,GT3,36,crew swap
DE0000004179,F00005910,2025-04-28T14:09:00,airport,WX01,-3,gate hold
DE0000004180,F00005910,2025-04-28T14:21:00,WEATHER,OPS9,15,crew swap
DE0000004181,F00005910,28-04-2025 14:19,TRAFFIC,ATC7,5,late inbound
DE0000004182,F00005913,13-01-2026 05:38,maint,WX01,11,maintenance check
DE0000004183,F00005913,01/13/2026 06:46,airport,MX5,12,ground stop
DE0000004184,F00005913,13-01-2026 06:17,MX,MX5,1,
DE0000004185,F00005915,18-06-2024 00:17,OPS,WX01,3,maintenance check
DE0000004186,F00005915,06/18/2024 00:35,atc,,7,deicing
DE0000004187,F00005915,18-06-2024 00:02,CRW,WX01,3m,maintenance check
DE0000004188,F00005920,19-03-2025 22:05,ATC,,6,ground stop
DE0000004189,F00005920,19-03-2025 20:05,WEATHER,CR02,10m,late inbound
DE0000004190,F00005920,19-03-2025 22:21,weather,CR02,13,deicing
DE0000004191,F00005922,14-06-2024 10:53,maint,GT3,6,deicing
DE0000004192,F00005922,06/14/2024 08:33,ATC,OPS9,24m,deicing
DE0000004193,F00005922,14-06-2024 10:14,weather,,6,gate hold
DE0000004194,F00005924,24-09-2024 19:08,TRAFFIC,GT3,1,late inbound
DE0000004195,F00005924,24-09-2024 17:54,GATE,CR02,5,crew swap
DE0000004196,F00005932,12-03-2025 10:19,MAINT,,54,ground stop
DE0000004197,F00005933,16-12-2025 02:28,ATC,MX5,29,crew swap
DE0000004198,F00005938,30-05-2024 01:25,crew,MX5,0,maintenance check
DE0000004199,F00005938,30-05-2024 03:21,crew,CR02,3,late inbound
DE0000004200,F00005938,30-05-2024 02:45,weather,GT3,1,deicing
DE0000004201,F00005942,17-11-2024 09:11,atc,WX01,2,deicing
DE0000004202,F00005942,17-11-2024 09:42,ATC,WX01,1m,ground stop
DE0000004203,F00005942,11/17/2024 09:03,WEATHER,CR02,2,deicing
DE0000004204,F00005948,21-01-2026 20:03,MAINT,WX01,45m,deicing
DE0000004205,F00005952,06-07-2024 03:32,ATC,MX5,15m,maintenance check
DE0000004206,F00005953,02-05-2025 22:41,WEATHER,OPS9,15,ground stop
DE0000004207,F00005958,20-03-2025 22:27,maint,OPS9,26,
DE0000004208,F00005966,27-07-2024 00:43,atc,CR02,16,late inbound
DE0000004209,F00005966,26-07-2024 22:34,atc,CR02,10,maintenance check
DE0000004210,F00005966,2024-07-27T00:44:00,other,CR02,1,crew swap
DE0000004211,F00005975,03/16/2025 02:55,WX,GT3,1m,ground stop
DE0000004212,F00005975,16-03-2025 01:41,crew,ATC7,25,
DE0000004213,F00005975,16-03-2025 01:50,MAINT,MX5,7,maintenance check
DE0000004214,F00005976,17-09-2025 13:41,other,WX01,3m,maintenance check
DE0000004215,F00005976,17-09-2025 15:38,OPS,MX5,5,late inbound
DE0000004216,F00005976,09/17/2025 13:57,TRAFFIC,GT3,15m,late inbound
DE0000004217,F00005977,05-10-2024 01:59,CRW,CR02,18,late inbound
DE0000004218,F00005978,08/21/2024 08:29,maint,GT3,12,late inbound
DE0000004219,F00005979,04/17/2025 15:00,WEATHER,MX5,3,deicing
DE0000004220,F00005979,17-04-2025 13:44,weather,,1,late inbound
DE0000004221,F00005979,17-04-2025 15:06,maint,CR02,1,gate hold
DE0000004222,F00005985,18-12-2025 09:17,weather,MX5,13,maintenance check
DE0000004223,F00005985,18-12-2025 07:01,AIRPORT,CR02,23,deicing
DE0000004224,F00005986,2024-03-01T03:05:00,maint,,11,deicing
DE0000004225,F00005986,2024-03-01T03:50:00,other,ATC7,1,crew swap
DE0000004226,F00005986,01-03-2024 02:40,TRAFFIC,OPS9,10,gate hold
DE0000004227,F00005991,01-09-2025 00:01,CREW,GT3,30m,crew swap
DE0000004228,F00005997,08-09-2025 10:48,ATC,ATC7,15,
DE0000004229,F00005997,2025-08-09T10:58:00,WEATHER,CR02,2,late inbound
DE0000004230,F00005998,19-08-2024 17:18,AIRPORT,CR02,1,ground stop
DE0000004231,F00005998,19-08-2024 15:24,CRW,ATC7,32,late inbound
DE0000004232,F00005999,10-09-2024 00:16,atc,OPS9,5,late inbound
DE0000004233,F00005999,09-10-2024 00:23,maint,GT3,1,
DE0000004234,F00005999,2024-09-09T23:58:00,OPS,,4,gate hold
DE0000004235,F00006001,21-03-2025 18:43,crew,MX5,46,gate hold
DE0000004236,F00006004,06-02-2025 13:53,other,OPS9,0,late inbound
DE0000004237,F00006004,06-02-2025 13:39,OPS,MX5,4,maintenance check
DE0000004238,F00006004,06-02-2025 12:07,ATC,ATC7,4,late inbound
DE0000004239,F00006007,02/23/2024 09:50,CREW,GT3,16,ground stop
DE0000004240,F00006009,09/16/2024 13:04,atc,CR02,51,ground stop
DE0000004241,F00006011,08-09-2025 12:11,GATE,OPS9,2,late inbound
DE0000004242,F00006011,08-09-2025 10:28,WEATHER,CR02,14,gate hold
DE0000004243,F00006011,08-09-2025 11:42,atc,WX01,-7,gate hold
DE0000004244,F00006012,21-01-2026 16:34,airport,ATC7,14,late inbound
DE0000004245,F00006015,09/26/2025 14:55,airport,CR02,13,crew swap
DE0000004246,F00006015,09/26/2025 12:38,MAINT,,25,maintenance check
DE0000004247,F00006016,20-07-2024 00:52,AIRPORT,WX01,3,late inbound
DE0000004248,F00006019,10-10-2024 14:09,OPS,OPS9,17,deicing
DE0000004249,F00006019,10-10-2024 12:31,GATE,CR02,6,deicing
DE0000004250,F00006020,09-10-2024 17:30,weather,OPS9,12,crew swap
DE0000004251,F00006020,09-10-2024 15:55,maint,MX5,3,ground stop
DE0000004252,F00006020,2024-10-09T17:32:00,AIRPORT,CR02,4,gate hold
DE0000004253,F00006024,21-09-2025 04:24,TRAFFIC,GT3,2,maintenance check
DE0000004254,F00006024,2025-09-21T03:52:00,CRW,MX5,27,ground stop
DE0000004255,F00006031,29-01-2026 06:03,CRW,,11m,
DE0000004256,F00006033,07-12-2024 19:45,maint,MX5,4,late inbound
DE0000004257,F00006033,2024-12-07T19:29:00,CREW,MX5,14,maintenance check
DE0000004258,F00006042,13-10-2024 19:24,airport,WX01,2,maintenance check
DE0000004259,F00006042,2024-10-13T18:30:00,other,GT3,13m,crew swap
DE0000004260,F00006045,04-02-2025 14:57,other,ATC7,29m,
DE0000004261,F00006051,07-03-2025 03:48,OPS,OPS9,7,gate hold
DE0000004262,F00006053,12-01-2025 16:46,WEATHER,GT3,1,crew swap
DE0000004263,F00006053,01-12-2025 17:22,CREW,GT3,1,gate hold
DE0000004264,F00006053,12-01-2025 16:30,OPS,MX5,7,gate hold
DE0000004265,F00006054,12-05-2024 06:52,airport,MX5,62,
DE0000004266,F00006054,12-05-2024 08:48,ATC,CR02,11,
DE0000004267,F00006055,03-09-2025 11:48,maint,WX01,3,
DE0000004268,F00006055,09-03-2025 13:07,maint,ATC7,-21,
DE0000004269,F00006055,2025-09-03T13:40:00,maint,MX5,-6,
DE0000004270,F00006057,2025-11-17T18:55:00,MX,WX01,25m,gate hold
DE0000004271,F00006058,25-09-2025 21:54,AIRPORT,ATC7,1,deicing
DE0000004272,F00006058,09/25/2025 20:08,other,OPS9,2,crew swap
DE0000004273,F00006058,25-09-2025 22:02,CREW,OPS9,10,gate hold
DE0000004274,F00006061,03/20/2025 21:20,ATC,ATC7,0,deicing
DE0000004275,F00006061,20-03-2025 21:39,other,,10,ground stop
DE0000004276,F00006061,20-03-2025 19:20,CREW,GT3,16,late inbound
DE0000004277,F00006068,2024-03-31T22:29:00,WX,,10,
DE0000004278,F00006068,31-03-2024 21:01,maint,WX01,14,late inbound
DE0000004279,F00006069,17-02-2024 12:17,ATC,OPS9,2,gate hold
DE0000004280,F00006069,17-02-2024 12:06,WX,,16m,gate hold
DE0000004281,F00006071,06/30/2025 16:30,weather,MX5,18,maintenance check
DE0000004282,F00006072,09-02-2024 06:48,WX,,4,ground stop
DE0000004283,F00006072,09-02-2024 07:54,WEATHER,,-11,maintenance check
DE0000004284,F00006073,03/28/2024 00:05,AIRPORT,MX5,15,ground stop
DE0000004285,F00006073,03/27/2024 23:06,atc,ATC7,8,gate hold
DE0000004286,F00006073,2024-03-27T23:06:00,ATC,ATC7,22,crew swap
DE0000004287,F00006074,27-03-2025 07:26,airport,MX5,5,maintenance check
DE0000004288,F00006074,27-03-2025 07:37,WEATHER,ATC7,8,late inbound
DE0000004289,F00006074,27-03-2025 07:52,WEATHER,,3,deicing
DE0000004290,F00006075,05-06-2025 16:55,TRAFFIC,CR02,13,deicing
DE0000004291,F00006079,13-01-2026 18:31,GATE,ATC7,4,late inbound
DE0000004292,F00006079,13-01-2026 21:00,other,MX5,1,late inbound
DE0000004293,F00006079,13-01-2026 18:38,ATC,ATC7,5,gate hold
DE0000004294,F00006080,27-12-2025 06:50,OTHER,MX5,5,crew swap
DE0000004295,F00006080,27-12-2025 08:09,CRW,ATC7,15,maintenance check
DE0000004296,F00006080,12/27/2025 05:54,airport,WX01,10,maintenance check
DE0000004297,F00006082,14-01-2025 05:00,airport,CR02,0,late inbound
DE0000004298,F00006082,01/14/2025 06:14,weather,ATC7,15,crew swap
DE0000004299,F00006086,26-04-2025 23:56,airport,ATC7,30,
DE0000004300,F00006088,26-12-2025 00:38,AIRPORT,CR02,21m,gate hold
DE0000004301,F00006088,26-12-2025 03:08,other,WX01,1,gate hold
DE0000004302,F00006089,21-10-2024 16:38,crew,,4,crew swap
DE0000004303,F00006091,15-12-2024 19:53,airport,ATC7,8,crew swap
DE0000004304,F00006091,15-12-2024 18:13,atc,,5,deicing
DE0000004305,F00006091,15-12-2024 18:53,WX,WX01,1,ground stop
DE0000004306,F00006092,07-04-2025 14:47,AIRPORT,ATC7,50,gate hold
DE0000004307,F00006092,07-04-2025 14:29,OTHER,OPS9,5,maintenance check
DE0000004308,F00006092,07-04-2025 13:56,atc,OPS9,8,deicing
DE0000004309,F00006093,02/23/2024 04:54,crew,MX5,18,deicing
DE0000004310,F00006094,10-08-2025 08:11,GATE,CR02,4,maintenance check
DE0000004311,F00006094,08-10-2025 09:11,airport,MX5,14,ground stop
DE0000004312,F00006095,19-08-2025 17:22,other,,0,ground stop
DE0000004313,F00006095,2025-08-19T17:33:00,WX,WX01,1,ground stop
DE0000004314,F00006095,08/19/2025 15:27,AIRPORT,MX5,1,maintenance check
DE0000004315,F00006100,05/22/2025 22:17,OTHER,,25,
DE0000004316,F00006107,2025-10-13T17:12:00,WEATHER,GT3,10,deicing
DE0000004317,F00006108,17-11-2025 00:52,weather,OPS9,14m,
DE0000004318,F00006108,16-11-2025 23:34,ATC,ATC7,11,deicing
DE0000004319,F00006111,08/24/2025 07:22,MAINT,,2,ground stop
DE0000004320,F00006111,24-08-2025 07:23,CRW,ATC7,3,
DE0000004321,F00006112,18-03-2024 14:10,other,MX5,4,deicing
DE0000004322,F00006115,14-12-2024 03:39,WEATHER,CR02,2,
DE0000004323,F00006115,14-12-2024 01:46,maint,WX01,8,maintenance check
DE0000004324,F00006116,02/22/2024 21:00,airport,ATC7,5,crew swap
DE0000004325,F00006116,22-02-2024 22:42,MX,OPS9,11,late inbound
DE0000004326,F00006117,17-04-2024 20:32,WEATHER,,20,crew swap
DE0000004327,F00006118,30-03-2024 19:01,CRW,,22,maintenance check
DE0000004328,F00006118,2024-03-30T19:55:00,airport,ATC7,2,gate hold
DE0000004329,F00006119,16-04-2025 21:18,airport,CR02,2,crew swap
DE0000004330,F00006119,16-04-2025 20:07,AIRPORT,GT3,12,late inbound
DE0000004331,F00006119,16-04-2025 20:50,CRW,GT3,1,deicing
DE0000004332,F00006125,01-03-2025 19:52,maint,MX5,79,crew swap
DE0000004333,F00006125,01-03-2025 19:22,CRW,MX5,6,maintenance check
DE0000004334,F00006126,09-08-2024 20:42,AIRPORT,GT3,22m,gate hold
DE0000004335,F00006128,18-10-2025 06:44,WEATHER,ATC7,29m,crew swap
DE0000004336,F00006133,06-10-2025 21:05,CREW,GT3,31,maintenance check
DE0000004337,F00006135,01-01-2025 00:22,MAINT,,8m,maintenance check
DE0000004338,F00006135,01-01-2025 01:43,OTHER,GT3,7,crew swap
DE0000004339,F00006136,11-09-2024 16:20,MX,WX01,47m,deicing
DE0000004340,F00006136,11-09-2024 17:52,weather,CR02,13,deicing
DE0000004341,F00006137,23-05-2024 00:53,maint,MX5,14,crew swap
DE0000004342,F00006137,22-05-2024 22:20,TRAFFIC,,9,late inbound
DE0000004343,F00006137,05/23/2024 00:28,other,MX5,9,late inbound
DE0000004344,F00006140,07-01-2025 07:10,WEATHER,WX01,20,gate hold
DE0000004345,F00006140,01-07-2025 08:40,CREW,MX5,2,deicing
DE0000004346,F00006140,01-07-2025 07:23,crew,WX01,5,
DE0000004347,F00006141,2025-04-16T02:23:00,airport,MX5,10,crew swap
DE0000004348,F00006143,08/17/2024 23:36,CRW,ATC7,2m,late inbound
DE0000004349,F00006143,08/18/2024 00:01,ATC,WX01,1m,late inbound
DE0000004350,F00006143,18-08-2024 00:46,GATE,MX5,1,gate hold
DE0000004351,F00006144,11-04-2024 11:24,other,WX01,3,maintenance check
DE0000004352,F00006144,04-11-2024 10:53,MAINT,OPS9,81,maintenance check
DE0000004353,F00006150,01/26/2026 23:19,crew,,23,gate hold
DE0000004354,F00006152,03-08-2024 02:14,TRAFFIC,MX5,6m,
DE0000004355,F00006152,03-08-2024 01:07,CRW,ATC7,1,late inbound
DE0000004356,F00006153,23-05-2025 09:22,AIRPORT,WX01,28,crew swap
DE0000004357,F00006156,02-01-2024 08:34,MAINT,MX5,10,maintenance check
DE0000004358,F00006157,17-06-2025 00:30,CREW,WX01,2,
DE0000004359,F00006157,06/17/2025 00:42,MAINT,MX5,2,
DE0000004360,F00006160,01-09-2025 08:35,ATC,CR02,-12,late inbound
DE0000004361,F00006161,12-07-2024 20:55,OTHER,CR02,11,gate hold
DE0000004362,F00006161,12-07-2024 20:56,CRW,GT3,2,late inbound
DE0000004363,F00006161,12-07-2024 19:57,maint,ATC7,14,gate hold
DE0000004364,F00006165,04-06-2025 20:52,MAINT,GT3,2,crew swap
DE0000004365,F00006165,2025-04-06T21:32:00,CRW,MX5,-22,
DE0000004366,F00006165,06-04-2025 22:35,WX,,56,crew swap
DE0000004367,F00006171,26-09-2024 14:43,maint,WX01,7,maintenance check
DE0000004368,F00006171,09/26/2024 14:15,CREW,,4,
DE0000004369,F00006171,26-09-2024 15:06,TRAFFIC,WX01,14,gate hold
DE0000004370,F00006175,03-12-2024 16:08,MX,ATC7,-1,ground stop
DE0000004371,F00006175,12-03-2024 18:12,maint,WX01,1,gate hold
DE0000004372,F00006175,12-03-2024 17:05,OTHER,CR02,1,deicing
DE0000004373,F00006176,2024-04-30T11:10:00,CRW,,7,
DE0000004374,F00006179,19-09-2025 15:46,maint,MX5,5m,gate hold
DE0000004375,F00006179,19-09-2025 17:27,airport,MX5,2,deicing
DE0000004376,F00006180,15-10-2024 22:08,OPS,GT3,4m,
DE0000004377,F00006180,15-10-2024 20:37,CREW,ATC7,20,late inbound
DE0000004378,F00006180,15-10-2024 23:27,GATE,WX01,-8,maintenance check
DE0000004379,F00006181,04-02-2024 15:20,CRW,,-15,gate hold
DE0000004380,F00006181,04-02-2024 16:55,maint,ATC7,8,
DE0000004381,F00006181,02-04-2024 15:46,weather,CR02,1,deicing
DE0000004382,F00006182,11-08-2024 23:50,other,MX5,5m,deicing
DE0000004383,F00006182,12-08-2024 01:45,CRW,WX01,16,crew swap
DE0000004384,F00006183,17-01-2025 23:45,airport,ATC7,7,gate hold
DE0000004385,F00006183,2025-01-18T01:08:00,CRW,ATC7,3,deicing
DE0000004386,F00006183,01/17/2025 23:44,CRW,WX01,16,deicing
DE0000004387,F00006187,01-09-2025 10:59,CRW,OPS9,8,deicing
DE0000004388,F00006187,01-09-2025 11:53,weather,ATC7,28,maintenance check
DE0000004389,F00006189,27-12-2025 20:37,CREW,OPS9,0,
DE0000004390,F00006189,27-12-2025 20:51,OTHER,OPS9,1,late inbound
DE0000004391,F00006189,12/27/2025 21:46,atc,ATC7,1,
DE0000004392,F00006190,28-11-2024 14:54,OPS,OPS9,22,maintenance check
DE0000004393,F00006197,08-09-2024 12:15,WX,CR02,3,deicing
DE0000004394,F00006197,09-08-2024 11:42,CREW,GT3,51,gate hold
DE0000004395,F00006200,2024-08-04T19:59:00,ATC,CR02,26m,late inbound
DE0000004396,F00006200,04-08-2024 19:10,AIRPORT,GT3,2,ground stop
DE0000004397,F00006200,04-08-2024 19:02,AIRPORT,CR02,18,ground stop
DE0000004398,F00006201,28-06-2025 13:25,TRAFFIC,GT3,8,crew swap
DE0000004399,F00006201,06/28/2025 12:14,GATE,WX01,1,crew swap
DE0000004400,F00006201,28-06-2025 14:18,CREW,CR02,2m,maintenance check
DE0000004401,F00006207,13-07-2024 00:43,TRAFFIC,MX5,9,ground stop
DE0000004402,F00006211,20-05-2025 05:43,MX,,12m,gate hold
DE0000004403,F00006211,05/20/2025 03:30,OPS,CR02,24,
DE0000004404,F00006214,04-08-2025 11:09,maint,MX5,9,ground stop
DE0000004405,F00006217,16-09-2025 04:41,weather,OPS9,19,late inbound
DE0000004406,F00006219,12/28/2025 03:43,MX,WX01,1,maintenance check
DE0000004407,F00006219,12/28/2025 05:34,GATE,ATC7,22,ground stop
DE0000004408,F00006220,05-11-2024 11:13,GATE,OPS9,26,ground stop
DE0000004409,F00006225,01-02-2025 00:01,airport,ATC7,9,crew swap
DE0000004410,F00006225,02-01-2025 00:06,WX,,54,deicing
DE0000004411,F00006228,27-11-2025 09:11,TRAFFIC,OPS9,4,late inbound
DE0000004412,F00006231,09-11-2024 23:59,OTHER,OPS9,207,maintenance check
DE0000004413,F00006232,08/16/2024 22:44,WX,GT3,26,maintenance check
DE0000004414,F00006233,2024-02-22T08:21:00,WEATHER,OPS9,30,deicing
DE0000004415,F00006237,09-07-2024 14:06,airport,,21,maintenance check
DE0000004416,F00006237,09-07-2024 11:39,AIRPORT,,13,gate hold
DE0000004417,F00006240,04-10-2024 15:44,AIRPORT,MX5,23m,maintenance check
DE0000004418,F00006240,04-10-2024 15:06,MAINT,WX01,1,
DE0000004419,F00006240,04-10-2024 15:45,crew,OPS9,1,deicing
DE0000004420,F00006241,31-03-2025 05:24,TRAFFIC,OPS9,-1,gate hold
DE0000004421,F00006241,03/31/2025 06:31,TRAFFIC,GT3,4,maintenance check
DE0000004422,F00006241,31-03-2025 05:31,WEATHER,OPS9,1m,crew swap
DE0000004423,F00006242,11-07-2025 21:05,CRW,ATC7,3m,
DE0000004424,F00006242,07-11-2025 20:15,OTHER,ATC7,17,
DE0000004425,F00006243,02/13/2025 14:09,MX,CR02,8,late inbound
DE0000004426,F00006243,13-02-2025 16:13,OTHER,MX5,8,deicing
DE0000004427,F00006244,31-07-2025 13:43,MAINT,WX01,15m,ground stop
DE0000004428,F00006244,31-07-2025 11:56,CREW,CR02,4,crew swap
DE0000004429,F00006248,14-03-2024 22:24,crew,,10,
DE0000004430,F00006248,03/14/2024 23:22,AIRPORT,GT3,25,gate hold
DE0000004431,F00006248,14-03-2024 21:48,crew,ATC7,14,crew swap
DE0000004432,F00006251,15-01-2026 02:40,CRW,GT3,3m,late inbound
DE0000004433,F00006251,15-01-2026 02:00,atc,,12,
DE0000004434,F00006254,01-03-2025 19:29,AIRPORT,,30m,maintenance check
DE0000004435,F00006261,04-11-2024 22:22,GATE,ATC7,1,ground stop
DE0000004436,F00006261,04-11-2024 22:07,OPS,GT3,1,ground stop
DE0000004437,F00006261,05-11-2024 00:04,WX,MX5,19m,crew swap
DE0000004438,F00006262,2024-09-25T12:59:00,CREW,WX01,0,
DE0000004439,F00006262,25-09-2024 10:49,GATE,,1,gate hold
DE0000004440,F00006262,09/25/2024 11:01,MAINT,GT3,3,deicing
DE0000004441,F00006264,06-12-2024 18:54,MX,MX5,2,maintenance check
DE0000004442,F00006264,06-12-2024 19:37,WX,OPS9,3,crew swap
DE0000004443,F00006268,09-06-2025 08:33,MX,OPS9,15,crew swap
DE0000004444,F00006269,2025-12-29T22:16:00,atc,MX5,46,ground stop
DE0000004445,F00006269,12/29/2025 23:10,CRW,MX5,1,maintenance check
DE0000004446,F00006269,29-12-2025 23:59,GATE,OPS9,1,gate hold
DE0000004447,F00006270,26-04-2025 18:58,AIRPORT,WX01,1,ground stop
DE0000004448,F00006270,26-04-2025 18:45,OPS,MX5,11,late inbound
DE0000004449,F00006270,26-04-2025 18:59,WX,OPS9,10,crew swap
DE0000004450,F00006271,07-02-2025 20:36,OPS,CR02,4,deicing
DE0000004451,F00006273,01-05-2025 14:41,OTHER,OPS9,20,late inbound
DE0000004452,F00006274,14-06-2025 20:10,other,GT3,7,deicing
DE0000004453,F00006279,17-10-2024 21:24,maint,GT3,37,
DE0000004454,F00006279,17-10-2024 22:58,CREW,GT3,38,ground stop
DE0000004455,F00006286,25-01-2025 03:23,CRW,ATC7,19,late inbound
DE0000004456,F00006286,25-01-2025 02:39,OPS,OPS9,6,ground stop
DE0000004457,F00006289,12/14/2025 14:21,airport,GT3,28m,crew swap
DE0000004458,F00006291,02-11-2024 13:05,WX,WX01,10,deicing
DE0000004459,F00006293,26-10-2024 10:40,CREW,OPS9,3,
DE0000004460,F00006299,12-12-2024 08:59,TRAFFIC,CR02,21,gate hold
DE0000004461,F00006299,12-12-2024 07:56,other,ATC7,5,gate hold
DE0000004462,F00006301,01/22/2026 13:57,airport,GT3,20,late inbound
DE0000004463,F00006301,01/22/2026 15:17,MX,MX5,4,crew swap
DE0000004464,F00006301,2026-01-22T15:27:00,ATC,OPS9,2,ground stop
DE0000004465,F00006304,07/13/2024 11:07,WX,ATC7,19,maintenance check
DE0000004466,F00006307,18-11-2024 01:24,maint,MX5,29,maintenance check
DE0000004467,F00006307,11/18/2024 02:10,AIRPORT,WX01,12,maintenance check
DE0000004468,F00006313,29-12-2025 15:08,airport,ATC7,9,deicing
DE0000004469,F00006314,17-10-2025 20:23,WX,CR02,1,
DE0000004470,F00006314,10/17/2025 21:17,MX,,9,gate hold
DE0000004471,F00006316,2025-06-29T12:55:00,AIRPORT,CR02,8,
DE0000004472,F00006316,29-06-2025 11:51,ATC,WX01,10,
DE0000004473,F00006317,19-03-2024 08:40,OTHER,,7m,crew swap
DE0000004474,F00006317,19-03-2024 08:04,atc,WX01,25,
DE0000004475,F00006317,03/19/2024 07:09,atc,CR02,5,deicing
DE0000004476,F00006323,20-06-2025 15:38,OPS,CR02,6,late inbound
DE0000004477,F00006323,20-06-2025 15:18,CRW,MX5,6,ground stop
DE0000004478,F00006327,26-04-2025 13:13,crew,,6,
DE0000004479,F00006329,09-01-2026 20:22,maint,MX5,0,late inbound
DE0000004480,F00006329,09-01-2026 19:35,GATE,MX5,2,late inbound
DE0000004481,F00006329,09-01-2026 17:30,MX,ATC7,1,deicing
DE0000004482,F00006330,07-09-2025 19:19,GATE,ATC7,3,crew swap
DE0000004483,F00006330,2025-09-07T19:59:00,GATE,CR02,4,gate hold
DE0000004484,F00006331,11-02-2025 01:44,atc,GT3,4,crew swap
DE0000004485,F00006331,11-02-2025 03:58,MAINT,,1,late inbound
DE0000004486,F00006331,02-11-2025 02:58,CRW,WX01,2,crew swap
DE0000004487,F00006332,08-02-2025 05:24,CRW,WX01,10,ground stop
DE0000004488,F00006332,2025-02-08T04:33:00,GATE,ATC7,16,
DE0000004489,F00006332,08-02-2025 05:21,OPS,,8,ground stop
DE0000004490,F00006335,06/14/2025 12:42,TRAFFIC,OPS9,8,
DE0000004491,F00006336,09-09-2024 05:08,TRAFFIC,,10,late inbound
DE0000004492,F00006336,2024-09-09T03:23:00,atc,WX01,1,late inbound
DE0000004493,F00006336,09-09-2024 03:17,other,,-9,deicing
DE0000004494,F00006339,30-10-2025 09:47,OPS,MX5,29,late inbound
DE0000004495,F00006340,21-10-2025 10:41,MAINT,WX01,2,deicing
DE0000004496,F00006342,26-10-2024 15:36,TRAFFIC,WX01,44,late inbound
DE0000004497,F00006342,26-10-2024 15:46,GATE,ATC7,18,maintenance check
DE0000004498,F00006342,2024-10-26T17:46:00,atc,GT3,3,
DE0000004499,F00006345,18-05-2025 08:43,atc,GT3,17,ground stop
DE0000004500,F00006345,18-05-2025 09:58,WX,WX01,1,gate hold
DE0000004501,F00006346,18-08-2025 16:50,TRAFFIC,ATC7,1,deicing
DE0000004502,F00006346,18-08-2025 16:48,CRW,,9,ground stop
DE0000004503,F00006350,05-02-2025 17:52,airport,ATC7,16,deicing
DE0000004504,F00006350,05-02-2025 17:59,GATE,WX01,5,ground stop
DE0000004505,F00006350,02-05-2025 18:33,atc,ATC7,2,maintenance check
DE0000004506,F00006357,01/13/2025 19:09,other,CR02,15,gate hold
DE0000004507,F00006357,13-01-2025 18:01,MAINT,OPS9,1m,deicing
DE0000004508,F00006358,01/13/2025 12:42,maint,OPS9,4,deicing
DE0000004509,F00006358,13-01-2025 13:45,WX,,7,ground stop
DE0000004510,F00006361,01-07-2025 09:49,OTHER,WX01,9m,late inbound
DE0000004511,F00006361,01-07-2025 11:12,crew,WX01,2m,
DE0000004512,F00006361,2025-07-01T10:49:00,crew,,5,crew swap
DE0000004513,F00006367,23-02-2024 00:36,WEATHER,GT3,3,gate hold
DE0000004514,F00006367,23-02-2024 00:19,OTHER,MX5,3,late inbound
DE0000004515,F00006368,03-06-2024 06:13,maint,OPS9,13,maintenance check
DE0000004516,F00006369,17-03-2024 19:49,GATE,WX01,0,ground stop
DE0000004517,F00006369,17-03-2024 19:23,CREW,ATC7,1,
DE0000004518,F00006370,30-03-2025 21:18,airport,MX5,57,
DE0000004519,F00006372,05-02-2024 11:17,WEATHER,MX5,23,maintenance check
DE0000004520,F00006374,14-07-2024 19:21,MAINT,GT3,0,ground stop
DE0000004521,F00006374,07/14/2024 17:46,WEATHER,ATC7,9,late inbound
DE0000004522,F00006375,04-04-2024 16:24,airport,WX01,-1,ground stop
DE0000004523,F00006375,04-04-2024 15:54,MAINT,CR02,1,maintenance check
DE0000004524,F00006375,2024-04-04T15:39:00,other,OPS9,1,
DE0000004525,F00006376,23-11-2025 21:52,CRW,CR02,0,ground stop
DE0000004526,F00006376,11/24/2025 00:25,GATE,WX01,1,late inbound
DE0000004527,F00006376,23-11-2025 23:12,OPS,CR02,2,
DE0000004528,F00006377,03-09-2024 15:07,CREW,,36,deicing
DE0000004529,F00006379,2025-03-13T09:10:00,TRAFFIC,OPS9,2,
DE0000004530,F00006379,2025-03-13T09:01:00,atc,OPS9,1,gate hold
DE0000004531,F00006379,13-03-2025 09:13,OTHER,MX5,17,
DE0000004532,F00006384,08-11-2025 16:18,weather,WX01,4,deicing
DE0000004533,F00006385,21-01-2025 23:22,CRW,WX01,5,crew swap
DE0000004534,F00006386,29-03-2025 21:49,other,OPS9,13,crew swap
DE0000004535,F00006386,29-03-2025 21:44,atc,ATC7,17,late inbound
DE0000004536,F00006393,2025-04-15T09:42:00,OTHER,ATC7,0,maintenance check
DE0000004537,F00006393,15-04-2025 10:50,CREW,MX5,5,maintenance check
DE0000004538,F00006393,04/15/2025 10:08,ATC,GT3,12,
DE0000004539,F00006398,16-04-2025 15:04,TRAFFIC,,3,deicing
DE0000004540,F00006398,2025-04-16T17:17:00,TRAFFIC,OPS9,2,deicing
DE0000004541,F00006398,16-04-2025 15:13,other,MX5,13,maintenance check
DE0000004542,F00006400,28-09-2025 05:22,AIRPORT,CR02,36m,gate hold
DE0000004543,F00006401,08/19/2025 20:44,AIRPORT,CR02,10,deicing
DE0000004544,F00006401,19-08-2025 22:14,MX,,2,
DE0000004545,F00006403,18-06-2024 13:31,airport,OPS9,19,
DE0000004546,F00006408,27-07-2025 09:56,weather,CR02,-16,crew swap
DE0000004547,F00006408,07/27/2025 07:59,ATC,WX01,5,crew swap
DE0000004548,F00006411,01/15/2025 07:36,TRAFFIC,WX01,2,gate hold
DE0000004549,F00006413,30-11-2025 08:41,ATC,ATC7,1,deicing
DE0000004550,F00006413,30-11-2025 09:28,ATC,ATC7,5m,deicing
DE0000004551,F00006413,30-11-2025 09:27,maint,CR02,3,
DE0000004552,F00006414,30-12-2024 19:09,CRW,OPS9,4,maintenance check
DE0000004553,F00006414,12/30/2024 20:59,CREW,MX5,3,maintenance check
DE0000004554,F00006416,03-04-2024 04:32,GATE,CR02,2,crew swap
DE0000004555,F00006416,04-03-2024 03:36,AIRPORT,,-18,ground stop
DE0000004556,F00006421,22-07-2024 06:03,MX,WX01,1,late inbound
DE0000004557,F00006421,22-07-2024 07:02,MX,MX5,1,ground stop
DE0000004558,F00006421,22-07-2024 08:05,WEATHER,ATC7,1,
DE0000004559,F00006424,20-02-2025 06:06,atc,CR02,25,maintenance check
DE0000004560,F00006428,10-06-2025 21:21,other,CR02,5m,crew swap
DE0000004561,F00006428,10-06-2025 22:12,OTHER,MX5,-1,gate hold
DE0000004562,F00006436,18-08-2025 06:27,AIRPORT,ATC7,19,crew swap
DE0000004563,F00006438,11-08-2025 15:25,OPS,MX5,0,maintenance check
DE0000004564,F00006438,08-11-2025 14:14,maint,ATC7,5,maintenance check
DE0000004565,F00006438,11-08-2025 15:27,CREW,ATC7,2,
DE0000004566,F00006439,04-03-2025 00:59,atc,CR02,1,late inbound
DE0000004567,F00006439,03-04-2025 01:31,CRW,,11m,
DE0000004568,F00006442,11-03-2025 10:18,atc,WX01,11,maintenance check
DE0000004569,F00006442,03-11-2025 09:25,MX,MX5,-2,crew swap
DE0000004570,F00006446,13-05-2024 22:56,maint,OPS9,22,maintenance check
DE0000004571,F00006451,17-05-2025 15:28,CRW,OPS9,9,ground stop
DE0000004572,F00006451,17-05-2025 15:17,ATC,OPS9,1,
DE0000004573,F00006451,17-05-2025 15:54,MAINT,CR02,16,deicing
DE0000004574,F00006452,07-04-2024 17:44,ATC,OPS9,4,deicing
DE0000004575,F00006452,07-04-2024 16:11,weather,MX5,1,late inbound
DE0000004576,F00006452,07-04-2024 18:20,MAINT,WX01,3m,late inbound
DE0000004577,F00006456,28-12-2024 19:19,CREW,WX01,4,ground stop
DE0000004578,F00006456,12/28/2024 18:44,MX,ATC7,1,
DE0000004579,F00006457,26-01-2025 13:47,weather,WX01,3m,ground stop
DE0000004580,F00006457,26-01-2025 14:46,MAINT,ATC7,6,ground stop
DE0000004581,F00006461,2025-05-21T03:32:00,ATC,WX01,2,ground stop
DE0000004582,F00006461,05/21/2025 03:55,CRW,ATC7,16,ground stop
DE0000004583,F00006461,21-05-2025 04:10,MX,,5,gate hold
DE0000004584,F00006464,2024-03-20T04:06:00,OTHER,GT3,5,deicing
DE0000004585,F00006464,20-03-2024 04:41,weather,OPS9,9,deicing
DE0000004586,F00006464,20-03-2024 04:48,maint,CR02,2,gate hold
DE0000004587,F00006467,04-11-2024 09:13,OTHER,,5,
DE0000004588,F00006467,11-04-2024 08:58,other,ATC7,5,deicing
DE0000004589,F00006468,09-01-2025 01:52,TRAFFIC,CR02,16,crew swap
DE0000004590,F00006468,09-01-2025 01:16,GATE,CR02,23,ground stop
DE0000004591,F00006469,07-12-2025 04:39,OPS,CR02,30,deicing
DE0000004592,F00006470,08/15/2025 18:31,airport,GT3,5,maintenance check
DE0000004593,F00006470,15-08-2025 20:44,weather,CR02,-1,deicing
DE0000004594,F00006471,13-09-2025 16:29,AIRPORT,,10,ground stop
DE0000004595,F00006474,06-07-2025 12:22,CREW,CR02,7,maintenance check
DE0000004596,F00006474,07-06-2025 14:47,CREW,WX01,6,crew swap
DE0000004597,F00006476,18-12-2024 05:46,OPS,,31,maintenance check
DE0000004598,F00006477,29-11-2025 12:33,other,WX01,15m,deicing
DE0000004599,F00006479,16-09-2024 03:19,OPS,GT3,4m,maintenance check
DE0000004600,F00006480,29-07-2024 00:57,crew,,16m,maintenance check
DE0000004601,F00006480,2024-07-29T01:18:00,CRW,MX5,7,crew swap
DE0000004602,F00006481,30-08-2024 20:34,CRW,CR02,0,deicing
DE0000004603,F00006481,30-08-2024 18:46,WX,MX5,-1,maintenance check
DE0000004604,F00006483,15-03-2024 07:03,MAINT,OPS9,3,maintenance check
DE0000004605,F00006483,15-03-2024 08:07,MAINT,GT3,4,ground stop
DE0000004606,F00006487,18-04-2024 01:08,AIRPORT,WX01,3,maintenance check
DE0000004607,F00006487,04/18/2024 00:30,WEATHER,OPS9,11,
DE0000004608,F00006489,06/14/2024 08:23,MX,MX5,13,crew swap
DE0000004609,F00006489,14-06-2024 08:43,AIRPORT,,6,late inbound
DE0000004610,F00006492,06/20/2025 13:38,maint,ATC7,1,
DE0000004611,F00006492,20-06-2025 13:21,TRAFFIC,MX5,9,crew swap
DE0000004612,F00006492,20-06-2025 14:18,crew,CR02,20m,late inbound
DE0000004613,F00006494,15-01-2026 14:16,TRAFFIC,CR02,-1,
DE0000004614,F00006494,15-01-2026 15:47,MX,GT3,1,crew swap
DE0000004615,F00006494,01/15/2026 14:43,other,MX5,-1,
DE0000004616,F00006496,06-06-2024 22:26,CREW,MX5,1,deicing
DE0000004617,F00006496,2024-06-06T20:55:00,CREW,WX01,6,maintenance check
DE0000004618,F00006496,06-06-2024 21:08,ATC,,30m,
DE0000004619,F00006498,23-02-2024 00:03,AIRPORT,MX5,2,deicing
DE0000004620,F00006498,23-02-2024 01:48,CREW,GT3,16,ground stop
DE0000004621,F00006502,01/15/2026 05:56,MAINT,GT3,2,maintenance check
DE0000004622,F00006502,01/15/2026 07:01,MX,MX5,2,crew swap
DE0000004623,F00006502,15-01-2026 06:39,MAINT,OPS9,10,gate hold
DE0000004624,F00006504,19-07-2024 20:18,CREW,CR02,1,crew swap
DE0000004625,F00006504,19-07-2024 22:23,GATE,GT3,29,ground stop
DE0000004626,F00006509,12-04-2025 01:02,MAINT,,15,gate hold
DE0000004627,F00006510,02-07-2025 11:47,WX,CR02,14,deicing
DE0000004628,F00006510,2025-07-02T11:24:00,weather,,11,ground stop
DE0000004629,F00006513,10/18/2025 13:53,WX,ATC7,1,
DE0000004630,F00006513,18-10-2025 11:42,MX,ATC7,5,gate hold
DE0000004631,F00006515,24-10-2024 13:21,crew,,63,ground stop
DE0000004632,F00006519,27-01-2025 22:07,MX,WX01,8,maintenance check
DE0000004633,F00006519,27-01-2025 20:19,OTHER,GT3,6,ground stop
DE0000004634,F00006519,27-01-2025 21:00,MAINT,OPS9,2,ground stop
DE0000004635,F00006522,2024-09-07T10:10:00,CREW,WX01,10,late inbound
DE0000004636,F00006522,07-09-2024 08:06,WEATHER,MX5,8m,late inbound
DE0000004637,F00006522,07-09-2024 09:24,TRAFFIC,WX01,12,maintenance check
DE0000004638,F00006527,21-01-2026 15:19,crew,CR02,26,maintenance check
DE0000004639,F00006531,07-01-2026 15:56,OPS,MX5,43,late inbound
DE0000004640,F00006534,07-04-2025 22:12,weather,GT3,6,gate hold
DE0000004641,F00006534,07-04-2025 21:37,GATE,,2,crew swap
DE0000004642,F00006534,04-07-2025 22:16,WX,ATC7,3,gate hold
DE0000004643,F00006536,20-08-2024 23:47,WEATHER,WX01,2,
DE0000004644,F00006536,2024-08-21T00:45:00,AIRPORT,WX01,2,deicing
DE0000004645,F00006536,21-08-2024 00:21,airport,MX5,3,gate hold
DE0000004646,F00006537,05-09-2024 22:09,weather,,4,deicing
DE0000004647,F00006537,09-05-2024 21:53,CREW,MX5,3,late inbound
DE0000004648,F00006537,05-09-2024 21:11,atc,WX01,3,gate hold
DE0000004649,F00006538,26-12-2025 09:47,OPS,,2,gate hold
DE0000004650,F00006538,26-12-2025 08:29,OPS,MX5,2,maintenance check
DE0000004651,F00006541,17-04-2025 16:21,WEATHER,GT3,11,late inbound
DE0000004652,F00006541,04/17/2025 16:14,CREW,WX01,2,late inbound
DE0000004653,F00006542,27-06-2025 21:57,other,CR02,6,late inbound
DE0000004654,F00006542,27-06-2025 22:02,OPS,,1,crew swap
DE0000004655,F00006544,03-07-2025 06:32,GATE,MX5,24,gate hold
DE0000004656,F00006544,07-03-2025 05:56,WEATHER,,9,gate hold
DE0000004657,F00006545,28-12-2024 04:48,WEATHER,ATC7,11,
DE0000004658,F00006546,24-08-2024 21:52,ATC,MX5,3,late inbound
DE0000004659,F00006547,01-11-2026 07:30,OTHER,ATC7,22,maintenance check
DE0000004660,F00006548,06/13/2025 17:17,CREW,MX5,2,
DE0000004661,F00006551,06/28/2024 02:32,CREW,CR02,13,
DE0000004662,F00006551,28-06-2024 02:32,MAINT,ATC7,13,
DE0000004663,F00006551,28-06-2024 04:18,MAINT,CR02,2,deicing
DE0000004664,F00006554,14-08-2024 05:50,OTHER,CR02,10,ground stop
DE0000004665,F00006554,2024-08-14T07:18:00,atc,MX5,2m,crew swap
DE0000004666,F00006555,08/29/2025 10:39,OTHER,WX01,28,crew swap
DE0000004667,F00006555,08/29/2025 09:14,airport,ATC7,4,gate hold
DE0000004668,F00006556,30-05-2025 23:04,TRAFFIC,WX01,8,maintenance check
DE0000004669,F00006556,31-05-2025 01:04,OPS,ATC7,7,maintenance check
DE0000004670,F00006557,28-07-2024 19:11,MX,,6,late inbound
DE0000004671,F00006557,28-07-2024 18:12,OTHER,,9,ground stop
DE0000004672,F00006559,16-06-2025 12:04,OTHER,ATC7,-1,deicing
DE0000004673,F00006559,16-06-2025 11:13,atc,MX5,1,gate hold
DE0000004674,F00006559,06/16/2025 12:02,OTHER,,1,ground stop
DE0000004675,F00006561,20-01-2025 04:36,GATE,CR02,82,crew swap
DE0000004676,F00006565,20-03-2024 06:44,MX,MX5,29m,
DE0000004677,F00006565,20-03-2024 07:35,atc,GT3,11,
DE0000004678,F00006566,07-06-2024 21:01,WX,CR02,1,late inbound
DE0000004679,F00006566,07-06-2024 22:04,other,OPS9,12,gate hold
DE0000004680,F00006566,07-06-2024 21:34,MX,WX01,13,ground stop
DE0000004681,F00006568,22-03-2025 16:51,WEATHER,WX01,0,maintenance check
DE0000004682,F00006568,22-03-2025 17:38,crew,ATC7,13,late inbound
DE0000004683,F00006571,03-03-2024 02:24,MAINT,,28,deicing
DE0000004684,F00006574,03-07-2025 12:42,WX,MX5,5,gate hold
DE0000004685,F00006574,03-07-2025 10:56,OTHER,,4,late inbound
DE0000004686,F00006574,03-07-2025 11:24,ATC,WX01,1,maintenance check
DE0000004687,F00006579,11/20/2024 23:46,GATE,GT3,0,ground stop
DE0000004688,F00006579,21-11-2024 01:40,CREW,WX01,9,
DE0000004689,F00006579,2024-11-21T01:01:00,WEATHER,WX01,4,late inbound
DE0000004690,F00006581,18-05-2025 06:46,ATC,OPS9,24,ground stop
DE0000004691,F00006585,30-07-2024 04:36,other,CR02,51m,ground stop
DE0000004692,F00006586,06/26/2025 06:33,ATC,CR02,0,ground stop
DE0000004693,F00006586,26-06-2025 08:11,ATC,WX01,41,ground stop
DE0000004694,F00006587,19-07-2025 13:08,OTHER,GT3,11,ground stop
DE0000004695,F00006587,19-07-2025 12:30,AIRPORT,ATC7,50,deicing
DE0000004696,F00006589,13-02-2025 19:15,AIRPORT,OPS9,12,ground stop
DE0000004697,F00006589,13-02-2025 19:47,CRW,CR02,18,deicing
DE0000004698,F00006591,02-10-2025 18:04,CRW,OPS9,1,gate hold
DE0000004699,F00006593,13-11-2025 08:32,CREW,MX5,2m,deicing
DE0000004700,F00006593,2025-11-13T06:59:00,MX,GT3,3m,maintenance check
DE0000004701,F00006593,11/13/2025 06:55,MX,WX01,-6,
DE0000004702,F00006599,21-08-2024 23:27,weather,WX01,4,maintenance check
DE0000004703,F00006599,21-08-2024 23:14,GATE,OPS9,16m,late inbound
DE0000004704,F00006602,14-01-2025 20:07,CREW,CR02,18m,gate hold
DE0000004705,F00006606,11/24/2024 00:51,MAINT,GT3,0,
DE0000004706,F00006606,23-11-2024 23:25,weather,WX01,5m,maintenance check
DE0000004707,F00006607,22-01-2025 04:16,atc,WX01,50,deicing
DE0000004708,F00006608,28-09-2024 03:47,atc,WX01,16,ground stop
DE0000004709,F00006608,28-09-2024 03:05,WEATHER,OPS9,1,
DE0000004710,F00006608,28-09-2024 02:34,TRAFFIC,,3,crew swap
DE0000004711,F00006610,26-08-2025 22:49,weather,OPS9,6,ground stop
DE0000004712,F00006610,27-08-2025 00:04,crew,CR02,3,ground stop
DE0000004713,F00006612,01-01-2026 07:23,airport,,14,ground stop
DE0000004714,F00006612,01-01-2026 07:58,WX,ATC7,5,gate hold
DE0000004715,F00006612,01-01-2026 07:35,OTHER,CR02,1,maintenance check
DE0000004716,F00006614,29-12-2024 00:23,airport,,2,ground stop
DE0000004717,F00006618,22-08-2025 22:42,ATC,GT3,37,maintenance check
DE0000004718,F00006618,2025-08-22T23:40:00,airport,MX5,2,
DE0000004719,F00006621,11/21/2024 04:43,ATC,,12,crew swap
DE0000004720,F00006621,21-11-2024 03:14,airport,CR02,21m,maintenance check
DE0000004721,F00006623,09-03-2025 06:51,weather,MX5,5,maintenance check
DE0000004722,F00006623,09-03-2025 05:27,other,WX01,14,maintenance check
DE0000004723,F00006623,03-09-2025 06:12,TRAFFIC,GT3,3,gate hold
DE0000004724,F00006628,10/14/2025 18:40,ATC,CR02,0,deicing
DE0000004725,F00006628,2025-10-14T18:49:00,other,GT3,5,
DE0000004726,F00006628,14-10-2025 20:07,atc,MX5,1,late inbound
DE0000004727,F00006629,08-01-2024 11:37,TRAFFIC,OPS9,6,
DE0000004728,F00006629,01-08-2024 12:36,OTHER,GT3,17,late inbound
DE0000004729,F00006632,15-03-2024 02:29,WEATHER,ATC7,1,ground stop
DE0000004730,F00006632,15-03-2024 03:28,OTHER,OPS9,2,maintenance check
DE0000004731,F00006632,15-03-2024 04:02,crew,OPS9,1,gate hold
DE0000004732,F00006634,01-04-2024 02:49,WEATHER,MX5,1,late inbound
DE0000004733,F00006635,2024-04-06T10:25:00,crew,MX5,7,ground stop
DE0000004734,F00006635,06-04-2024 10:08,weather,GT3,4,crew swap
DE0000004735,F00006636,14-05-2025 06:29,GATE,,23,ground stop
DE0000004736,F00006636,05/14/2025 06:15,OTHER,OPS9,1,late inbound
DE0000004737,F00006636,14-05-2025 05:28,ATC,WX01,2m,late inbound
DE0000004738,F00006637,04-12-2025 09:18,other,WX01,14,maintenance check
DE0000004739,F00006637,04-12-2025 08:05,atc,,11,ground stop
DE0000004740,F00006642,08-04-2025 04:55,CRW,OPS9,1m,ground stop
DE0000004741,F00006642,08-04-2025 05:33,crew,MX5,1,crew swap
DE0000004742,F00006646,29-05-2025 23:22,atc,CR02,16m,maintenance check
DE0000004743,F00006646,29-05-2025 21:31,CREW,,6,
DE0000004744,F00006647,05/16/2025 13:33,GATE,OPS9,0,
DE0000004745,F00006647,05/16/2025 14:31,OTHER,OPS9,-1,gate hold
DE0000004746,F00006647,16-05-2025 15:11,weather,CR02,1,ground stop
DE0000004747,F00006652,04-07-2024 18:01,maint,CR02,0,maintenance check
DE0000004748,F00006652,04-07-2024 17:24,OTHER,ATC7,1m,gate hold
DE0000004749,F00006652,04-07-2024 15:31,WEATHER,CR02,2,late inbound
DE0000004750,F00006656,27-10-2025 05:26,MAINT,CR02,-1,
DE0000004751,F00006656,27-10-2025 04:35,weather,,1,deicing
DE0000004752,F00006656,27-10-2025 04:32,atc,GT3,1,deicing
DE0000004753,F00006658,02-12-2024 05:24,WX,ATC7,0,late inbound
DE0000004754,F00006658,02-12-2024 05:01,other,,16,
DE0000004755,F00006658,02-12-2024 04:32,MAINT,CR02,4,ground stop
DE0000004756,F00006661,06/30/2024 17:29,ATC,,-1,maintenance check
DE0000004757,F00006661,30-06-2024 19:18,other,OPS9,1,late inbound
DE0000004758,F00006661,30-06-2024 19:41,WEATHER,,1,deicing
DE0000004759,F00006662,2025-09-14T11:58:00,OPS,,3,maintenance check
DE0000004760,F00006666,17-05-2025 06:10,OTHER,WX01,20,maintenance check
DE0000004761,F00006667,10/14/2025 07:56,CRW,WX01,16,ground stop
DE0000004762,F00006673,2025-01-22T19:01:00,CRW,GT3,3,late inbound
DE0000004763,F00006673,22-01-2025 18:27,AIRPORT,CR02,10,gate hold
DE0000004764,F00006674,02-11-2024 14:17,OPS,GT3,1m,crew swap
DE0000004765,F00006675,15-12-2024 13:48,crew,OPS9,4,deicing
DE0000004766,F00006675,15-12-2024 15:24,other,OPS9,8,
DE0000004767,F00006677,24-11-2025 04:33,maint,CR02,1,maintenance check
DE0000004768,F00006677,24-11-2025 02:10,weather,,-9,crew swap
DE0000004769,F00006679,12-01-2026 14:30,other,MX5,42,late inbound
DE0000004770,F00006681,23-03-2024 10:54,airport,CR02,33m,gate hold
DE0000004771,F00006681,23-03-2024 12:02,weather,OPS9,19,ground stop
DE0000004772,F00006681,23-03-2024 12:11,WX,ATC7,4,maintenance check
DE0000004773,F00006686,2024-09-03T11:26:00,OTHER,GT3,16m,deicing
DE0000004774,F00006688,09-02-2024 02:05,CRW,OPS9,0,maintenance check
DE0000004775,F00006688,02-09-2024 00:49,AIRPORT,CR02,3,deicing
DE0000004776,F00006688,09-02-2024 02:00,GATE,,5,late inbound
DE0000004777,F00006690,08/16/2025 07:46,other,MX5,23,late inbound
DE0000004778,F00006690,16-08-2025 07:52,airport,ATC7,5,gate hold
DE0000004779,F00006700,04-01-2025 23:13,airport,WX01,2,deicing
DE0000004780,F00006700,2025-01-05T00:39:00,GATE,WX01,13m,deicing
DE0000004781,F00006700,04-01-2025 23:01,WX,WX01,2,ground stop
DE0000004782,F00006703,2025-05-20T21:05:00,WX,OPS9,35,ground stop
DE0000004783,F00006707,10-12-2024 17:44,OTHER,GT3,2,ground stop
DE0000004784,F00006707,2024-12-10T19:20:00,MX,ATC7,9,crew swap
DE0000004785,F00006707,10-12-2024 19:36,crew,WX01,3,
DE0000004786,F00006708,16-05-2025 07:43,WX,GT3,15,crew swap
DE0000004787,F00006710,10-09-2025 00:25,GATE,MX5,1,ground stop
DE0000004788,F00006713,09-01-2025 19:39,ATC,MX5,8,crew swap
DE0000004789,F00006714,03-09-2024 22:16,maint,MX5,0,gate hold
DE0000004790,F00006714,09-03-2024 23:52,atc,GT3,2,gate hold
DE0000004791,F00006714,09-03-2024 22:08,OTHER,OPS9,1,ground stop
DE0000004792,F00006716,03-05-2024 11:28,maint,MX5,9,deicing
DE0000004793,F00006717,05-02-2024 05:11,atc,MX5,29,maintenance check
DE0000004794,F00006717,05-02-2024 04:16,WX,MX5,11,gate hold
DE0000004795,F00006720,12-02-2024 05:30,maint,OPS9,30,gate hold
DE0000004796,F00006724,29-05-2024 06:44,crew,ATC7,1,crew swap
DE0000004797,F00006724,05/29/2024 05:50,weather,CR02,3,
DE0000004798,F00006724,29-05-2024 08:06,GATE,CR02,3,late inbound
DE0000004799,F00006726,2025-01-22T19:17:00,MX,ATC7,7,
DE0000004800,F00006726,22-01-2025 18:53,ATC,OPS9,23,ground stop
DE0000004801,F00006727,02-04-2024 18:24,OTHER,,15,ground stop
DE0000004802,F00006727,02-04-2024 19:54,WEATHER,,6,crew swap
DE0000004803,F00006733,16-12-2025 00:09,MX,OPS9,3,crew swap
DE0000004804,F00006733,16-12-2025 00:15,MAINT,OPS9,14,maintenance check
DE0000004805,F00006734,04/14/2025 02:50,ATC,,13,
DE0000004806,F00006734,14-04-2025 02:50,other,GT3,35,gate hold
DE0000004807,F00006736,19-02-2024 15:55,weather,,5,crew swap
DE0000004808,F00006736,19-02-2024 17:41,MX,GT3,10,deicing
DE0000004809,F00006739,09-04-2025 14:09,maint,CR02,8,
DE0000004810,F00006739,2025-09-04T13:48:00,TRAFFIC,MX5,6,crew swap
DE0000004811,F00006739,04-09-2025 13:49,atc,ATC7,19m,ground stop
DE0000004812,F00006742,23-03-2025 14:50,crew,MX5,1,maintenance check
DE0000004813,F00006742,23-03-2025 14:46,crew,GT3,-6,crew swap
DE0000004814,F00006742,23-03-2025 15:40,airport,CR02,1,
DE0000004815,F00006746,09/17/2024 01:32,atc,,19,gate hold
DE0000004816,F00006748,01-09-2025 14:48,ATC,MX5,35,gate hold
DE0000004817,F00006749,15-03-2025 08:18,CRW,GT3,1,crew swap
DE0000004818,F00006751,2025-03-19T19:01:00,other,WX01,12,ground stop
DE0000004819,F00006755,19-11-2025 22:06,CRW,MX5,3,crew swap
DE0000004820,F00006759,14-05-2025 16:11,MX,CR02,-7,deicing
DE0000004821,F00006759,14-05-2025 16:04,AIRPORT,WX01,2,late inbound
DE0000004822,F00006760,2025-08-23T04:34:00,ATC,GT3,10,gate hold
DE0000004823,F00006764,10-06-2024 08:07,MAINT,WX01,66,maintenance check
DE0000004824,F00006764,10-06-2024 08:10,AIRPORT,CR02,13,gate hold
DE0000004825,F00006774,31-05-2024 21:20,MX,,3,late inbound
DE0000004826,F00006774,31-05-2024 21:36,ATC,WX01,2,ground stop
DE0000004827,F00006774,31-05-2024 22:05,GATE,ATC7,1,crew swap
DE0000004828,F00006775,30-09-2024 21:38,airport,WX01,0,maintenance check
DE0000004829,F00006775,30-09-2024 22:50,maint,WX01,6,crew swap
DE0000004830,F00006776,09-06-2025 01:35,GATE,,27,maintenance check
DE0000004831,F00006778,29-09-2025 10:21,weather,MX5,3,gate hold
DE0000004832,F00006779,2026-01-19T16:23:00,WEATHER,,-13,maintenance check
DE0000004833,F00006779,19-01-2026 17:10,WX,CR02,14,late inbound
DE0000004834,F00006779,2026-01-19T16:26:00,OPS,OPS9,6,maintenance check
DE0000004835,F00006783,13-12-2024 11:53,WEATHER,OPS9,10,ground stop
DE0000004836,F00006784,2024-06-28T04:19:00,OTHER,OPS9,36m,maintenance check
DE0000004837,F00006785,02-01-2026 18:15,ATC,GT3,40,
DE0000004838,F00006789,2025-11-18T02:50:00,weather,GT3,1,late inbound
DE0000004839,F00006793,14-11-2025 13:30,MAINT,GT3,1m,crew swap
DE0000004840,F00006793,2025-11-14T12:14:00,airport,GT3,24,deicing
DE0000004841,F00006795,21-01-2025 08:19,WX,WX01,10,gate hold
DE0000004842,F00006795,21-01-2025 07:43,TRAFFIC,GT3,3,maintenance check
DE0000004843,F00006796,12-09-2024 17:38,other,MX5,11,deicing
DE0000004844,F00006796,12-09-2024 17:45,crew,CR02,1,gate hold
DE0000004845,F00006796,12-09-2024 18:08,atc,ATC7,4,late inbound
DE0000004846,F00006797,13-07-2024 15:21,WEATHER,MX5,1,gate hold
DE0000004847,F00006799,31-10-2024 20:32,atc,WX01,0,maintenance check
DE0000004848,F00006799,31-10-2024 20:18,atc,OPS9,12,maintenance check
DE0000004849,F00006800,14-05-2024 19:19,AIRPORT,ATC7,13,gate hold
DE0000004850,F00006800,14-05-2024 17:15,other,MX5,4,maintenance check
DE0000004851,F00006800,14-05-2024 17:46,CREW,OPS9,31,ground stop
DE0000004852,F00006802,2025-10-29T04:53:00,OTHER,,4,late inbound
DE0000004853,F00006802,29-10-2025 03:10,crew,WX01,21,ground stop
DE0000004854,F00006805,20-07-2025 11:49,GATE,,7m,deicing
DE0000004855,F00006812,2024-08-15T05:30:00,OPS,OPS9,2,late inbound
DE0000004856,F00006812,15-08-2024 05:32,crew,,1,late inbound
DE0000004857,F00006812,2024-08-15T05:32:00,OPS,GT3,3,ground stop
DE0000004858,F00006814,17-03-2024 07:56,TRAFFIC,ATC7,20,gate hold
DE0000004859,F00006814,03/17/2024 09:31,atc,ATC7,10,ground stop
DE0000004860,F00006815,26-11-2024 12:41,GATE,MX5,13,crew swap
DE0000004861,F00006815,2024-11-26T12:45:00,ATC,WX01,6,late inbound
DE0000004862,F00006815,11/26/2024 10:40,MAINT,MX5,5,maintenance check
DE0000004863,F00006817,17-06-2025 03:55,OPS,,1,ground stop
DE0000004864,F00006817,17-06-2025 05:25,maint,WX01,1,maintenance check
DE0000004865,F00006817,17-06-2025 04:23,OTHER,,2m,late inbound
DE0000004866,F00006820,06/26/2025 09:39,atc,MX5,2,maintenance check
DE0000004867,F00006820,26-06-2025 11:50,atc,WX01,27,deicing
DE0000004868,F00006820,26-06-2025 10:08,weather,ATC7,14,maintenance check
DE0000004869,F00006822,11-04-2024 17:32,MX,ATC7,8m,deicing
DE0000004870,F00006825,01-05-2025 20:55,maint,GT3,2,maintenance check
DE0000004871,F00006825,01-05-2025 19:18,weather,,6,
DE0000004872,F00006825,05-01-2025 18:58,OTHER,,7,deicing
DE0000004873,F00006832,23-06-2024 08:26,OPS,GT3,1m,deicing
DE0000004874,F00006832,2024-06-23T07:33:00,other,ATC7,-1,crew swap
DE0000004875,F00006834,26-09-2025 11:04,maint,WX01,12m,late inbound
DE0000004876,F00006834,26-09-2025 12:57,CRW,MX5,8,late inbound
DE0000004877,F00006837,27-01-2026 08:07,WX,ATC7,3,maintenance check
DE0000004878,F00006837,27-01-2026 09:56,TRAFFIC,GT3,2,maintenance check
DE0000004879,F00006837,27-01-2026 07:51,AIRPORT,WX01,3,crew swap
DE0000004880,F00006839,2024-05-06T20:42:00,OPS,,2,
DE0000004881,F00006839,06-05-2024 22:00,crew,OPS9,5,ground stop
DE0000004882,F00006840,05-12-2025 12:24,OPS,OPS9,56,late inbound
DE0000004883,F00006846,09-11-2025 15:38,ATC,MX5,6,deicing
DE0000004884,F00006848,2026-01-25T12:47:00,TRAFFIC,WX01,2,gate hold
DE0000004885,F00006848,2026-01-25T12:24:00,CREW,MX5,29,gate hold
DE0000004886,F00006848,25-01-2026 11:44,AIRPORT,OPS9,57,crew swap
DE0000004887,F00006849,2025-05-07T12:32:00,CRW,WX01,211,maintenance check
DE0000004888,F00006851,14-08-2024 01:42,WEATHER,WX01,7,maintenance check
DE0000004889,F00006851,14-08-2024 00:55,other,,5,maintenance check
DE0000004890,F00006854,2025-05-11T17:59:00,MX,MX5,8,late inbound
DE0000004891,F00006854,2025-05-11T18:06:00,ATC,,13,crew swap
DE0000004892,F00006854,11-05-2025 18:39,WX,OPS9,13,crew swap
DE0000004893,F00006857,01/30/2025 17:21,atc,ATC7,6,deicing
DE0000004894,F00006857,30-01-2025 16:37,ATC,OPS9,1,deicing
DE0000004895,F00006859,20-02-2025 08:29,CREW,GT3,2,
DE0000004896,F00006859,02/20/2025 08:30,GATE,OPS9,9,deicing
DE0000004897,F00006868,13-03-2025 12:50,GATE,WX01,-4,maintenance check
DE0000004898,F00006868,03/13/2025 13:22,OPS,MX5,6,crew swap
DE0000004899,F00006871,2025-08-19T09:41:00,AIRPORT,ATC7,1,gate hold
DE0000004900,F00006871,19-08-2025 07:22,atc,,2,late inbound
DE0000004901,F00006871,08/19/2025 09:30,other,ATC7,3,
DE0000004902,F00006872,23-10-2025 10:22,weather,ATC7,13,late inbound
DE0000004903,F00006875,08-08-2025 11:54,OPS,ATC7,30,gate hold
DE0000004904,F00006878,05-05-2025 12:34,atc,OPS9,35,crew swap
DE0000004905,F00006879,2025-01-10T23:49:00,CRW,MX5,16,crew swap
DE0000004906,F00006879,10-01-2025 23:21,OPS,,8,gate hold
DE0000004907,F00006886,21-05-2024 05:10,ATC,ATC7,6,crew swap
DE0000004908,F00006886,21-05-2024 04:04,MAINT,CR02,1,maintenance check
DE0000004909,F00006887,01-06-2024 21:34,airport,OPS9,22,ground stop
DE0000004910,F00006889,08-09-2025 14:44,AIRPORT,,15,late inbound
DE0000004911,F00006889,09-08-2025 15:32,WX,,5,ground stop
DE0000004912,F00006893,13-11-2025 16:52,WX,GT3,1,gate hold
DE0000004913,F00006895,06-03-2024 23:24,CRW,,10,late inbound
DE0000004914,F00006898,19-03-2025 10:28,MX,WX01,11,crew swap
DE0000004915,F00006898,19-03-2025 11:25,WEATHER,ATC7,6m,deicing
DE0000004916,F00006904,04-06-2024 08:34,weather,CR02,2,deicing
DE0000004917,F00006904,06-04-2024 07:41,CREW,GT3,3m,gate hold
DE0000004918,F00006906,23-01-2025 10:03,OPS,,24,late inbound
DE0000004919,F00006909,2024-03-05T00:01:00,TRAFFIC,,2,maintenance check
DE0000004920,F00006909,04-03-2024 23:21,crew,GT3,24,deicing
DE0000004921,F00006910,23-01-2025 11:12,TRAFFIC,WX01,-38,ground stop
DE0000004922,F00006918,19-04-2025 08:50,AIRPORT,MX5,16,ground stop
DE0000004923,F00006918,04/19/2025 08:14,TRAFFIC,,1,crew swap
DE0000004924,F00006919,20-10-2024 01:39,WX,WX01,2m,ground stop
DE0000004925,F00006919,20-10-2024 01:58,other,WX01,2,deicing
DE0000004926,F00006919,20-10-2024 01:43,crew,OPS9,3,ground stop
DE0000004927,F00006920,09-02-2024 12:37,airport,WX01,28,gate hold
DE0000004928,F00006920,09-02-2024 11:47,MAINT,ATC7,2,
DE0000004929,F00006922,11-02-2025 16:38,WEATHER,CR02,4m,
DE0000004930,F00006922,11-02-2025 17:35,crew,CR02,8,
DE0000004931,F00006924,26-05-2024 16:41,MX,CR02,6m,
DE0000004932,F00006924,26-05-2024 15:44,CREW,,12,late inbound
DE0000004933,F00006925,23-05-2024 13:13,WX,CR02,18,maintenance check
DE0000004934,F00006926,2025-09-13T14:48:00,maint,MX5,14,ground stop
DE0000004935,F00006926,13-09-2025 16:42,crew,,21,ground stop
DE0000004936,F00006929,31-03-2025 23:15,ATC,,15,late inbound
DE0000004937,F00006929,01-04-2025 00:40,crew,,15,late inbound
DE0000004938,F00006930,09/19/2024 17:13,CRW,ATC7,-1,
DE0000004939,F00006930,19-09-2024 18:04,OTHER,MX5,3,deicing
DE0000004940,F00006930,19-09-2024 17:46,WX,GT3,1,deicing
DE0000004941,F00006931,11/18/2024 19:22,CRW,MX5,26,
DE0000004942,F00006936,03-01-2025 15:49,CREW,MX5,-1,maintenance check
DE0000004943,F00006936,01-03-2025 14:25,atc,ATC7,1,deicing
DE0000004944,F00006936,01-03-2025 14:31,CREW,MX5,1,late inbound
DE0000004945,F00006937,14-02-2025 19:07,ATC,OPS9,26,crew swap
DE0000004946,F00006938,20-11-2024 19:47,MAINT,WX01,17,maintenance check
DE0000004947,F00006939,09-05-2024 08:07,TRAFFIC,WX01,15,late inbound
DE0000004948,F00006940,05/17/2024 15:06,OPS,GT3,11,deicing
DE0000004949,F00006940,17-05-2024 16:42,CREW,GT3,13,
DE0000004950,F00006940,17-05-2024 14:27,ATC,CR02,4,deicing
DE0000004951,F00006943,12-01-2026 16:13,WX,WX01,11,deicing
DE0000004952,F00006943,12-01-2026 18:10,maint,MX5,9,ground stop
DE0000004953,F00006943,12-01-2026 17:15,AIRPORT,,5,crew swap
DE0000004954,F00006944,05-11-2025 06:29,WX,MX5,45,ground stop
DE0000004955,F00006945,18-09-2024 01:33,MX,CR02,7,
DE0000004956,F00006946,23-06-2024 05:05,MX,CR02,2,ground stop
DE0000004957,F00006946,2024-06-23T04:09:00,crew,GT3,1,late inbound
DE0000004958,F00006946,23-06-2024 05:10,GATE,MX5,13,maintenance check
DE0000004959,F00006950,2024-09-26T01:25:00,weather,WX01,15,
DE0000004960,F00006953,10-09-2025 11:18,crew,MX5,9,crew swap
DE0000004961,F00006953,09-10-2025 12:17,maint,OPS9,1,ground stop
DE0000004962,F00006953,09-10-2025 12:55,other,CR02,-2,gate hold
DE0000004963,F00006959,22-07-2025 04:35,TRAFFIC,WX01,6m,late inbound
DE0000004964,F00006959,22-07-2025 03:16,WEATHER,MX5,32,deicing
DE0000004965,F00006961,24-05-2025 18:50,CREW,,34,deicing
DE0000004966,F00006963,28-05-2025 16:03,AIRPORT,,3,
DE0000004967,F00006967,03/22/2025 13:20,airport,WX01,3m,maintenance check
DE0000004968,F00006967,22-03-2025 15:19,OPS,WX01,1,gate hold
DE0000004969,F00006968,21-09-2024 23:14,other,OPS9,15,crew swap
DE0000004970,F00006977,15-09-2024 10:52,other,WX01,2,deicing
DE0000004971,F00006977,2024-09-15T10:50:00,CREW,GT3,5,gate hold
DE0000004972,F00006977,15-09-2024 08:51,WX,OPS9,9,gate hold
DE0000004973,F00006980,04-01-2025 09:19,CREW,ATC7,5,maintenance check
DE0000004974,F00006980,04-01-2025 11:40,TRAFFIC,GT3,1,deicing
DE0000004975,F00006980,2025-01-04T09:09:00,CRW,CR02,2,late inbound
DE0000004976,F00006981,10-12-2025 15:00,atc,OPS9,3,ground stop
DE0000004977,F00006981,10-12-2025 13:28,weather,ATC7,1,late inbound
DE0000004978,F00006981,10-12-2025 14:31,other,CR02,14,ground stop
DE0000004979,F00006984,24-01-2026 05:34,ATC,MX5,-6,
DE0000004980,F00006984,01/24/2026 03:19,WEATHER,OPS9,14,late inbound
DE0000004981,F00006989,14-11-2025 22:45,airport,WX01,3,crew swap
DE0000004982,F00006989,14-11-2025 20:43,WEATHER,OPS9,1,ground stop
DE0000004983,F00006989,14-11-2025 20:42,WX,ATC7,1,ground stop
DE0000004984,F00006993,24-10-2024 23:59,WEATHER,MX5,0,maintenance check
DE0000004985,F00006993,2024-10-24T21:36:00,weather,WX01,1,deicing
DE0000004986,F00006993,2024-10-24T23:37:00,crew,,6,ground stop
DE0000004987,F00006995,06-04-2024 22:57,CREW,MX5,43,gate hold
DE0000004988,F00006996,01-12-2024 05:29,MAINT,WX01,34,late inbound
DE0000004989,F00006997,11-01-2025 15:27,CRW,GT3,33,gate hold
DE0000004990,F00006999,26-04-2024 22:30,maint,ATC7,1,
DE0000004991,F00006999,04/26/2024 23:08,CREW,,25,ground stop
DE0000004992,F00007002,21-06-2024 00:15,other,WX01,27,ground stop
DE0000004993,F00007003,03-10-2024 04:52,WX,MX5,7,crew swap
DE0000004994,F00007014,21-10-2025 08:22,crew,MX5,7,deicing
DE0000004995,F00007014,21-10-2025 09:55,WX,ATC7,3,maintenance check
DE0000004996,F00007014,21-10-2025 09:50,ATC,WX01,1,ground stop
DE0000004997,F00007017,10-11-2025 20:06,atc,WX01,18,deicing
DE0000004998,F00007017,2025-11-10T17:37:00,TRAFFIC,GT3,30,ground stop
DE0000004999,F00007021,08-08-2024 00:52,MX,,3,late inbound
DE0000005000,F00007021,2024-08-08T00:25:00,WX,ATC7,16,ground stop
DE0000005001,F00007021,08-08-2024 00:28,maint,WX01,10,gate hold
DE0000005002,F00007030,09-12-2024 14:20,MX,CR02,9,deicing
DE0000005003,F00007030,12-09-2024 12:43,ATC,GT3,10,gate hold
DE0000005004,F00007030,12-09-2024 12:12,GATE,OPS9,1,gate hold
DE0000005005,F00007031,2025-10-16T01:04:00,weather,GT3,-2,ground stop
DE0000005006,F00007031,15-10-2025 22:38,airport,OPS9,5,late inbound
DE0000005007,F00007031,16-10-2025 00:19,other,WX01,1,
DE0000005008,F00007032,06-11-2025 03:02,AIRPORT,OPS9,7,crew swap
DE0000005009,F00007033,08-06-2025 16:59,atc,OPS9,0,late inbound
DE0000005010,F00007033,2025-06-08T17:07:00,ATC,CR02,2,gate hold
DE0000005011,F00007033,08-06-2025 15:51,CREW,MX5,2,
DE0000005012,F00007039,2025-12-09T11:27:00,TRAFFIC,OPS9,13,gate hold
DE0000005013,F00007040,2025-01-22T13:08:00,ATC,ATC7,3,late inbound
DE0000005014,F00007040,22-01-2025 14:37,WX,WX01,3,crew swap
DE0000005015,F00007040,22-01-2025 14:18,GATE,MX5,1,deicing
DE0000005016,F00007041,28-06-2025 03:04,other,GT3,12,gate hold
DE0000005017,F00007048,09-06-2025 06:17,WX,CR02,12,maintenance check
DE0000005018,F00007050,12-05-2025 19:23,maint,ATC7,19,gate hold
DE0000005019,F00007050,12-05-2025 20:35,maint,MX5,50,deicing
DE0000005020,F00007052,2026-01-16T18:21:00,ATC,ATC7,20,ground stop
DE0000005021,F00007052,2026-01-16T16:58:00,CRW,CR02,23,maintenance check
DE0000005022,F00007055,25-12-2025 08:12,atc,WX01,1,ground stop
DE0000005023,F00007055,25-12-2025 10:31,other,OPS9,1,ground stop
DE0000005024,F00007060,08-10-2024 19:16,weather,,18,late inbound
DE0000005025,F00007064,20-11-2025 01:57,MX,MX5,13,ground stop
DE0000005026,F00007064,20-11-2025 03:19,CRW,CR02,8,gate hold
DE0000005027,F00007066,01/26/2026 06:13,AIRPORT,WX01,1,late inbound
DE0000005028,F00007066,26-01-2026 04:08,WEATHER,OPS9,1,deicing
DE0000005029,F00007066,01/26/2026 06:03,CREW,CR02,-2,late inbound
DE0000005030,F00007070,21-06-2025 07:08,maint,CR02,25,maintenance check
DE0000005031,F00007072,10-05-2025 09:11,airport,ATC7,28,ground stop
DE0000005032,F00007074,26-04-2025 02:59,atc,ATC7,1,gate hold
DE0000005033,F00007074,2025-04-26T05:25:00,weather,WX01,3,gate hold
DE0000005034,F00007078,23-02-2024 16:14,crew,ATC7,1,
DE0000005035,F00007078,23-02-2024 15:09,WEATHER,CR02,24m,ground stop
DE0000005036,F00007078,23-02-2024 16:03,TRAFFIC,GT3,4,late inbound
DE0000005037,F00007080,08/17/2024 22:28,GATE,CR02,36,late inbound
DE0000005038,F00007080,17-08-2024 22:48,atc,CR02,24,maintenance check
DE0000005039,F00007081,28-06-2025 06:53,WEATHER,WX01,3,
DE0000005040,F00007081,2025-06-28T04:35:00,airport,CR02,1,
DE0000005041,F00007082,17-11-2024 04:39,AIRPORT,GT3,-8,deicing
DE0000005042,F00007082,17-11-2024 06:54,MX,OPS9,4m,ground stop
DE0000005043,F00007083,02-02-2025 02:05,maint,ATC7,8,gate hold
DE0000005044,F00007083,02-02-2025 02:30,AIRPORT,,1,gate hold
DE0000005045,F00007083,02-02-2025 00:55,weather,MX5,1,gate hold
DE0000005046,F00007084,20-09-2025 15:09,maint,,8,late inbound
DE0000005047,F00007084,09/20/2025 16:57,crew,MX5,13,crew swap
DE0000005048,F00007090,31-07-2025 01:01,weather,,0,ground stop
DE0000005049,F00007090,31-07-2025 03:15,AIRPORT,ATC7,1,late inbound
DE0000005050,F00007090,07/31/2025 00:57,OPS,MX5,1,late inbound
DE0000005051,F00007091,20-09-2025 10:48,OTHER,CR02,28,deicing
DE0000005052,F00007093,2025-07-30T15:22:00,weather,MX5,6,
DE0000005053,F00007095,24-06-2025 19:51,other,MX5,2,
DE0000005054,F00007095,06/24/2025 19:30,OTHER,GT3,3,ground stop
DE0000005055,F00007095,24-06-2025 19:00,ATC,,6,late inbound
DE0000005056,F00007096,26-11-2024 11:41,OPS,,12,gate hold
DE0000005057,F00007099,10/17/2025 15:50,TRAFFIC,GT3,7,crew swap
DE0000005058,F00007106,2024-04-15T04:27:00,WX,OPS9,23,
DE0000005059,F00007106,04/15/2024 03:36,maint,MX5,2,deicing
DE0000005060,F00007106,15-04-2024 03:18,AIRPORT,CR02,24,deicing
DE0000005061,F00007108,23-09-2025 15:22,crew,ATC7,30m,
DE0000005062,F00007109,07-08-2024 15:26,WX,,10,gate hold
DE0000005063,F00007112,31-05-2025 03:10,TRAFFIC,ATC7,69,crew swap
DE0000005064,F00007113,01-12-2025 03:54,GATE,,30m,late inbound
DE0000005065,F00007115,14-07-2024 17:05,AIRPORT,ATC7,0,deicing
DE0000005066,F00007115,14-07-2024 18:06,WEATHER,,4,gate hold
DE0000005067,F00007116,24-03-2024 21:16,atc,,6,crew swap
DE0000005068,F00007117,16-06-2025 05:59,OPS,WX01,35,deicing
DE0000005069,F00007125,17-06-2025 12:34,CREW,GT3,18,maintenance check
DE0000005070,F00007126,12-03-2024 23:05,GATE,GT3,10,late inbound
DE0000005071,F00007126,12-03-2024 22:22,WEATHER,,3,deicing
DE0000005072,F00007127,05/26/2024 17:08,weather,ATC7,2,deicing
DE0000005073,F00007128,21-01-2026 22:54,other,,-1,
DE0000005074,F00007128,22-01-2026 00:51,GATE,ATC7,1m,maintenance check
DE0000005075,F00007128,21-01-2026 22:32,MX,GT3,1,deicing
DE0000005076,F00007132,2025-11-09T17:23:00,OTHER,GT3,7,late inbound
DE0000005077,F00007132,09-11-2025 18:27,OTHER,ATC7,23,ground stop
DE0000005078,F00007140,30-09-2025 03:02,other,MX5,4,gate hold
DE0000005079,F00007140,30-09-2025 03:34,CRW,OPS9,5,deicing
DE0000005080,F00007140,09/30/2025 05:07,OTHER,MX5,-6,deicing
DE0000005081,F00007142,02-02-2025 16:10,other,CR02,0,deicing
DE0000005082,F00007142,2025-02-02T16:47:00,ATC,GT3,1,ground stop
DE0000005083,F00007144,08-01-2026 20:41,atc,ATC7,15,crew swap
DE0000005084,F00007144,08-01-2026 22:06,atc,MX5,5,ground stop
DE0000005085,F00007146,18-05-2024 10:56,atc,WX01,1,late inbound
DE0000005086,F00007150,12-09-2025 18:51,TRAFFIC,ATC7,9,
DE0000005087,F00007152,23-09-2025 06:02,MAINT,ATC7,2,gate hold
DE0000005088,F00007152,23-09-2025 05:52,ATC,WX01,2,deicing
DE0000005089,F00007152,23-09-2025 07:35,GATE,CR02,1,maintenance check
DE0000005090,F00007155,08/31/2024 18:57,WX,ATC7,20,ground stop
DE0000005091,F00007155,08/31/2024 18:32,MX,ATC7,1,deicing
DE0000005092,F00007155,31-08-2024 16:50,WEATHER,ATC7,1m,maintenance check
DE0000005093,F00007157,29-03-2024 03:56,GATE,GT3,1,late inbound
DE0000005094,F00007157,03/29/2024 04:09,AIRPORT,MX5,15,gate hold
DE0000005095,F00007157,03/29/2024 03:08,MX,,6,crew swap
DE0000005096,F00007160,19-02-2024 10:41,other,GT3,31m,gate hold
DE0000005097,F00007164,26-04-2025 01:29,GATE,OPS9,3m,ground stop
DE0000005098,F00007164,25-04-2025 23:50,weather,,1,
DE0000005099,F00007165,04-10-2024 08:29,weather,WX01,11,crew swap
DE0000005100,F00007165,10-04-2024 06:24,MAINT,GT3,1,late inbound
DE0000005101,F00007165,04-10-2024 08:38,MAINT,,10m,late inbound
DE0000005102,F00007168,2025-11-04T03:14:00,atc,MX5,5,deicing
DE0000005103,F00007168,04-11-2025 02:17,TRAFFIC,CR02,11,crew swap
DE0000005104,F00007170,11-01-2024 05:57,atc,OPS9,1,maintenance check
DE0000005105,F00007172,12-02-2025 10:04,maint,GT3,2,late inbound
DE0000005106,F00007172,12-02-2025 10:09,CRW,OPS9,2,maintenance check
DE0000005107,F00007172,12-02-2025 11:51,CREW,MX5,3,crew swap
DE0000005108,F00007173,24-12-2025 06:34,weather,,40,ground stop
DE0000005109,F00007176,08-01-2026 23:19,weather,CR02,6,deicing
DE0000005110,F00007177,2025-09-22T01:55:00,crew,OPS9,-24,gate hold
DE0000005111,F00007180,17-05-2025 00:52,OTHER,OPS9,12,deicing
DE0000005112,F00007180,05/17/2025 01:01,OPS,,1,crew swap
DE0000005113,F00007180,05/16/2025 23:33,atc,GT3,17,late inbound
DE0000005114,F00007182,06-10-2025 16:12,WEATHER,ATC7,113,gate hold
DE0000005115,F00007182,06-10-2025 16:06,maint,GT3,13,ground stop
DE0000005116,F00007184,25-12-2024 22:36,AIRPORT,WX01,17,deicing
DE0000005117,F00007184,25-12-2024 23:18,CRW,ATC7,15,
DE0000005118,F00007186,30-07-2025 07:47,WEATHER,,2,late inbound
DE0000005119,F00007186,30-07-2025 09:18,crew,OPS9,5,
DE0000005120,F00007186,30-07-2025 09:57,crew,OPS9,1,ground stop
DE0000005121,F00007187,02/21/2025 00:55,MX,CR02,2,deicing
DE0000005122,F00007187,21-02-2025 00:52,other,GT3,1,deicing
DE0000005123,F00007188,14-08-2024 22:35,maint,WX01,6,crew swap
DE0000005124,F00007188,14-08-2024 23:04,atc,WX01,13,late inbound
DE0000005125,F00007189,02-12-2024 00:17,WEATHER,GT3,15,
DE0000005126,F00007189,02-12-2024 01:29,GATE,MX5,13,deicing
DE0000005127,F00007189,02-12-2024 01:21,weather,WX01,3,
DE0000005128,F00007190,2025-02-05T08:48:00,other,GT3,16,late inbound
DE0000005129,F00007192,07/20/2025 11:31,WEATHER,,4m,
DE0000005130,F00007196,27-05-2025 00:43,MAINT,MX5,37,crew swap
DE0000005131,F00007196,05/27/2025 02:25,other,ATC7,1,deicing
DE0000005132,F00007197,19-12-2025 04:56,AIRPORT,ATC7,-1,late inbound
DE0000005133,F00007197,12/19/2025 03:18,atc,,1m,late inbound
DE0000005134,F00007197,19-12-2025 04:41,CRW,,1,deicing
DE0000005135,F00007198,28-02-2025 21:46,crew,MX5,30m,maintenance check
DE0000005136,F00007200,09-10-2025 21:01,CREW,CR02,28,maintenance check
DE0000005137,F00007200,09-10-2025 20:21,CREW,MX5,8,crew swap
DE0000005138,F00007200,09-10-2025 19:22,maint,ATC7,24,deicing
DE0000005139,F00007205,01-09-2025 22:51,airport,OPS9,6,deicing
DE0000005140,F00007205,09-02-2025 00:07,MX,GT3,19,ground stop
DE0000005141,F00007205,09-01-2025 22:50,WX,MX5,1m,late inbound
DE0000005142,F00007207,03-08-2025 11:16,CREW,,1,maintenance check
DE0000005143,F00007207,03-08-2025 11:57,airport,WX01,10,deicing
DE0000005144,F00007208,09-11-2024 07:53,ATC,ATC7,33,late inbound
DE0000005145,F00007209,02-11-2025 06:16,OTHER,GT3,1,gate hold
DE0000005146,F00007211,04/29/2024 12:54,WX,CR02,1,maintenance check
DE0000005147,F00007211,29-04-2024 13:26,maint,OPS9,3,deicing
DE0000005148,F00007212,27-07-2025 17:35,MAINT,,1,
DE0000005149,F00007212,2025-07-27T17:19:00,ATC,GT3,8,deicing
DE0000005150,F00007212,27-07-2025 18:36,CREW,ATC7,8,maintenance check
DE0000005151,F00007213,25-09-2024 02:42,atc,CR02,60,crew swap
DE0000005152,F00007219,09/17/2024 07:03,other,MX5,21,deicing
DE0000005153,F00007222,2024-10-08T20:00:00,WX,GT3,8,deicing
DE0000005154,F00007223,28-06-2025 19:50,airport,ATC7,22,deicing
DE0000005155,F00007223,28-06-2025 20:51,WEATHER,ATC7,6,ground stop
DE0000005156,F00007225,10/24/2025 03:58,WEATHER,,55,late inbound
DE0000005157,F00007225,24-10-2025 04:18,airport,CR02,70,
DE0000005158,F00007225,2025-10-24T05:01:00,OTHER,WX01,118,deicing
DE0000005159,F00007230,29-03-2025 10:40,GATE,GT3,2m,maintenance check
DE0000005160,F00007230,2025-03-29T09:54:00,atc,WX01,2,crew swap
DE0000005161,F00007230,29-03-2025 11:23,airport,OPS9,2,late inbound
DE0000005162,F00007232,10-11-2025 06:20,TRAFFIC,CR02,24,ground stop
DE0000005163,F00007232,10-11-2025 04:39,atc,OPS9,3,gate hold
DE0000005164,F00007236,25-11-2025 08:49,OPS,GT3,3,maintenance check
DE0000005165,F00007236,25-11-2025 09:01,weather,ATC7,15,
DE0000005166,F00007236,25-11-2025 09:24,crew,ATC7,1,
DE0000005167,F00007238,09/26/2025 01:59,ATC,OPS9,7,ground stop
DE0000005168,F00007240,2025-09-02T20:46:00,MX,MX5,14m,maintenance check
DE0000005169,F00007243,09-10-2025 01:52,airport,ATC7,28,
DE0000005170,F00007253,11/22/2024 17:13,WX,GT3,-6,crew swap
DE0000005171,F00007253,22-11-2024 17:16,CREW,OPS9,17,crew swap
DE0000005172,F00007253,22-11-2024 18:20,ATC,OPS9,10,late inbound
DE0000005173,F00007258,06-07-2024 04:24,airport,MX5,9,crew swap
DE0000005174,F00007258,06-07-2024 04:44,MX,OPS9,18,deicing
DE0000005175,F00007259,11/28/2025 01:33,crew,GT3,20,maintenance check
DE0000005176,F00007262,18-01-2026 21:30,OTHER,WX01,22,late inbound
DE0000005177,F00007265,14-02-2024 12:17,ATC,,22,
DE0000005178,F00007265,02/14/2024 12:31,weather,,60m,deicing
DE0000005179,F00007272,05-07-2024 13:09,airport,ATC7,18,late inbound
DE0000005180,F00007272,05-07-2024 13:43,GATE,WX01,12,
DE0000005181,F00007274,20-06-2025 22:32,crew,,52,
DE0000005182,F00007275,16-06-2024 01:52,atc,MX5,47,ground stop
DE0000005183,F00007277,20-09-2025 15:44,CRW,WX01,4,deicing
DE0000005184,F00007282,31-05-2024 01:36,crew,,1,crew swap
DE0000005185,F00007282,31-05-2024 01:28,AIRPORT,,1,late inbound
DE0000005186,F00007282,31-05-2024 00:01,weather,MX5,7,maintenance check
DE0000005187,F00007284,2025-10-04T02:31:00,MX,WX01,14,ground stop
DE0000005188,F00007284,04-10-2025 01:46,GATE,MX5,5,
DE0000005189,F00007286,27-05-2025 23:00,CREW,CR02,0,
DE0000005190,F00007286,28-05-2025 01:00,weather,GT3,12,gate hold
DE0000005191,F00007293,2025-06-05T10:20:00,airport,OPS9,8,maintenance check
DE0000005192,F00007293,05-06-2025 09:44,crew,CR02,-1,gate hold
DE0000005193,F00007294,2025-02-20T16:10:00,OPS,MX5,1,
DE0000005194,F00007294,02/20/2025 17:54,OTHER,ATC7,9m,gate hold
DE0000005195,F00007294,20-02-2025 15:50,other,GT3,-2,maintenance check
DE0000005196,F00007295,07/19/2025 11:26,TRAFFIC,MX5,11,ground stop
DE0000005197,F00007301,2025-12-09T16:14:00,maint,,0,gate hold
DE0000005198,F00007301,09-12-2025 17:46,WX,ATC7,-1,
DE0000005199,F00007301,09-12-2025 15:21,AIRPORT,GT3,9,gate hold
DE0000005200,F00007302,2025-09-17T03:01:00,MAINT,,27,late inbound
DE0000005201,F00007305,14-03-2025 13:08,weather,OPS9,12,maintenance check
DE0000005202,F00007305,14-03-2025 14:12,CRW,OPS9,1,crew swap
DE0000005203,F00007305,14-03-2025 12:53,MAINT,OPS9,3,ground stop
DE0000005204,F00007306,01-09-2026 03:34,TRAFFIC,MX5,10,late inbound
DE0000005205,F00007312,11-11-2025 09:17,WEATHER,,18,deicing
DE0000005206,F00007314,19-07-2024 13:05,maint,OPS9,4m,deicing
DE0000005207,F00007314,19-07-2024 13:00,WEATHER,WX01,2,ground stop
DE0000005208,F00007314,07/19/2024 14:57,WX,ATC7,6,maintenance check
DE0000005209,F00007315,07-02-2024 16:17,airport,ATC7,17,ground stop
DE0000005210,F00007323,2025-08-11T23:47:00,AIRPORT,OPS9,9,ground stop
DE0000005211,F00007323,08-12-2025 02:23,GATE,ATC7,9,late inbound
DE0000005212,F00007325,06-09-2024 10:37,OTHER,GT3,17,gate hold
DE0000005213,F00007325,06-09-2024 09:51,WEATHER,MX5,-1,
DE0000005214,F00007330,19-12-2025 18:17,weather,MX5,7,ground stop
DE0000005215,F00007333,04-03-2024 05:25,CRW,OPS9,2,maintenance check
DE0000005216,F00007333,03-04-2024 06:08,OTHER,GT3,5,
DE0000005217,F00007333,03-04-2024 06:38,OTHER,MX5,1,deicing
DE0000005218,F00007337,02/26/2024 17:25,GATE,GT3,59,crew swap
DE0000005219,F00007340,02-12-2025 05:15,crew,GT3,10,ground stop
DE0000005220,F00007348,11-02-2025 22:52,other,WX01,14,
DE0000005221,F00007348,02-11-2025 22:35,WX,CR02,44,deicing
DE0000005222,F00007350,30-01-2026 12:16,CRW,WX01,10,maintenance check
DE0000005223,F00007355,01/23/2025 22:22,maint,ATC7,4,crew swap
DE0000005224,F00007355,23-01-2025 22:12,weather,CR02,3,maintenance check
DE0000005225,F00007355,23-01-2025 21:53,weather,CR02,2,crew swap
DE0000005226,F00007356,2024-11-24T12:19:00,WX,OPS9,18m,crew swap
DE0000005227,F00007363,14-01-2026 10:31,CRW,OPS9,1m,gate hold
DE0000005228,F00007363,2026-01-14T11:58:00,MX,MX5,14,gate hold
DE0000005229,F00007367,03/26/2025 07:45,CREW,WX01,2,ground stop
DE0000005230,F00007368,11-09-2024 09:01,other,OPS9,3,maintenance check
DE0000005231,F00007371,27-11-2024 03:32,CREW,GT3,11m,deicing
DE0000005232,F00007371,27-11-2024 03:28,AIRPORT,,1,gate hold
DE0000005233,F00007372,18-02-2024 06:05,TRAFFIC,CR02,0,gate hold
DE0000005234,F00007372,18-02-2024 07:48,other,GT3,1m,
DE0000005235,F00007374,15-10-2024 04:10,other,OPS9,4,maintenance check
DE0000005236,F00007374,15-10-2024 04:51,MAINT,CR02,18,
DE0000005237,F00007374,15-10-2024 02:50,TRAFFIC,CR02,7,
DE0000005238,F00007375,02-08-2024 14:51,CRW,ATC7,10,late inbound
DE0000005239,F00007380,07-07-2024 21:34,crew,,6,ground stop
DE0000005240,F00007380,07-08-2024 00:07,CREW,WX01,9,gate hold
DE0000005241,F00007382,21-10-2025 03:51,maint,WX01,2,late inbound
DE0000005242,F00007382,21-10-2025 03:52,WX,CR02,7,ground stop
DE0000005243,F00007382,21-10-2025 04:25,ATC,OPS9,21,ground stop
DE0000005244,F00007384,2024-03-13T21:06:00,TRAFFIC,CR02,6,
DE0000005245,F00007384,13-03-2024 21:17,weather,CR02,9,deicing
DE0000005246,F00007388,08-10-2025 01:24,WX,GT3,8,
DE0000005247,F00007388,08-10-2025 02:10,maint,CR02,54,crew swap
DE0000005248,F00007388,08-10-2025 00:20,other,CR02,19m,gate hold
DE0000005249,F00007389,29-06-2024 16:59,WX,MX5,41,crew swap
DE0000005250,F00007391,08-12-2024 09:58,GATE,ATC7,0,deicing
DE0000005251,F00007391,08-12-2024 10:40,AIRPORT,GT3,5,crew swap
DE0000005252,F00007392,11-10-2025 19:09,CREW,CR02,70,ground stop
DE0000005253,F00007392,10-11-2025 18:15,GATE,OPS9,14,maintenance check
DE0000005254,F00007394,12/14/2024 00:27,CRW,,-1,
DE0000005255,F00007394,14-12-2024 01:56,maint,GT3,2,maintenance check
DE0000005256,F00007394,14-12-2024 00:48,GATE,WX01,1,gate hold
DE0000005257,F00007398,10-08-2025 12:00,atc,OPS9,30,deicing
DE0000005258,F00007402,10/17/2024 11:58,other,MX5,7,
DE0000005259,F00007402,10/17/2024 12:33,CREW,MX5,1,
DE0000005260,F00007404,22-11-2025 22:20,GATE,CR02,7,crew swap
DE0000005261,F00007405,07-12-2024 11:07,other,GT3,8,crew swap
DE0000005262,F00007406,24-06-2024 02:27,ATC,ATC7,17,maintenance check
DE0000005263,F00007406,06/24/2024 02:43,GATE,,1,deicing
DE0000005264,F00007407,11-07-2024 03:38,WEATHER,,-21,late inbound
DE0000005265,F00007413,05-04-2025 19:49,WEATHER,WX01,1,maintenance check
DE0000005266,F00007413,04-05-2025 20:05,MX,WX01,5,ground stop
DE0000005267,F00007413,05-04-2025 18:54,atc,OPS9,1,crew swap
DE0000005268,F00007418,03-01-2026 15:06,CRW,WX01,4m,ground stop
DE0000005269,F00007418,03-01-2026 14:58,MX,WX01,4,
DE0000005270,F00007419,03/17/2024 00:45,MX,MX5,14,maintenance check
DE0000005271,F00007420,12-04-2024 02:21,AIRPORT,OPS9,15,ground stop
DE0000005272,F00007425,28-08-2025 14:13,CREW,MX5,2,gate hold
DE0000005273,F00007429,2024-02-28T21:32:00,airport,WX01,3,ground stop
DE0000005274,F00007430,05-08-2025 12:04,WX,ATC7,10m,ground stop
DE0000005275,F00007434,13-04-2025 19:08,GATE,,1,gate hold
DE0000005276,F00007434,04/13/2025 20:43,ATC,CR02,1,maintenance check
DE0000005277,F00007434,13-04-2025 20:55,TRAFFIC,WX01,1,ground stop
DE0000005278,F00007435,03/27/2024 23:02,crew,MX5,3,gate hold
DE0000005279,F00007435,27-03-2024 22:38,OTHER,MX5,9,maintenance check
DE0000005280,F00007436,06-04-2025 12:27,OPS,CR02,7,
DE0000005281,F00007436,06-04-2025 14:24,AIRPORT,,3,
DE0000005282,F00007441,01/16/2026 11:17,atc,CR02,26,late inbound
DE0000005283,F00007442,20-01-2026 03:51,CREW,OPS9,13,
DE0000005284,F00007442,20-01-2026 05:07,CRW,OPS9,13,gate hold
DE0000005285,F00007448,17-09-2025 11:21,TRAFFIC,CR02,3,gate hold
DE0000005286,F00007448,09/17/2025 09:54,GATE,CR02,-8,
DE0000005287,F00007449,16-07-2024 04:15,WX,,0m,
DE0000005288,F00007449,16-07-2024 03:28,airport,MX5,3,maintenance check
DE0000005289,F00007449,16-07-2024 03:13,MAINT,OPS9,1,late inbound
DE0000005290,F00007451,27-10-2024 18:57,OPS,OPS9,7,deicing
DE0000005291,F00007451,27-10-2024 18:52,CREW,OPS9,1,gate hold
DE0000005292,F00007451,27-10-2024 18:53,WX,ATC7,15,
DE0000005293,F00007456,11-01-2025 11:36,OTHER,ATC7,9,gate hold
DE0000005294,F00007456,11-01-2025 10:06,WX,WX01,21,ground stop
DE0000005295,F00007459,04-10-2024 15:56,other,ATC7,17,ground stop
DE0000005296,F00007462,11-09-2025 04:53,maint,CR02,4,deicing
DE0000005297,F00007464,2025-03-30T22:51:00,airport,MX5,7,ground stop
DE0000005298,F00007467,05-05-2025 02:12,CREW,WX01,4,gate hold
DE0000005299,F00007467,05-05-2025 03:48,WEATHER,GT3,1,deicing
DE0000005300,F00007469,24-08-2025 01:35,MAINT,CR02,-1,crew swap
DE0000005301,F00007469,24-08-2025 03:55,WX,MX5,6,late inbound
DE0000005302,F00007469,2025-08-24T02:16:00,other,CR02,1,deicing
DE0000005303,F00007471,02-02-2025 09:15,MAINT,GT3,22,deicing
DE0000005304,F00007471,02-02-2025 10:40,CREW,WX01,1,crew swap
DE0000005305,F00007471,2025-02-02T08:41:00,CREW,OPS9,3,crew swap
DE0000005306,F00007472,31-12-2025 04:32,OPS,,20,late inbound
DE0000005307,F00007475,05/17/2024 17:51,AIRPORT,OPS9,0,ground stop
DE0000005308,F00007475,2024-05-17T20:13:00,maint,ATC7,1,gate hold
DE0000005309,F00007475,17-05-2024 19:13,OPS,GT3,-1,crew swap
DE0000005310,F00007477,01-05-2025 02:16,weather,GT3,1,ground stop
DE0000005311,F00007477,2025-05-01T01:54:00,MX,CR02,7,crew swap
DE0000005312,F00007478,10-12-2024 11:34,other,OPS9,8,crew swap
DE0000005313,F00007478,2024-12-10T11:11:00,MX,CR02,10,crew swap
DE0000005314,F00007478,2024-12-10T11:13:00,crew,GT3,1,deicing
DE0000005315,F00007479,30-07-2025 20:47,GATE,CR02,8,deicing
DE0000005316,F00007479,30-07-2025 22:51,MAINT,CR02,1,crew swap
DE0000005317,F00007479,30-07-2025 22:33,WX,ATC7,5,deicing
DE0000005318,F00007480,29-09-2024 11:24,WX,GT3,20,crew swap
DE0000005319,F00007483,2024-02-06T14:20:00,MX,,1,gate hold
DE0000005320,F00007483,06-02-2024 16:32,OPS,CR02,3,gate hold
DE0000005321,F00007487,25-02-2024 16:23,GATE,OPS9,4,late inbound
DE0000005322,F00007487,25-02-2024 17:53,GATE,OPS9,20,late inbound
DE0000005323,F00007489,19-12-2024 17:11,GATE,MX5,20,ground stop
DE0000005324,F00007489,19-12-2024 17:41,crew,OPS9,10,gate hold
DE0000005325,F00007491,18-06-2025 22:57,TRAFFIC,WX01,5,
DE0000005326,F00007491,18-06-2025 22:49,WEATHER,,7,ground stop
DE0000005327,F00007491,2025-06-18T23:11:00,TRAFFIC,OPS9,7,
DE0000005328,F00007492,03-10-2024 12:30,crew,CR02,16,ground stop
DE0000005329,F00007495,2025-04-25T23:14:00,airport,OPS9,16,
DE0000005330,F00007495,04/25/2025 22:33,weather,GT3,2,late inbound
DE0000005331,F00007495,25-04-2025 22:56,MX,CR02,-2,deicing
DE0000005332,F00007501,08/18/2024 16:10,CRW,GT3,10,maintenance check
DE0000005333,F00007501,2024-08-18T15:39:00,airport,CR02,7,gate hold
DE0000005334,F00007502,25-10-2025 17:11,other,GT3,13,maintenance check
DE0000005335,F00007504,23-01-2025 22:31,CREW,CR02,5,ground stop
DE0000005336,F00007505,25-12-2024 21:39,GATE,OPS9,0,deicing
DE0000005337,F00007505,25-12-2024 21:57,maint,ATC7,27,late inbound
DE0000005338,F00007506,11-05-2024 21:13,OPS,CR02,0,late inbound
DE0000005339,F00007506,05-11-2024 21:08,CREW,WX01,-2,
DE0000005340,F00007506,11-05-2024 20:06,OTHER,,13,maintenance check
DE0000005341,F00007508,02-07-2025 14:27,WEATHER,CR02,9,ground stop
DE0000005342,F00007508,07-02-2025 15:54,atc,GT3,21,crew swap
DE0000005343,F00007522,03-02-2025 06:24,WX,ATC7,4,gate hold
DE0000005344,F00007522,03-02-2025 06:45,OTHER,GT3,4,late inbound
DE0000005345,F00007522,2025-02-03T05:26:00,OTHER,MX5,4,
DE0000005346,F00007524,03/29/2024 15:54,OTHER,WX01,3,late inbound
DE0000005347,F00007524,29-03-2024 14:22,GATE,,9,crew swap
DE0000005348,F00007524,2024-03-29T15:40:00,WX,MX5,2,maintenance check
DE0000005349,F00007526,2024-02-24T06:26:00,weather,CR02,7,crew swap
DE0000005350,F00007526,02/24/2024 08:35,TRAFFIC,OPS9,1,ground stop
DE0000005351,F00007526,24-02-2024 08:21,other,,8,crew swap
DE0000005352,F00007529,14-11-2025 17:02,MAINT,ATC7,-29,maintenance check
DE0000005353,F00007529,11/14/2025 17:20,OPS,GT3,3,maintenance check
DE0000005354,F00007531,01-12-2024 19:25,AIRPORT,WX01,8,late inbound
DE0000005355,F00007531,12-01-2024 20:41,weather,CR02,10,crew swap
DE0000005356,F00007531,01-12-2024 19:28,weather,GT3,7,late inbound
DE0000005357,F00007537,31-10-2025 22:19,WEATHER,CR02,4,deicing
DE0000005358,F00007541,13-01-2025 01:10,AIRPORT,,10,deicing
DE0000005359,F00007542,08/28/2025 22:03,OPS,,11,ground stop
DE0000005360,F00007548,17-01-2025 18:30,airport,GT3,13,ground stop
DE0000005361,F00007548,01/17/2025 18:04,CRW,CR02,5,late inbound
DE0000005362,F00007548,01/17/2025 17:40,MAINT,MX5,14,
DE0000005363,F00007552,26-08-2025 12:08,TRAFFIC,WX01,8,deicing
DE0000005364,F00007552,26-08-2025 14:42,OPS,,2,crew swap
DE0000005365,F00007552,26-08-2025 13:20,MX,WX01,1,
DE0000005366,F00007553,23-01-2025 03:01,GATE,WX01,11,maintenance check
DE0000005367,F00007554,26-03-2024 01:48,MAINT,CR02,5,maintenance check
DE0000005368,F00007554,26-03-2024 01:22,atc,MX5,1m,deicing
DE0000005369,F00007556,06-12-2025 23:19,WX,,17,maintenance check
DE0000005370,F00007556,07-12-2025 00:39,TRAFFIC,WX01,8,crew swap
DE0000005371,F00007556,2025-12-06T23:08:00,weather,WX01,8,crew swap
DE0000005372,F00007557,02/25/2025 15:57,WEATHER,GT3,5,ground stop
DE0000005373,F00007557,25-02-2025 15:01,atc,GT3,2,ground stop
DE0000005374,F00007557,25-02-2025 16:19,CREW,WX01,3,gate hold
DE0000005375,F00007558,22-11-2024 08:09,airport,MX5,8,
DE0000005376,F00007560,19-03-2025 21:15,CREW,CR02,60,late inbound
DE0000005377,F00007561,06-07-2024 00:30,CRW,,22m,late inbound
DE0000005378,F00007561,2024-07-05T23:26:00,MX,ATC7,21,gate hold
DE0000005379,F00007562,04-11-2025 10:42,MAINT,OPS9,1,
DE0000005380,F00007562,04-11-2025 09:05,other,OPS9,7,maintenance check
DE0000005381,F00007562,04-11-2025 09:48,GATE,GT3,-9,ground stop
DE0000005382,F00007564,16-08-2024 01:09,CRW,OPS9,1m,maintenance check
DE0000005383,F00007564,16-08-2024 01:14,WEATHER,CR02,-1,deicing
DE0000005384,F00007567,09-08-2025 13:17,MX,GT3,21,late inbound
DE0000005385,F00007568,29-12-2024 11:14,ATC,,43,maintenance check
DE0000005386,F00007572,29-05-2025 16:50,OPS,,9,late inbound
DE0000005387,F00007572,29-05-2025 16:53,OPS,MX5,8,ground stop
DE0000005388,F00007574,2025-11-13T22:51:00,CREW,ATC7,-1,maintenance check
DE0000005389,F00007574,13-11-2025 22:22,CREW,OPS9,1,maintenance check
DE0000005390,F00007574,13-11-2025 23:34,WEATHER,OPS9,1,late inbound
DE0000005391,F00007580,06-11-2025 08:48,WEATHER,MX5,-1,gate hold
DE0000005392,F00007580,06-11-2025 09:38,OTHER,WX01,10,maintenance check
DE0000005393,F00007580,06-11-2025 09:16,ATC,OPS9,9,gate hold
DE0000005394,F00007584,26-12-2024 06:34,OPS,CR02,1,ground stop
DE0000005395,F00007584,26-12-2024 04:52,GATE,ATC7,1,maintenance check
DE0000005396,F00007584,12/26/2024 07:24,MX,ATC7,1m,
DE0000005397,F00007585,30-01-2025 03:40,AIRPORT,ATC7,14,maintenance check
DE0000005398,F00007585,2025-01-30T05:21:00,other,OPS9,1,ground stop
DE0000005399,F00007588,18-09-2025 08:08,CRW,,5,gate hold
DE0000005400,F00007588,18-09-2025 09:03,ATC,,4m,maintenance check
DE0000005401,F00007589,28-09-2024 17:32,airport,CR02,0,ground stop
DE0000005402,F00007589,09/28/2024 15:06,atc,CR02,10,deicing
DE0000005403,F00007589,28-09-2024 16:41,CREW,WX01,-4,maintenance check
DE0000005404,F00007590,07/13/2025 11:43,MAINT,,25,crew swap
DE0000005405,F00007590,13-07-2025 13:46,GATE,CR02,2,gate hold
DE0000005406,F00007590,13-07-2025 12:53,GATE,CR02,15,
DE0000005407,F00007593,16-09-2025 17:22,GATE,WX01,36,ground stop
DE0000005408,F00007602,28-03-2025 20:14,atc,MX5,10,ground stop
DE0000005409,F00007602,28-03-2025 20:11,weather,OPS9,4m,
DE0000005410,F00007608,19-10-2025 02:25,OPS,WX01,5,late inbound
DE0000005411,F00007608,19-10-2025 01:49,OTHER,ATC7,2,late inbound
DE0000005412,F00007608,19-10-2025 02:58,WX,CR02,1,late inbound
DE0000005413,F00007610,21-07-2024 22:57,ATC,,0,late inbound
DE0000005414,F00007610,22-07-2024 00:21,AIRPORT,CR02,1,ground stop
DE0000005415,F00007611,13-06-2025 12:44,MAINT,OPS9,-10,
DE0000005416,F00007616,11-06-2024 06:56,WEATHER,CR02,30,ground stop
DE0000005417,F00007617,11-12-2025 05:27,OPS,MX5,1,crew swap
DE0000005418,F00007617,11-12-2025 06:35,atc,WX01,2,gate hold
DE0000005419,F00007617,12-11-2025 05:36,MAINT,,2,gate hold
DE0000005420,F00007620,01/20/2025 23:54,TRAFFIC,CR02,19,deicing
DE0000005421,F00007621,29-10-2025 12:41,atc,MX5,15,maintenance check
DE0000005422,F00007632,01-09-2025 18:35,MX,GT3,14,maintenance check
DE0000005423,F00007633,16-09-2025 10:58,WX,OPS9,1,crew swap
DE0000005424,F00007633,16-09-2025 09:52,weather,ATC7,3,ground stop
DE0000005425,F00007633,09/16/2025 09:48,AIRPORT,CR02,2,late inbound
DE0000005426,F00007634,23-02-2025 01:27,AIRPORT,MX5,2m,
DE0000005427,F00007635,15-11-2025 05:13,CRW,WX01,13,deicing
DE0000005428,F00007635,11/15/2025 04:05,atc,,53,maintenance check
DE0000005429,F00007637,08-05-2025 22:51,ATC,GT3,-1,ground stop
DE0000005430,F00007637,08-05-2025 23:01,CREW,ATC7,1,
DE0000005431,F00007637,08-05-2025 23:17,CRW,GT3,1,deicing
DE0000005432,F00007643,01-06-2024 20:26,GATE,CR02,3,maintenance check
DE0000005433,F00007643,01-06-2024 18:15,CREW,OPS9,1,maintenance check
DE0000005434,F00007643,06-01-2024 20:04,AIRPORT,GT3,1,
DE0000005435,F00007645,03-12-2024 08:25,atc,WX01,14,
DE0000005436,F00007645,2024-12-03T07:48:00,GATE,ATC7,15,
DE0000005437,F00007646,28-07-2025 20:48,GATE,WX01,1,crew swap
DE0000005438,F00007646,28-07-2025 22:10,OTHER,WX01,9,deicing
DE0000005439,F00007647,06-08-2025 16:50,maint,GT3,36m,deicing
DE0000005440,F00007650,2025-08-17T01:38:00,WEATHER,CR02,2,maintenance check
DE0000005441,F00007650,17-08-2025 00:48,ATC,MX5,10,ground stop
DE0000005442,F00007650,17-08-2025 00:13,other,OPS9,11,crew swap
DE0000005443,F00007655,04-10-2025 19:01,OPS,OPS9,-20,late inbound
DE0000005444,F00007655,04-10-2025 18:24,OTHER,,11,ground stop
DE0000005445,F00007658,07-08-2025 23:20,atc,WX01,31,
DE0000005446,F00007660,01/22/2025 12:03,other,CR02,7,crew swap
DE0000005447,F00007660,01/22/2025 11:38,CRW,CR02,7,ground stop
DE0000005448,F00007660,22-01-2025 13:56,ATC,ATC7,7,maintenance check
DE0000005449,F00007665,26-08-2025 03:56,OPS,MX5,4,
DE0000005450,F00007667,26-01-2026 05:32,MX,CR02,28,ground stop
DE0000005451,F00007668,25-02-2024 21:35,CRW,WX01,0,
DE0000005452,F00007668,25-02-2024 20:57,OTHER,MX5,1,deicing
DE0000005453,F00007670,28-01-2026 15:22,airport,MX5,6,gate hold
DE0000005454,F00007670,01/28/2026 15:43,airport,CR02,12,late inbound
DE0000005455,F00007670,28-01-2026 17:27,WX,ATC7,5,deicing
DE0000005456,F00007672,04-05-2025 05:24,weather,CR02,44,ground stop
DE0000005457,F00007672,05-04-2025 04:15,OTHER,,3,
DE0000005458,F00007672,05-04-2025 06:05,WX,WX01,8,
DE0000005459,F00007679,12-10-2025 10:25,MX,MX5,1,deicing
DE0000005460,F00007679,12-10-2025 09:20,MAINT,GT3,6,ground stop
DE0000005461,F00007680,01-11-2024 00:41,CRW,OPS9,8,crew swap
DE0000005462,F00007680,01-11-2024 01:09,crew,WX01,5,crew swap
DE0000005463,F00007686,02-11-2025 00:15,maint,,4,deicing
DE0000005464,F00007686,02-11-2025 00:08,other,MX5,2,deicing
DE0000005465,F00007688,01-07-2026 11:02,other,ATC7,0,late inbound
DE0000005466,F00007688,07-01-2026 12:51,TRAFFIC,OPS9,1,crew swap
DE0000005467,F00007688,07-01-2026 11:41,TRAFFIC,OPS9,4,deicing
DE0000005468,F00007692,2024-10-02T14:38:00,MAINT,,4,crew swap
DE0000005469,F00007692,02-10-2024 13:40,crew,WX01,26,late inbound
DE0000005470,F00007712,13-10-2024 19:14,CREW,,231,gate hold
DE0000005471,F00007713,31-07-2025 12:03,maint,GT3,3,deicing
DE0000005472,F00007713,2025-07-31T13:54:00,weather,OPS9,14,
DE0000005473,F00007718,11/24/2024 02:43,maint,ATC7,6,gate hold
DE0000005474,F00007718,2024-11-24T04:05:00,airport,MX5,2m,maintenance check
DE0000005475,F00007718,11/24/2024 02:53,WX,CR02,2,
DE0000005476,F00007720,15-01-2026 08:01,CREW,,7,late inbound
DE0000005477,F00007720,15-01-2026 08:13,MAINT,WX01,14,maintenance check
DE0000005478,F00007720,15-01-2026 07:56,TRAFFIC,OPS9,6,maintenance check
DE0000005479,F00007724,22-08-2024 16:12,WEATHER,OPS9,30,gate hold
DE0000005480,F00007730,01/18/2025 13:40,weather,WX01,50,maintenance check
DE0000005481,F00007731,31-01-2026 20:18,maint,MX5,30,gate hold
DE0000005482,F00007732,05-12-2024 10:28,OPS,,9,deicing
DE0000005483,F00007735,04-07-2025 22:30,AIRPORT,OPS9,11,ground stop
DE0000005484,F00007736,21-03-2025 07:35,crew,WX01,16,
DE0000005485,F00007741,04-08-2024 11:52,crew,GT3,4,
DE0000005486,F00007741,04-08-2024 10:14,OPS,ATC7,22,
DE0000005487,F00007743,30-05-2024 04:14,CRW,CR02,4,gate hold
DE0000005488,F00007743,30-05-2024 02:44,airport,MX5,11,
DE0000005489,F00007743,30-05-2024 04:39,CRW,GT3,9,
DE0000005490,F00007744,15-12-2024 03:43,MAINT,ATC7,21,maintenance check
DE0000005491,F00007744,15-12-2024 02:16,WEATHER,OPS9,7,ground stop
DE0000005492,F00007745,2024-11-21T08:30:00,MAINT,ATC7,33,crew swap
DE0000005493,F00007749,30-03-2024 18:14,OTHER,,18,gate hold
DE0000005494,F00007749,30-03-2024 17:58,OPS,GT3,1,crew swap
DE0000005495,F00007749,30-03-2024 16:33,CRW,MX5,1,gate hold
DE0000005496,F00007752,12-07-2025 14:12,atc,OPS9,17,deicing
DE0000005497,F00007755,2025-07-16T06:32:00,atc,OPS9,15,gate hold
DE0000005498,F00007756,16-06-2025 21:11,WX,GT3,0,deicing
DE0000005499,F00007756,2025-06-16T21:40:00,other,,50,crew swap
DE0000005500,F00007756,06/16/2025 22:32,ATC,CR02,27,deicing
DE0000005501,F00007764,27-03-2025 06:21,maint,GT3,10,late inbound
DE0000005502,F00007764,27-03-2025 05:48,crew,WX01,16,ground stop
DE0000005503,F00007764,27-03-2025 05:02,crew,GT3,1,crew swap
DE0000005504,F00007769,11-10-2024 18:19,airport,GT3,41,ground stop
DE0000005505,F00007769,11-10-2024 17:46,airport,GT3,12,gate hold
DE0000005506,F00007770,31-12-2024 04:38,weather,,14,crew swap
DE0000005507,F00007772,20-05-2025 19:04,CREW,,9,deicing
DE0000005508,F00007772,05/20/2025 20:08,other,WX01,17,deicing
DE0000005509,F00007774,25-10-2024 11:32,airport,GT3,-12,crew swap
DE0000005510,F00007779,07-06-2024 16:43,atc,OPS9,3,crew swap
DE0000005511,F00007779,06-07-2024 17:10,weather,MX5,1,
DE0000005512,F00007779,06-07-2024 17:18,other,MX5,16,ground stop
DE0000005513,F00007784,06-12-2024 21:02,weather,OPS9,6m,gate hold
DE0000005514,F00007784,12-06-2024 21:48,CRW,,1,maintenance check
DE0000005515,F00007784,06-12-2024 21:53,WEATHER,CR02,9,deicing
DE0000005516,F00007785,01-02-2025 21:32,weather,ATC7,3,ground stop
DE0000005517,F00007785,02-01-2025 23:24,GATE,OPS9,6,maintenance check
DE0000005518,F00007786,2025-11-22T02:07:00,atc,GT3,1,maintenance check
DE0000005519,F00007786,22-11-2025 00:38,MAINT,MX5,6,crew swap
DE0000005520,F00007788,25-12-2025 07:55,WEATHER,GT3,3,ground stop
DE0000005521,F00007788,12/25/2025 08:19,atc,ATC7,3,ground stop
DE0000005522,F00007788,25-12-2025 08:47,MAINT,CR02,6,
DE0000005523,F00007791,13-09-2024 20:09,OPS,CR02,15,deicing
DE0000005524,F00007793,12-07-2025 03:24,TRAFFIC,WX01,6,ground stop
DE0000005525,F00007793,12-07-2025 01:58,atc,ATC7,4,maintenance check
DE0000005526,F00007797,04-02-2025 19:17,WX,CR02,32,deicing
DE0000005527,F00007797,2025-02-04T17:59:00,CREW,WX01,-4,gate hold
DE0000005528,F00007797,04-02-2025 20:19,TRAFFIC,MX5,24,maintenance check
DE0000005529,F00007804,29-04-2024 11:37,OTHER,CR02,12m,ground stop
DE0000005530,F00007804,29-04-2024 12:17,ATC,OPS9,1,gate hold
DE0000005531,F00007805,04-12-2025 16:56,maint,ATC7,39,
DE0000005532,F00007806,07-07-2025 02:23,CREW,,7,gate hold
DE0000005533,F00007806,07-07-2025 02:34,weather,WX01,3,maintenance check
DE0000005534,F00007806,07-07-2025 00:53,CREW,OPS9,5,gate hold
DE0000005535,F00007809,05-08-2025 00:22,WX,GT3,14,ground stop
DE0000005536,F00007810,13-02-2025 06:14,maint,GT3,8,deicing
DE0000005537,F00007811,30-09-2025 16:25,AIRPORT,WX01,1,
DE0000005538,F00007811,2025-09-30T16:43:00,GATE,GT3,18,maintenance check
DE0000005539,F00007811,30-09-2025 16:22,weather,GT3,7,deicing
DE0000005540,F00007815,08-06-2024 14:14,MAINT,,6,late inbound
DE0000005541,F00007815,2024-06-08T15:32:00,ATC,,3,
DE0000005542,F00007815,08-06-2024 16:46,TRAFFIC,WX01,6,late inbound
DE0000005543,F00007816,07-11-2025 15:38,AIRPORT,MX5,-37,maintenance check
DE0000005544,F00007817,22-11-2024 06:46,weather,ATC7,-25,
DE0000005545,F00007819,05-10-2025 13:32,CREW,MX5,4,ground stop
DE0000005546,F00007819,05-10-2025 12:40,CREW,WX01,8,crew swap
DE0000005547,F00007822,06-04-2025 07:17,WEATHER,GT3,12,gate hold
DE0000005548,F00007822,04-06-2025 06:31,CREW,WX01,8,gate hold
DE0000005549,F00007823,08-02-2025 10:44,other,OPS9,6,ground stop
DE0000005550,F00007823,08-02-2025 13:10,atc,OPS9,6m,gate hold
DE0000005551,F00007826,13-03-2025 11:03,other,GT3,-1,maintenance check
DE0000005552,F00007826,13-03-2025 08:43,GATE,GT3,5,late inbound
DE0000005553,F00007838,11/24/2025 15:11,WEATHER,WX01,2m,gate hold
DE0000005554,F00007838,24-11-2025 17:23,airport,OPS9,10,ground stop
DE0000005555,F00007841,25-11-2025 18:44,CREW,ATC7,96,maintenance check
DE0000005556,F00007841,25-11-2025 17:11,atc,OPS9,92,crew swap
DE0000005557,F00007845,06-09-2024 13:47,weather,WX01,37,
DE0000005558,F00007846,25-01-2026 16:47,OTHER,,7,ground stop
DE0000005559,F00007846,25-01-2026 14:27,other,CR02,2,maintenance check
DE0000005560,F00007846,25-01-2026 14:24,other,WX01,1,gate hold
DE0000005561,F00007847,20-12-2024 22:19,weather,GT3,-5,gate hold
DE0000005562,F00007847,20-12-2024 20:35,crew,GT3,9,gate hold
DE0000005563,F00007847,2024-12-20T19:42:00,other,GT3,10,late inbound
DE0000005564,F00007849,11-01-2026 18:22,weather,WX01,13,deicing
DE0000005565,F00007849,11-01-2026 19:58,other,WX01,1,late inbound
DE0000005566,F00007850,2024-07-05T22:25:00,crew,CR02,5,late inbound
DE0000005567,F00007850,07-05-2024 21:59,maint,ATC7,5,crew swap
DE0000005568,F00007850,05-07-2024 21:38,OPS,GT3,4,ground stop
DE0000005569,F00007851,11-07-2024 13:51,MX,,7,ground stop
DE0000005570,F00007853,10/25/2025 15:01,OPS,WX01,12,deicing
DE0000005571,F00007853,10/25/2025 16:45,atc,OPS9,1,maintenance check
DE0000005572,F00007853,25-10-2025 16:52,crew,OPS9,13m,crew swap
DE0000005573,F00007854,06-08-2025 04:41,MX,CR02,14m,
DE0000005574,F00007854,06-08-2025 05:08,WEATHER,,10,gate hold
DE0000005575,F00007856,2025-06-04T09:24:00,CRW,,8,
DE0000005576,F00007857,29-02-2024 12:32,WEATHER,GT3,4,
DE0000005577,F00007857,29-02-2024 13:16,crew,,3,gate hold
DE0000005578,F00007860,2024-02-01T23:50:00,OTHER,MX5,10,late inbound
DE0000005579,F00007861,11/27/2024 16:05,MX,WX01,4,deicing
DE0000005580,F00007861,11/27/2024 15:01,OPS,MX5,2,late inbound
DE0000005581,F00007865,08-01-2026 07:47,CRW,WX01,14,gate hold
DE0000005582,F00007865,2026-01-08T08:36:00,other,WX01,16,deicing
DE0000005583,F00007866,23-03-2025 15:53,WEATHER,GT3,3m,
DE0000005584,F00007866,2025-03-23T18:02:00,MX,CR02,5,gate hold
DE0000005585,F00007866,23-03-2025 16:49,other,CR02,2m,
DE0000005586,F00007867,06-10-2025 02:00,OPS,OPS9,24,late inbound
DE0000005587,F00007867,06-10-2025 00:28,ATC,MX5,43,gate hold
DE0000005588,F00007869,04-07-2025 01:39,AIRPORT,WX01,18,late inbound
DE0000005589,F00007871,27-06-2025 18:37,WX,CR02,2,ground stop
DE0000005590,F00007871,27-06-2025 18:38,WX,,2,crew swap
DE0000005591,F00007872,09-05-2024 18:01,maint,WX01,3,gate hold
DE0000005592,F00007874,03-09-2025 12:58,OPS,ATC7,8,deicing
DE0000005593,F00007874,09-03-2025 14:53,MAINT,CR02,1,
DE0000005594,F00007874,03-09-2025 13:31,airport,CR02,10,maintenance check
DE0000005595,F00007877,22-08-2024 05:04,weather,GT3,18,ground stop
DE0000005596,F00007878,07-11-2024 00:42,airport,GT3,0,crew swap
DE0000005597,F00007878,11-07-2024 02:16,MX,OPS9,31,gate hold
DE0000005598,F00007880,30-12-2025 04:52,CRW,MX5,25,crew swap
DE0000005599,F00007880,30-12-2025 03:05,MX,WX01,5,
DE0000005600,F00007881,02/14/2024 14:12,WX,MX5,6,ground stop
DE0000005601,F00007883,07-12-2024 17:24,AIRPORT,GT3,45,
DE0000005602,F00007887,05/30/2025 17:23,GATE,,3,crew swap
DE0000005603,F00007887,30-05-2025 16:16,crew,WX01,17,ground stop
DE0000005604,F00007888,05/18/2025 12:16,maint,GT3,3,crew swap
DE0000005605,F00007888,18-05-2025 10:44,MAINT,,3,
DE0000005606,F00007892,15-02-2024 01:28,GATE,MX5,9,
DE0000005607,F00007892,15-02-2024 03:40,OPS,CR02,7,late inbound
DE0000005608,F00007893,19-04-2024 23:03,WEATHER,WX01,17,late inbound
DE0000005609,F00007893,04/20/2024 01:11,CREW,,7,crew swap
DE0000005610,F00007902,17-04-2025 05:15,MAINT,MX5,-6,late inbound
DE0000005611,F00007902,17-04-2025 06:17,weather,GT3,8,gate hold
DE0000005612,F00007902,17-04-2025 05:32,CREW,OPS9,-12,maintenance check
DE0000005613,F00007903,11-05-2024 08:05,weather,ATC7,2,ground stop
DE0000005614,F00007907,19-02-2024 05:03,WX,MX5,7,gate hold
DE0000005615,F00007907,19-02-2024 04:47,WX,,8,deicing
DE0000005616,F00007907,19-02-2024 06:11,CRW,ATC7,5,maintenance check
DE0000005617,F00007909,08/26/2024 13:11,maint,OPS9,2,ground stop
DE0000005618,F00007909,26-08-2024 12:47,atc,MX5,17,gate hold
DE0000005619,F00007911,08/26/2025 18:51,AIRPORT,CR02,9,ground stop
DE0000005620,F00007912,21-11-2025 04:04,GATE,GT3,29,deicing
DE0000005621,F00007912,11/21/2025 03:50,maint,GT3,9,deicing
DE0000005622,F00007917,2025-12-01T20:35:00,TRAFFIC,GT3,43,
DE0000005623,F00007917,2025-12-01T19:27:00,WEATHER,ATC7,1,gate hold
DE0000005624,F00007917,01-12-2025 20:55,maint,OPS9,7,crew swap
DE0000005625,F00007918,27-11-2025 10:13,atc,GT3,10,gate hold
DE0000005626,F00007918,11/27/2025 10:32,CRW,ATC7,1,crew swap
DE0000005627,F00007919,19-01-2026 12:32,atc,CR02,24,ground stop
DE0000005628,F00007922,10-10-2024 00:39,crew,,16,ground stop
DE0000005629,F00007923,2024-07-16T17:09:00,OPS,,7,gate hold
DE0000005630,F00007923,16-07-2024 16:25,crew,WX01,11,deicing
DE0000005631,F00007923,16-07-2024 16:22,WEATHER,CR02,-4,
DE0000005632,F00007925,20-12-2025 14:23,OPS,ATC7,10m,
DE0000005633,F00007925,20-12-2025 14:09,AIRPORT,MX5,7m,ground stop
DE0000005634,F00007926,17-09-2024 14:31,AIRPORT,ATC7,21,crew swap
DE0000005635,F00007927,04-04-2024 10:39,weather,,0,late inbound
DE0000005636,F00007927,04-04-2024 11:34,CRW,WX01,-1,
DE0000005637,F00007928,31-12-2025 21:03,maint,CR02,8,deicing
DE0000005638,F00007928,31-12-2025 19:39,CREW,GT3,2,ground stop
DE0000005639,F00007928,2025-12-31T18:34:00,MAINT,MX5,2,late inbound
DE0000005640,F00007933,21-06-2025 10:03,MX,GT3,2,maintenance check
DE0000005641,F00007933,06/21/2025 10:19,CRW,,1,deicing
DE0000005642,F00007938,29-07-2025 05:17,MX,OPS9,30,maintenance check
DE0000005643,F00007942,03/20/2024 04:13,ATC,WX01,1,
DE0000005644,F00007942,03/20/2024 03:39,WEATHER,GT3,1,crew swap
DE0000005645,F00007942,03/20/2024 03:49,OPS,GT3,1,late inbound
DE0000005646,F00007944,14-09-2024 06:55,ATC,MX5,0m,
DE0000005647,F00007944,2024-09-14T07:36:00,AIRPORT,CR02,4,ground stop
DE0000005648,F00007944,14-09-2024 07:47,ATC,OPS9,2,deicing
DE0000005649,F00007947,09-04-2024 05:58,other,OPS9,30,gate hold
DE0000005650,F00007949,12-07-2024 18:14,WEATHER,GT3,5,late inbound
DE0000005651,F00007949,12-07-2024 19:17,OPS,CR02,3,gate hold
DE0000005652,F00007949,12-07-2024 19:20,weather,OPS9,5,crew swap
DE0000005653,F00007951,03/28/2025 22:19,other,GT3,2,crew swap
DE0000005654,F00007951,28-03-2025 21:47,MX,CR02,10,ground stop
DE0000005655,F00007954,08/27/2024 06:31,AIRPORT,GT3,0,maintenance check
DE0000005656,F00007954,27-08-2024 06:13,airport,ATC7,7,late inbound
DE0000005657,F00007958,2025-06-02T05:13:00,crew,WX01,-1,crew swap
DE0000005658,F00007958,02-06-2025 03:38,CRW,OPS9,1,gate hold
DE0000005659,F00007958,02-06-2025 03:23,airport,ATC7,1,
DE0000005660,F00007960,12/13/2025 14:03,crew,,4,maintenance check
DE0000005661,F00007961,20-09-2025 08:07,weather,ATC7,27m,maintenance check
DE0000005662,F00007962,22-10-2024 09:12,GATE,,11,maintenance check
DE0000005663,F00007962,22-10-2024 08:15,OTHER,CR02,2,deicing
DE0000005664,F00007966,10/20/2025 13:16,CRW,ATC7,-1,deicing
DE0000005665,F00007966,20-10-2025 14:31,TRAFFIC,OPS9,1,
DE0000005666,F00007966,20-10-2025 13:46,MAINT,CR02,1,ground stop
DE0000005667,F00007968,25-02-2025 09:29,GATE,,9,late inbound
DE0000005668,F00007968,02/25/2025 09:25,OTHER,ATC7,20,crew swap
DE0000005669,F00007968,25-02-2025 08:31,CREW,ATC7,1,maintenance check
DE0000005670,F00007969,10-11-2024 06:16,MAINT,,1,deicing
DE0000005671,F00007970,10-03-2025 09:15,other,GT3,-30,ground stop
DE0000005672,F00007972,29-07-2025 04:59,WX,GT3,9,gate hold
DE0000005673,F00007972,07/29/2025 06:04,AIRPORT,CR02,7,late inbound
DE0000005674,F00007972,29-07-2025 07:27,WEATHER,GT3,3,deicing
DE0000005675,F00007973,30-05-2024 13:40,AIRPORT,WX01,5,maintenance check
DE0000005676,F00007973,30-05-2024 14:06,CREW,CR02,39,maintenance check
DE0000005677,F00007974,21-05-2024 06:09,CRW,MX5,9,crew swap
DE0000005678,F00007974,21-05-2024 04:20,MX,OPS9,19,ground stop
DE0000005679,F00007976,2025-02-05T07:58:00,crew,WX01,3,deicing
DE0000005680,F00007976,02-05-2025 07:39,crew,GT3,19m,crew swap
DE0000005681,F00007981,22-02-2025 20:39,maint,CR02,35,gate hold
DE0000005682,F00007981,02/22/2025 20:14,WEATHER,OPS9,10,
DE0000005683,F00007983,04-07-2025 06:37,WEATHER,OPS9,3,maintenance check
DE0000005684,F00007985,23-01-2025 00:37,ATC,,3,late inbound
DE0000005685,F00007985,01/23/2025 00:45,GATE,GT3,2m,ground stop
DE0000005686,F00007985,22-01-2025 22:55,TRAFFIC,WX01,2m,ground stop
DE0000005687,F00007987,17-07-2025 17:49,weather,WX01,8,maintenance check
DE0000005688,F00007988,05-05-2024 01:35,other,MX5,29,crew swap
DE0000005689,F00007990,07-05-2025 00:45,airport,MX5,8,
DE0000005690,F00007990,05-07-2025 01:57,crew,MX5,1,
DE0000005691,F00007991,04-05-2024 13:17,weather,CR02,11,deicing
DE0000005692,F00007991,04-05-2024 13:32,other,,14,gate hold
DE0000005693,F00007991,2024-05-04T13:23:00,other,GT3,5,gate hold
DE0000005694,F00007994,27-02-2025 16:20,crew,ATC7,11,ground stop
DE0000005695,F00007994,27-02-2025 14:52,OTHER,GT3,8,deicing
DE0000005696,F00007994,2025-02-27T13:32:00,atc,,19m,crew swap
DE0000005697,F00007997,05-04-2024 12:04,OTHER,GT3,3,deicing
DE0000005698,F00007997,05-04-2024 13:40,WX,CR02,4,crew swap
DE0000005699,F00007998,09-12-2025 15:31,airport,WX01,4,deicing
DE0000005700,F00007998,09-12-2025 13:34,airport,MX5,23,maintenance check
DE0000005701,F00007998,09-12-2025 13:39,CREW,MX5,3,crew swap
DE0000005702,F00007999,08-03-2024 17:40,GATE,WX01,6m,gate hold
DE0000005703,F00007999,08-03-2024 17:44,WEATHER,,14,crew swap
DE0000005704,F00007999,08-03-2024 16:42,MX,,51,maintenance check
DE0000005705,F00008000,2025-10-04T18:53:00,MAINT,WX01,13,
DE0000005706,F00008000,04-10-2025 18:41,atc,,-2,crew swap
DE0000005707,F00008000,04-10-2025 19:07,TRAFFIC,ATC7,1m,late inbound
DE0000005708,F00008002,04-02-2025 21:27,maint,WX01,5,ground stop
DE0000005709,F00008002,02-04-2025 23:43,MX,ATC7,2,gate hold
DE0000005710,F00008002,02-04-2025 21:16,AIRPORT,WX01,2,deicing
DE0000005711,F00008004,2024-06-19T19:25:00,atc,,13m,crew swap
DE0000005712,F00008005,03/13/2025 02:10,TRAFFIC,CR02,4,late inbound
DE0000005713,F00008005,13-03-2025 02:40,airport,MX5,3,late inbound
DE0000005714,F00008005,13-03-2025 02:27,crew,ATC7,7,deicing
DE0000005715,F00008008,14-11-2024 18:50,MX,OPS9,1m,ground stop
DE0000005716,F00008011,10-12-2025 23:00,TRAFFIC,WX01,0,
DE0000005717,F00008011,10-12-2025 21:46,ATC,,16,ground stop
DE0000005718,F00008011,12-10-2025 20:29,MAINT,,16,late inbound
DE0000005719,F00008015,13-10-2024 17:45,other,,3,ground stop
DE0000005720,F00008015,13-10-2024 19:35,atc,ATC7,2,deicing
DE0000005721,F00008015,13-10-2024 17:19,MX,,1m,gate hold
DE0000005722,F00008017,28-09-2024 15:22,CREW,ATC7,12,deicing
DE0000005723,F00008020,15-07-2025 18:12,weather,WX01,14,deicing
DE0000005724,F00008022,22-12-2025 09:50,WX,OPS9,30m,gate hold
DE0000005725,F00008023,26-06-2025 11:05,AIRPORT,OPS9,19,crew swap
DE0000005726,F00008028,20-01-2026 09:04,OTHER,ATC7,0,deicing
DE0000005727,F00008028,20-01-2026 10:13,maint,,1m,maintenance check
DE0000005728,F00008028,20-01-2026 11:06,weather,GT3,7,
DE0000005729,F00008031,12-01-2025 01:56,weather,MX5,25,
DE0000005730,F00008033,07-10-2025 19:32,AIRPORT,GT3,22,crew swap
DE0000005731,F00008033,10-07-2025 18:34,WEATHER,GT3,34,deicing
DE0000005732,F00008040,06-08-2025 20:15,atc,MX5,0,ground stop
DE0000005733,F00008040,06-08-2025 20:41,MAINT,,-5,ground stop
DE0000005734,F00008040,06-08-2025 20:12,AIRPORT,,3,crew swap
DE0000005735,F00008041,04-03-2025 15:59,MAINT,WX01,1,crew swap
DE0000005736,F00008042,01-10-2026 02:36,other,CR02,18,crew swap
DE0000005737,F00008042,10-01-2026 03:24,crew,ATC7,14,crew swap
DE0000005738,F00008042,2026-01-10T05:10:00,TRAFFIC,WX01,18,crew swap
DE0000005739,F00008043,05-06-2025 20:18,WEATHER,,-11,late inbound
DE0000005740,F00008053,12-10-2024 05:27,CREW,ATC7,22,late inbound
DE0000005741,F00008054,15-02-2024 10:08,OTHER,GT3,5,gate hold
DE0000005742,F00008054,15-02-2024 10:54,MAINT,OPS9,1,ground stop
DE0000005743,F00008054,15-02-2024 10:11,other,,14,maintenance check
DE0000005744,F00008059,21-07-2024 00:44,TRAFFIC,ATC7,0,ground stop
DE0000005745,F00008059,21-07-2024 01:40,atc,MX5,1,late inbound
DE0000005746,F00008062,01/30/2025 19:00,MX,,15,crew swap
DE0000005747,F00008067,06/19/2024 21:38,other,OPS9,44,late inbound
DE0000005748,F00008071,05-03-2024 23:29,TRAFFIC,OPS9,4,
DE0000005749,F00008071,05-03-2024 22:14,OTHER,WX01,3,
DE0000005750,F00008071,05-03-2024 21:51,CRW,,4,gate hold
DE0000005751,F00008075,09-05-2025 17:35,GATE,WX01,13,
DE0000005752,F00008081,05-02-2024 09:32,CRW,CR02,21,
DE0000005753,F00008083,12-12-2024 05:51,WX,ATC7,0,crew swap
DE0000005754,F00008083,12-12-2024 05:03,OTHER,OPS9,1,late inbound
DE0000005755,F00008085,04/16/2024 19:19,maint,WX01,69,crew swap
DE0000005756,F00008088,05-01-2024 16:42,MX,WX01,1,crew swap
DE0000005757,F00008088,01-05-2024 15:14,maint,WX01,2,late inbound
DE0000005758,F00008088,01-05-2024 15:08,AIRPORT,GT3,8,
DE0000005759,F00008092,16-02-2024 16:51,crew,OPS9,-9,
DE0000005760,F00008092,16-02-2024 18:05,WEATHER,CR02,5,crew swap
DE0000005761,F00008092,16-02-2024 17:14,airport,OPS9,49,ground stop
DE0000005762,F00008093,05/16/2025 23:03,CRW,WX01,73,ground stop
DE0000005763,F00008094,03-09-2025 13:25,OPS,CR02,33,maintenance check
DE0000005764,F00008094,03-09-2025 14:42,OTHER,OPS9,4,
DE0000005765,F00008094,03-09-2025 13:36,ATC,WX01,3,maintenance check
DE0000005766,F00008098,04-10-2024 16:49,maint,WX01,3,
DE0000005767,F00008098,10-04-2024 16:09,MAINT,ATC7,16,gate hold
DE0000005768,F00008098,10-04-2024 18:09,MX,MX5,5,
DE0000005769,F00008099,16-02-2025 10:12,airport,WX01,313,late inbound
DE0000005770,F00008100,02-01-2025 03:01,other,GT3,30m,crew swap
DE0000005771,F00008101,26-09-2025 04:22,OTHER,,39,maintenance check
DE0000005772,F00008105,2025-06-29T01:44:00,MX,OPS9,0,late inbound
DE0000005773,F00008105,06/29/2025 03:08,TRAFFIC,WX01,6,deicing
DE0000005774,F00008105,29-06-2025 03:59,CREW,GT3,1,gate hold
DE0000005775,F00008107,03/14/2024 01:00,OTHER,CR02,1,maintenance check
DE0000005776,F00008107,14-03-2024 03:39,OTHER,GT3,13,gate hold
DE0000005777,F00008107,2024-03-14T03:47:00,atc,ATC7,3,maintenance check
DE0000005778,F00008108,17-01-2025 20:28,AIRPORT,ATC7,1,ground stop
DE0000005779,F00008108,17-01-2025 20:30,OTHER,MX5,13,late inbound
DE0000005780,F00008109,16-08-2024 00:14,GATE,WX01,21,ground stop
DE0000005781,F00008109,15-08-2024 23:18,CRW,OPS9,10,gate hold
DE0000005782,F00008111,30-06-2024 07:35,AIRPORT,CR02,0,ground stop
DE0000005783,F00008111,30-06-2024 09:14,OPS,WX01,1,maintenance check
DE0000005784,F00008111,30-06-2024 07:29,MX,WX01,3,ground stop
DE0000005785,F00008116,02-11-2025 05:42,OTHER,MX5,2,
DE0000005786,F00008116,2025-11-02T05:07:00,WX,OPS9,4,maintenance check
DE0000005787,F00008117,2024-11-02T22:07:00,WEATHER,MX5,6,crew swap
DE0000005788,F00008117,02-11-2024 22:46,WX,ATC7,4,deicing
DE0000005789,F00008119,04-04-2024 04:04,OTHER,WX01,21m,gate hold
DE0000005790,F00008119,04-04-2024 03:59,MX,,49,late inbound
DE0000005791,F00008124,09/25/2025 06:33,TRAFFIC,GT3,20,gate hold
DE0000005792,F00008125,04-06-2025 21:51,WX,,15,gate hold
DE0000005793,F00008133,16-11-2025 10:57,CRW,,3,gate hold
DE0000005794,F00008133,2025-11-16T09:28:00,CRW,,11,deicing
DE0000005795,F00008138,28-07-2025 08:23,MX,MX5,3,crew swap
DE0000005796,F00008138,2025-07-28T09:38:00,TRAFFIC,OPS9,1,late inbound
DE0000005797,F00008138,28-07-2025 08:45,MX,CR02,10,ground stop
DE0000005798,F00008142,06-05-2025 06:25,atc,WX01,30,ground stop
DE0000005799,F00008143,08-01-2026 08:35,WEATHER,CR02,3,maintenance check
DE0000005800,F00008143,2026-01-08T08:26:00,MX,ATC7,2,maintenance check
DE0000005801,F00008143,08-01-2026 08:22,MX,CR02,33,ground stop
DE0000005802,F00008146,20-04-2025 12:35,ATC,ATC7,10,maintenance check
DE0000005803,F00008148,08-05-2025 20:07,WEATHER,WX01,24,maintenance check
DE0000005804,F00008149,22-08-2024 07:29,WX,GT3,1m,crew swap
DE0000005805,F00008149,22-08-2024 07:33,other,MX5,10,maintenance check
DE0000005806,F00008149,22-08-2024 08:25,maint,ATC7,5,late inbound
DE0000005807,F00008151,29-12-2025 00:30,MAINT,ATC7,1,deicing
DE0000005808,F00008151,12/29/2025 00:23,MAINT,OPS9,1,late inbound
DE0000005809,F00008153,29-05-2024 07:20,CREW,ATC7,-2,crew swap
DE0000005810,F00008153,29-05-2024 07:02,atc,ATC7,5,gate hold
DE0000005811,F00008153,29-05-2024 09:49,crew,MX5,2,crew swap
DE0000005812,F00008156,04-11-2024 15:10,OTHER,MX5,13m,
DE0000005813,F00008159,07-11-2024 05:13,MAINT,ATC7,53,maintenance check
DE0000005814,F00008159,11-07-2024 04:01,MX,WX01,9,gate hold
DE0000005815,F00008161,05-02-2025 11:55,maint,MX5,20,
DE0000005816,F00008161,05-02-2025 12:09,CRW,GT3,8,late inbound
DE0000005817,F00008161,02-05-2025 10:55,AIRPORT,OPS9,2m,maintenance check
DE0000005818,F00008163,25-06-2024 10:04,MAINT,,11,
DE0000005819,F00008167,18-03-2024 03:06,MX,MX5,35,deicing
DE0000005820,F00008167,03/18/2024 04:33,maint,WX01,2,ground stop
DE0000005821,F00008167,03/18/2024 05:49,OPS,GT3,27,maintenance check
DE0000005822,F00008168,27-02-2025 10:22,WX,ATC7,10,ground stop
DE0000005823,F00008170,05-10-2025 10:00,CREW,WX01,3,crew swap
DE0000005824,F00008170,05-10-2025 09:18,AIRPORT,MX5,18,late inbound
DE0000005825,F00008171,16-11-2024 07:37,CREW,OPS9,-3,maintenance check
DE0000005826,F00008171,11/16/2024 08:55,GATE,OPS9,41,
DE0000005827,F00008176,01-03-2025 16:22,airport,,2,maintenance check
DE0000005828,F00008176,01-03-2025 16:40,CRW,OPS9,12,late inbound
DE0000005829,F00008181,04/14/2024 22:51,OTHER,ATC7,2,late inbound
DE0000005830,F00008182,03-07-2025 05:21,MAINT,CR02,67,ground stop
DE0000005831,F00008186,31-07-2024 05:27,maint,GT3,1,crew swap
DE0000005832,F00008186,31-07-2024 04:30,WEATHER,OPS9,7m,crew swap
DE0000005833,F00008188,2024-02-06T13:17:00,airport,ATC7,1m,late inbound
DE0000005834,F00008188,02-06-2024 10:40,OPS,MX5,3,gate hold
DE0000005835,F00008189,2024-02-21T21:23:00,maint,GT3,25,gate hold
DE0000005836,F00008189,22-02-2024 00:08,OPS,CR02,4,maintenance check
DE0000005837,F00008189,21-02-2024 23:56,WEATHER,GT3,16,crew swap
DE0000005838,F00008190,08/27/2024 08:44,crew,ATC7,1,maintenance check
DE0000005839,F00008190,08/27/2024 09:14,maint,CR02,8,maintenance check
DE0000005840,F00008195,08-02-2024 06:38,MX,WX01,5m,crew swap
DE0000005841,F00008195,08-02-2024 05:29,CREW,OPS9,6,ground stop
DE0000005842,F00008195,08-02-2024 07:23,CRW,OPS9,7,
DE0000005843,F00008200,15-05-2025 19:31,CREW,CR02,0,deicing
DE0000005844,F00008200,15-05-2025 21:24,CRW,WX01,2,late inbound
DE0000005845,F00008200,15-05-2025 19:18,OPS,GT3,2,ground stop
DE0000005846,F00008207,2024-10-20T13:22:00,atc,GT3,7m,deicing
DE0000005847,F00008207,20-10-2024 12:01,MX,,53,deicing
DE0000005848,F00008212,20-07-2024 02:43,OPS,MX5,14,gate hold
DE0000005849,F00008214,2024-07-12T03:47:00,OPS,CR02,0,maintenance check
DE0000005850,F00008214,07-12-2024 04:53,AIRPORT,,1,late inbound
DE0000005851,F00008215,24-01-2026 07:35,crew,CR02,2,
DE0000005852,F00008215,24-01-2026 06:26,GATE,OPS9,18,late inbound
DE0000005853,F00008215,01/24/2026 07:59,GATE,WX01,23,deicing
DE0000005854,F00008216,17-07-2025 08:53,OTHER,WX01,1,maintenance check
DE0000005855,F00008220,07-08-2024 20:07,CREW,ATC7,3m,crew swap
DE0000005856,F00008220,07-08-2024 19:34,WEATHER,,2,maintenance check
DE0000005857,F00008223,20-08-2024 05:11,airport,CR02,28,crew swap
DE0000005858,F00008223,20-08-2024 05:00,crew,CR02,4,ground stop
DE0000005859,F00008224,03-08-2024 06:25,ATC,MX5,17m,deicing
DE0000005860,F00008225,18-06-2024 02:28,crew,WX01,12,ground stop
DE0000005861,F00008225,17-06-2024 23:58,other,ATC7,6,maintenance check
DE0000005862,F00008225,18-06-2024 00:16,AIRPORT,WX01,6,gate hold
DE0000005863,F00008229,23-08-2024 09:23,WX,CR02,57,maintenance check
DE0000005864,F00008230,02-02-2025 20:00,other,WX01,229,
DE0000005865,F00008233,22-03-2024 16:14,OPS,GT3,9,
DE0000005866,F00008235,05/22/2025 02:05,WEATHER,MX5,11,deicing
DE0000005867,F00008235,22-05-2025 05:03,CRW,CR02,13,gate hold
DE0000005868,F00008235,22-05-2025 03:33,CRW,WX01,16,deicing
DE0000005869,F00008236,20-10-2025 13:41,ATC,CR02,6,maintenance check
DE0000005870,F00008236,20-10-2025 15:16,WX,OPS9,10,
DE0000005871,F00008236,20-10-2025 14:51,OPS,WX01,51,late inbound
DE0000005872,F00008237,04-09-2025 04:46,MAINT,MX5,0,deicing
DE0000005873,F00008237,09-04-2025 02:53,TRAFFIC,OPS9,88,gate hold
DE0000005874,F00008237,09-04-2025 04:38,OTHER,MX5,1,deicing
DE0000005875,F00008239,04-09-2025 06:13,MAINT,ATC7,-3,maintenance check
DE0000005876,F00008239,04-09-2025 07:33,WEATHER,ATC7,13,ground stop
DE0000005877,F00008239,04-09-2025 05:44,OPS,GT3,1,maintenance check
DE0000005878,F00008240,2024-05-13T19:40:00,OTHER,GT3,13,gate hold
DE0000005879,F00008244,03-05-2024 06:00,GATE,MX5,6,
DE0000005880,F00008244,2024-05-03T04:43:00,TRAFFIC,WX01,12,gate hold
DE0000005881,F00008244,03-05-2024 05:31,OPS,MX5,2,deicing
DE0000005882,F00008245,2025-09-21T13:48:00,ATC,OPS9,10,maintenance check
DE0000005883,F00008247,21-09-2024 14:56,TRAFFIC,GT3,4,late inbound
DE0000005884,F00008247,21-09-2024 15:01,AIRPORT,WX01,-5,deicing
DE0000005885,F00008247,09/21/2024 14:29,OTHER,MX5,3,deicing
DE0000005886,F00008248,10-10-2025 02:07,WEATHER,,9,ground stop
DE0000005887,F00008248,10-10-2025 01:48,CRW,ATC7,-11,
DE0000005888,F00008250,07-03-2024 04:10,airport,MX5,2m,gate hold
DE0000005889,F00008250,03-07-2024 04:51,TRAFFIC,,2,ground stop
DE0000005890,F00008250,03-07-2024 04:03,crew,,11,gate hold
DE0000005891,F00008252,05-02-2025 22:52,TRAFFIC,CR02,-3,ground stop
DE0000005892,F00008252,02-05-2025 23:56,crew,OPS9,16,
DE0000005893,F00008252,05-02-2025 22:47,WEATHER,GT3,2,maintenance check
DE0000005894,F00008257,02/16/2024 19:02,CREW,ATC7,2,crew swap
DE0000005895,F00008257,2024-02-16T20:06:00,airport,OPS9,8,ground stop
DE0000005896,F00008258,17-08-2024 21:56,MX,ATC7,3,deicing
DE0000005897,F00008258,17-08-2024 21:18,other,,5,ground stop
DE0000005898,F00008259,15-01-2025 15:00,crew,ATC7,0m,crew swap
DE0000005899,F00008259,15-01-2025 13:14,maint,CR02,10m,
DE0000005900,F00008259,15-01-2025 14:14,OTHER,OPS9,16,crew swap
DE0000005901,F00008261,26-04-2025 07:09,crew,GT3,17,maintenance check
DE0000005902,F00008262,04/15/2025 14:11,CREW,ATC7,0,maintenance check
DE0000005903,F00008262,15-04-2025 13:11,airport,GT3,1,gate hold
DE0000005904,F00008262,15-04-2025 13:07,WX,ATC7,5,
DE0000005905,F00008265,06-02-2024 15:12,maint,ATC7,1m,late inbound
DE0000005906,F00008265,02-06-2024 14:05,ATC,GT3,1,ground stop
DE0000005907,F00008267,04-03-2024 17:35,TRAFFIC,MX5,15,maintenance check
DE0000005908,F00008268,30-05-2025 05:48,airport,GT3,-46,
DE0000005909,F00008269,17-08-2025 15:59,MX,CR02,6m,deicing
DE0000005910,F00008269,08/17/2025 17:21,OTHER,WX01,2,maintenance check
DE0000005911,F00008269,08/17/2025 17:54,airport,CR02,7,late inbound
DE0000005912,F00008276,2024-05-09T00:54:00,maint,ATC7,16m,crew swap
DE0000005913,F00008276,09-05-2024 01:32,atc,CR02,34m,crew swap
DE0000005914,F00008279,09/28/2025 23:48,CREW,GT3,15m,deicing
DE0000005915,F00008279,28-09-2025 21:18,CRW,OPS9,6,late inbound
DE0000005916,F00008279,09/28/2025 23:32,ATC,,11,deicing
DE0000005917,F00008280,03-02-2024 20:11,atc,ATC7,19,maintenance check
DE0000005918,F00008281,07-02-2025 21:50,OTHER,GT3,1,ground stop
DE0000005919,F00008281,07-02-2025 20:57,OPS,MX5,2,gate hold
DE0000005920,F00008283,10-12-2024 02:52,MAINT,OPS9,55,crew swap
DE0000005921,F00008285,31-10-2025 06:37,CRW,OPS9,5,ground stop
DE0000005922,F00008285,31-10-2025 09:08,other,CR02,6,maintenance check
DE0000005923,F00008287,15-10-2024 16:09,CRW,,5,
DE0000005924,F00008287,15-10-2024 15:07,WX,CR02,1,late inbound
DE0000005925,F00008287,15-10-2024 14:49,CREW,ATC7,1,maintenance check
DE0000005926,F00008290,11/25/2024 17:25,other,,2,ground stop
DE0000005927,F00008290,25-11-2024 19:29,maint,WX01,5,late inbound
DE0000005928,F00008290,25-11-2024 19:17,airport,GT3,3,deicing
DE0000005929,F00008291,08-04-2025 00:51,GATE,GT3,25,maintenance check
DE0000005930,F00008293,11-11-2025 18:46,AIRPORT,ATC7,0,late inbound
DE0000005931,F00008293,2025-11-11T18:10:00,crew,OPS9,-1,maintenance check
DE0000005932,F00008293,2025-11-11T17:38:00,MAINT,WX01,5,
DE0000005933,F00008294,16-08-2025 20:24,airport,WX01,26,
DE0000005934,F00008295,27-09-2025 15:52,weather,MX5,0,deicing
DE0000005935,F00008295,27-09-2025 17:27,TRAFFIC,ATC7,5,
DE0000005936,F00008295,27-09-2025 17:39,MX,ATC7,2m,late inbound
DE0000005937,F00008296,08-02-2025 22:29,airport,CR02,15,deicing
DE0000005938,F00008296,08-02-2025 22:00,weather,ATC7,29,maintenance check
DE0000005939,F00008297,2024-11-27T20:43:00,MAINT,MX5,23,gate hold
DE0000005940,F00008302,2024-06-15T12:23:00,OTHER,,4,late inbound
DE0000005941,F00008302,15-06-2024 14:49,TRAFFIC,OPS9,2,late inbound
DE0000005942,F00008307,14-07-2024 13:44,weather,,11,maintenance check
DE0000005943,F00008307,07/14/2024 14:31,WEATHER,WX01,12,late inbound
DE0000005944,F00008307,07/14/2024 15:08,maint,OPS9,-10,late inbound
DE0000005945,F00008310,10/28/2024 19:31,airport,GT3,2,gate hold
DE0000005946,F00008310,28-10-2024 20:40,AIRPORT,CR02,1,ground stop
DE0000005947,F00008310,28-10-2024 21:20,ATC,MX5,1,late inbound
DE0000005948,F00008311,18-04-2025 04:16,CRW,ATC7,16,crew swap
DE0000005949,F00008321,2024-07-08T05:49:00,maint,,0,deicing
DE0000005950,F00008321,08-07-2024 06:14,airport,,1,maintenance check
DE0000005951,F00008322,31-10-2025 05:58,other,GT3,38,maintenance check
DE0000005952,F00008323,25-09-2025 07:57,crew,WX01,26,maintenance check
DE0000005953,F00008324,04-06-2024 05:02,CREW,GT3,12,deicing
DE0000005954,F00008324,04-06-2024 06:04,maint,OPS9,5,gate hold
DE0000005955,F00008324,2024-06-04T03:54:00,MX,MX5,4,ground stop
DE0000005956,F00008327,24-06-2025 01:09,CREW,ATC7,2,deicing
DE0000005957,F00008327,24-06-2025 00:43,maint,ATC7,12,
DE0000005958,F00008327,24-06-2025 01:46,AIRPORT,ATC7,2m,maintenance check
DE0000005959,F00008328,2025-05-04T22:46:00,CREW,GT3,4,deicing
DE0000005960,F00008328,2025-05-05T00:36:00,weather,,2,gate hold
DE0000005961,F00008331,03-06-2024 23:35,OTHER,GT3,19,
DE0000005962,F00008331,03-06-2024 23:24,WX,CR02,-5,gate hold
DE0000005963,F00008331,04-06-2024 01:51,CRW,MX5,13,crew swap
DE0000005964,F00008332,19-12-2024 11:11,OPS,GT3,1,ground stop
DE0000005965,F00008332,12/19/2024 12:37,maint,GT3,-16,late inbound
DE0000005966,F00008332,19-12-2024 10:56,GATE,WX01,19,
DE0000005967,F00008339,12/29/2024 13:35,maint,MX5,3,crew swap
DE0000005968,F00008339,29-12-2024 11:29,MX,CR02,11,late inbound
DE0000005969,F00008340,29-05-2025 12:11,weather,GT3,1,maintenance check
DE0000005970,F00008340,29-05-2025 11:31,MAINT,CR02,1,late inbound
DE0000005971,F00008340,29-05-2025 10:58,atc,ATC7,1,maintenance check
DE0000005972,F00008348,02-09-2025 12:31,CREW,,0,crew swap
DE0000005973,F00008348,09-02-2025 13:22,maint,,3,gate hold
DE0000005974,F00008348,09-02-2025 12:39,AIRPORT,,24,gate hold
DE0000005975,F00008353,22-11-2025 23:07,OPS,MX5,4,crew swap
DE0000005976,F00008353,11/22/2025 21:27,CRW,WX01,1m,ground stop
DE0000005977,F00008353,22-11-2025 20:36,other,GT3,4,deicing
DE0000005978,F00008354,2026-01-03T17:27:00,WX,CR02,22,ground stop
DE0000005979,F00008359,16-02-2024 12:12,WX,,24,maintenance check
DE0000005980,F00008359,16-02-2024 12:19,TRAFFIC,,7,crew swap
DE0000005981,F00008359,2024-02-16T14:24:00,atc,MX5,2,deicing
DE0000005982,F00008361,12-06-2025 01:10,WX,CR02,0,late inbound
DE0000005983,F00008361,06-12-2025 00:31,WEATHER,GT3,2,ground stop
DE0000005984,F00008361,05-12-2025 23:55,MAINT,ATC7,1,deicing
DE0000005985,F00008363,11-09-2025 07:39,OPS,MX5,0m,crew swap
DE0000005986,F00008363,2025-09-11T09:10:00,MAINT,OPS9,19,deicing
DE0000005987,F00008363,11-09-2025 07:37,ATC,MX5,5,late inbound
DE0000005988,F00008365,03-12-2024 09:06,airport,,3,deicing
DE0000005989,F00008365,12-03-2024 09:39,CRW,MX5,7,maintenance check
DE0000005990,F00008365,12-03-2024 09:07,WEATHER,MX5,1,crew swap
DE0000005991,F00008371,17-11-2024 18:06,OTHER,,16,gate hold
DE0000005992,F00008371,17-11-2024 20:15,TRAFFIC,MX5,1,crew swap
DE0000005993,F00008371,11/17/2024 20:03,weather,ATC7,1,late inbound
DE0000005994,F00008378,04-01-2026 17:51,atc,GT3,14,maintenance check
DE0000005995,F00008379,16-11-2025 05:20,OTHER,ATC7,3,maintenance check
DE0000005996,F00008379,16-11-2025 05:26,WEATHER,OPS9,6,
DE0000005997,F00008380,07-07-2025 17:26,OPS,CR02,6,
DE0000005998,F00008380,07-07-2025 18:21,MX,OPS9,7,crew swap
DE0000005999,F00008380,07-07-2025 17:42,AIRPORT,CR02,23,gate hold
DE0000006000,F00008383,19-07-2025 09:34,GATE,MX5,0,late inbound
DE0000006001,F00008383,19-07-2025 09:50,WX,WX01,2m,late inbound
DE0000006002,F00008390,17-09-2024 03:01,other,CR02,10,deicing
DE0000006003,F00008390,17-09-2024 02:09,atc,CR02,22,late inbound
DE0000006004,F00008393,06-08-2025 06:23,CRW,OPS9,18,deicing
DE0000006005,F00008393,08-06-2025 06:48,CRW,GT3,29,gate hold
DE0000006006,F00008393,06-08-2025 06:14,atc,OPS9,7,maintenance check
DE0000006007,F00008397,2025-09-13T14:49:00,ATC,ATC7,8,deicing
DE0000006008,F00008397,13-09-2025 16:16,other,WX01,16,deicing
DE0000006009,F00008397,09/13/2025 15:26,WX,MX5,-6,
DE0000006010,F00008401,23-08-2025 15:10,OPS,GT3,28,maintenance check
DE0000006011,F00008401,23-08-2025 14:57,other,GT3,-173,gate hold
DE0000006012,F00008405,25-06-2024 20:35,MX,OPS9,6,gate hold
DE0000006013,F00008405,06/25/2024 20:28,OPS,,2,maintenance check
DE0000006014,F00008405,25-06-2024 21:38,CRW,ATC7,22,gate hold
DE0000006015,F00008406,2024-06-14T12:13:00,WX,MX5,8,maintenance check
DE0000006016,F00008406,2024-06-14T13:37:00,maint,ATC7,20,deicing
DE0000006017,F00008406,14-06-2024 12:29,maint,,8,crew swap
DE0000006018,F00008410,16-12-2024 08:40,OTHER,GT3,11,deicing
DE0000006019,F00008410,16-12-2024 07:38,MX,WX01,8,maintenance check
DE0000006020,F00008411,13-01-2025 08:08,OTHER,ATC7,20,ground stop
DE0000006021,F00008411,13-01-2025 08:21,MAINT,GT3,4,ground stop
DE0000006022,F00008411,01/13/2025 06:41,OPS,CR02,4,deicing
DE0000006023,F00008413,13-12-2024 17:03,ATC,ATC7,8m,maintenance check
DE0000006024,F00008413,13-12-2024 16:26,atc,,4,deicing
DE0000006025,F00008414,02-08-2025 08:18,AIRPORT,WX01,3,maintenance check
DE0000006026,F00008414,08-02-2025 07:26,airport,GT3,6,
DE0000006027,F00008414,02-08-2025 05:31,weather,OPS9,4,deicing
DE0000006028,F00008416,12/18/2025 23:10,WX,,23m,crew swap
DE0000006029,F00008421,12-09-2025 20:24,atc,OPS9,6,deicing
DE0000006030,F00008421,12-09-2025 22:21,WX,CR02,12,
DE0000006031,F00008426,05-09-2025 09:14,OTHER,,8,ground stop
DE0000006032,F00008426,09-05-2025 10:21,WX,MX5,10,deicing
DE0000006033,F00008426,2025-05-09T08:46:00,ATC,,3,maintenance check
DE0000006034,F00008429,29-03-2025 04:47,WEATHER,WX01,23,crew swap
DE0000006035,F00008432,02-10-2024 16:49,CREW,CR02,-74,crew swap
DE0000006036,F00008432,02-10-2024 16:01,TRAFFIC,,10,maintenance check
DE0000006037,F00008432,10-02-2024 15:22,CRW,ATC7,2,ground stop
DE0000006038,F00008439,11-06-2025 15:34,weather,CR02,0,
DE0000006039,F00008439,11-06-2025 16:14,airport,,2,gate hold
DE0000006040,F00008439,11-06-2025 15:13,atc,MX5,1,crew swap
DE0000006041,F00008443,08-12-2024 04:18,other,,17,ground stop
DE0000006042,F00008443,08-12-2024 05:02,CREW,WX01,5,ground stop
DE0000006043,F00008443,08-12-2024 04:28,MX,ATC7,3,maintenance check
DE0000006044,F00008444,22-09-2024 11:15,ATC,WX01,1,crew swap
DE0000006045,F00008444,22-09-2024 12:24,AIRPORT,MX5,1,late inbound
DE0000006046,F00008445,08-04-2024 20:02,WX,CR02,3,crew swap
DE0000006047,F00008445,08-04-2024 23:00,other,CR02,1,late inbound
DE0000006048,F00008445,08-04-2024 20:59,WEATHER,,14,deicing
DE0000006049,F00008447,04-03-2024 20:46,OTHER,ATC7,27,maintenance check
DE0000006050,F00008447,04-03-2024 22:15,WX,ATC7,-3,maintenance check
DE0000006051,F00008449,22-11-2025 07:53,MAINT,WX01,1m,maintenance check
DE0000006052,F00008449,22-11-2025 07:09,WEATHER,GT3,4,late inbound
DE0000006053,F00008449,22-11-2025 08:24,ATC,ATC7,10,
DE0000006054,F00008451,22-05-2024 15:33,TRAFFIC,ATC7,14,crew swap
DE0000006055,F00008451,22-05-2024 15:24,TRAFFIC,WX01,1,ground stop
DE0000006056,F00008451,05/22/2024 14:44,MX,CR02,3,late inbound
DE0000006057,F00008454,07-01-2026 20:27,OTHER,WX01,18,ground stop
DE0000006058,F00008458,2025-03-09T02:36:00,airport,WX01,2,late inbound
DE0000006059,F00008462,14-09-2024 13:18,airport,MX5,36,crew swap
DE0000006060,F00008463,21-06-2024 13:38,ATC,WX01,2,gate hold
DE0000006061,F00008463,2024-06-21T15:49:00,OPS,GT3,-1,maintenance check
DE0000006062,F00008463,21-06-2024 13:59,MX,ATC7,1,
DE0000006063,F00008465,09-09-2025 21:27,other,MX5,2,ground stop
DE0000006064,F00008465,09-09-2025 21:19,CREW,CR02,3,late inbound
DE0000006065,F00008468,2025-07-10T04:23:00,CREW,CR02,6m,crew swap
DE0000006066,F00008468,10-07-2025 04:14,OPS,,2,late inbound
DE0000006067,F00008473,08-09-2025 02:40,maint,MX5,23,deicing
DE0000006068,F00008474,16-05-2024 20:39,WEATHER,OPS9,4,ground stop
DE0000006069,F00008474,16-05-2024 20:34,GATE,WX01,10,deicing
DE0000006070,F00008474,16-05-2024 21:10,WX,CR02,1,deicing
DE0000006071,F00008475,21-10-2025 00:58,CRW,OPS9,4,late inbound
DE0000006072,F00008475,21-10-2025 01:56,atc,GT3,3,late inbound
DE0000006073,F00008478,04-05-2024 23:22,ATC,CR02,0,gate hold
DE0000006074,F00008478,04-05-2024 23:30,WEATHER,WX01,9,late inbound
DE0000006075,F00008478,05-05-2024 01:19,WX,CR02,19,crew swap
DE0000006076,F00008479,18-03-2025 09:37,WEATHER,GT3,2,deicing
DE0000006077,F00008479,2025-03-18T07:43:00,OPS,OPS9,7,
DE0000006078,F00008479,18-03-2025 08:36,CREW,MX5,1,ground stop
DE0000006079,F00008487,04-05-2024 02:53,crew,CR02,13,
DE0000006080,F00008487,05-04-2024 02:47,GATE,CR02,11,crew swap
DE0000006081,F00008489,15-11-2024 21:14,maint,WX01,-8,crew swap
DE0000006082,F00008489,15-11-2024 20:24,OTHER,GT3,1,ground stop
DE0000006083,F00008493,11/21/2025 22:02,other,GT3,-18,
DE0000006084,F00008495,26-11-2024 20:52,OTHER,GT3,0,maintenance check
DE0000006085,F00008495,26-11-2024 23:35,other,OPS9,1,maintenance check
DE0000006086,F00008495,26-11-2024 22:01,other,ATC7,1,
DE0000006087,F00008497,14-02-2024 08:43,weather,ATC7,7,ground stop
DE0000006088,F00008497,14-02-2024 10:07,other,WX01,3,crew swap
DE0000006089,F00008497,14-02-2024 09:28,CREW,CR02,1,maintenance check
DE0000006090,F00008500,11-03-2024 02:33,CREW,GT3,1m,crew swap
DE0000006091,F00008500,03-11-2024 02:43,OPS,,24,
DE0000006092,F00008500,2024-11-03T02:14:00,maint,ATC7,1,deicing
DE0000006093,F00008504,08-10-2024 02:30,MX,CR02,12,late inbound
DE0000006094,F00008504,08-10-2024 02:21,OTHER,WX01,4,gate hold
DE0000006095,F00008504,08-10-2024 02:39,CREW,WX01,8,gate hold
DE0000006096,F00008505,17-10-2025 23:27,CRW,,17,deicing
DE0000006097,F00008505,17-10-2025 22:19,OPS,GT3,2,deicing
DE0000006098,F00008505,2025-10-17T22:03:00,ATC,OPS9,11m,late inbound
DE0000006099,F00008509,10/26/2024 14:04,crew,MX5,21m,crew swap
DE0000006100,F00008509,10/26/2024 14:00,CREW,CR02,6,gate hold
DE0000006101,F00008518,27-08-2025 22:49,GATE,MX5,3,maintenance check
DE0000006102,F00008518,27-08-2025 20:52,OPS,MX5,1,maintenance check
DE0000006103,F00008520,24-12-2025 11:51,OPS,GT3,20,ground stop
DE0000006104,F00008524,21-08-2025 04:44,GATE,GT3,0,crew swap
DE0000006105,F00008524,21-08-2025 03:43,TRAFFIC,GT3,1,
DE0000006106,F00008527,29-10-2025 07:46,crew,ATC7,25,crew swap
DE0000006107,F00008529,01-04-2024 21:08,airport,GT3,1,crew swap
DE0000006108,F00008529,01-04-2024 20:07,other,MX5,-1,
DE0000006109,F00008531,21-11-2025 04:20,CREW,OPS9,15,
DE0000006110,F00008534,04-01-2026 08:37,GATE,CR02,53m,late inbound
DE0000006111,F00008537,03-09-2025 09:12,AIRPORT,,4,crew swap
DE0000006112,F00008537,03-09-2025 11:17,OPS,CR02,3,ground stop
DE0000006113,F00008537,09-03-2025 09:30,TRAFFIC,ATC7,3,crew swap
DE0000006114,F00008541,01-01-2025 01:53,TRAFFIC,OPS9,9,maintenance check
DE0000006115,F00008541,01-01-2025 01:49,WX,WX01,2m,crew swap
DE0000006116,F00008541,01-01-2025 02:51,MX,OPS9,5,late inbound
DE0000006117,F00008543,31-12-2024 11:33,maint,OPS9,10m,gate hold
DE0000006118,F00008543,31-12-2024 11:36,MAINT,GT3,6,gate hold
DE0000006119,F00008543,31-12-2024 10:16,OPS,WX01,-5,late inbound
DE0000006120,F00008545,22-08-2024 12:38,crew,CR02,-7,ground stop
DE0000006121,F00008545,22-08-2024 11:22,CRW,MX5,9m,crew swap
DE0000006122,F00008545,22-08-2024 10:43,airport,OPS9,-5,gate hold
DE0000006123,F00008546,07-09-2025 02:24,atc,ATC7,9,ground stop
DE0000006124,F00008546,07-09-2025 02:10,AIRPORT,GT3,13,ground stop
DE0000006125,F00008551,01/17/2025 00:18,airport,GT3,4,deicing
DE0000006126,F00008551,17-01-2025 00:51,WEATHER,OPS9,7m,deicing
DE0000006127,F00008553,25-08-2025 12:16,airport,MX5,15,late inbound
DE0000006128,F00008554,06-09-2024 05:08,maint,,12,late inbound
DE0000006129,F00008555,05/20/2025 09:26,OPS,,30,
DE0000006130,F00008555,20-05-2025 09:12,MAINT,MX5,1,deicing
DE0000006131,F00008557,06-09-2024 22:50,WX,GT3,24,deicing
DE0000006132,F00008558,16-08-2025 22:41,weather,ATC7,4,
DE0000006133,F00008558,2025-08-16T22:49:00,GATE,GT3,40,deicing
DE0000006134,F00008564,26-07-2025 07:31,OTHER,,-318,ground stop
DE0000006135,F00008565,04-02-2024 20:01,atc,ATC7,38,late inbound
DE0000006136,F00008571,17-01-2026 10:51,CRW,CR02,26,maintenance check
DE0000006137,F00008571,01/17/2026 12:33,OTHER,GT3,23,maintenance check
DE0000006138,F00008574,15-05-2024 04:45,other,OPS9,1,crew swap
DE0000006139,F00008574,15-05-2024 02:52,OTHER,MX5,1,gate hold
DE0000006140,F00008574,05/15/2024 04:46,WX,ATC7,2,crew swap
DE0000006141,F00008579,26-06-2024 08:58,OTHER,WX01,12,crew swap
DE0000006142,F00008579,2024-06-26T09:03:00,CREW,WX01,6m,
DE0000006143,F00008579,06/26/2024 06:27,OTHER,OPS9,3,deicing
DE0000006144,F00008581,09/19/2025 15:23,OTHER,MX5,20m,maintenance check
DE0000006145,F00008582,12-09-2025 22:04,weather,OPS9,4,maintenance check
DE0000006146,F00008582,09-12-2025 21:59,OTHER,GT3,1,crew swap
DE0000006147,F00008585,21-08-2024 14:10,AIRPORT,,5m,maintenance check
DE0000006148,F00008587,23-10-2025 13:18,other,WX01,24,
DE0000006149,F00008587,23-10-2025 12:35,maint,MX5,16,maintenance check
DE0000006150,F00008588,12/23/2024 09:53,TRAFFIC,,2,gate hold
DE0000006151,F00008588,23-12-2024 07:48,other,CR02,1,late inbound
DE0000006152,F00008588,23-12-2024 07:33,ATC,,1,crew swap
DE0000006153,F00008590,24-08-2024 03:00,atc,,1,late inbound
DE0000006154,F00008590,24-08-2024 02:53,MX,ATC7,16,
DE0000006155,F00008596,09-06-2024 12:25,MX,GT3,8,gate hold
DE0000006156,F00008596,09-06-2024 14:01,ATC,,9,late inbound
DE0000006157,F00008599,2025-05-05T08:19:00,WEATHER,GT3,1,deicing
DE0000006158,F00008599,05-05-2025 08:17,crew,OPS9,1m,ground stop
DE0000006159,F00008599,05-05-2025 06:40,TRAFFIC,MX5,8,ground stop
DE0000006160,F00008606,27-05-2024 01:45,TRAFFIC,,4,deicing
DE0000006161,F00008606,27-05-2024 01:16,TRAFFIC,,-11,deicing
DE0000006162,F00008607,11/27/2024 13:47,WX,MX5,10,late inbound
DE0000006163,F00008609,07-10-2024 13:11,MAINT,,2,deicing
DE0000006164,F00008609,07-10-2024 12:09,crew,ATC7,23,gate hold
DE0000006165,F00008610,30-10-2025 22:07,OPS,WX01,33,gate hold
DE0000006166,F00008610,30-10-2025 23:12,airport,,26,deicing
DE0000006167,F00008611,20-09-2024 01:05,TRAFFIC,ATC7,19,
DE0000006168,F00008611,20-09-2024 01:49,WX,ATC7,4,deicing
DE0000006169,F00008611,09/20/2024 01:58,GATE,ATC7,5m,late inbound
DE0000006170,F00008618,03-11-2024 04:07,AIRPORT,GT3,47,
DE0000006171,F00008618,03-11-2024 01:56,airport,,6,late inbound
DE0000006172,F00008618,03-11-2024 03:28,other,WX01,1,maintenance check
DE0000006173,F00008619,09-07-2024 19:34,weather,,42,maintenance check
DE0000006174,F00008620,31-03-2024 11:42,CREW,,10,late inbound
DE0000006175,F00008620,2024-03-31T11:47:00,other,GT3,7,gate hold
DE0000006176,F00008625,03-10-2025 02:31,ATC,CR02,5m,deicing
DE0000006177,F00008626,10/19/2024 13:55,atc,,2,late inbound
DE0000006178,F00008626,19-10-2024 13:19,ATC,,-1,crew swap
DE0000006179,F00008629,02-10-2025 05:26,crew,,23,crew swap
DE0000006180,F00008632,2025-02-26T17:43:00,crew,MX5,3m,late inbound
DE0000006181,F00008632,2025-02-26T15:20:00,ATC,MX5,2,ground stop
DE0000006182,F00008632,2025-02-26T17:37:00,AIRPORT,,7m,maintenance check
DE0000006183,F00008634,12-09-2024 10:25,CREW,WX01,24,ground stop
DE0000006184,F00008634,2024-09-12T10:56:00,MX,,-6,deicing
DE0000006185,F00008635,19-08-2025 03:25,TRAFFIC,OPS9,3,deicing
DE0000006186,F00008636,12-01-2025 18:32,maint,,6,ground stop
DE0000006187,F00008636,12-01-2025 18:43,TRAFFIC,OPS9,11,
DE0000006188,F00008636,12-01-2025 19:05,TRAFFIC,ATC7,2,ground stop
DE0000006189,F00008637,03-10-2025 06:57,weather,MX5,3,late inbound
DE0000006190,F00008637,03-10-2025 06:48,GATE,CR02,11,crew swap
DE0000006191,F00008637,03-10-2025 08:01,airport,,1,maintenance check
DE0000006192,F00008638,30-11-2025 22:52,AIRPORT,MX5,4m,deicing
DE0000006193,F00008638,11/30/2025 22:12,CRW,MX5,4,
DE0000006194,F00008642,28-03-2025 08:12,OPS,MX5,11,gate hold
DE0000006195,F00008647,05-06-2024 06:17,crew,OPS9,0,ground stop
DE0000006196,F00008647,06-05-2024 05:34,OPS,OPS9,1,ground stop
DE0000006197,F00008647,06-05-2024 06:06,OTHER,WX01,3,
DE0000006198,F00008648,28-01-2026 16:33,ATC,GT3,13,ground stop
DE0000006199,F00008649,25-07-2024 05:39,other,WX01,15,ground stop
DE0000006200,F00008649,25-07-2024 06:38,OTHER,,-1,
DE0000006201,F00008649,25-07-2024 05:27,crew,CR02,14,crew swap
DE0000006202,F00008650,01-09-2024 11:12,OPS,OPS9,24,
DE0000006203,F00008650,01-09-2024 11:31,ATC,WX01,-1,late inbound
DE0000006204,F00008657,02/20/2024 14:03,other,WX01,2,crew swap
DE0000006205,F00008657,02/20/2024 13:49,ATC,OPS9,1,
DE0000006206,F00008657,20-02-2024 13:11,weather,,-4,gate hold
DE0000006207,F00008659,05-12-2025 08:41,WX,CR02,18,gate hold
DE0000006208,F00008659,05-12-2025 07:08,WEATHER,ATC7,17,maintenance check
DE0000006209,F00008659,2025-12-05T07:03:00,WEATHER,WX01,7,late inbound
DE0000006210,F00008670,07-02-2025 10:32,CRW,MX5,5,
DE0000006211,F00008670,07-02-2025 11:38,CRW,OPS9,1,late inbound
DE0000006212,F00008670,02-07-2025 11:05,CREW,CR02,1m,maintenance check
DE0000006213,F00008672,05-10-2025 23:21,WX,ATC7,1,
DE0000006214,F00008672,05-10-2025 20:55,AIRPORT,,11,deicing
DE0000006215,F00008672,05-10-2025 21:04,atc,GT3,4,
DE0000006216,F00008676,19-01-2026 18:32,other,CR02,-1,crew swap
DE0000006217,F00008676,19-01-2026 18:10,TRAFFIC,,1,deicing
DE0000006218,F00008676,2026-01-19T21:03:00,WX,CR02,1,
DE0000006219,F00008678,2025-11-28T22:27:00,ATC,,3,deicing
DE0000006220,F00008678,28-11-2025 20:42,crew,GT3,8,ground stop
DE0000006221,F00008683,16-04-2024 04:54,atc,OPS9,5,crew swap
DE0000006222,F00008684,25-06-2024 01:48,maint,OPS9,1,gate hold
DE0000006223,F00008684,25-06-2024 01:47,WEATHER,CR02,13,deicing
DE0000006224,F00008684,25-06-2024 01:49,airport,OPS9,3m,deicing
DE0000006225,F00008685,10/29/2024 13:32,ATC,OPS9,36,deicing
DE0000006226,F00008691,01-09-2025 05:03,ATC,ATC7,0,late inbound
DE0000006227,F00008691,01-09-2025 05:13,maint,GT3,4,crew swap
DE0000006228,F00008691,01-09-2025 05:47,GATE,CR02,8,maintenance check
DE0000006229,F00008693,10/14/2025 11:44,crew,GT3,-19,maintenance check
DE0000006230,F00008694,06/21/2025 16:21,MAINT,OPS9,12m,maintenance check
DE0000006231,F00008700,30-12-2025 06:09,maint,MX5,22,maintenance check
DE0000006232,F00008700,30-12-2025 05:40,MAINT,CR02,9,deicing
DE0000006233,F00008700,30-12-2025 07:20,crew,OPS9,3,deicing
DE0000006234,F00008701,19-06-2024 13:52,GATE,WX01,6,
DE0000006235,F00008701,19-06-2024 15:39,OTHER,,24,late inbound
DE0000006236,F00008702,23-07-2024 02:56,weather,MX5,11,crew swap
DE0000006237,F00008703,16-03-2024 05:08,CREW,ATC7,1,deicing
DE0000006238,F00008703,16-03-2024 06:50,MX,OPS9,1,crew swap
DE0000006239,F00008710,21-08-2024 21:38,maint,CR02,33,late inbound
DE0000006240,F00008710,08/21/2024 21:52,weather,ATC7,1,maintenance check
DE0000006241,F00008710,21-08-2024 22:27,MAINT,OPS9,4,gate hold
DE0000006242,F00008711,26-09-2024 05:48,WX,MX5,35,ground stop
DE0000006243,F00008711,26-09-2024 07:13,TRAFFIC,GT3,2,ground stop
DE0000006244,F00008712,18-07-2024 01:13,MX,CR02,3,gate hold
DE0000006245,F00008714,28-07-2025 11:44,CRW,,6m,
DE0000006246,F00008714,07/28/2025 11:44,ATC,ATC7,19,gate hold
DE0000006247,F00008716,28-12-2025 15:01,OTHER,CR02,1,late inbound
DE0000006248,F00008716,28-12-2025 14:27,weather,OPS9,16,crew swap
DE0000006249,F00008717,29-03-2025 01:11,other,,-16,deicing
DE0000006250,F00008717,03/29/2025 03:01,other,OPS9,17,late inbound
DE0000006251,F00008719,18-01-2025 19:19,crew,MX5,4m,crew swap
DE0000006252,F00008719,01/18/2025 21:43,atc,ATC7,12,gate hold
DE0000006253,F00008720,2025-02-16T22:56:00,OPS,,2,crew swap
DE0000006254,F00008720,2025-02-17T00:33:00,other,WX01,1,deicing
DE0000006255,F00008723,29-06-2025 13:34,OPS,CR02,16m,crew swap
DE0000006256,F00008723,29-06-2025 13:16,CRW,CR02,7,maintenance check
DE0000006257,F00008724,2025-12-17T04:58:00,MX,GT3,40,ground stop
DE0000006258,F00008726,25-04-2025 16:23,CREW,OPS9,9,late inbound
DE0000006259,F00008726,25-04-2025 17:51,weather,MX5,38,gate hold
DE0000006260,F00008726,25-04-2025 17:41,MX,WX01,4,ground stop
DE0000006261,F00008728,12-11-2024 18:22,OPS,,-1,deicing
DE0000006262,F00008728,11-12-2024 20:24,crew,CR02,1,deicing
DE0000006263,F00008728,11-12-2024 17:56,CRW,CR02,1,maintenance check
DE0000006264,F00008731,03-12-2025 08:39,GATE,OPS9,12,
DE0000006265,F00008732,26-08-2024 21:25,ATC,GT3,13,ground stop
DE0000006266,F00008732,08/26/2024 22:56,weather,,10,maintenance check
DE0000006267,F00008735,20-03-2024 13:07,GATE,ATC7,10,maintenance check
DE0000006268,F00008735,20-03-2024 12:19,MX,ATC7,1m,deicing
DE0000006269,F00008736,21-03-2025 01:35,OPS,MX5,4,
DE0000006270,F00008736,21-03-2025 00:31,GATE,GT3,2m,crew swap
DE0000006271,F00008737,2025-08-10T00:44:00,OTHER,GT3,11,crew swap
DE0000006272,F00008737,08-10-2025 00:02,AIRPORT,OPS9,6m,gate hold
DE0000006273,F00008739,19-11-2024 18:11,atc,CR02,6,ground stop
DE0000006274,F00008741,2024-05-26T14:27:00,AIRPORT,CR02,3,deicing
DE0000006275,F00008743,01/29/2026 07:38,WX,OPS9,1m,maintenance check
DE0000006276,F00008743,29-01-2026 07:25,other,GT3,2,late inbound
DE0000006277,F00008743,01/29/2026 08:28,atc,ATC7,5,
DE0000006278,F00008748,26-06-2024 13:54,GATE,CR02,4,late inbound
DE0000006279,F00008748,26-06-2024 12:54,airport,MX5,3,gate hold
DE0000006280,F00008749,14-05-2024 04:35,other,OPS9,11,
DE0000006281,F00008750,23-10-2025 05:08,WX,ATC7,0,late inbound
DE0000006282,F00008750,23-10-2025 04:17,AIRPORT,MX5,4,maintenance check
DE0000006283,F00008750,23-10-2025 06:29,airport,MX5,7,gate hold
DE0000006284,F00008757,18-09-2025 01:50,weather,MX5,6,ground stop
DE0000006285,F00008757,18-09-2025 01:43,AIRPORT,WX01,21,
DE0000006286,F00008758,20-03-2025 05:18,MAINT,GT3,19,gate hold
DE0000006287,F00008758,2025-03-20T05:46:00,AIRPORT,WX01,6,
DE0000006288,F00008761,15-10-2025 18:19,OTHER,,7,ground stop
DE0000006289,F00008764,24-08-2024 08:36,CREW,GT3,21,
DE0000006290,F00008764,24-08-2024 07:42,OTHER,CR02,19,deicing
DE0000006291,F00008767,09-03-2025 11:54,MAINT,OPS9,5,late inbound
DE0000006292,F00008768,04-02-2025 09:57,OTHER,ATC7,-1,deicing
DE0000006293,F00008768,02-04-2025 12:10,OPS,OPS9,1,maintenance check
DE0000006294,F00008768,02-04-2025 11:41,airport,WX01,1,ground stop
DE0000006295,F00008771,19-08-2024 18:36,airport,MX5,19,crew swap
DE0000006296,F00008772,19-10-2024 18:05,airport,MX5,0,
DE0000006297,F00008772,19-10-2024 17:32,WEATHER,MX5,4,
DE0000006298,F00008772,19-10-2024 16:38,CREW,GT3,13m,ground stop
DE0000006299,F00008773,04-06-2024 22:39,CRW,MX5,20,ground stop
DE0000006300,F00008773,04-06-2024 21:21,CREW,ATC7,1,late inbound
DE0000006301,F00008774,08/23/2025 07:43,atc,MX5,5,gate hold
DE0000006302,F00008774,23-08-2025 08:42,WEATHER,,4,late inbound
DE0000006303,F00008776,26-09-2024 14:15,maint,,1,late inbound
DE0000006304,F00008776,26-09-2024 13:19,AIRPORT,WX01,1,
DE0000006305,F00008776,09/26/2024 14:54,WX,OPS9,7,gate hold
DE0000006306,F00008777,12-07-2025 21:59,CREW,GT3,2,crew swap
DE0000006307,F00008777,2025-07-12T20:37:00,weather,GT3,4,late inbound
DE0000006308,F00008777,12-07-2025 23:03,GATE,MX5,3,ground stop
DE0000006309,F00008778,11-10-2024 10:10,MAINT,ATC7,7,crew swap
DE0000006310,F00008778,10-11-2024 10:04,MX,CR02,6,
DE0000006311,F00008781,01-01-2026 21:18,maint,CR02,1,late inbound
DE0000006312,F00008781,01-01-2026 20:10,MX,,18,ground stop
DE0000006313,F00008785,11/28/2024 05:36,WX,ATC7,-17,deicing
DE0000006314,F00008785,28-11-2024 05:09,MAINT,MX5,4,maintenance check
DE0000006315,F00008786,12-11-2025 09:38,airport,ATC7,6,deicing
DE0000006316,F00008786,11-12-2025 09:51,ATC,CR02,2,maintenance check
DE0000006317,F00008786,11-12-2025 07:36,MAINT,GT3,24,deicing
DE0000006318,F00008788,28-04-2024 12:12,MAINT,,7,deicing
DE0000006319,F00008788,28-04-2024 13:17,WX,MX5,-4,gate hold
DE0000006320,F00008788,28-04-2024 14:19,airport,,1,late inbound
DE0000006321,F00008794,2024-06-07T08:44:00,airport,MX5,1,gate hold
DE0000006322,F00008794,2024-06-07T07:56:00,AIRPORT,CR02,2,deicing
DE0000006323,F00008794,06-07-2024 08:05,MAINT,GT3,1m,gate hold
DE0000006324,F00008798,2024-03-16T10:40:00,CRW,GT3,23,ground stop
DE0000006325,F00008798,16-03-2024 09:46,airport,ATC7,36,crew swap
DE0000006326,F00008798,16-03-2024 09:36,weather,CR02,13,gate hold
DE0000006327,F00008801,15-06-2025 04:34,OPS,CR02,18,maintenance check
DE0000006328,F00008804,05-06-2025 11:40,other,,1,
DE0000006329,F00008806,07-03-2024 01:41,WEATHER,,19,deicing
DE0000006330,F00008809,10/24/2025 08:29,CREW,GT3,5,maintenance check
DE0000006331,F00008811,22-11-2024 19:42,OPS,,5,
DE0000006332,F00008811,22-11-2024 19:56,WEATHER,,3,gate hold
DE0000006333,F00008813,19-07-2024 06:18,airport,ATC7,5m,late inbound
DE0000006334,F00008813,07/19/2024 06:59,CREW,,1,late inbound
DE0000006335,F00008813,2024-07-19T08:19:00,MX,MX5,1,ground stop
DE0000006336,F00008815,24-01-2025 22:50,weather,MX5,2,deicing
DE0000006337,F00008815,24-01-2025 23:17,maint,MX5,1,deicing
DE0000006338,F00008815,01/24/2025 23:46,CREW,CR02,8,crew swap
DE0000006339,F00008818,01-10-2024 11:29,MAINT,OPS9,54,
DE0000006340,F00008823,23-11-2025 17:40,CRW,MX5,-18,ground stop
DE0000006341,F00008823,23-11-2025 17:53,CREW,WX01,1,ground stop
DE0000006342,F00008823,11/23/2025 18:47,WX,MX5,19,maintenance check
DE0000006343,F00008824,29-04-2025 14:35,TRAFFIC,OPS9,25,gate hold
DE0000006344,F00008824,29-04-2025 12:46,OPS,,1,ground stop
DE0000006345,F00008828,15-03-2024 11:38,MX,ATC7,26,gate hold
DE0000006346,F00008828,15-03-2024 11:21,OTHER,,4,ground stop
DE0000006347,F00008829,08-01-2026 18:53,TRAFFIC,,6,crew swap
DE0000006348,F00008829,2026-01-08T20:40:00,OTHER,OPS9,23,maintenance check
DE0000006349,F00008829,08-01-2026 20:06,other,OPS9,25,maintenance check
DE0000006350,F00008831,02-03-2025 23:20,CREW,CR02,14,maintenance check
DE0000006351,F00008831,04-02-2025 00:21,AIRPORT,OPS9,9,deicing
DE0000006352,F00008834,20-05-2024 19:46,MAINT,WX01,2,ground stop
DE0000006353,F00008834,2024-05-20T22:35:00,OTHER,MX5,10,ground stop
DE0000006354,F00008836,15-11-2024 05:03,crew,OPS9,6,maintenance check
DE0000006355,F00008836,11/15/2024 04:50,ATC,MX5,17m,deicing
DE0000006356,F00008837,18-05-2025 12:49,CRW,GT3,5,crew swap
DE0000006357,F00008837,18-05-2025 11:33,atc,GT3,1,late inbound
DE0000006358,F00008842,21-04-2025 19:37,crew,WX01,22,gate hold
DE0000006359,F00008845,16-07-2024 14:49,maint,WX01,21,late inbound
DE0000006360,F00008845,16-07-2024 16:03,MAINT,OPS9,5,maintenance check
DE0000006361,F00008845,07/16/2024 16:29,TRAFFIC,CR02,26,ground stop
DE0000006362,F00008847,06-09-2024 14:42,WX,GT3,24,
DE0000006363,F00008848,12/23/2025 19:59,atc,ATC7,10,crew swap
DE0000006364,F00008849,02-04-2024 05:48,maint,MX5,8m,deicing
DE0000006365,F00008849,02-04-2024 04:11,airport,ATC7,4,
DE0000006366,F00008849,04-02-2024 06:09,WEATHER,GT3,5,ground stop
DE0000006367,F00008851,2024-06-27T14:41:00,MX,MX5,8,deicing
DE0000006368,F00008851,27-06-2024 15:23,MX,,22,crew swap
DE0000006369,F00008852,17-02-2025 03:15,CRW,OPS9,0,maintenance check
DE0000006370,F00008852,17-02-2025 02:58,TRAFFIC,GT3,23,late inbound
DE0000006371,F00008852,02/17/2025 05:06,GATE,CR02,11,gate hold
DE0000006372,F00008856,21-05-2024 07:28,airport,ATC7,4,late inbound
DE0000006373,F00008856,21-05-2024 05:45,MX,OPS9,7m,ground stop
DE0000006374,F00008856,21-05-2024 05:58,OTHER,ATC7,1,deicing
DE0000006375,F00008858,10/23/2025 11:15,weather,OPS9,137,
DE0000006376,F00008859,02-10-2025 08:51,WEATHER,,13,late inbound
DE0000006377,F00008859,02-10-2025 08:30,weather,GT3,-25,ground stop
DE0000006378,F00008862,14-02-2024 00:00,OPS,,1,deicing
DE0000006379,F00008862,2024-02-13T21:45:00,weather,OPS9,-19,ground stop
DE0000006380,F00008863,06-05-2024 22:27,maint,OPS9,15m,deicing
DE0000006381,F00008863,06-05-2024 22:37,crew,OPS9,5,deicing
DE0000006382,F00008863,05-06-2024 20:23,maint,,4,gate hold
DE0000006383,F00008864,2025-02-16T23:46:00,AIRPORT,WX01,25,
DE0000006384,F00008864,02/16/2025 22:53,AIRPORT,ATC7,2,deicing
DE0000006385,F00008869,10-01-2025 02:57,WEATHER,ATC7,5,gate hold
DE0000006386,F00008871,05-05-2024 21:25,weather,GT3,85,ground stop
DE0000006387,F00008874,10-05-2024 14:44,WX,GT3,4,gate hold
DE0000006388,F00008874,10-05-2024 15:25,CRW,WX01,18,deicing
DE0000006389,F00008874,05-10-2024 16:59,other,GT3,8,ground stop
DE0000006390,F00008875,20-01-2026 14:45,ATC,GT3,44m,crew swap
DE0000006391,F00008876,12/20/2024 15:21,other,GT3,33,ground stop
DE0000006392,F00008876,20-12-2024 15:44,ATC,WX01,4,crew swap
DE0000006393,F00008877,05-03-2024 04:30,CRW,MX5,22,
DE0000006394,F00008879,08/15/2024 14:00,WX,ATC7,21,
DE0000006395,F00008882,07/13/2024 09:03,GATE,CR02,30,gate hold
DE0000006396,F00008884,09-12-2025 10:43,MAINT,WX01,1,deicing
DE0000006397,F00008884,12-09-2025 10:53,WX,MX5,10,crew swap
DE0000006398,F00008888,08-07-2025 21:14,WEATHER,,1,ground stop
DE0000006399,F00008888,08-07-2025 20:27,MAINT,MX5,1m,ground stop
DE0000006400,F00008889,03/30/2025 21:18,atc,ATC7,15,late inbound
DE0000006401,F00008889,30-03-2025 20:18,WX,,-2,late inbound
DE0000006402,F00008889,30-03-2025 20:27,maint,CR02,-3,gate hold
DE0000006403,F00008903,03-03-2025 02:22,airport,GT3,31,
DE0000006404,F00008903,03-03-2025 02:49,crew,ATC7,10,
DE0000006405,F00008905,17-06-2024 07:45,weather,CR02,24,maintenance check
DE0000006406,F00008905,2024-06-17T07:34:00,airport,MX5,2,crew swap
DE0000006407,F00008906,07/13/2025 05:58,CREW,GT3,3,late inbound
DE0000006408,F00008909,23-04-2024 13:14,airport,ATC7,10,deicing
DE0000006409,F00008909,2024-04-23T10:47:00,other,ATC7,1,deicing
DE0000006410,F00008913,02-06-2025 12:25,atc,MX5,20,crew swap
DE0000006411,F00008916,2025-08-12T17:24:00,other,OPS9,2,
DE0000006412,F00008916,12-08-2025 18:14,WEATHER,,1,gate hold
DE0000006413,F00008916,12-08-2025 19:09,CREW,CR02,1,gate hold
DE0000006414,F00008922,06/23/2025 03:33,OPS,OPS9,1m,late inbound
DE0000006415,F00008922,06/23/2025 01:43,CREW,ATC7,3,late inbound
DE0000006416,F00008929,11-05-2024 17:26,GATE,OPS9,6,
DE0000006417,F00008929,11-05-2024 15:33,ATC,OPS9,2,maintenance check
DE0000006418,F00008929,11-05-2024 15:39,MX,WX01,1,crew swap
DE0000006419,F00008933,25-06-2025 09:43,maint,,18,crew swap
DE0000006420,F00008933,25-06-2025 08:30,TRAFFIC,MX5,-8,ground stop
DE0000006421,F00008936,2026-01-21T08:20:00,OPS,WX01,8,late inbound
DE0000006422,F00008937,24-12-2024 18:13,airport,,56,deicing
DE0000006423,F00008939,2024-03-06T11:41:00,MX,WX01,0,gate hold
DE0000006424,F00008939,06-03-2024 11:55,WX,WX01,1,gate hold
DE0000006425,F00008939,06-03-2024 12:59,other,GT3,1,
DE0000006426,F00008940,18-12-2024 13:27,MX,WX01,3m,ground stop
DE0000006427,F00008940,18-12-2024 13:31,GATE,,3m,crew swap
DE0000006428,F00008940,18-12-2024 14:53,GATE,WX01,18,crew swap
DE0000006429,F00008941,2025-07-27T10:51:00,crew,OPS9,0,crew swap
DE0000006430,F00008941,27-07-2025 10:51,AIRPORT,CR02,1,late inbound
DE0000006431,F00008942,19-06-2024 12:12,WEATHER,,25,crew swap
DE0000006432,F00008945,12-01-2026 17:01,CREW,GT3,5,ground stop
DE0000006433,F00008945,12-01-2026 15:32,MX,,3,maintenance check
DE0000006434,F00008945,12-01-2026 14:49,MAINT,ATC7,11,deicing
DE0000006435,F00008946,12/22/2025 05:25,MX,CR02,1,gate hold
DE0000006436,F00008946,22-12-2025 03:16,ATC,MX5,2m,
DE0000006437,F00008946,22-12-2025 05:57,MX,ATC7,1,deicing
DE0000006438,F00008957,03-08-2024 17:11,maint,CR02,2,gate hold
DE0000006439,F00008958,2024-08-20T05:38:00,WX,OPS9,-1,ground stop
DE0000006440,F00008958,20-08-2024 06:10,CREW,,1,late inbound
DE0000006441,F00008958,08/20/2024 07:03,crew,CR02,1,crew swap
DE0000006442,F00008959,01/29/2025 22:26,weather,GT3,87,late inbound
DE0000006443,F00008962,2025-10-28T09:23:00,OPS,WX01,0,ground stop
DE0000006444,F00008962,10/28/2025 08:34,CREW,,1,ground stop
DE0000006445,F00008962,10/28/2025 09:21,CRW,ATC7,1,gate hold
DE0000006446,F00008966,01-09-2026 05:33,WX,,1,
DE0000006447,F00008966,09-01-2026 03:25,weather,WX01,1,ground stop
DE0000006448,F00008967,02-11-2024 17:52,ATC,ATC7,15,crew swap
DE0000006449,F00008967,02-11-2024 17:26,WEATHER,MX5,19,maintenance check
DE0000006450,F00008967,02-11-2024 14:54,OTHER,CR02,19,gate hold
DE0000006451,F00008969,06-02-2025 02:02,MX,WX01,35,crew swap
DE0000006452,F00008971,21-02-2024 04:28,crew,GT3,0,ground stop
DE0000006453,F00008971,02/21/2024 04:10,airport,,1,deicing
DE0000006454,F00008972,09/26/2025 11:29,MAINT,WX01,2,
DE0000006455,F00008972,26-09-2025 11:28,weather,GT3,2,maintenance check
DE0000006456,F00008972,26-09-2025 13:06,OPS,CR02,2,gate hold
DE0000006457,F00008975,15-04-2025 05:08,maint,,7,deicing
DE0000006458,F00008975,15-04-2025 06:55,AIRPORT,GT3,36,gate hold
DE0000006459,F00008976,05-11-2024 11:37,TRAFFIC,WX01,6,crew swap
DE0000006460,F00008976,05-11-2024 10:40,other,OPS9,9,gate hold
DE0000006461,F00008979,26-07-2025 10:21,other,MX5,-1,ground stop
DE0000006462,F00008979,26-07-2025 10:21,AIRPORT,,1,
DE0000006463,F00008979,2025-07-26T12:31:00,MX,ATC7,1,crew swap
DE0000006464,F00008980,2024-06-09T00:47:00,TRAFFIC,WX01,9m,maintenance check
DE0000006465,F00008983,17-10-2025 15:17,TRAFFIC,OPS9,1,late inbound
DE0000006466,F00008983,17-10-2025 14:26,WX,,8,crew swap
DE0000006467,F00008984,11-12-2024 16:53,TRAFFIC,OPS9,1,late inbound
DE0000006468,F00008984,12-11-2024 16:13,CRW,GT3,1,crew swap
DE0000006469,F00008984,11-12-2024 16:50,ATC,OPS9,5,gate hold
DE0000006470,F00008985,28-09-2024 21:40,atc,CR02,3,crew swap
DE0000006471,F00008985,28-09-2024 21:43,MX,,4,late inbound
DE0000006472,F00008985,28-09-2024 23:57,MAINT,ATC7,14,crew swap
DE0000006473,F00008986,18-09-2025 04:23,MX,MX5,1m,
DE0000006474,F00008986,18-09-2025 03:17,maint,GT3,40,crew swap
DE0000006475,F00008992,18-09-2024 23:27,MX,,17,crew swap
DE0000006476,F00008997,08-12-2025 12:23,TRAFFIC,GT3,26,ground stop
DE0000006477,F00008997,08-12-2025 10:59,GATE,MX5,8,maintenance check
DE0000006478,F00008998,13-11-2025 02:30,CRW,GT3,4,ground stop
DE0000006479,F00008998,13-11-2025 03:30,atc,OPS9,3,crew swap
DE0000006480,F00009000,03-08-2024 02:23,OPS,CR02,8,late inbound
DE0000006481,F00009000,2024-08-03T01:37:00,AIRPORT,WX01,1m,ground stop
DE0000006482,F00009000,03-08-2024 02:02,WX,,14,maintenance check
DE0000006483,F00009002,09/30/2024 00:38,CREW,OPS9,0,
DE0000006484,F00009002,30-09-2024 02:35,WX,,1,ground stop
DE0000006485,F00009006,27-06-2025 10:38,maint,,-2,ground stop
DE0000006486,F00009006,27-06-2025 11:04,TRAFFIC,WX01,21,late inbound
DE0000006487,F00009007,2024-05-19T23:21:00,airport,OPS9,28,gate hold
DE0000006488,F00009007,20-05-2024 00:57,ATC,OPS9,11,crew swap
DE0000006489,F00009010,12-03-2024 04:49,MX,ATC7,11,late inbound
DE0000006490,F00009011,31-01-2026 07:41,weather,,8,gate hold
DE0000006491,F00009014,14-08-2025 17:40,WX,OPS9,10,gate hold
DE0000006492,F00009014,08/14/2025 18:54,MAINT,MX5,1,late inbound
DE0000006493,F00009014,14-08-2025 17:54,ATC,OPS9,8,ground stop
DE0000006494,F00009015,03-02-2024 01:06,MAINT,,53,
DE0000006495,F00009015,02-03-2024 01:27,atc,,10,deicing
DE0000006496,F00009015,02-03-2024 00:37,CRW,WX01,1m,crew swap
DE0000006497,F00009018,22-10-2025 12:59,WX,WX01,-1,late inbound
DE0000006498,F00009018,22-10-2025 14:07,other,,-1,maintenance check
DE0000006499,F00009018,22-10-2025 14:22,AIRPORT,GT3,3,deicing
DE0000006500,F00009019,07-02-2025 03:16,ATC,OPS9,35,crew swap
DE0000006501,F00009022,14-08-2024 14:34,CRW,OPS9,7,gate hold
DE0000006502,F00009026,08/17/2024 17:11,other,GT3,23m,late inbound
DE0000006503,F00009026,08/17/2024 19:15,OPS,CR02,3m,maintenance check
DE0000006504,F00009026,17-08-2024 17:45,ATC,GT3,15,crew swap
DE0000006505,F00009028,12-05-2025 08:59,other,MX5,7,crew swap
DE0000006506,F00009028,12-05-2025 07:57,airport,ATC7,1,
DE0000006507,F00009032,2024-11-12T22:13:00,WX,OPS9,11,
DE0000006508,F00009039,2026-01-23T03:17:00,atc,GT3,25,late inbound
DE0000006509,F00009041,03/29/2024 08:11,other,CR02,1,crew swap
DE0000006510,F00009041,29-03-2024 07:56,MX,MX5,1,deicing
DE0000006511,F00009043,15-05-2025 14:30,OPS,OPS9,5,deicing
DE0000006512,F00009043,15-05-2025 13:23,atc,WX01,4,ground stop
DE0000006513,F00009044,16-12-2024 17:19,GATE,MX5,1m,maintenance check
DE0000006514,F00009051,03-03-2024 12:27,CRW,OPS9,8,gate hold
DE0000006515,F00009051,03-03-2024 10:59,CREW,CR02,4,deicing
DE0000006516,F00009051,03-03-2024 12:21,MAINT,CR02,2,maintenance check
DE0000006517,F00009055,2024-03-09T03:18:00,GATE,ATC7,4,gate hold
DE0000006518,F00009058,13-11-2025 03:45,ATC,GT3,28,deicing
DE0000006519,F00009059,2024-08-16T14:43:00,ATC,MX5,15,deicing
DE0000006520,F00009059,16-08-2024 14:20,atc,ATC7,3,ground stop
DE0000006521,F00009062,03-05-2024 02:19,crew,CR02,23,deicing
DE0000006522,F00009062,03-05-2024 04:05,CRW,ATC7,5m,late inbound
DE0000006523,F00009062,03-05-2024 03:36,WX,CR02,5,deicing
DE0000006524,F00009063,23-09-2024 14:36,MAINT,,10,deicing
DE0000006525,F00009063,23-09-2024 15:00,OPS,,20,deicing
DE0000006526,F00009064,19-11-2024 09:47,CRW,CR02,10,late inbound
DE0000006527,F00009066,08-04-2024 09:29,other,,27,late inbound
DE0000006528,F00009067,14-11-2024 02:41,other,GT3,0,late inbound
DE0000006529,F00009067,11/14/2024 02:44,WEATHER,OPS9,1,late inbound
DE0000006530,F00009067,2024-11-14T04:26:00,WX,CR02,7,gate hold
DE0000006531,F00009070,12-08-2025 14:17,AIRPORT,MX5,0,deicing
DE0000006532,F00009070,08-12-2025 12:18,WX,WX01,13,crew swap
DE0000006533,F00009070,2025-12-08T12:17:00,maint,WX01,5,ground stop
DE0000006534,F00009072,18-12-2024 17:34,maint,CR02,1,
DE0000006535,F00009072,2024-12-18T18:48:00,WX,,12,deicing
DE0000006536,F00009072,18-12-2024 18:35,OPS,,9,deicing
DE0000006537,F00009075,13-02-2024 14:15,CRW,ATC7,4,deicing
DE0000006538,F00009075,13-02-2024 13:03,atc,MX5,12,deicing
DE0000006539,F00009075,13-02-2024 13:04,AIRPORT,GT3,2,late inbound
DE0000006540,F00009077,03-06-2024 08:55,crew,MX5,21m,maintenance check
DE0000006541,F00009080,03/28/2024 11:27,AIRPORT,MX5,1,ground stop
DE0000006542,F00009080,2024-03-28T13:32:00,airport,,18,maintenance check
DE0000006543,F00009081,08-01-2025 08:01,GATE,,18,gate hold
DE0000006544,F00009081,08-01-2025 05:48,ATC,OPS9,7,ground stop
DE0000006545,F00009082,22-07-2025 13:22,crew,ATC7,18,
DE0000006546,F00009090,2024-05-02T08:16:00,atc,GT3,11,gate hold
DE0000006547,F00009091,06-06-2025 22:10,CREW,MX5,4m,gate hold
DE0000006548,F00009091,06-06-2025 21:51,TRAFFIC,WX01,21,late inbound
DE0000006549,F00009091,06-06-2025 21:25,other,ATC7,5,ground stop
DE0000006550,F00009094,23-11-2025 18:40,ATC,CR02,52,gate hold
DE0000006551,F00009100,18-11-2025 21:59,WX,OPS9,5,
DE0000006552,F00009100,11/18/2025 22:03,airport,GT3,8,crew swap
DE0000006553,F00009100,11/18/2025 22:47,OPS,ATC7,8,maintenance check
DE0000006554,F00009101,2024-07-21T02:16:00,GATE,,7m,ground stop
DE0000006555,F00009101,21-07-2024 02:49,MX,ATC7,23,ground stop
DE0000006556,F00009102,17-08-2025 17:32,WEATHER,WX01,-1,deicing
DE0000006557,F00009102,17-08-2025 15:27,weather,MX5,1,
DE0000006558,F00009102,17-08-2025 16:51,CRW,,1,ground stop
DE0000006559,F00009103,12-10-2025 04:08,MX,ATC7,-37,gate hold
DE0000006560,F00009105,09-12-2024 11:25,MAINT,GT3,7,crew swap
DE0000006561,F00009105,12-09-2024 12:41,other,GT3,1,deicing
DE0000006562,F00009105,12-09-2024 11:13,other,WX01,4,gate hold
DE0000006563,F00009106,2024-06-01T05:40:00,CREW,CR02,2,maintenance check
DE0000006564,F00009106,06-01-2024 04:20,ATC,,6,gate hold
DE0000006565,F00009106,01-06-2024 03:03,MAINT,WX01,5m,maintenance check
DE0000006566,F00009107,06-07-2024 16:01,CREW,MX5,0,ground stop
DE0000006567,F00009107,06-07-2024 16:34,airport,,1,maintenance check
DE0000006568,F00009107,06-07-2024 16:49,MAINT,,1,maintenance check
DE0000006569,F00009108,03-06-2025 17:10,crew,CR02,6,ground stop
DE0000006570,F00009108,03-06-2025 18:03,TRAFFIC,,114,
DE0000006571,F00009108,06-03-2025 16:14,other,CR02,67,late inbound
DE0000006572,F00009113,22-05-2025 14:04,TRAFFIC,OPS9,3,gate hold
DE0000006573,F00009113,05/22/2025 12:23,other,MX5,4,
DE0000006574,F00009113,22-05-2025 14:36,other,CR02,11,maintenance check
DE0000006575,F00009116,14-10-2025 10:00,CRW,GT3,26,gate hold
DE0000006576,F00009117,09-01-2025 10:42,ATC,OPS9,3,late inbound
DE0000006577,F00009118,14-05-2024 21:41,GATE,WX01,4,ground stop
DE0000006578,F00009118,05/14/2024 23:01,WX,OPS9,6,crew swap
DE0000006579,F00009118,05/14/2024 23:21,crew,,-2,
DE0000006580,F00009119,20-02-2024 10:27,OPS,OPS9,5,crew swap
DE0000006581,F00009127,17-11-2025 03:51,atc,,-1,
DE0000006582,F00009127,17-11-2025 05:44,crew,,1,
DE0000006583,F00009127,17-11-2025 03:32,ATC,GT3,1,deicing
DE0000006584,F00009130,15-02-2025 23:30,WX,,88,late inbound
DE0000006585,F00009131,27-12-2024 01:23,MAINT,GT3,5,maintenance check
DE0000006586,F00009131,27-12-2024 00:56,TRAFFIC,MX5,1,gate hold
DE0000006587,F00009131,27-12-2024 01:55,AIRPORT,MX5,-1,maintenance check
DE0000006588,F00009140,03-07-2025 00:27,CREW,OPS9,6,late inbound
DE0000006589,F00009140,03-07-2025 01:03,MAINT,,27m,deicing
DE0000006590,F00009141,23-02-2024 14:29,WEATHER,WX01,1,ground stop
DE0000006591,F00009141,02/23/2024 13:54,maint,OPS9,1,late inbound
DE0000006592,F00009141,23-02-2024 12:19,OTHER,,3,gate hold
DE0000006593,F00009146,08-08-2024 22:31,GATE,ATC7,7,ground stop
DE0000006594,F00009146,08-08-2024 22:16,OPS,OPS9,11,
DE0000006595,F00009147,14-07-2025 11:16,atc,CR02,3,maintenance check
DE0000006596,F00009147,14-07-2025 12:03,MAINT,MX5,37,ground stop
DE0000006597,F00009148,29-10-2024 23:50,GATE,MX5,1,ground stop
DE0000006598,F00009148,30-10-2024 00:56,crew,ATC7,13,ground stop
DE0000006599,F00009156,24-03-2025 13:22,maint,ATC7,9,late inbound
DE0000006600,F00009156,03/24/2025 12:43,MAINT,MX5,4,deicing
DE0000006601,F00009156,03/24/2025 12:04,crew,WX01,4,
DE0000006602,F00009160,03-05-2025 19:44,atc,GT3,7m,crew swap
DE0000006603,F00009160,03-05-2025 20:37,weather,OPS9,23,
DE0000006604,F00009161,06/30/2024 11:11,crew,GT3,10,crew swap
DE0000006605,F00009161,30-06-2024 12:36,crew,ATC7,3,late inbound
DE0000006606,F00009163,07-09-2024 02:00,WX,,6,gate hold
DE0000006607,F00009163,2024-09-07T02:20:00,airport,GT3,26,ground stop
DE0000006608,F00009165,06/23/2024 17:13,OTHER,ATC7,7,
DE0000006609,F00009165,06/23/2024 16:05,weather,GT3,10,late inbound
DE0000006610,F00009169,05-05-2025 17:33,other,ATC7,2,crew swap
DE0000006611,F00009169,05-05-2025 18:17,crew,WX01,2,gate hold
DE0000006612,F00009169,05-05-2025 16:01,crew,,26m,maintenance check
DE0000006613,F00009171,12/17/2025 03:05,crew,ATC7,12,maintenance check
DE0000006614,F00009171,17-12-2025 03:51,CREW,OPS9,11,maintenance check
DE0000006615,F00009177,06-03-2024 01:17,weather,CR02,2,gate hold
DE0000006616,F00009180,12-05-2024 03:30,MAINT,ATC7,3,gate hold
DE0000006617,F00009180,12-05-2024 06:11,other,ATC7,-4,crew swap
DE0000006618,F00009180,12-05-2024 04:26,MX,ATC7,15,maintenance check
DE0000006619,F00009181,25-06-2024 18:25,OTHER,OPS9,7,deicing
DE0000006620,F00009181,25-06-2024 19:43,WX,MX5,5,crew swap
DE0000006621,F00009182,07-02-2025 11:32,other,CR02,7,gate hold
DE0000006622,F00009182,02-07-2025 13:17,WEATHER,CR02,2,late inbound
DE0000006623,F00009183,07/27/2025 21:12,WX,WX01,1,late inbound
DE0000006624,F00009183,07/27/2025 18:44,weather,MX5,8,crew swap
DE0000006625,F00009186,03-03-2025 21:20,MX,,43,late inbound
DE0000006626,F00009188,28-09-2024 01:20,maint,MX5,4,deicing
DE0000006627,F00009188,28-09-2024 03:32,MX,CR02,8,maintenance check
DE0000006628,F00009188,09/28/2024 02:59,MAINT,GT3,2,late inbound
DE0000006629,F00009189,02/20/2024 07:16,OPS,GT3,16,late inbound
DE0000006630,F00009193,19-05-2024 11:35,atc,GT3,3,maintenance check
DE0000006631,F00009193,05/19/2024 10:42,CRW,GT3,-17,ground stop
DE0000006632,F00009196,10-05-2024 01:42,crew,ATC7,17,ground stop
DE0000006633,F00009196,05-10-2024 01:48,crew,WX01,2,ground stop
DE0000006634,F00009197,2024-03-13T06:52:00,WX,OPS9,6,crew swap
DE0000006635,F00009197,13-03-2024 08:02,airport,,1,maintenance check
DE0000006636,F00009200,2024-02-14T19:17:00,TRAFFIC,,0,ground stop
DE0000006637,F00009200,14-02-2024 18:34,ATC,OPS9,10,deicing
DE0000006638,F00009200,14-02-2024 19:44,CRW,OPS9,6m,
DE0000006639,F00009202,05-04-2024 23:04,WEATHER,WX01,3,
DE0000006640,F00009202,05-04-2024 21:10,CREW,MX5,10,
DE0000006641,F00009203,2025-08-17T17:25:00,GATE,WX01,4,maintenance check
DE0000006642,F00009203,17-08-2025 18:30,AIRPORT,ATC7,15,ground stop
DE0000006643,F00009205,01/19/2026 14:40,MX,MX5,6m,crew swap
DE0000006644,F00009206,17-07-2025 20:56,other,ATC7,28m,
DE0000006645,F00009209,20-06-2025 16:54,atc,OPS9,24,deicing
DE0000006646,F00009212,03-02-2025 11:49,OTHER,GT3,32,deicing
DE0000006647,F00009213,28-07-2024 17:23,CREW,ATC7,4,
DE0000006648,F00009213,07/28/2024 18:03,TRAFFIC,ATC7,1,late inbound
DE0000006649,F00009213,2024-07-28T17:48:00,weather,GT3,21,late inbound
DE0000006650,F00009215,28-02-2024 23:05,weather,WX01,1,late inbound
DE0000006651,F00009215,29-02-2024 01:04,CREW,GT3,27,ground stop
DE0000006652,F00009216,23-05-2024 00:59,MAINT,CR02,5,deicing
DE0000006653,F00009216,05/23/2024 00:09,TRAFFIC,WX01,2,maintenance check
DE0000006654,F00009221,12-11-2025 19:58,MAINT,MX5,5,ground stop
DE0000006655,F00009223,20-10-2024 05:27,GATE,MX5,6,
DE0000006656,F00009225,20-06-2024 04:00,AIRPORT,MX5,25,deicing
DE0000006657,F00009225,20-06-2024 03:27,MAINT,,-9,
DE0000006658,F00009226,04/27/2025 22:34,OPS,MX5,-1,deicing
DE0000006659,F00009226,04/27/2025 22:19,maint,MX5,1,
DE0000006660,F00009226,27-04-2025 22:29,ATC,CR02,-1,late inbound
DE0000006661,F00009227,19-12-2025 02:14,maint,CR02,1,maintenance check
DE0000006662,F00009227,19-12-2025 00:35,ATC,,2,maintenance check
DE0000006663,F00009227,12/19/2025 02:52,other,CR02,3,
DE0000006664,F00009228,28-04-2024 19:13,other,,0,deicing
DE0000006665,F00009228,04/28/2024 18:05,other,GT3,14,
DE0000006666,F00009228,28-04-2024 18:38,atc,ATC7,7,late inbound
DE0000006667,F00009229,02-11-2025 22:22,weather,,-1,late inbound
DE0000006668,F00009229,02-11-2025 22:40,CRW,OPS9,1,deicing
DE0000006669,F00009229,02-11-2025 22:35,maint,MX5,1,
DE0000006670,F00009231,2025-08-19T05:03:00,WX,ATC7,13m,deicing
DE0000006671,F00009233,01-07-2024 14:40,MX,CR02,28,maintenance check
DE0000006672,F00009233,07-01-2024 14:29,weather,,24,late inbound
DE0000006673,F00009236,12/16/2024 21:25,MX,ATC7,8m,late inbound
DE0000006674,F00009241,29-08-2025 08:51,airport,,27m,deicing
DE0000006675,F00009243,14-11-2025 12:42,AIRPORT,GT3,13,maintenance check
DE0000006676,F00009243,14-11-2025 12:46,TRAFFIC,ATC7,1,ground stop
DE0000006677,F00009246,18-01-2026 17:32,other,,24,deicing
DE0000006678,F00009247,11-02-2025 09:18,weather,CR02,-11,ground stop
DE0000006679,F00009252,06-03-2024 15:44,WEATHER,OPS9,60m,crew swap
DE0000006680,F00009253,19-01-2026 03:34,GATE,GT3,16,ground stop
DE0000006681,F00009253,19-01-2026 02:26,other,WX01,1,late inbound
DE0000006682,F00009257,27-09-2024 08:32,OPS,CR02,6,deicing
DE0000006683,F00009257,27-09-2024 10:04,maint,ATC7,-22,late inbound
DE0000006684,F00009261,2025-07-30T12:18:00,CREW,CR02,10,crew swap
DE0000006685,F00009266,04-08-2025 22:11,WX,GT3,24,maintenance check
DE0000006686,F00009274,24-05-2024 14:16,GATE,GT3,16,maintenance check
DE0000006687,F00009274,24-05-2024 16:00,atc,,11,late inbound
DE0000006688,F00009274,05/24/2024 14:29,AIRPORT,OPS9,3,deicing
DE0000006689,F00009281,24-11-2025 06:59,GATE,WX01,5,
DE0000006690,F00009281,24-11-2025 07:34,MAINT,ATC7,6,late inbound
DE0000006691,F00009282,07/25/2024 04:29,MX,CR02,12,
DE0000006692,F00009282,25-07-2024 04:41,other,WX01,6,deicing
DE0000006693,F00009282,25-07-2024 06:22,GATE,MX5,9,late inbound
DE0000006694,F00009283,22-07-2024 01:03,TRAFFIC,MX5,1,
DE0000006695,F00009283,07/22/2024 00:23,weather,CR02,7,late inbound
DE0000006696,F00009283,07/22/2024 01:11,airport,CR02,5,crew swap
DE0000006697,F00009286,24-05-2024 06:25,OTHER,ATC7,15,deicing
DE0000006698,F00009286,24-05-2024 06:23,WEATHER,GT3,2,gate hold
DE0000006699,F00009286,05/24/2024 07:27,maint,OPS9,4,ground stop
DE0000006700,F00009292,22-08-2025 19:45,CREW,WX01,3,deicing
DE0000006701,F00009292,2025-08-22T19:32:00,MAINT,OPS9,7,maintenance check
DE0000006702,F00009295,18-02-2025 12:42,other,,9,deicing
DE0000006703,F00009297,06-11-2024 16:20,MAINT,MX5,11,crew swap
DE0000006704,F00009297,11-06-2024 16:40,atc,CR02,9,crew swap
DE0000006705,F00009298,22-02-2024 04:31,CREW,OPS9,13,maintenance check
DE0000006706,F00009298,22-02-2024 04:45,ATC,MX5,3,crew swap
DE0000006707,F00009300,24-10-2025 10:13,WX,MX5,7,maintenance check
DE0000006708,F00009301,03-01-2025 17:18,crew,ATC7,174,crew swap
DE0000006709,F00009302,19-11-2025 19:50,crew,GT3,49,late inbound
DE0000006710,F00009304,25-02-2024 17:36,atc,WX01,9,maintenance check
DE0000006711,F00009308,01-11-2025 14:32,OTHER,,25,gate hold
DE0000006712,F00009308,11-01-2025 13:56,other,OPS9,28,late inbound
DE0000006713,F00009309,14-07-2025 10:50,CREW,CR02,11,crew swap
DE0000006714,F00009309,14-07-2025 12:12,WEATHER,MX5,2,maintenance check
DE0000006715,F00009309,14-07-2025 11:09,CREW,GT3,17m,ground stop
DE0000006716,F00009310,16-05-2024 11:41,MAINT,WX01,75,deicing
DE0000006717,F00009312,22-05-2025 10:42,TRAFFIC,GT3,30,gate hold
DE0000006718,F00009313,23-08-2024 15:39,WX,CR02,22,late inbound
DE0000006719,F00009313,23-08-2024 16:11,maint,CR02,37,late inbound
DE0000006720,F00009313,23-08-2024 17:32,GATE,OPS9,195,late inbound
DE0000006721,F00009315,09-10-2025 03:36,OTHER,WX01,6,deicing
DE0000006722,F00009315,09-10-2025 03:22,AIRPORT,CR02,23,deicing
DE0000006723,F00009316,07-10-2024 16:41,crew,MX5,11m,crew swap
DE0000006724,F00009316,07-10-2024 17:28,CREW,,1,gate hold
DE0000006725,F00009316,07-10-2024 18:10,TRAFFIC,ATC7,1,deicing
DE0000006726,F00009319,26-11-2025 16:21,crew,CR02,0,deicing
DE0000006727,F00009319,26-11-2025 17:15,ATC,OPS9,1,gate hold
DE0000006728,F00009319,2025-11-26T14:40:00,CRW,ATC7,1,crew swap
DE0000006729,F00009322,11-06-2024 10:45,AIRPORT,GT3,26,maintenance check
DE0000006730,F00009323,2024-11-29T19:18:00,crew,,38,deicing
DE0000006731,F00009324,03-02-2025 17:29,CRW,ATC7,91,ground stop
DE0000006732,F00009324,03-02-2025 17:33,airport,CR02,120,ground stop
DE0000006733,F00009325,26-07-2025 08:57,maint,MX5,0,maintenance check
DE0000006734,F00009325,26-07-2025 07:08,CRW,MX5,9,maintenance check
DE0000006735,F00009325,26-07-2025 08:23,GATE,ATC7,3,late inbound
DE0000006736,F00009330,22-07-2025 00:54,OPS,WX01,1,ground stop
DE0000006737,F00009330,22-07-2025 00:32,airport,CR02,4,crew swap
DE0000006738,F00009332,07-01-2025 22:56,WEATHER,,3,
DE0000006739,F00009332,01-07-2025 23:20,AIRPORT,,4,
DE0000006740,F00009332,08-01-2025 00:19,WX,WX01,11,deicing
DE0000006741,F00009335,18-09-2025 11:52,airport,ATC7,26,crew swap
DE0000006742,F00009335,18-09-2025 13:32,AIRPORT,GT3,-20,
DE0000006743,F00009341,12-06-2025 14:21,MAINT,WX01,0,
DE0000006744,F00009341,12-06-2025 13:24,CRW,WX01,-3,deicing
DE0000006745,F00009341,12-06-2025 12:44,WEATHER,ATC7,7,crew swap
DE0000006746,F00009345,08-01-2026 01:33,other,CR02,67,ground stop
DE0000006747,F00009347,03/14/2025 21:44,GATE,ATC7,3,maintenance check
DE0000006748,F00009347,14-03-2025 21:49,WX,GT3,8,ground stop
DE0000006749,F00009347,03/14/2025 22:17,OTHER,WX01,6m,deicing
DE0000006750,F00009348,06-07-2024 09:50,WX,MX5,0,deicing
DE0000006751,F00009348,07-06-2024 08:44,OPS,WX01,5,gate hold
DE0000006752,F00009361,15-03-2024 14:26,other,ATC7,19,
DE0000006753,F00009363,03-11-2025 20:36,crew,MX5,0,deicing
DE0000006754,F00009363,03-11-2025 21:04,OPS,ATC7,3,late inbound
DE0000006755,F00009367,05-08-2025 20:28,TRAFFIC,OPS9,6,maintenance check
DE0000006756,F00009367,05-08-2025 20:40,WX,MX5,17,maintenance check
DE0000006757,F00009373,08/15/2025 23:27,CREW,WX01,1,gate hold
DE0000006758,F00009373,15-08-2025 22:05,weather,GT3,9,gate hold
DE0000006759,F00009373,15-08-2025 22:46,OPS,ATC7,4,maintenance check
DE0000006760,F00009374,01/24/2025 05:31,TRAFFIC,GT3,9,maintenance check
DE0000006761,F00009374,24-01-2025 05:56,TRAFFIC,,9,deicing
DE0000006762,F00009376,27-11-2024 16:48,other,CR02,32,deicing
DE0000006763,F00009376,2024-11-27T17:05:00,WEATHER,ATC7,15,maintenance check
DE0000006764,F00009377,2024-09-07T15:23:00,TRAFFIC,GT3,21,late inbound
DE0000006765,F00009378,30-07-2024 06:34,airport,,2,crew swap
DE0000006766,F00009378,2024-07-30T06:23:00,atc,WX01,14,ground stop
DE0000006767,F00009378,30-07-2024 05:56,maint,WX01,1,gate hold
DE0000006768,F00009381,2025-08-04T15:12:00,TRAFFIC,MX5,16m,crew swap
DE0000006769,F00009383,18-09-2024 17:37,airport,ATC7,0,late inbound
DE0000006770,F00009383,18-09-2024 17:35,airport,OPS9,27,crew swap
DE0000006771,F00009385,14-06-2024 06:12,GATE,ATC7,1,late inbound
DE0000006772,F00009385,14-06-2024 07:28,atc,ATC7,15,maintenance check
DE0000006773,F00009389,29-12-2025 03:13,ATC,,0,deicing
DE0000006774,F00009389,2025-12-29T03:46:00,TRAFFIC,,1,late inbound
DE0000006775,F00009389,29-12-2025 04:16,weather,GT3,1,crew swap
DE0000006776,F00009392,17-10-2024 04:34,CREW,ATC7,38,maintenance check
DE0000006777,F00009396,15-11-2024 16:25,crew,CR02,0,maintenance check
DE0000006778,F00009396,15-11-2024 16:22,ATC,OPS9,1,ground stop
DE0000006779,F00009396,15-11-2024 17:00,atc,WX01,16,maintenance check
DE0000006780,F00009397,29-03-2025 05:20,OPS,CR02,6,
DE0000006781,F00009397,29-03-2025 06:17,airport,MX5,10,deicing
DE0000006782,F00009401,04-06-2025 06:01,MAINT,,11,gate hold
DE0000006783,F00009401,2025-06-04T06:23:00,OTHER,OPS9,16,
DE0000006784,F00009402,02/18/2025 07:52,GATE,,17,ground stop
DE0000006785,F00009402,18-02-2025 08:58,airport,MX5,7,deicing
DE0000006786,F00009404,26-04-2024 01:43,OPS,MX5,18,late inbound
DE0000006787,F00009404,26-04-2024 00:57,CREW,OPS9,1,maintenance check
DE0000006788,F00009404,04/26/2024 01:50,maint,CR02,3,late inbound
DE0000006789,F00009409,01-03-2024 18:21,OTHER,OPS9,7,crew swap
DE0000006790,F00009410,2024-06-12T21:33:00,OTHER,MX5,12,maintenance check
DE0000006791,F00009410,12-06-2024 22:15,WEATHER,,10,maintenance check
DE0000006792,F00009410,06-12-2024 23:21,GATE,ATC7,3,
DE0000006793,F00009413,11-03-2024 06:16,MX,WX01,14,ground stop
DE0000006794,F00009417,23-06-2025 04:30,OPS,CR02,3,late inbound
DE0000006795,F00009417,23-06-2025 05:28,CRW,GT3,1,crew swap
DE0000006796,F00009420,01-10-2024 15:12,crew,CR02,3,deicing
DE0000006797,F00009420,2024-10-01T14:01:00,weather,ATC7,1,crew swap
DE0000006798,F00009420,01-10-2024 16:07,weather,OPS9,2,crew swap
DE0000006799,F00009427,16-07-2024 14:29,OTHER,CR02,4,late inbound
DE0000006800,F00009427,16-07-2024 15:46,other,WX01,3,deicing
DE0000006801,F00009427,07/16/2024 14:58,WEATHER,ATC7,1,late inbound
DE0000006802,F00009428,09-03-2024 19:42,OTHER,CR02,28,deicing
DE0000006803,F00009432,2025-08-22T04:15:00,weather,ATC7,27,ground stop
DE0000006804,F00009432,08/22/2025 04:26,OPS,OPS9,-3,crew swap
DE0000006805,F00009435,24-12-2024 21:45,CRW,OPS9,50,maintenance check
DE0000006806,F00009437,20-11-2024 23:45,MAINT,OPS9,0,maintenance check
DE0000006807,F00009437,11/20/2024 23:16,MAINT,OPS9,13,late inbound
DE0000006808,F00009440,11-07-2024 21:46,WEATHER,,11,deicing
DE0000006809,F00009440,07-11-2024 20:01,CRW,GT3,3,crew swap
DE0000006810,F00009440,07-11-2024 21:13,maint,,-7,ground stop
DE0000006811,F00009441,03-04-2025 10:34,GATE,MX5,15,
DE0000006812,F00009441,03-04-2025 10:53,WEATHER,CR02,10,late inbound
DE0000006813,F00009443,08/15/2024 20:26,weather,,1,deicing
DE0000006814,F00009443,15-08-2024 21:23,AIRPORT,MX5,1,deicing
DE0000006815,F00009444,04-03-2025 01:18,ATC,CR02,52m,late inbound
DE0000006816,F00009445,16-12-2025 03:05,atc,GT3,10,maintenance check
DE0000006817,F00009445,16-12-2025 00:47,AIRPORT,MX5,2,deicing
DE0000006818,F00009450,01/21/2026 10:57,AIRPORT,GT3,4,crew swap
DE0000006819,F00009450,21-01-2026 08:21,CRW,GT3,9,ground stop
DE0000006820,F00009450,21-01-2026 09:58,other,GT3,3,deicing
DE0000006821,F00009451,2025-01-23T11:58:00,WX,WX01,34m,ground stop
DE0000006822,F00009455,07-12-2024 11:57,CRW,CR02,32,ground stop
DE0000006823,F00009455,07-12-2024 10:18,MX,ATC7,3,deicing
DE0000006824,F00009455,07-12-2024 11:10,MAINT,WX01,10,ground stop
DE0000006825,F00009456,08-09-2024 14:31,maint,GT3,-1,deicing
DE0000006826,F00009456,09-08-2024 13:13,TRAFFIC,ATC7,1,crew swap
DE0000006827,F00009456,08-09-2024 13:54,airport,,1,ground stop
DE0000006828,F00009458,12-07-2025 14:28,TRAFFIC,CR02,49m,
DE0000006829,F00009458,2025-07-12T13:34:00,ATC,CR02,12,gate hold
DE0000006830,F00009458,12-07-2025 11:43,MAINT,GT3,9,deicing
DE0000006831,F00009461,2025-08-21T18:54:00,ATC,ATC7,29,ground stop
DE0000006832,F00009462,02-06-2025 02:47,OPS,ATC7,-4,
DE0000006833,F00009463,17-02-2024 10:53,crew,,5,late inbound
DE0000006834,F00009463,17-02-2024 11:54,maint,OPS9,3,gate hold
DE0000006835,F00009464,17-04-2025 01:00,CREW,ATC7,1,crew swap
DE0000006836,F00009464,2025-04-16T23:20:00,maint,ATC7,2m,late inbound
DE0000006837,F00009464,16-04-2025 23:53,other,WX01,5,late inbound
DE0000006838,F00009468,20-05-2024 21:19,GATE,ATC7,18,gate hold
DE0000006839,F00009468,20-05-2024 21:29,OTHER,ATC7,12,gate hold
DE0000006840,F00009471,17-03-2025 05:21,weather,,6,late inbound
DE0000006841,F00009471,03/17/2025 06:39,WX,OPS9,25,deicing
DE0000006842,F00009475,05/21/2024 12:58,crew,ATC7,4,deicing
DE0000006843,F00009475,2024-05-21T13:04:00,TRAFFIC,MX5,15,late inbound
DE0000006844,F00009482,13-01-2025 06:46,CRW,CR02,-24,ground stop
DE0000006845,F00009488,11-11-2024 00:24,GATE,OPS9,3,crew swap
DE0000006846,F00009488,11-11-2024 00:25,MX,CR02,32m,
DE0000006847,F00009489,17-10-2025 20:36,CREW,CR02,34,gate hold
DE0000006848,F00009491,06-10-2025 01:53,WEATHER,MX5,1,gate hold
DE0000006849,F00009491,06-10-2025 00:42,AIRPORT,,1,crew swap
DE0000006850,F00009495,2025-10-05T15:01:00,other,OPS9,1,maintenance check
DE0000006851,F00009496,20-11-2024 16:34,AIRPORT,GT3,9,late inbound
DE0000006852,F00009496,20-11-2024 14:17,MAINT,WX01,6m,crew swap
DE0000006853,F00009497,29-05-2025 15:56,WEATHER,WX01,12,maintenance check
DE0000006854,F00009497,29-05-2025 15:17,CRW,MX5,25,crew swap
DE0000006855,F00009498,30-04-2025 21:19,AIRPORT,WX01,5,deicing
DE0000006856,F00009498,30-04-2025 23:19,CREW,MX5,9,gate hold
DE0000006857,F00009502,2024-09-19T23:57:00,ATC,ATC7,11,gate hold
DE0000006858,F00009505,03-07-2024 05:58,CREW,WX01,1,ground stop
DE0000006859,F00009506,18-07-2024 20:54,other,GT3,2,crew swap
DE0000006860,F00009507,28-06-2025 17:16,MAINT,CR02,23,late inbound
DE0000006861,F00009512,20-12-2024 02:38,maint,,5,late inbound
DE0000006862,F00009512,20-12-2024 02:11,TRAFFIC,OPS9,3,maintenance check
DE0000006863,F00009512,20-12-2024 02:02,airport,,-1,ground stop
DE0000006864,F00009515,25-04-2024 19:31,ATC,OPS9,1m,ground stop
DE0000006865,F00009515,25-04-2024 18:37,weather,MX5,1,late inbound
DE0000006866,F00009515,25-04-2024 17:15,CRW,ATC7,6,maintenance check
DE0000006867,F00009519,17-09-2024 02:21,crew,CR02,52,maintenance check
DE0000006868,F00009520,24-05-2025 04:27,MAINT,ATC7,31,late inbound
DE0000006869,F00009521,15-04-2025 04:01,OPS,ATC7,6,ground stop
DE0000006870,F00009521,15-04-2025 03:53,weather,MX5,11,late inbound
DE0000006871,F00009525,2024-07-23T05:57:00,CREW,OPS9,2,deicing
DE0000006872,F00009525,23-07-2024 06:04,WEATHER,CR02,31,crew swap
DE0000006873,F00009526,29-04-2024 03:50,CRW,CR02,1,deicing
DE0000006874,F00009526,29-04-2024 01:41,maint,WX01,17,late inbound
DE0000006875,F00009531,26-10-2024 20:06,airport,WX01,0,late inbound
DE0000006876,F00009531,10/26/2024 20:55,maint,,15m,gate hold
DE0000006877,F00009531,26-10-2024 18:16,MAINT,OPS9,-1,gate hold
DE0000006878,F00009536,19-09-2024 01:16,MX,CR02,12,gate hold
DE0000006879,F00009539,03-03-2025 15:53,atc,CR02,7,crew swap
DE0000006880,F00009539,03-03-2025 13:51,TRAFFIC,CR02,11,ground stop
DE0000006881,F00009539,03-03-2025 15:25,atc,CR02,1,maintenance check
DE0000006882,F00009544,2025-02-05T02:40:00,TRAFFIC,GT3,21,maintenance check
DE0000006883,F00009544,02-05-2025 05:10,crew,OPS9,-1,maintenance check
DE0000006884,F00009548,18-01-2025 19:49,WEATHER,ATC7,10,ground stop
DE0000006885,F00009548,18-01-2025 19:01,GATE,ATC7,19,gate hold
DE0000006886,F00009548,18-01-2025 18:34,GATE,OPS9,4,maintenance check
DE0000006887,F00009549,23-07-2024 12:46,CREW,WX01,0,ground stop
DE0000006888,F00009549,23-07-2024 11:27,OPS,MX5,1,crew swap
DE0000006889,F00009549,23-07-2024 11:30,other,CR02,1,gate hold
DE0000006890,F00009551,10-01-2025 05:52,ATC,GT3,24,late inbound
DE0000006891,F00009551,01-10-2025 05:44,other,WX01,1,gate hold
DE0000006892,F00009552,10-11-2024 04:30,OPS,ATC7,13,crew swap
DE0000006893,F00009552,11-10-2024 04:40,MX,OPS9,5m,crew swap
DE0000006894,F00009553,01-10-2025 07:28,weather,GT3,-8,ground stop
DE0000006895,F00009553,10-01-2025 09:32,weather,ATC7,7m,late inbound
DE0000006896,F00009553,2025-01-10T09:10:00,MAINT,MX5,15,gate hold
DE0000006897,F00009555,07-11-2024 01:40,WX,WX01,9,ground stop
DE0000006898,F00009555,07-11-2024 01:32,ATC,MX5,5,crew swap
DE0000006899,F00009555,07-11-2024 02:33,OTHER,OPS9,-12,late inbound
DE0000006900,F00009556,14-02-2025 17:04,TRAFFIC,ATC7,10,
DE0000006901,F00009556,14-02-2025 17:34,CREW,ATC7,8,crew swap
DE0000006902,F00009556,14-02-2025 17:19,airport,OPS9,14,maintenance check
DE0000006903,F00009558,2025-04-11T09:41:00,airport,CR02,19,gate hold
DE0000006904,F00009565,20-05-2025 02:23,GATE,,3,deicing
DE0000006905,F00009565,05/20/2025 00:41,weather,ATC7,3,gate hold
DE0000006906,F00009566,03-09-2024 04:24,TRAFFIC,ATC7,15,ground stop
DE0000006907,F00009570,21-11-2025 07:46,AIRPORT,GT3,17,gate hold
DE0000006908,F00009572,08/23/2025 09:08,CRW,OPS9,27,deicing
DE0000006909,F00009577,01-03-2024 02:22,OTHER,OPS9,1,late inbound
DE0000006910,F00009577,01-03-2024 01:30,MAINT,WX01,1,maintenance check
DE0000006911,F00009584,16-04-2025 16:48,TRAFFIC,WX01,2m,
DE0000006912,F00009584,04/16/2025 13:55,MAINT,OPS9,1,ground stop
DE0000006913,F00009584,16-04-2025 15:49,atc,,4,ground stop
DE0000006914,F00009587,14-10-2025 10:53,weather,WX01,2,gate hold
DE0000006915,F00009587,10/14/2025 11:19,CREW,MX5,1,gate hold
DE0000006916,F00009588,30-01-2026 19:25,MX,,56,
DE0000006917,F00009588,01/30/2026 18:49,weather,ATC7,11,maintenance check
DE0000006918,F00009589,15-08-2025 13:11,maint,,3m,
DE0000006919,F00009589,15-08-2025 13:41,atc,WX01,1,crew swap
DE0000006920,F00009589,15-08-2025 13:54,MAINT,WX01,1,gate hold
DE0000006921,F00009590,03/21/2024 02:36,WX,CR02,39,
DE0000006922,F00009591,23-07-2025 16:41,other,WX01,0,deicing
DE0000006923,F00009591,07/23/2025 15:00,atc,GT3,3,
DE0000006924,F00009591,23-07-2025 14:34,WEATHER,OPS9,1,late inbound
DE0000006925,F00009592,24-02-2024 07:37,WX,ATC7,7,gate hold
DE0000006926,F00009592,24-02-2024 07:44,CREW,MX5,34,maintenance check
DE0000006927,F00009602,23-12-2024 09:34,AIRPORT,MX5,1,deicing
DE0000006928,F00009603,11-06-2024 06:51,GATE,ATC7,0,crew swap
DE0000006929,F00009603,06-11-2024 05:05,CRW,,1,crew swap
DE0000006930,F00009603,2024-06-11T05:13:00,atc,ATC7,11,ground stop
DE0000006931,F00009608,2025-06-25T04:47:00,CRW,CR02,4m,crew swap
DE0000006932,F00009612,2024-06-22T19:13:00,ATC,GT3,4,maintenance check
DE0000006933,F00009612,22-06-2024 18:40,weather,ATC7,1,gate hold
DE0000006934,F00009612,22-06-2024 19:34,MX,CR02,2,crew swap
DE0000006935,F00009621,09-05-2025 23:59,WEATHER,,2,deicing
DE0000006936,F00009621,10-05-2025 00:22,WEATHER,CR02,18,maintenance check
DE0000006937,F00009621,10-05-2025 01:16,MAINT,GT3,10,maintenance check
DE0000006938,F00009622,06-12-2024 00:40,atc,,4,maintenance check
DE0000006939,F00009622,05-12-2024 23:24,atc,GT3,3,ground stop
DE0000006940,F00009622,2024-12-06T01:28:00,atc,ATC7,8,ground stop
DE0000006941,F00009623,18-08-2024 19:10,CREW,ATC7,5,deicing
DE0000006942,F00009623,08/18/2024 18:36,WX,ATC7,4,deicing
DE0000006943,F00009623,18-08-2024 18:40,OTHER,CR02,13,maintenance check
DE0000006944,F00009628,2025-06-23T21:27:00,atc,ATC7,4,deicing
DE0000006945,F00009630,2024-12-27T00:11:00,AIRPORT,ATC7,0,deicing
DE0000006946,F00009630,26-12-2024 22:42,TRAFFIC,MX5,4,late inbound
DE0000006947,F00009630,26-12-2024 23:33,TRAFFIC,,3,late inbound
DE0000006948,F00009631,10-08-2025 19:05,MAINT,CR02,-4,late inbound
DE0000006949,F00009631,08-10-2025 20:25,other,MX5,1,ground stop
DE0000006950,F00009631,10-08-2025 19:44,WX,ATC7,7,late inbound
DE0000006951,F00009632,12-06-2024 03:10,OTHER,ATC7,41,ground stop
DE0000006952,F00009633,27-05-2025 03:13,CRW,CR02,17,ground stop
DE0000006953,F00009633,27-05-2025 03:27,maint,OPS9,7,late inbound
DE0000006954,F00009637,15-12-2025 13:42,OPS,WX01,1,late inbound
DE0000006955,F00009637,15-12-2025 14:49,AIRPORT,ATC7,1,ground stop
DE0000006956,F00009637,15-12-2025 14:45,AIRPORT,GT3,1m,late inbound
DE0000006957,F00009638,16-10-2024 22:13,crew,GT3,29,crew swap
DE0000006958,F00009638,16-10-2024 21:11,WX,,1,maintenance check
DE0000006959,F00009641,05-04-2024 16:00,crew,CR02,22,maintenance check
DE0000006960,F00009643,12-03-2024 06:37,CREW,,11,deicing
DE0000006961,F00009643,12-03-2024 05:03,TRAFFIC,OPS9,23,
DE0000006962,F00009646,02-10-2025 07:00,maint,MX5,2,crew swap
DE0000006963,F00009646,10-02-2025 07:31,WX,MX5,-1,maintenance check
DE0000006964,F00009646,10-02-2025 07:14,GATE,GT3,3,ground stop
DE0000006965,F00009652,23-04-2024 17:08,ATC,CR02,6,
DE0000006966,F00009652,23-04-2024 18:33,crew,WX01,1,
DE0000006967,F00009653,25-07-2024 03:14,GATE,WX01,1,gate hold
DE0000006968,F00009653,25-07-2024 04:11,ATC,WX01,1,gate hold
DE0000006969,F00009656,2024-06-25T14:10:00,GATE,ATC7,2,late inbound
DE0000006970,F00009656,25-06-2024 13:51,CREW,WX01,1,deicing
DE0000006971,F00009658,2024-04-19T01:34:00,other,WX01,-1,maintenance check
DE0000006972,F00009658,19-04-2024 01:26,other,WX01,1,gate hold
DE0000006973,F00009658,19-04-2024 02:57,CRW,CR02,1,deicing
DE0000006974,F00009660,07/16/2025 23:38,CRW,GT3,17,maintenance check
DE0000006975,F00009662,08/13/2025 03:32,WX,OPS9,3,
DE0000006976,F00009662,13-08-2025 03:49,ATC,CR02,5,maintenance check
DE0000006977,F00009668,12-11-2024 16:26,MAINT,,0,gate hold
DE0000006978,F00009668,12-11-2024 16:16,weather,CR02,4,late inbound
DE0000006979,F00009669,26-06-2024 20:17,atc,WX01,9,ground stop
DE0000006980,F00009670,17-03-2025 20:13,GATE,MX5,38,crew swap
DE0000006981,F00009670,17-03-2025 19:18,OTHER,CR02,14,crew swap
DE0000006982,F00009674,31-03-2024 17:28,OPS,WX01,-228,crew swap
DE0000006983,F00009675,10/13/2025 09:04,CRW,CR02,3,maintenance check
DE0000006984,F00009675,13-10-2025 11:29,OTHER,OPS9,27,crew swap
DE0000006985,F00009679,12/20/2024 16:50,airport,GT3,3,
DE0000006986,F00009679,20-12-2024 16:56,MAINT,OPS9,5,maintenance check
DE0000006987,F00009690,10-04-2024 13:27,OTHER,MX5,4,ground stop
DE0000006988,F00009690,10-04-2024 14:03,CREW,ATC7,18,ground stop
DE0000006989,F00009690,04-10-2024 15:02,other,ATC7,-3,gate hold
DE0000006990,F00009697,2024-09-15T02:39:00,OTHER,CR02,10,
DE0000006991,F00009697,15-09-2024 02:29,MX,MX5,14,gate hold
DE0000006992,F00009698,25-05-2024 06:55,other,OPS9,23,
DE0000006993,F00009700,19-07-2025 15:58,MX,WX01,1,late inbound
DE0000006994,F00009701,2025-07-11T23:41:00,OPS,ATC7,2,
DE0000006995,F00009701,11-07-2025 22:49,OPS,,1,crew swap
DE0000006996,F00009701,11-07-2025 23:58,crew,GT3,1,gate hold
DE0000006997,F00009706,08-01-2024 04:28,MX,,4,deicing
DE0000006998,F00009707,19-05-2025 23:11,OTHER,OPS9,19,crew swap
DE0000006999,F00009708,08-07-2025 03:28,WEATHER,OPS9,2,
DE0000007000,F00009708,08-07-2025 00:57,MAINT,OPS9,1,late inbound
DE0000007001,F00009717,04-03-2025 07:58,CRW,ATC7,36m,maintenance check
DE0000007002,F00009722,08/16/2024 21:47,CREW,ATC7,7,deicing
DE0000007003,F00009722,16-08-2024 21:32,MAINT,CR02,1,crew swap
DE0000007004,F00009724,2025-09-30T13:20:00,OTHER,WX01,20,
DE0000007005,F00009724,30-09-2025 15:08,other,MX5,6,ground stop
DE0000007006,F00009724,09/30/2025 14:35,atc,CR02,4m,ground stop
DE0000007007,F00009728,11-11-2025 09:29,CREW,OPS9,4,crew swap
DE0000007008,F00009728,11-11-2025 09:15,crew,OPS9,10,late inbound
DE0000007009,F00009728,11-11-2025 09:31,CRW,WX01,10,gate hold
DE0000007010,F00009729,01/30/2025 20:58,maint,OPS9,3,gate hold
DE0000007011,F00009729,30-01-2025 19:06,MX,WX01,2,deicing
DE0000007012,F00009729,30-01-2025 19:49,maint,WX01,1,gate hold
DE0000007013,F00009730,09/21/2024 00:44,MAINT,ATC7,32m,crew swap
DE0000007014,F00009737,10-04-2025 13:00,MAINT,,4,
DE0000007015,F00009737,10-04-2025 13:42,ATC,WX01,1,gate hold
DE0000007016,F00009737,04-10-2025 11:59,GATE,ATC7,1,gate hold
DE0000007017,F00009738,02-01-2024 18:53,weather,CR02,4,deicing
DE0000007018,F00009739,2025-09-11T15:07:00,atc,MX5,6,late inbound
DE0000007019,F00009739,11-09-2025 14:50,CRW,ATC7,3,
DE0000007020,F00009739,11-09-2025 15:44,OPS,WX01,3,maintenance check
DE0000007021,F00009742,24-03-2025 19:16,MX,CR02,2,gate hold
DE0000007022,F00009749,17-04-2024 01:59,other,GT3,0,crew swap
DE0000007023,F00009749,04/17/2024 01:32,MAINT,ATC7,2,gate hold
DE0000007024,F00009749,17-04-2024 02:28,ATC,MX5,1,late inbound
DE0000007025,F00009756,31-12-2024 12:48,other,,2,crew swap
DE0000007026,F00009756,12/31/2024 13:35,crew,WX01,3,late inbound
DE0000007027,F00009756,12/31/2024 14:44,MX,WX01,12,deicing
DE0000007028,F00009758,15-11-2024 07:43,weather,GT3,0,late inbound
DE0000007029,F00009758,15-11-2024 08:17,WX,WX01,1,deicing
DE0000007030,F00009758,11/15/2024 08:49,other,ATC7,7,
DE0000007031,F00009762,27-05-2024 14:47,GATE,GT3,11,
DE0000007032,F00009762,27-05-2024 17:05,MAINT,OPS9,1,deicing
DE0000007033,F00009762,05/27/2024 14:58,CRW,WX01,5,deicing
DE0000007034,F00009767,2024-06-29T09:35:00,AIRPORT,,7,
DE0000007035,F00009767,06/29/2024 10:09,GATE,,2,gate hold
DE0000007036,F00009767,29-06-2024 10:55,maint,CR02,-3,ground stop
DE0000007037,F00009770,08-12-2025 15:43,AIRPORT,MX5,2,deicing
DE0000007038,F00009770,12-08-2025 17:38,WEATHER,MX5,-1,gate hold
DE0000007039,F00009770,08-12-2025 15:35,OPS,OPS9,11,
DE0000007040,F00009772,06-04-2024 15:12,WEATHER,WX01,18,ground stop
DE0000007041,F00009773,08/25/2024 20:26,AIRPORT,,2,crew swap
DE0000007042,F00009792,27-02-2024 23:22,other,WX01,3,deicing
DE0000007043,F00009792,27-02-2024 23:43,CREW,OPS9,-5,crew swap
DE0000007044,F00009792,27-02-2024 23:16,MAINT,ATC7,2,ground stop
DE0000007045,F00009795,12-05-2025 17:55,GATE,CR02,28,crew swap
DE0000007046,F00009796,2025-07-28T18:08:00,OTHER,MX5,15m,
DE0000007047,F00009797,22-05-2024 07:10,TRAFFIC,ATC7,0,deicing
DE0000007048,F00009797,22-05-2024 07:18,maint,MX5,2,ground stop
DE0000007049,F00009798,15-12-2024 16:08,maint,GT3,39,gate hold
DE0000007050,F00009802,02/14/2025 17:04,atc,MX5,3m,ground stop
DE0000007051,F00009802,02/14/2025 17:40,weather,ATC7,2,late inbound
DE0000007052,F00009803,20-07-2024 21:16,weather,,4,late inbound
DE0000007053,F00009803,2024-07-20T21:20:00,MX,WX01,13,crew swap
DE0000007054,F00009807,03/25/2024 09:04,OPS,MX5,1,ground stop
DE0000007055,F00009807,25-03-2024 06:54,TRAFFIC,MX5,6,
DE0000007056,F00009807,25-03-2024 08:50,OTHER,GT3,5,deicing
DE0000007057,F00009809,08/24/2024 17:07,crew,OPS9,10,
DE0000007058,F00009809,08/24/2024 19:33,OPS,GT3,6,gate hold
DE0000007059,F00009812,2024-05-07T01:56:00,TRAFFIC,GT3,8,maintenance check
DE0000007060,F00009812,05-07-2024 02:00,MAINT,,4,gate hold
DE0000007061,F00009812,07-05-2024 02:24,OPS,CR02,7,gate hold
DE0000007062,F00009814,20-04-2025 23:46,GATE,ATC7,0,crew swap
DE0000007063,F00009814,21-04-2025 00:31,AIRPORT,ATC7,10,late inbound
DE0000007064,F00009815,29-06-2024 18:13,crew,WX01,2,maintenance check
DE0000007065,F00009815,29-06-2024 16:49,WX,MX5,17,gate hold
DE0000007066,F00009818,2024-07-22T06:28:00,weather,WX01,11,
DE0000007067,F00009820,12/20/2025 08:48,TRAFFIC,CR02,15,deicing
DE0000007068,F00009820,12/20/2025 07:40,OTHER,GT3,4,deicing
DE0000007069,F00009820,20-12-2025 07:54,maint,ATC7,9m,deicing
DE0000007070,F00009821,07-12-2025 03:58,other,WX01,9,crew swap
DE0000007071,F00009828,03-10-2025 16:32,weather,,4,
DE0000007072,F00009828,10-03-2025 17:25,weather,,20,crew swap
DE0000007073,F00009832,12/24/2025 14:09,WX,MX5,1,crew swap
DE0000007074,F00009832,12/24/2025 13:28,ATC,MX5,5,deicing
DE0000007075,F00009836,01/25/2026 08:29,CREW,WX01,-13,deicing
DE0000007076,F00009836,25-01-2026 09:06,WEATHER,OPS9,3,late inbound
DE0000007077,F00009836,25-01-2026 08:02,crew,MX5,14,maintenance check
DE0000007078,F00009838,01/19/2026 21:14,ATC,GT3,302,crew swap
DE0000007079,F00009839,03-03-2025 18:13,WX,,2,crew swap
DE0000007080,F00009839,03-03-2025 18:45,WEATHER,,1,gate hold
DE0000007081,F00009839,03-03-2025 17:07,WX,MX5,1,deicing
DE0000007082,F00009840,2025-07-08T16:04:00,ATC,ATC7,1,ground stop
DE0000007083,F00009840,08-07-2025 17:12,MAINT,,4,gate hold
DE0000007084,F00009840,08-07-2025 18:17,OPS,CR02,1,gate hold
DE0000007085,F00009852,24-07-2025 11:43,ATC,CR02,6,ground stop
DE0000007086,F00009852,24-07-2025 10:17,ATC,WX01,22,ground stop
DE0000007087,F00009856,01-07-2025 08:46,GATE,MX5,17,maintenance check
DE0000007088,F00009859,10-10-2025 00:48,atc,MX5,30,crew swap
DE0000007089,F00009859,10-10-2025 00:10,other,ATC7,5,late inbound
DE0000007090,F00009860,10-10-2024 08:35,GATE,WX01,4,
DE0000007091,F00009860,10-10-2024 09:42,airport,CR02,3,crew swap
DE0000007092,F00009861,20-11-2025 17:16,AIRPORT,MX5,1,maintenance check
DE0000007093,F00009861,20-11-2025 18:15,airport,ATC7,4,maintenance check
DE0000007094,F00009864,22-02-2024 02:48,CREW,,2,
DE0000007095,F00009864,21-02-2024 23:52,WEATHER,MX5,1m,gate hold
DE0000007096,F00009864,22-02-2024 02:26,weather,WX01,16,late inbound
DE0000007097,F00009866,03-04-2025 15:20,OPS,ATC7,80m,crew swap
DE0000007098,F00009867,24-11-2024 15:20,GATE,ATC7,2,maintenance check
DE0000007099,F00009867,24-11-2024 14:27,CREW,WX01,6,maintenance check
DE0000007100,F00009867,24-11-2024 14:28,CREW,CR02,1,late inbound
DE0000007101,F00009872,22-06-2025 10:27,crew,,24,crew swap
DE0000007102,F00009872,22-06-2025 08:53,OTHER,,14,
DE0000007103,F00009874,07-11-2025 09:25,weather,OPS9,6,ground stop
DE0000007104,F00009874,07-11-2025 10:18,other,MX5,6m,ground stop
DE0000007105,F00009874,07-11-2025 11:27,GATE,ATC7,4,gate hold
DE0000007106,F00009877,12-12-2025 03:00,MX,CR02,0,
DE0000007107,F00009877,12-12-2025 04:09,crew,,1,
DE0000007108,F00009879,05-09-2024 05:17,MAINT,GT3,27,late inbound
DE0000007109,F00009883,14-02-2025 12:01,maint,ATC7,0,deicing
DE0000007110,F00009883,14-02-2025 12:17,OTHER,OPS9,4,
DE0000007111,F00009883,14-02-2025 11:32,other,ATC7,-1,late inbound
DE0000007112,F00009886,07/27/2025 12:32,OPS,ATC7,1,gate hold
DE0000007113,F00009886,07/27/2025 10:04,WEATHER,ATC7,5,gate hold
DE0000007114,F00009886,2025-07-27T10:34:00,maint,MX5,4,deicing
DE0000007115,F00009888,10-07-2024 01:15,OTHER,ATC7,7,crew swap
DE0000007116,F00009888,10-07-2024 00:40,AIRPORT,,1,
DE0000007117,F00009889,16-08-2025 13:36,AIRPORT,GT3,1m,
DE0000007118,F00009889,08/16/2025 11:53,weather,ATC7,-1,maintenance check
DE0000007119,F00009889,16-08-2025 14:01,airport,GT3,1,gate hold
DE0000007120,F00009892,11-11-2025 04:14,weather,ATC7,1,ground stop
DE0000007121,F00009892,11-11-2025 03:57,other,MX5,4,deicing
DE0000007122,F00009893,21-06-2025 03:53,AIRPORT,WX01,4,deicing
DE0000007123,F00009893,06/21/2025 03:47,OPS,OPS9,16,maintenance check
DE0000007124,F00009898,05-05-2025 03:31,MAINT,MX5,4,deicing
DE0000007125,F00009898,05-05-2025 04:23,CRW,GT3,38,ground stop
DE0000007126,F00009899,30-03-2025 15:15,MX,ATC7,13,deicing
DE0000007127,F00009899,30-03-2025 16:48,other,WX01,1,maintenance check
DE0000007128,F00009899,03/30/2025 15:57,CRW,ATC7,4,late inbound
DE0000007129,F00009900,21-10-2025 06:49,CRW,MX5,16,ground stop
DE0000007130,F00009907,20-03-2024 05:09,maint,ATC7,15,maintenance check
DE0000007131,F00009907,20-03-2024 04:34,WEATHER,ATC7,1,
DE0000007132,F00009908,09-09-2024 17:43,TRAFFIC,,15,
DE0000007133,F00009908,2024-09-09T16:47:00,atc,WX01,14,ground stop
DE0000007134,F00009910,2024-02-24T20:36:00,weather,WX01,14,late inbound
DE0000007135,F00009910,24-02-2024 21:14,CREW,GT3,6,late inbound
DE0000007136,F00009913,24-09-2025 09:19,TRAFFIC,CR02,1,ground stop
DE0000007137,F00009913,24-09-2025 07:16,ATC,,7,crew swap
DE0000007138,F00009913,24-09-2025 08:36,weather,CR02,15,
DE0000007139,F00009914,2024-04-16T01:37:00,airport,MX5,0,gate hold
DE0000007140,F00009914,16-04-2024 01:54,ATC,ATC7,4,
DE0000007141,F00009914,15-04-2024 23:41,GATE,OPS9,1,deicing
DE0000007142,F00009915,03-03-2025 10:05,crew,CR02,10,maintenance check
DE0000007143,F00009915,03-03-2025 11:48,CRW,CR02,8,deicing
DE0000007144,F00009915,03-03-2025 11:39,CREW,CR02,13,ground stop
DE0000007145,F00009918,18-03-2025 19:52,weather,WX01,8,
DE0000007146,F00009918,2025-03-18T19:47:00,maint,MX5,9,
DE0000007147,F00009918,18-03-2025 17:57,CREW,CR02,9,gate hold
DE0000007148,F00009919,02-12-2024 03:42,other,GT3,1,crew swap
DE0000007149,F00009920,29-01-2026 21:12,airport,WX01,-1,late inbound
DE0000007150,F00009920,01/29/2026 21:19,CREW,MX5,1,crew swap
DE0000007151,F00009920,01/29/2026 20:51,OPS,ATC7,1,maintenance check
DE0000007152,F00009922,10/17/2024 21:37,other,GT3,3,
DE0000007153,F00009922,17-10-2024 23:41,airport,ATC7,22,ground stop
DE0000007154,F00009922,2024-10-17T22:01:00,WEATHER,GT3,5,
DE0000007155,F00009924,07/17/2024 07:00,other,MX5,21,maintenance check
DE0000007156,F00009927,2024-07-04T16:07:00,other,MX5,29m,maintenance check
DE0000007157,F00009930,05/20/2025 05:50,OTHER,ATC7,13,
DE0000007158,F00009930,20-05-2025 06:13,MX,CR02,1,crew swap
DE0000007159,F00009930,20-05-2025 04:23,other,ATC7,50,ground stop
DE0000007160,F00009935,12-06-2024 10:59,maint,WX01,4,deicing
DE0000007161,F00009935,12-06-2024 08:50,maint,MX5,1,maintenance check
DE0000007162,F00009937,09-01-2025 12:59,CREW,CR02,1,maintenance check
DE0000007163,F00009937,09-01-2025 15:12,airport,OPS9,6,gate hold
DE0000007164,F00009941,21-01-2026 10:44,airport,CR02,0,crew swap
DE0000007165,F00009941,21-01-2026 10:06,CREW,MX5,1,late inbound
DE0000007166,F00009949,09/26/2025 09:11,MX,GT3,4,maintenance check
DE0000007167,F00009949,26-09-2025 08:07,TRAFFIC,,25,crew swap
DE0000007168,F00009949,26-09-2025 08:39,MAINT,,1m,crew swap
DE0000007169,F00009959,2025-12-06T12:12:00,OTHER,WX01,28,
DE0000007170,F00009960,07/20/2025 12:48,AIRPORT,MX5,26m,late inbound
DE0000007171,F00009962,23-07-2025 07:48,maint,,42,crew swap
DE0000007172,F00009962,07/23/2025 07:57,airport,CR02,-7,
DE0000007173,F00009964,22-08-2025 14:27,AIRPORT,MX5,1,gate hold
DE0000007174,F00009964,08/22/2025 12:09,CREW,OPS9,1,crew swap
DE0000007175,F00009970,03/13/2025 22:04,airport,OPS9,-3,late inbound
DE0000007176,F00009970,13-03-2025 21:22,MX,WX01,11,late inbound
DE0000007177,F00009972,26-01-2026 21:42,atc,WX01,16,
DE0000007178,F00009973,11-10-2024 13:52,airport,GT3,8,deicing
DE0000007179,F00009973,2024-10-11T14:20:00,weather,,9,gate hold
DE0000007180,F00009973,2024-10-11T14:01:00,GATE,,11,ground stop
DE0000007181,F00009977,01-06-2024 18:45,CREW,OPS9,1,maintenance check
DE0000007182,F00009977,06-01-2024 17:26,TRAFFIC,,7,maintenance check
DE0000007183,F00009977,06-01-2024 19:03,CREW,,11,late inbound
DE0000007184,F00009981,05/28/2024 17:38,other,,92,ground stop
DE0000007185,F00009981,28-05-2024 19:29,OPS,,126,maintenance check
DE0000007186,F00009981,05/28/2024 20:28,MAINT,GT3,24,deicing
DE0000007187,F00009986,28-02-2025 09:40,MAINT,MX5,4,crew swap
DE0000007188,F00009986,28-02-2025 08:28,CRW,OPS9,3,
DE0000007189,F00009988,2025-09-08T06:47:00,MAINT,CR02,21,
DE0000007190,F00009988,08-09-2025 07:58,WEATHER,,20,ground stop
DE0000007191,F00009991,17-01-2025 16:56,airport,WX01,12,
DE0000007192,F00009991,17-01-2025 17:04,OPS,WX01,9,
DE0000007193,F00009993,06-09-2024 13:45,other,CR02,21,maintenance check
DE0000007194,F00009995,16-10-2025 22:27,airport,WX01,12,late inbound
DE0000007195,F00009995,16-10-2025 20:48,crew,ATC7,10,maintenance check
DE0000007196,F00009998,09-01-2024 03:44,AIRPORT,CR02,1,deicing
DE0000007197,F00009998,01-09-2024 04:16,CREW,OPS9,6,ground stop
DE0000007198,F00009999,2024-03-29T02:20:00,atc,MX5,6,maintenance check
DE0000007199,F00009999,29-03-2024 02:00,CRW,MX5,2,deicing
DE0000007200,F00010002,09-10-2024 00:20,CRW,WX01,-11,
DE0000007201,F00010002,09-10-2024 00:22,crew,MX5,21,ground stop
DE0000007202,F00010002,10-09-2024 01:17,WEATHER,CR02,2,crew swap
DE0000007203,F00010003,18-08-2024 04:06,WX,GT3,7,
DE0000007204,F00010003,18-08-2024 02:45,maint,WX01,27,crew swap
DE0000007205,F00010007,08-01-2025 03:54,crew,WX01,3,crew swap
DE0000007206,F00010007,08-01-2025 03:53,weather,ATC7,5,late inbound
DE0000007207,F00010007,08-01-2025 03:14,GATE,,2,maintenance check
DE0000007208,F00010008,2024-09-19T11:14:00,OTHER,WX01,2,maintenance check
DE0000007209,F00010008,19-09-2024 12:06,GATE,CR02,4,crew swap
DE0000007210,F00010008,19-09-2024 12:01,atc,OPS9,2m,crew swap
DE0000007211,F00010009,16-10-2024 18:43,weather,GT3,-23,deicing
DE0000007212,F00010009,16-10-2024 20:34,WX,MX5,11,ground stop
DE0000007213,F00010009,16-10-2024 19:47,MX,CR02,2,crew swap
DE0000007214,F00010012,02-03-2025 01:47,CRW,WX01,1,crew swap
DE0000007215,F00010014,14-03-2025 11:30,maint,,13,ground stop
DE0000007216,F00010017,25-12-2024 09:15,AIRPORT,,15,deicing
DE0000007217,F00010017,25-12-2024 06:56,airport,MX5,19,late inbound
DE0000007218,F00010017,25-12-2024 08:09,weather,OPS9,4,deicing
DE0000007219,F00010019,2024-04-09T08:13:00,CREW,ATC7,4,gate hold
DE0000007220,F00010021,17-06-2024 01:40,OPS,MX5,7m,maintenance check
DE0000007221,F00010022,20-06-2024 20:50,maint,WX01,3,deicing
DE0000007222,F00010022,20-06-2024 19:08,TRAFFIC,ATC7,8,ground stop
DE0000007223,F00010024,29-10-2024 09:42,CREW,OPS9,4,ground stop
DE0000007224,F00010024,29-10-2024 11:55,OTHER,WX01,58,deicing
DE0000007225,F00010025,24-01-2026 07:52,maint,ATC7,4,
DE0000007226,F00010025,24-01-2026 06:04,WX,GT3,8,late inbound
DE0000007227,F00010025,24-01-2026 08:09,maint,ATC7,2,late inbound
DE0000007228,F00010029,13-08-2025 15:39,TRAFFIC,CR02,8m,crew swap
DE0000007229,F00010029,13-08-2025 16:47,WEATHER,MX5,1m,maintenance check
DE0000007230,F00010029,13-08-2025 16:01,airport,CR02,17,late inbound
DE0000007231,F00010030,15-11-2025 12:54,OTHER,GT3,24,
DE0000007232,F00010032,08/30/2025 04:05,MX,WX01,3,late inbound
DE0000007233,F00010034,08/21/2025 09:15,CREW,ATC7,1,crew swap
DE0000007234,F00010034,21-08-2025 07:48,TRAFFIC,OPS9,2,deicing
DE0000007235,F00010034,08/21/2025 06:48,GATE,MX5,6,late inbound
DE0000007236,F00010035,08-09-2025 22:34,ATC,ATC7,-39,late inbound
DE0000007237,F00010035,08-09-2025 22:29,OTHER,CR02,132,maintenance check
DE0000007238,F00010035,09-08-2025 22:21,other,ATC7,25,crew swap
DE0000007239,F00010042,06-04-2025 18:35,airport,MX5,4,late inbound
DE0000007240,F00010042,04-06-2025 19:05,maint,GT3,8,gate hold
DE0000007241,F00010042,06-04-2025 20:23,TRAFFIC,ATC7,3,
DE0000007242,F00010045,13-11-2024 17:54,GATE,OPS9,6,gate hold
DE0000007243,F00010045,13-11-2024 16:45,crew,ATC7,5,ground stop
DE0000007244,F00010049,11-03-2025 08:07,WEATHER,OPS9,1m,crew swap
DE0000007245,F00010049,11-03-2025 10:03,crew,GT3,26,late inbound
DE0000007246,F00010049,03-11-2025 08:46,airport,WX01,12,deicing
DE0000007247,F00010052,22-02-2025 14:57,maint,ATC7,0,maintenance check
DE0000007248,F00010052,02/22/2025 15:03,other,GT3,15,ground stop
DE0000007249,F00010052,22-02-2025 15:14,AIRPORT,GT3,2,gate hold
DE0000007250,F00010054,12-11-2025 15:53,other,WX01,1,gate hold
DE0000007251,F00010061,25-03-2024 09:28,maint,,-1,gate hold
DE0000007252,F00010061,25-03-2024 09:50,airport,MX5,1,deicing
DE0000007253,F00010061,03/25/2024 09:30,MAINT,MX5,1,maintenance check
DE0000007254,F00010068,01/26/2026 16:22,CREW,CR02,46,maintenance check
DE0000007255,F00010068,26-01-2026 15:27,OPS,WX01,4,maintenance check
DE0000007256,F00010072,20-05-2024 08:47,atc,GT3,1,late inbound
DE0000007257,F00010072,20-05-2024 09:06,CREW,WX01,1,deicing
DE0000007258,F00010072,05/20/2024 06:49,WX,OPS9,9m,late inbound
DE0000007259,F00010073,01-04-2025 17:41,WX,CR02,20,late inbound
DE0000007260,F00010073,01-04-2025 17:22,GATE,OPS9,1,late inbound
DE0000007261,F00010073,01-04-2025 17:29,TRAFFIC,,4,maintenance check
DE0000007262,F00010074,21-03-2024 12:07,CREW,WX01,1,deicing
DE0000007263,F00010074,21-03-2024 10:41,maint,GT3,12,maintenance check
DE0000007264,F00010074,21-03-2024 12:42,MAINT,OPS9,13,deicing
DE0000007265,F00010075,21-06-2025 23:06,OPS,ATC7,42,ground stop
DE0000007266,F00010077,08-06-2024 09:17,OPS,CR02,8,maintenance check
DE0000007267,F00010078,30-10-2025 06:53,TRAFFIC,OPS9,43,crew swap
DE0000007268,F00010078,30-10-2025 06:49,GATE,MX5,4,maintenance check
DE0000007269,F00010082,27-01-2026 08:05,OPS,GT3,6,
DE0000007270,F00010082,27-01-2026 08:22,maint,OPS9,26,gate hold
DE0000007271,F00010082,27-01-2026 08:58,CREW,,11,late inbound
DE0000007272,F00010084,01-04-2025 17:51,WX,WX01,1,gate hold
DE0000007273,F00010084,2025-04-01T15:48:00,atc,WX01,20,ground stop
DE0000007274,F00010088,02/21/2024 18:53,AIRPORT,MX5,15,ground stop
DE0000007275,F00010088,2024-02-21T19:31:00,CRW,OPS9,16,ground stop
DE0000007276,F00010088,02/21/2024 17:59,atc,GT3,2,crew swap
DE0000007277,F00010090,16-08-2024 19:55,other,GT3,16,crew swap
DE0000007278,F00010092,03-02-2024 04:51,crew,GT3,2,ground stop
DE0000007279,F00010092,03-02-2024 04:48,AIRPORT,,2,crew swap
DE0000007280,F00010092,03-02-2024 04:21,other,MX5,22,deicing
DE0000007281,F00010096,07-02-2024 07:42,CREW,GT3,13m,ground stop
DE0000007282,F00010101,25-12-2024 19:46,airport,,24,maintenance check
DE0000007283,F00010104,12/19/2025 11:55,atc,MX5,32,gate hold
DE0000007284,F00010104,2025-12-19T12:04:00,crew,GT3,4,late inbound
DE0000007285,F00010111,08/26/2024 07:36,crew,OPS9,35,deicing
DE0000007286,F00010111,26-08-2024 08:50,OPS,CR02,11,crew swap
DE0000007287,F00010114,16-12-2025 18:51,GATE,ATC7,2,deicing
DE0000007288,F00010114,2025-12-16T19:52:00,MX,GT3,25,gate hold
DE0000007289,F00010114,16-12-2025 17:54,TRAFFIC,,3,late inbound
DE0000007290,F00010116,03/27/2024 01:03,WX,GT3,1,
DE0000007291,F00010116,27-03-2024 01:39,TRAFFIC,ATC7,2,late inbound
DE0000007292,F00010117,01/22/2026 05:16,MX,OPS9,4,crew swap
DE0000007293,F00010120,23-01-2026 17:59,MX,GT3,20,late inbound
DE0000007294,F00010122,03/13/2024 23:36,MX,CR02,1,deicing
DE0000007295,F00010122,03/13/2024 23:45,AIRPORT,MX5,5,crew swap
DE0000007296,F00010122,2024-03-14T00:21:00,WX,WX01,5,gate hold
DE0000007297,F00010123,29-08-2024 07:27,atc,CR02,-1,late inbound
DE0000007298,F00010123,08/29/2024 07:56,AIRPORT,MX5,1,gate hold
DE0000007299,F00010123,2024-08-29T06:44:00,OPS,WX01,1,gate hold
DE0000007300,F00010124,11-04-2024 01:21,atc,ATC7,5,late inbound
DE0000007301,F00010124,11-04-2024 01:06,OPS,MX5,-1,deicing
DE0000007302,F00010126,29-04-2025 22:57,weather,CR02,25,late inbound
DE0000007303,F00010128,29-08-2024 22:19,CRW,GT3,19,
DE0000007304,F00010129,06/24/2025 18:36,CRW,CR02,0,gate hold
DE0000007305,F00010129,24-06-2025 19:34,atc,WX01,2,crew swap
DE0000007306,F00010130,08-04-2025 23:18,OTHER,MX5,-2,maintenance check
DE0000007307,F00010130,2025-04-08T21:44:00,CREW,CR02,8,maintenance check
DE0000007308,F00010130,04-08-2025 21:55,crew,OPS9,5m,gate hold
DE0000007309,F00010132,13-06-2025 22:56,WEATHER,,18,late inbound
DE0000007310,F00010132,06/13/2025 20:55,OTHER,MX5,2,crew swap
DE0000007311,F00010137,07/14/2025 19:34,OTHER,GT3,6,maintenance check
DE0000007312,F00010137,14-07-2025 21:21,airport,OPS9,-11,maintenance check
DE0000007313,F00010137,14-07-2025 19:27,GATE,WX01,7,maintenance check
DE0000007314,F00010145,05-09-2024 19:05,OPS,CR02,12,gate hold
DE0000007315,F00010149,09-05-2024 19:04,MX,CR02,6,late inbound
DE0000007316,F00010152,27-11-2024 08:34,maint,CR02,-6,deicing
DE0000007317,F00010156,29-11-2025 18:54,WEATHER,MX5,3,late inbound
DE0000007318,F00010156,29-11-2025 20:23,atc,MX5,20,crew swap
DE0000007319,F00010156,29-11-2025 20:40,ATC,WX01,9,crew swap
DE0000007320,F00010158,04-08-2025 15:03,weather,,41m,
DE0000007321,F00010160,2024-11-28T23:12:00,airport,CR02,7,ground stop
DE0000007322,F00010160,29-11-2024 00:23,maint,MX5,-1,deicing
DE0000007323,F00010160,28-11-2024 23:26,TRAFFIC,,1,crew swap
DE0000007324,F00010165,06-02-2025 20:26,other,ATC7,9,
DE0000007325,F00010165,06-02-2025 18:19,AIRPORT,WX01,4m,crew swap
DE0000007326,F00010165,06-02-2025 20:17,ATC,CR02,1,
DE0000007327,F00010166,02/16/2024 16:29,atc,OPS9,25,
DE0000007328,F00010166,16-02-2024 18:26,weather,WX01,1,maintenance check
DE0000007329,F00010170,31-05-2025 22:58,atc,WX01,3,ground stop
DE0000007330,F00010170,31-05-2025 21:08,OPS,,9,late inbound
DE0000007331,F00010170,31-05-2025 23:09,MX,ATC7,15,deicing
DE0000007332,F00010173,2025-12-21T13:00:00,ATC,WX01,2,ground stop
DE0000007333,F00010173,21-12-2025 14:47,CRW,OPS9,6,
DE0000007334,F00010173,21-12-2025 14:09,weather,CR02,1,ground stop
DE0000007335,F00010175,04-08-2025 22:59,MAINT,WX01,35,late inbound
DE0000007336,F00010176,28-11-2024 23:14,GATE,MX5,3,crew swap
DE0000007337,F00010176,28-11-2024 21:05,atc,ATC7,2,ground stop
DE0000007338,F00010176,28-11-2024 21:30,OTHER,OPS9,2,crew swap
DE0000007339,F00010191,15-11-2024 09:09,WEATHER,WX01,1,maintenance check
DE0000007340,F00010191,15-11-2024 08:37,AIRPORT,GT3,1,deicing
DE0000007341,F00010191,11/15/2024 09:37,crew,MX5,17,ground stop
DE0000007342,F00010192,10-03-2025 00:16,other,WX01,1,crew swap
DE0000007343,F00010195,07/19/2024 04:52,ATC,,2,crew swap
DE0000007344,F00010195,19-07-2024 03:14,CREW,MX5,6,crew swap
DE0000007345,F00010199,24-10-2024 18:31,CREW,GT3,3,deicing
DE0000007346,F00010199,10/24/2024 18:52,other,ATC7,1,crew swap
DE0000007347,F00010199,24-10-2024 19:32,MAINT,WX01,3,gate hold
DE0000007348,F00010200,07/29/2025 11:21,ATC,ATC7,51,maintenance check
DE0000007349,F00010204,07-12-2024 21:19,AIRPORT,ATC7,17,crew swap
DE0000007350,F00010204,2024-07-12T21:03:00,atc,ATC7,6,late inbound
DE0000007351,F00010208,24-10-2025 01:06,CREW,GT3,28,late inbound
DE0000007352,F00010208,24-10-2025 01:43,other,WX01,14,
DE0000007353,F00010214,10-09-2025 13:03,OTHER,CR02,3,ground stop
DE0000007354,F00010214,09-10-2025 13:42,atc,MX5,7m,late inbound
DE0000007355,F00010214,09-10-2025 14:52,TRAFFIC,MX5,26,ground stop
DE0000007356,F00010215,25-04-2024 14:37,GATE,WX01,11,late inbound
DE0000007357,F00010215,25-04-2024 15:01,ATC,CR02,1,ground stop
DE0000007358,F00010215,25-04-2024 16:09,OTHER,WX01,33,maintenance check
DE0000007359,F00010216,13-09-2024 13:08,weather,ATC7,13,maintenance check
DE0000007360,F00010216,13-09-2024 12:26,WX,GT3,10,deicing
DE0000007361,F00010217,06-09-2024 19:51,other,CR02,30,ground stop
DE0000007362,F00010219,09-06-2025 16:19,AIRPORT,CR02,3,ground stop
DE0000007363,F00010219,06-09-2025 14:35,weather,MX5,2,gate hold
DE0000007364,F00010219,09-06-2025 15:34,crew,WX01,1,late inbound
DE0000007365,F00010222,10-12-2025 02:12,crew,OPS9,1,crew swap
DE0000007366,F00010230,01-09-2025 12:01,ATC,WX01,15,
DE0000007367,F00010230,09-01-2025 09:43,OPS,CR02,5m,gate hold
DE0000007368,F00010230,01-09-2025 10:55,OTHER,WX01,15m,
DE0000007369,F00010234,05/14/2024 10:38,airport,WX01,15,gate hold
DE0000007370,F00010236,20-02-2025 18:26,crew,GT3,5,ground stop
DE0000007371,F00010236,20-02-2025 17:42,WEATHER,WX01,4,late inbound
DE0000007372,F00010236,2025-02-20T15:44:00,WEATHER,WX01,5,crew swap
DE0000007373,F00010238,2024-09-23T12:54:00,CRW,ATC7,23,
DE0000007374,F00010238,23-09-2024 10:28,OTHER,WX01,7,gate hold
DE0000007375,F00010241,10-05-2024 04:08,maint,ATC7,3,deicing
DE0000007376,F00010243,11-09-2025 01:59,airport,ATC7,-3,ground stop
DE0000007377,F00010243,09-11-2025 00:47,ATC,ATC7,13,ground stop
DE0000007378,F00010243,2025-09-10T23:35:00,CREW,CR02,6,late inbound
DE0000007379,F00010246,24-05-2024 16:43,atc,,4,
DE0000007380,F00010246,24-05-2024 15:55,WEATHER,ATC7,7,deicing
DE0000007381,F00010247,23-10-2025 05:45,airport,WX01,30,crew swap
DE0000007382,F00010251,22-05-2024 11:40,CREW,ATC7,4,gate hold
DE0000007383,F00010251,05/22/2024 10:36,GATE,ATC7,13,deicing
DE0000007384,F00010251,05/22/2024 13:15,WEATHER,ATC7,1m,crew swap
DE0000007385,F00010253,02/21/2025 05:25,AIRPORT,MX5,-1,deicing
DE0000007386,F00010253,21-02-2025 05:55,WEATHER,WX01,1,maintenance check
DE0000007387,F00010253,21-02-2025 05:45,AIRPORT,OPS9,1,gate hold
DE0000007388,F00010254,12/23/2024 11:03,airport,GT3,3m,crew swap
DE0000007389,F00010254,12/23/2024 12:11,atc,CR02,3,
DE0000007390,F00010257,21-04-2024 22:37,other,ATC7,16,maintenance check
DE0000007391,F00010257,21-04-2024 22:56,airport,CR02,6,
DE0000007392,F00010260,31-07-2024 13:57,CRW,CR02,16,gate hold
DE0000007393,F00010262,16-08-2024 15:45,GATE,GT3,8,ground stop
DE0000007394,F00010262,16-08-2024 16:42,GATE,OPS9,-1,ground stop
DE0000007395,F00010265,28-05-2024 00:40,ATC,ATC7,21,deicing
DE0000007396,F00010266,19-04-2025 05:20,ATC,WX01,30,deicing
DE0000007397,F00010266,19-04-2025 06:09,OPS,MX5,13,late inbound
DE0000007398,F00010272,04-06-2025 10:34,WX,,1,
DE0000007399,F00010272,04-06-2025 10:26,WX,MX5,9,maintenance check
DE0000007400,F00010272,06-04-2025 10:24,WX,CR02,6,late inbound
DE0000007401,F00010273,29-03-2024 19:42,GATE,WX01,7,
DE0000007402,F00010273,29-03-2024 17:56,other,ATC7,15,deicing
DE0000007403,F00010273,29-03-2024 18:38,other,MX5,-2,ground stop
DE0000007404,F00010275,11-01-2024 12:08,WX,CR02,12,gate hold
DE0000007405,F00010275,01-11-2024 10:17,OPS,WX01,4,crew swap
DE0000007406,F00010277,19-11-2025 19:39,CREW,ATC7,33,
DE0000007407,F00010279,2024-07-08T16:22:00,CRW,GT3,33,
DE0000007408,F00010279,07-08-2024 14:56,OTHER,GT3,2,late inbound
DE0000007409,F00010279,08-07-2024 15:03,CREW,WX01,8m,late inbound
DE0000007410,F00010283,01/23/2026 16:35,GATE,,3,deicing
DE0000007411,F00010283,23-01-2026 18:29,OPS,WX01,10,late inbound
DE0000007412,F00010284,09-07-2024 04:59,MX,OPS9,1,late inbound
DE0000007413,F00010284,09-07-2024 06:31,ATC,GT3,7,gate hold
DE0000007414,F00010286,27-06-2024 00:17,other,GT3,1,ground stop
DE0000007415,F00010286,26-06-2024 22:55,CREW,,7,maintenance check
DE0000007416,F00010286,26-06-2024 23:30,other,,2,ground stop
DE0000007417,F00010287,29-05-2025 21:50,MAINT,ATC7,18,gate hold
DE0000007418,F00010287,29-05-2025 21:59,crew,WX01,32,deicing
DE0000007419,F00010291,03-06-2024 17:15,OPS,GT3,144,late inbound
DE0000007420,F00010291,03-06-2024 19:43,CRW,WX01,34,late inbound
DE0000007421,F00010291,03-06-2024 18:30,CREW,MX5,38,crew swap
DE0000007422,F00010295,09-02-2025 00:44,maint,ATC7,13,gate hold
DE0000007423,F00010300,29-11-2025 01:20,crew,ATC7,0,late inbound
DE0000007424,F00010300,11/29/2025 02:47,CRW,CR02,1,late inbound
DE0000007425,F00010300,29-11-2025 00:28,CRW,ATC7,3,
DE0000007426,F00010301,10-08-2025 18:01,ATC,WX01,0,ground stop
DE0000007427,F00010301,08-10-2025 18:59,crew,GT3,4,gate hold
DE0000007428,F00010314,04-08-2024 10:56,maint,ATC7,6m,gate hold
DE0000007429,F00010314,04-08-2024 10:51,TRAFFIC,,20,crew swap
DE0000007430,F00010320,19-12-2025 15:38,CREW,CR02,2,late inbound
DE0000007431,F00010320,12/19/2025 14:20,airport,,27,crew swap
DE0000007432,F00010325,14-04-2024 03:07,other,GT3,1,
DE0000007433,F00010325,14-04-2024 04:36,MAINT,ATC7,2,crew swap
DE0000007434,F00010325,14-04-2024 04:42,CRW,OPS9,2,
DE0000007435,F00010327,27-01-2026 20:41,CREW,MX5,13,maintenance check
DE0000007436,F00010327,27-01-2026 20:40,other,WX01,3,late inbound
DE0000007437,F00010327,27-01-2026 21:58,WEATHER,WX01,8,late inbound
DE0000007438,F00010330,26-11-2024 19:10,other,WX01,2,ground stop
DE0000007439,F00010330,26-11-2024 19:56,atc,ATC7,17,gate hold
DE0000007440,F00010330,26-11-2024 19:58,maint,ATC7,11,deicing
DE0000007441,F00010332,04/23/2025 11:31,MX,GT3,3,crew swap
DE0000007442,F00010332,23-04-2025 13:13,CRW,,6,crew swap
DE0000007443,F00010346,24-01-2025 11:15,MAINT,WX01,18m,
DE0000007444,F00010355,02-04-2025 13:17,GATE,WX01,4,ground stop
DE0000007445,F00010355,04-02-2025 14:44,WEATHER,MX5,20,ground stop
DE0000007446,F00010365,15-08-2025 01:41,CREW,,3,deicing
DE0000007447,F00010370,05-09-2025 13:20,airport,MX5,-1,deicing
DE0000007448,F00010370,05-09-2025 13:39,other,OPS9,1m,late inbound
DE0000007449,F00010370,05-09-2025 15:17,WEATHER,ATC7,1,late inbound
DE0000007450,F00010373,05/14/2024 11:22,TRAFFIC,,43,late inbound
DE0000007451,F00010373,14-05-2024 09:58,MAINT,CR02,38,deicing
DE0000007452,F00010374,13-12-2025 17:31,TRAFFIC,MX5,1,deicing
DE0000007453,F00010374,13-12-2025 15:44,TRAFFIC,WX01,1,
DE0000007454,F00010374,12/13/2025 15:17,weather,WX01,10,maintenance check
DE0000007455,F00010378,13-02-2024 04:39,maint,MX5,2,late inbound
DE0000007456,F00010378,02/13/2024 06:16,crew,GT3,3,maintenance check
DE0000007457,F00010378,02/13/2024 06:36,CREW,WX01,2,deicing
DE0000007458,F00010380,18-08-2024 12:23,atc,MX5,11,
DE0000007459,F00010380,18-08-2024 14:59,other,WX01,2,crew swap
DE0000007460,F00010381,10/19/2024 16:10,MAINT,ATC7,28,crew swap
DE0000007461,F00010381,19-10-2024 17:00,AIRPORT,GT3,1,maintenance check
DE0000007462,F00010385,25-11-2025 05:45,crew,ATC7,34,ground stop
DE0000007463,F00010386,2025-01-29T06:41:00,WEATHER,GT3,34,
DE0000007464,F00010386,29-01-2025 07:09,GATE,OPS9,4,ground stop
DE0000007465,F00010387,18-02-2024 19:10,OPS,GT3,4,maintenance check
DE0000007466,F00010390,25-03-2025 00:08,atc,OPS9,8,late inbound
DE0000007467,F00010391,20-10-2024 08:39,MAINT,ATC7,1,ground stop
DE0000007468,F00010391,20-10-2024 09:58,GATE,GT3,5,gate hold
DE0000007469,F00010393,04-03-2024 20:51,TRAFFIC,CR02,3,maintenance check
DE0000007470,F00010393,04-03-2024 22:01,WX,MX5,7,
DE0000007471,F00010393,04-03-2024 21:28,maint,WX01,6,gate hold
DE0000007472,F00010396,19-05-2024 05:32,airport,MX5,-1,gate hold
DE0000007473,F00010396,2024-05-19T07:18:00,other,OPS9,1,crew swap
DE0000007474,F00010396,05/19/2024 07:53,CREW,ATC7,6,deicing
DE0000007475,F00010400,25-07-2024 14:12,ATC,ATC7,-20,deicing
DE0000007476,F00010400,25-07-2024 15:23,WEATHER,,10,gate hold
DE0000007477,F00010407,02-06-2025 15:18,TRAFFIC,WX01,4,ground stop
DE0000007478,F00010407,02-06-2025 14:31,TRAFFIC,MX5,-9,
DE0000007479,F00010408,21-09-2024 06:21,atc,MX5,7,maintenance check
DE0000007480,F00010408,09/21/2024 05:11,crew,MX5,2,maintenance check
DE0000007481,F00010409,10/26/2024 04:36,WEATHER,ATC7,0,crew swap
DE0000007482,F00010409,26-10-2024 05:30,other,GT3,10,crew swap
DE0000007483,F00010412,25-01-2026 08:33,MAINT,WX01,21,
DE0000007484,F00010412,2026-01-25T07:21:00,airport,ATC7,32,maintenance check
DE0000007485,F00010413,07-04-2025 13:33,AIRPORT,OPS9,8,
DE0000007486,F00010413,04-07-2025 14:05,ATC,ATC7,8,late inbound
DE0000007487,F00010413,2025-07-04T12:45:00,TRAFFIC,,3,crew swap
DE0000007488,F00010414,2025-06-05T02:53:00,OTHER,GT3,-2,
DE0000007489,F00010414,2025-06-05T01:30:00,crew,OPS9,12,
DE0000007490,F00010414,06-05-2025 01:48,WX,CR02,16,late inbound
DE0000007491,F00010416,28-11-2024 16:43,MX,WX01,45,ground stop
DE0000007492,F00010420,24-06-2024 21:44,crew,ATC7,12,maintenance check
DE0000007493,F00010420,25-06-2024 00:24,maint,OPS9,18,ground stop
DE0000007494,F00010420,2024-06-24T22:28:00,atc,MX5,9,ground stop
DE0000007495,F00010424,05/23/2024 14:17,crew,WX01,2m,ground stop
DE0000007496,F00010424,23-05-2024 13:39,MX,MX5,1,maintenance check
DE0000007497,F00010424,23-05-2024 13:06,CRW,,1,maintenance check
DE0000007498,F00010425,18-10-2024 03:42,WX,WX01,8,gate hold
DE0000007499,F00010425,18-10-2024 02:02,MX,MX5,14m,late inbound
DE0000007500,F00010425,2024-10-18T03:01:00,CRW,MX5,4,crew swap
DE0000007501,F00010426,21-08-2025 12:36,weather,ATC7,8,crew swap
DE0000007502,F00010426,21-08-2025 13:04,GATE,ATC7,16,
DE0000007503,F00010428,30-06-2025 20:37,CREW,,4,
DE0000007504,F00010428,06/30/2025 22:59,atc,MX5,17,crew swap
DE0000007505,F00010429,07-05-2024 02:32,WEATHER,ATC7,47m,maintenance check
DE0000007506,F00010431,02-08-2024 22:00,WX,,18,gate hold
DE0000007507,F00010431,2024-08-02T22:19:00,CREW,OPS9,-26,ground stop
DE0000007508,F00010432,29-11-2025 20:13,GATE,MX5,1,crew swap
DE0000007509,F00010432,2025-11-29T19:52:00,GATE,GT3,-1,deicing
DE0000007510,F00010432,2025-11-29T20:17:00,MX,GT3,1,gate hold
DE0000007511,F00010433,28-10-2025 23:12,atc,ATC7,4m,gate hold
DE0000007512,F00010433,29-10-2025 00:07,AIRPORT,CR02,11,ground stop
DE0000007513,F00010435,13-08-2024 17:17,TRAFFIC,MX5,21,late inbound
DE0000007514,F00010441,10-02-2025 22:33,AIRPORT,WX01,-5,crew swap
DE0000007515,F00010445,01/16/2025 15:07,OPS,ATC7,8,maintenance check
DE0000007516,F00010445,2025-01-16T13:50:00,CRW,ATC7,3,ground stop
DE0000007517,F00010445,01/16/2025 13:45,airport,WX01,4m,maintenance check
DE0000007518,F00010447,05-06-2025 14:19,AIRPORT,,11,ground stop
DE0000007519,F00010447,05-06-2025 14:10,CREW,GT3,8,gate hold
DE0000007520,F00010450,21-12-2024 22:33,ATC,,92,ground stop
DE0000007521,F00010450,2024-12-21T23:00:00,MAINT,MX5,55m,gate hold
DE0000007522,F00010459,11-06-2024 02:12,MAINT,MX5,0,
DE0000007523,F00010459,06-11-2024 03:31,weather,ATC7,6,late inbound
DE0000007524,F00010459,11-06-2024 03:43,weather,,13,late inbound
DE0000007525,F00010464,06-09-2025 01:36,MAINT,,1,
DE0000007526,F00010464,06-09-2025 01:01,airport,WX01,16,ground stop
DE0000007527,F00010466,02/19/2024 18:03,TRAFFIC,GT3,25,late inbound
DE0000007528,F00010466,02/19/2024 17:22,airport,WX01,8m,
DE0000007529,F00010466,19-02-2024 17:53,atc,WX01,3,ground stop
DE0000007530,F00010468,14-05-2025 14:36,MX,,1,crew swap
DE0000007531,F00010472,08-12-2025 18:24,MAINT,GT3,3,late inbound
DE0000007532,F00010472,2025-12-08T18:52:00,OTHER,ATC7,1,ground stop
DE0000007533,F00010472,08-12-2025 17:52,airport,,3,crew swap
DE0000007534,F00010475,13-07-2024 07:49,weather,OPS9,5,maintenance check
DE0000007535,F00010476,25-12-2024 15:10,airport,OPS9,11,maintenance check
DE0000007536,F00010476,25-12-2024 12:46,CREW,MX5,7,maintenance check
DE0000007537,F00010477,27-05-2025 04:36,ATC,,15,deicing
DE0000007538,F00010479,04-12-2024 04:59,MAINT,WX01,55,
DE0000007539,F00010481,12-08-2025 09:22,crew,ATC7,11,ground stop
DE0000007540,F00010481,12-08-2025 07:16,CRW,OPS9,7,crew swap
DE0000007541,F00010482,09-03-2025 04:30,atc,CR02,-5,crew swap
DE0000007542,F00010482,03-09-2025 01:59,TRAFFIC,CR02,1,
DE0000007543,F00010484,2024-03-02T10:04:00,other,,18,late inbound
DE0000007544,F00010484,02-03-2024 12:24,WX,,1,gate hold
DE0000007545,F00010484,03-02-2024 10:44,MX,GT3,5,
DE0000007546,F00010485,01-04-2026 17:06,atc,GT3,38,late inbound
DE0000007547,F00010485,04-01-2026 15:17,other,MX5,138,crew swap
DE0000007548,F00010485,2026-01-04T14:35:00,MX,ATC7,-64,late inbound
DE0000007549,F00010495,11/29/2025 09:31,WEATHER,CR02,18m,gate hold
DE0000007550,F00010496,2024-05-25T14:08:00,OTHER,ATC7,19,crew swap
DE0000007551,F00010496,25-05-2024 14:25,WX,MX5,1,maintenance check
DE0000007552,F00010496,05/25/2024 13:06,weather,CR02,10,deicing
DE0000007553,F00010497,14-09-2024 01:11,maint,WX01,5,gate hold
DE0000007554,F00010499,05-12-2024 00:18,GATE,MX5,1,
DE0000007555,F00010499,04-12-2024 22:27,OPS,,4,ground stop
DE0000007556,F00010499,05-12-2024 00:52,WX,,1,gate hold
DE0000007557,F00010500,10-07-2025 04:53,MX,WX01,13,deicing
DE0000007558,F00010500,07-10-2025 05:04,WX,OPS9,7,ground stop
DE0000007559,F00010500,10-07-2025 03:18,TRAFFIC,CR02,10,maintenance check
DE0000007560,F00010505,09-10-2025 15:46,TRAFFIC,CR02,20,maintenance check
DE0000007561,F00010507,18-01-2025 13:05,MX,MX5,-1,crew swap
DE0000007562,F00010507,01/18/2025 10:55,ATC,WX01,1,crew swap
DE0000007563,F00010507,18-01-2025 11:33,CREW,WX01,1,crew swap
DE0000007564,F00010508,01-02-2025 03:42,OTHER,,1,maintenance check
DE0000007565,F00010508,01-02-2025 03:08,MAINT,CR02,7,gate hold
DE0000007566,F00010510,07-06-2024 17:37,WEATHER,ATC7,4m,late inbound
DE0000007567,F00010510,06-07-2024 18:45,WEATHER,,1,maintenance check
DE0000007568,F00010511,02/17/2025 23:23,other,ATC7,6,crew swap
DE0000007569,F00010511,02/18/2025 00:58,MX,WX01,3,maintenance check
DE0000007570,F00010511,17-02-2025 23:35,weather,GT3,1,
DE0000007571,F00010516,29-10-2025 18:51,TRAFFIC,CR02,17,late inbound
DE0000007572,F00010516,29-10-2025 19:52,crew,MX5,1,crew swap
DE0000007573,F00010516,29-10-2025 18:23,OPS,WX01,1,late inbound
DE0000007574,F00010520,03-11-2025 07:49,WX,MX5,0,gate hold
DE0000007575,F00010520,11-03-2025 06:53,ATC,WX01,-1,
DE0000007576,F00010523,06/15/2025 12:04,weather,OPS9,4,gate hold
DE0000007577,F00010523,15-06-2025 11:02,airport,MX5,1,crew swap
DE0000007578,F00010523,15-06-2025 12:20,WEATHER,ATC7,4,maintenance check
DE0000007579,F00010525,31-10-2024 05:01,atc,CR02,6,
DE0000007580,F00010525,31-10-2024 03:58,CRW,WX01,-9,
DE0000007581,F00010528,16-02-2025 08:33,CRW,OPS9,9,gate hold
DE0000007582,F00010528,2025-02-16T09:24:00,maint,ATC7,12,ground stop
DE0000007583,F00010528,02/16/2025 07:59,AIRPORT,,9,gate hold
DE0000007584,F00010529,11/16/2025 08:33,CREW,,7,maintenance check
DE0000007585,F00010530,05-07-2024 09:57,maint,ATC7,0,late inbound
DE0000007586,F00010530,07-05-2024 09:40,crew,OPS9,18,maintenance check
DE0000007587,F00010530,07-05-2024 09:38,airport,WX01,2,ground stop
DE0000007588,F00010531,08-06-2024 17:02,OPS,GT3,9,maintenance check
DE0000007589,F00010532,02/22/2025 05:18,OTHER,GT3,0,maintenance check
DE0000007590,F00010532,02/22/2025 03:27,OTHER,,2,maintenance check
DE0000007591,F00010532,22-02-2025 03:23,MAINT,ATC7,3,deicing
DE0000007592,F00010534,10-06-2025 21:31,airport,CR02,18m,late inbound
DE0000007593,F00010534,06-10-2025 20:52,weather,MX5,20,crew swap
DE0000007594,F00010535,22-08-2024 06:10,WX,ATC7,14,late inbound
DE0000007595,F00010535,22-08-2024 07:40,WEATHER,WX01,9,late inbound
DE0000007596,F00010536,17-12-2024 01:10,MAINT,MX5,1,ground stop
DE0000007597,F00010536,17-12-2024 03:10,CRW,WX01,-22,late inbound
DE0000007598,F00010541,2025-09-23T10:33:00,ATC,CR02,-2,crew swap
DE0000007599,F00010541,09/23/2025 09:46,maint,WX01,19,
DE0000007600,F00010541,23-09-2025 10:40,OPS,CR02,2,ground stop
DE0000007601,F00010542,26-05-2025 18:54,WX,CR02,6,ground stop
DE0000007602,F00010544,09/19/2024 01:49,ATC,,5,
DE0000007603,F00010544,2024-09-19T01:58:00,atc,CR02,3,ground stop
DE0000007604,F00010544,19-09-2024 00:57,WEATHER,WX01,3,ground stop
DE0000007605,F00010545,25-09-2024 21:08,MAINT,MX5,0,deicing
DE0000007606,F00010545,25-09-2024 21:16,crew,OPS9,1,crew swap
DE0000007607,F00010545,2024-09-25T20:11:00,CRW,,1,
DE0000007608,F00010548,29-10-2024 02:06,AIRPORT,GT3,2,
DE0000007609,F00010548,29-10-2024 03:34,OTHER,GT3,3,ground stop
DE0000007610,F00010548,2024-10-29T01:22:00,GATE,MX5,10,gate hold
DE0000007611,F00010551,29-01-2026 23:53,WX,CR02,7,deicing
DE0000007612,F00010553,17-04-2025 01:51,atc,GT3,4,ground stop
DE0000007613,F00010553,17-04-2025 03:41,other,WX01,3m,crew swap
DE0000007614,F00010553,17-04-2025 01:45,other,GT3,8,crew swap
DE0000007615,F00010562,28-07-2024 03:05,AIRPORT,ATC7,6,crew swap
DE0000007616,F00010562,2024-07-28T01:40:00,WEATHER,OPS9,6,
DE0000007617,F00010565,26-11-2024 23:58,MAINT,MX5,57,gate hold
DE0000007618,F00010565,27-11-2024 00:42,airport,ATC7,4,gate hold
DE0000007619,F00010565,27-11-2024 00:28,OTHER,OPS9,21,deicing
DE0000007620,F00010567,28-08-2025 06:52,other,GT3,0,ground stop
DE0000007621,F00010567,28-08-2025 06:54,weather,OPS9,21,maintenance check
DE0000007622,F00010567,28-08-2025 06:21,OTHER,,14,maintenance check
DE0000007623,F00010569,14-02-2024 09:53,MX,WX01,0,maintenance check
DE0000007624,F00010569,14-02-2024 10:37,WX,GT3,1,late inbound
DE0000007625,F00010570,2025-03-30T02:47:00,CRW,MX5,11,
DE0000007626,F00010570,30-03-2025 04:42,maint,GT3,1m,
DE0000007627,F00010570,30-03-2025 03:48,WX,OPS9,1m,gate hold
DE0000007628,F00010573,15-10-2024 19:57,MX,GT3,17,gate hold
DE0000007629,F00010573,10/15/2024 18:37,TRAFFIC,GT3,13,
DE0000007630,F00010573,15-10-2024 19:01,airport,CR02,1m,deicing
DE0000007631,F00010582,27-08-2024 19:57,ATC,CR02,12,ground stop
DE0000007632,F00010582,27-08-2024 22:27,ATC,MX5,14,maintenance check
DE0000007633,F00010582,27-08-2024 20:11,CREW,WX01,1,late inbound
DE0000007634,F00010587,19-04-2025 13:06,OTHER,,29,late inbound
DE0000007635,F00010587,19-04-2025 14:57,OTHER,ATC7,-1,maintenance check
DE0000007636,F00010588,2025-01-12T11:03:00,OTHER,ATC7,14,deicing
DE0000007637,F00010591,2024-12-26T06:10:00,MAINT,OPS9,7,crew swap
DE0000007638,F00010591,26-12-2024 06:39,ATC,,12,gate hold
DE0000007639,F00010599,04/13/2024 05:43,AIRPORT,CR02,65,
DE0000007640,F00010600,03/13/2025 09:07,WEATHER,GT3,15,deicing
DE0000007641,F00010600,2025-03-13T09:23:00,WX,,19,
DE0000007642,F00010602,2024-04-22T07:08:00,OPS,GT3,8m,late inbound
DE0000007643,F00010608,07-05-2024 16:05,CREW,MX5,26,late inbound
DE0000007644,F00010609,07-06-2024 21:01,WX,,5,
DE0000007645,F00010611,05/29/2025 06:07,AIRPORT,CR02,30,maintenance check
DE0000007646,F00010613,19-09-2025 01:49,atc,GT3,0,crew swap
DE0000007647,F00010613,09/18/2025 23:48,AIRPORT,WX01,22,crew swap
DE0000007648,F00010613,18-09-2025 23:59,MAINT,,1,ground stop
DE0000007649,F00010614,26-05-2024 23:33,ATC,,21,gate hold
DE0000007650,F00010615,11-09-2025 07:44,atc,WX01,10,gate hold
DE0000007651,F00010615,11-09-2025 05:25,crew,GT3,3,ground stop
DE0000007652,F00010615,09-11-2025 06:20,TRAFFIC,OPS9,1,maintenance check
DE0000007653,F00010618,15-08-2025 13:46,CRW,GT3,8,
DE0000007654,F00010618,15-08-2025 11:36,atc,CR02,11,late inbound
DE0000007655,F00010618,08/15/2025 11:25,MX,ATC7,1,ground stop
DE0000007656,F00010623,05/25/2025 17:40,OTHER,WX01,20,
DE0000007657,F00010624,22-09-2024 20:42,weather,,13,ground stop
DE0000007658,F00010630,03-11-2024 02:35,WEATHER,MX5,10,crew swap
DE0000007659,F00010631,30-01-2025 19:32,ATC,OPS9,0,maintenance check
DE0000007660,F00010631,30-01-2025 18:37,ATC,,-13,crew swap
DE0000007661,F00010631,2025-01-30T19:38:00,maint,,19,ground stop
DE0000007662,F00010633,29-12-2024 18:02,MAINT,ATC7,3,maintenance check
DE0000007663,F00010634,09-03-2025 02:31,airport,MX5,0,ground stop
DE0000007664,F00010634,09-03-2025 01:17,weather,OPS9,1,deicing
DE0000007665,F00010634,03-09-2025 02:49,maint,,10,late inbound
DE0000007666,F00010638,14-07-2025 07:38,MAINT,GT3,12,gate hold
DE0000007667,F00010638,14-07-2025 08:02,crew,CR02,1,maintenance check
DE0000007668,F00010641,07-07-2025 03:34,AIRPORT,WX01,7,crew swap
DE0000007669,F00010642,25-06-2024 11:29,WX,,1,late inbound
DE0000007670,F00010642,25-06-2024 12:15,weather,CR02,8,crew swap
DE0000007671,F00010642,25-06-2024 11:31,MAINT,MX5,7,crew swap
DE0000007672,F00010644,2024-11-27T00:29:00,AIRPORT,GT3,36,gate hold
DE0000007673,F00010672,10-05-2025 12:42,atc,CR02,20,ground stop
DE0000007674,F00010674,07-05-2025 22:43,maint,WX01,19,late inbound
DE0000007675,F00010674,07-05-2025 21:01,crew,CR02,8,ground stop
DE0000007676,F00010676,23-06-2024 18:50,ATC,GT3,4,gate hold
DE0000007677,F00010676,23-06-2024 17:38,CRW,GT3,1,deicing
DE0000007678,F00010677,15-04-2025 10:02,MX,OPS9,0m,maintenance check
DE0000007679,F00010677,04/15/2025 09:05,OTHER,,-1,ground stop
DE0000007680,F00010681,05-06-2025 09:05,OPS,,7,gate hold
DE0000007681,F00010682,16-06-2025 10:57,crew,ATC7,30,
DE0000007682,F00010684,01-11-2024 19:13,WX,MX5,11,maintenance check
DE0000007683,F00010684,01-11-2024 18:06,crew,ATC7,9,deicing
DE0000007684,F00010684,01-11-2024 17:28,WEATHER,OPS9,15,
DE0000007685,F00010687,21-02-2025 08:42,MAINT,GT3,13,ground stop
DE0000007686,F00010687,21-02-2025 09:06,AIRPORT,ATC7,13,gate hold
DE0000007687,F00010690,15-08-2025 21:07,weather,ATC7,10,deicing
DE0000007688,F00010690,08/15/2025 19:06,other,CR02,4,deicing
DE0000007689,F00010690,08/15/2025 20:43,crew,MX5,5m,deicing
DE0000007690,F00010697,29-09-2024 18:04,weather,GT3,6,gate hold
DE0000007691,F00010697,29-09-2024 18:18,WX,,10,late inbound
DE0000007692,F00010697,29-09-2024 16:54,MAINT,OPS9,9,ground stop
DE0000007693,F00010698,18-01-2026 17:39,CRW,OPS9,31,late inbound
DE0000007694,F00010698,18-01-2026 19:02,ATC,MX5,23,gate hold
DE0000007695,F00010698,18-01-2026 17:52,CREW,ATC7,1,gate hold
DE0000007696,F00010701,21-12-2024 06:00,CREW,WX01,4,gate hold
DE0000007697,F00010701,21-12-2024 03:35,CRW,CR02,18,late inbound
DE0000007698,F00010702,29-09-2025 01:32,GATE,OPS9,30,crew swap
DE0000007699,F00010703,11-01-2026 19:05,GATE,GT3,25,maintenance check
DE0000007700,F00010706,18-02-2025 11:04,AIRPORT,,10,ground stop
DE0000007701,F00010706,18-02-2025 09:57,AIRPORT,,20,gate hold
DE0000007702,F00010711,18-03-2025 09:49,airport,GT3,26m,
DE0000007703,F00010711,03/18/2025 12:24,crew,MX5,4,maintenance check
DE0000007704,F00010711,18-03-2025 10:38,CRW,WX01,7,
DE0000007705,F00010712,05-08-2024 19:08,CRW,OPS9,7,gate hold
DE0000007706,F00010714,24-11-2024 06:24,WX,GT3,3,crew swap
DE0000007707,F00010714,11/24/2024 05:11,GATE,OPS9,10,
DE0000007708,F00010725,07-08-2024 00:30,MX,MX5,17,ground stop
DE0000007709,F00010725,08-07-2024 02:37,AIRPORT,,1,gate hold
DE0000007710,F00010726,04/29/2024 14:12,CREW,MX5,0,ground stop
DE0000007711,F00010726,29-04-2024 14:30,weather,CR02,4,maintenance check
DE0000007712,F00010726,29-04-2024 14:25,ATC,GT3,8,deicing
DE0000007713,F00010727,05-12-2025 03:07,OPS,OPS9,3,late inbound
DE0000007714,F00010727,05-12-2025 02:57,weather,WX01,12m,late inbound
DE0000007715,F00010728,17-07-2025 19:39,weather,CR02,7,deicing
DE0000007716,F00010728,17-07-2025 20:21,OTHER,GT3,17,deicing
DE0000007717,F00010728,17-07-2025 20:19,other,OPS9,2,ground stop
DE0000007718,F00010732,22-10-2025 21:55,MAINT,CR02,0,deicing
DE0000007719,F00010732,22-10-2025 23:23,atc,ATC7,1m,deicing
DE0000007720,F00010736,23-01-2025 13:12,OTHER,ATC7,12,maintenance check
DE0000007721,F00010736,23-01-2025 12:24,crew,CR02,1,crew swap
DE0000007722,F00010739,12-08-2024 15:58,GATE,WX01,2,crew swap
DE0000007723,F00010739,12-08-2024 15:48,ATC,CR02,4,deicing
DE0000007724,F00010739,12-08-2024 16:11,crew,GT3,14,maintenance check
DE0000007725,F00010740,08-09-2025 14:01,atc,,9m,
DE0000007726,F00010740,08-09-2025 14:33,weather,GT3,2,deicing
DE0000007727,F00010740,2025-09-08T14:18:00,AIRPORT,ATC7,-2,
DE0000007728,F00010741,12/24/2025 07:40,CRW,ATC7,9m,maintenance check
DE0000007729,F00010741,24-12-2025 05:09,WX,GT3,44,ground stop
DE0000007730,F00010743,07-09-2024 16:19,MX,WX01,6,
DE0000007731,F00010749,04-12-2025 13:27,TRAFFIC,GT3,21,ground stop
DE0000007732,F00010749,04-12-2025 15:47,crew,GT3,1,maintenance check
DE0000007733,F00010750,08/20/2024 01:25,TRAFFIC,GT3,-4,ground stop
DE0000007734,F00010755,14-02-2024 10:32,crew,OPS9,19m,maintenance check
DE0000007735,F00010758,12-04-2025 06:43,CREW,ATC7,1m,crew swap
DE0000007736,F00010760,10-07-2025 11:43,airport,GT3,2,
DE0000007737,F00010761,2025-01-04T15:16:00,CREW,CR02,29m,crew swap
DE0000007738,F00010772,19-01-2026 18:33,CREW,MX5,0,
DE0000007739,F00010772,01/19/2026 19:39,maint,ATC7,2m,crew swap
DE0000007740,F00010775,2025-03-06T05:14:00,MX,OPS9,16,gate hold
DE0000007741,F00010775,06-03-2025 05:04,MAINT,MX5,-4,deicing
DE0000007742,F00010777,28-09-2025 07:09,TRAFFIC,,21,late inbound
DE0000007743,F00010777,28-09-2025 06:12,OPS,,9,maintenance check
DE0000007744,F00010783,09-06-2025 01:41,other,OPS9,4m,
DE0000007745,F00010783,06-09-2025 01:21,weather,CR02,5,
DE0000007746,F00010783,09-06-2025 02:14,TRAFFIC,OPS9,7m,ground stop
DE0000007747,F00010786,28-10-2025 00:33,weather,OPS9,-3,maintenance check
DE0000007748,F00010792,19-09-2025 23:23,GATE,GT3,-9,gate hold
DE0000007749,F00010792,20-09-2025 01:34,CRW,CR02,56,
DE0000007750,F00010795,01-03-2026 03:27,MX,,7,maintenance check
DE0000007751,F00010796,21-01-2026 09:55,crew,,14,late inbound
DE0000007752,F00010800,10-10-2025 14:27,atc,WX01,79,maintenance check
DE0000007753,F00010813,06/26/2024 09:14,atc,CR02,35,ground stop
DE0000007754,F00010815,07-04-2024 11:40,airport,WX01,11,ground stop
DE0000007755,F00010815,07-04-2024 11:01,GATE,WX01,16,maintenance check
DE0000007756,F00010818,11-03-2024 04:05,crew,WX01,2,late inbound
DE0000007757,F00010818,03-11-2024 03:55,TRAFFIC,WX01,1,ground stop
DE0000007758,F00010825,12/26/2024 15:26,WX,,3,
DE0000007759,F00010825,2024-12-26T16:04:00,GATE,CR02,4,crew swap
DE0000007760,F00010838,02/20/2024 04:49,CRW,WX01,0,ground stop
DE0000007761,F00010838,20-02-2024 04:40,MX,ATC7,1,deicing
DE0000007762,F00010842,2025-10-21T09:18:00,other,GT3,76,maintenance check
DE0000007763,F00010845,11-05-2024 03:11,MAINT,WX01,49,gate hold
DE0000007764,F00010848,08-08-2025 08:47,TRAFFIC,CR02,6,deicing
DE0000007765,F00010848,08-08-2025 10:35,other,ATC7,-41,
DE0000007766,F00010848,08-08-2025 09:06,GATE,OPS9,4,deicing
DE0000007767,F00010852,2025-04-18T04:32:00,MAINT,,12,maintenance check
DE0000007768,F00010854,24-08-2025 17:01,CRW,OPS9,29,gate hold
DE0000007769,F00010856,20-07-2024 11:34,weather,OPS9,0,deicing
DE0000007770,F00010856,20-07-2024 10:17,airport,,4,ground stop
DE0000007771,F00010856,20-07-2024 10:33,CRW,GT3,2,ground stop
DE0000007772,F00010858,05-09-2025 19:11,airport,OPS9,7,
DE0000007773,F00010862,2024-07-13T03:34:00,CREW,OPS9,19m,late inbound
DE0000007774,F00010862,13-07-2024 03:15,ATC,GT3,21,deicing
DE0000007775,F00010869,01-10-2025 19:45,GATE,WX01,13,
DE0000007776,F00010870,05-04-2024 20:09,crew,CR02,14,ground stop
DE0000007777,F00010871,09-05-2025 00:46,ATC,WX01,25,late inbound
DE0000007778,F00010871,09-05-2025 01:47,maint,,8,deicing
DE0000007779,F00010871,09-05-2025 02:07,crew,WX01,4,late inbound
DE0000007780,F00010872,07-05-2025 10:28,MAINT,CR02,6,deicing
DE0000007781,F00010872,07-05-2025 09:46,atc,OPS9,1m,ground stop
DE0000007782,F00010875,15-04-2025 02:26,WX,MX5,29,deicing
DE0000007783,F00010875,15-04-2025 00:47,AIRPORT,OPS9,8,deicing
DE0000007784,F00010877,06/20/2025 22:04,MX,ATC7,26,maintenance check
DE0000007785,F00010877,20-06-2025 22:39,MX,CR02,8,deicing
DE0000007786,F00010877,20-06-2025 20:01,airport,CR02,7,late inbound
DE0000007787,F00010883,11-03-2025 15:32,WX,OPS9,34,maintenance check
DE0000007788,F00010883,2025-11-03T14:35:00,other,GT3,2,maintenance check
DE0000007789,F00010883,03-11-2025 16:19,MAINT,CR02,24,gate hold
DE0000007790,F00010885,05-03-2025 15:48,atc,GT3,6,late inbound
DE0000007791,F00010887,14-11-2025 15:57,AIRPORT,CR02,12,crew swap
DE0000007792,F00010887,14-11-2025 16:05,WX,MX5,18m,gate hold
DE0000007793,F00010889,01/14/2026 21:36,WEATHER,,29,maintenance check
DE0000007794,F00010890,05-10-2025 13:16,OTHER,,1,
DE0000007795,F00010890,10-05-2025 14:34,atc,WX01,14,ground stop
DE0000007796,F00010890,10-05-2025 14:17,crew,,45,late inbound
DE0000007797,F00010891,12-03-2025 16:31,ATC,CR02,3m,ground stop
DE0000007798,F00010891,2025-12-03T16:24:00,other,MX5,20,crew swap
DE0000007799,F00010892,20-01-2026 06:36,MX,OPS9,8,maintenance check
DE0000007800,F00010892,20-01-2026 05:40,GATE,WX01,10m,maintenance check
DE0000007801,F00010894,03-08-2024 04:54,OTHER,CR02,13,
DE0000007802,F00010896,27-04-2025 18:19,CREW,WX01,12,ground stop
DE0000007803,F00010897,01-12-2024 01:31,CRW,,1,ground stop
DE0000007804,F00010899,06-04-2025 13:52,maint,GT3,1,maintenance check
DE0000007805,F00010899,06-04-2025 13:23,other,OPS9,2,late inbound
DE0000007806,F00010899,06-04-2025 13:17,GATE,,17,late inbound
DE0000007807,F00010900,08/13/2024 17:12,WX,WX01,6,
DE0000007808,F00010900,2024-08-13T16:06:00,CREW,CR02,1,ground stop
DE0000007809,F00010901,05-06-2024 00:55,WX,OPS9,4,
DE0000007810,F00010901,06-05-2024 01:15,airport,WX01,2,crew swap
DE0000007811,F00010901,05-06-2024 01:55,WX,GT3,4,crew swap
DE0000007812,F00010902,14-10-2024 12:13,weather,OPS9,146,gate hold
DE0000007813,F00010902,14-10-2024 10:45,CREW,MX5,115,ground stop
DE0000007814,F00010906,2024-10-23T05:47:00,crew,MX5,4,ground stop
DE0000007815,F00010907,18-10-2025 07:35,CREW,ATC7,8m,ground stop
DE0000007816,F00010913,11-09-2025 22:39,OPS,MX5,30,crew swap
DE0000007817,F00010918,06-10-2024 00:46,WX,WX01,14,crew swap
DE0000007818,F00010918,10-06-2024 02:07,MAINT,CR02,-4,
DE0000007819,F00010918,06-10-2024 00:15,CRW,GT3,1,maintenance check
DE0000007820,F00010923,02-11-2025 09:57,AIRPORT,WX01,2,deicing
DE0000007821,F00010923,02-11-2025 09:53,airport,OPS9,1,late inbound
DE0000007822,F00010923,2025-11-02T10:37:00,TRAFFIC,ATC7,4,crew swap
